"MTU (CET/CEST)","Area","Sequence","Day-ahead Price (EUR/MWh)","MTU (CET/CEST) Start","MTU (CET/CEST) End","SummerIndicator","MTU (CET/CEST) End UTC"
"05/01/2015 00:00:00 - 05/01/2015 01:00:00","BZN|DE-AT-LU","Without Sequence",22.34,"05/01/2015 00:00:00","2015-01-05T01:00","CET","2015-01-05T00:00"
"05/01/2015 01:00:00 - 05/01/2015 02:00:00","BZN|DE-AT-LU","Without Sequence",17.93,"05/01/2015 01:00:00","2015-01-05T02:00","CET","2015-01-05T01:00"
"05/01/2015 02:00:00 - 05/01/2015 03:00:00","BZN|DE-AT-LU","Without Sequence",15.17,"05/01/2015 02:00:00","2015-01-05T03:00","CET","2015-01-05T02:00"
"05/01/2015 03:00:00 - 05/01/2015 04:00:00","BZN|DE-AT-LU","Without Sequence",16.38,"05/01/2015 03:00:00","2015-01-05T04:00","CET","2015-01-05T03:00"
"05/01/2015 04:00:00 - 05/01/2015 05:00:00","BZN|DE-AT-LU","Without Sequence",17.38,"05/01/2015 04:00:00","2015-01-05T05:00","CET","2015-01-05T04:00"
"05/01/2015 05:00:00 - 05/01/2015 06:00:00","BZN|DE-AT-LU","Without Sequence",16.38,"05/01/2015 05:00:00","2015-01-05T06:00","CET","2015-01-05T05:00"
"05/01/2015 06:00:00 - 05/01/2015 07:00:00","BZN|DE-AT-LU","Without Sequence",26.61,"05/01/2015 06:00:00","2015-01-05T07:00","CET","2015-01-05T06:00"
"05/01/2015 07:00:00 - 05/01/2015 08:00:00","BZN|DE-AT-LU","Without Sequence",37.63,"05/01/2015 07:00:00","2015-01-05T08:00","CET","2015-01-05T07:00"
"05/01/2015 08:00:00 - 05/01/2015 09:00:00","BZN|DE-AT-LU","Without Sequence",39.09,"05/01/2015 08:00:00","2015-01-05T09:00","CET","2015-01-05T08:00"
"05/01/2015 09:00:00 - 05/01/2015 10:00:00","BZN|DE-AT-LU","Without Sequence",41.51,"05/01/2015 09:00:00","2015-01-05T10:00","CET","2015-01-05T09:00"
"05/01/2015 10:00:00 - 05/01/2015 11:00:00","BZN|DE-AT-LU","Without Sequence",40.46,"05/01/2015 10:00:00","2015-01-05T11:00","CET","2015-01-05T10:00"
"05/01/2015 11:00:00 - 05/01/2015 12:00:00","BZN|DE-AT-LU","Without Sequence",40.97,"05/01/2015 11:00:00","2015-01-05T12:00","CET","2015-01-05T11:00"
"05/01/2015 12:00:00 - 05/01/2015 13:00:00","BZN|DE-AT-LU","Without Sequence",40.72,"05/01/2015 12:00:00","2015-01-05T13:00","CET","2015-01-05T12:00"
"05/01/2015 13:00:00 - 05/01/2015 14:00:00","BZN|DE-AT-LU","Without Sequence",41.92,"05/01/2015 13:00:00","2015-01-05T14:00","CET","2015-01-05T13:00"
"05/01/2015 14:00:00 - 05/01/2015 15:00:00","BZN|DE-AT-LU","Without Sequence",42,"05/01/2015 14:00:00","2015-01-05T15:00","CET","2015-01-05T14:00"
"05/01/2015 15:00:00 - 05/01/2015 16:00:00","BZN|DE-AT-LU","Without Sequence",43.1,"05/01/2015 15:00:00","2015-01-05T16:00","CET","2015-01-05T15:00"
"05/01/2015 16:00:00 - 05/01/2015 17:00:00","BZN|DE-AT-LU","Without Sequence",46.7,"05/01/2015 16:00:00","2015-01-05T17:00","CET","2015-01-05T16:00"
"05/01/2015 17:00:00 - 05/01/2015 18:00:00","BZN|DE-AT-LU","Without Sequence",56.78,"05/01/2015 17:00:00","2015-01-05T18:00","CET","2015-01-05T17:00"
"05/01/2015 18:00:00 - 05/01/2015 19:00:00","BZN|DE-AT-LU","Without Sequence",58.84,"05/01/2015 18:00:00","2015-01-05T19:00","CET","2015-01-05T18:00"
"05/01/2015 19:00:00 - 05/01/2015 20:00:00","BZN|DE-AT-LU","Without Sequence",49.23,"05/01/2015 19:00:00","2015-01-05T20:00","CET","2015-01-05T19:00"
"05/01/2015 20:00:00 - 05/01/2015 21:00:00","BZN|DE-AT-LU","Without Sequence",44.32,"05/01/2015 20:00:00","2015-01-05T21:00","CET","2015-01-05T20:00"
"05/01/2015 21:00:00 - 05/01/2015 22:00:00","BZN|DE-AT-LU","Without Sequence",40,"05/01/2015 21:00:00","2015-01-05T22:00","CET","2015-01-05T21:00"
"05/01/2015 22:00:00 - 05/01/2015 23:00:00","BZN|DE-AT-LU","Without Sequence",35.08,"05/01/2015 22:00:00","2015-01-05T23:00","CET","2015-01-05T22:00"
"05/01/2015 23:00:00 - 06/01/2015 00:00:00","BZN|DE-AT-LU","Without Sequence",35.08,"05/01/2015 23:00:00","2015-01-06T00:00","CET","2015-01-05T23:00"
"06/01/2015 00:00:00 - 06/01/2015 01:00:00","BZN|DE-AT-LU","Without Sequence",30.02,"06/01/2015 00:00:00","2015-01-06T01:00","CET","2015-01-06T00:00"
"06/01/2015 01:00:00 - 06/01/2015 02:00:00","BZN|DE-AT-LU","Without Sequence",30.57,"06/01/2015 01:00:00","2015-01-06T02:00","CET","2015-01-06T01:00"
"06/01/2015 02:00:00 - 06/01/2015 03:00:00","BZN|DE-AT-LU","Without Sequence",30.25,"06/01/2015 02:00:00","2015-01-06T03:00","CET","2015-01-06T02:00"
"06/01/2015 03:00:00 - 06/01/2015 04:00:00","BZN|DE-AT-LU","Without Sequence",30.29,"06/01/2015 03:00:00","2015-01-06T04:00","CET","2015-01-06T03:00"
"06/01/2015 04:00:00 - 06/01/2015 05:00:00","BZN|DE-AT-LU","Without Sequence",30.63,"06/01/2015 04:00:00","2015-01-06T05:00","CET","2015-01-06T04:00"
"06/01/2015 05:00:00 - 06/01/2015 06:00:00","BZN|DE-AT-LU","Without Sequence",29.64,"06/01/2015 05:00:00","2015-01-06T06:00","CET","2015-01-06T05:00"
"06/01/2015 06:00:00 - 06/01/2015 07:00:00","BZN|DE-AT-LU","Without Sequence",29.67,"06/01/2015 06:00:00","2015-01-06T07:00","CET","2015-01-06T06:00"
"06/01/2015 07:00:00 - 06/01/2015 08:00:00","BZN|DE-AT-LU","Without Sequence",38.82,"06/01/2015 07:00:00","2015-01-06T08:00","CET","2015-01-06T07:00"
"06/01/2015 08:00:00 - 06/01/2015 09:00:00","BZN|DE-AT-LU","Without Sequence",40.76,"06/01/2015 08:00:00","2015-01-06T09:00","CET","2015-01-06T08:00"
"06/01/2015 09:00:00 - 06/01/2015 10:00:00","BZN|DE-AT-LU","Without Sequence",40.02,"06/01/2015 09:00:00","2015-01-06T10:00","CET","2015-01-06T09:00"
"06/01/2015 10:00:00 - 06/01/2015 11:00:00","BZN|DE-AT-LU","Without Sequence",33.99,"06/01/2015 10:00:00","2015-01-06T11:00","CET","2015-01-06T10:00"
"06/01/2015 11:00:00 - 06/01/2015 12:00:00","BZN|DE-AT-LU","Without Sequence",31.22,"06/01/2015 11:00:00","2015-01-06T12:00","CET","2015-01-06T11:00"
"06/01/2015 12:00:00 - 06/01/2015 13:00:00","BZN|DE-AT-LU","Without Sequence",30.06,"06/01/2015 12:00:00","2015-01-06T13:00","CET","2015-01-06T12:00"
"06/01/2015 13:00:00 - 06/01/2015 14:00:00","BZN|DE-AT-LU","Without Sequence",29.99,"06/01/2015 13:00:00","2015-01-06T14:00","CET","2015-01-06T13:00"
"06/01/2015 14:00:00 - 06/01/2015 15:00:00","BZN|DE-AT-LU","Without Sequence",30.73,"06/01/2015 14:00:00","2015-01-06T15:00","CET","2015-01-06T14:00"
"06/01/2015 15:00:00 - 06/01/2015 16:00:00","BZN|DE-AT-LU","Without Sequence",37.38,"06/01/2015 15:00:00","2015-01-06T16:00","CET","2015-01-06T15:00"
"06/01/2015 16:00:00 - 06/01/2015 17:00:00","BZN|DE-AT-LU","Without Sequence",40.32,"06/01/2015 16:00:00","2015-01-06T17:00","CET","2015-01-06T16:00"
"06/01/2015 17:00:00 - 06/01/2015 18:00:00","BZN|DE-AT-LU","Without Sequence",45.96,"06/01/2015 17:00:00","2015-01-06T18:00","CET","2015-01-06T17:00"
"06/01/2015 18:00:00 - 06/01/2015 19:00:00","BZN|DE-AT-LU","Without Sequence",45.71,"06/01/2015 18:00:00","2015-01-06T19:00","CET","2015-01-06T18:00"
"06/01/2015 19:00:00 - 06/01/2015 20:00:00","BZN|DE-AT-LU","Without Sequence",39.57,"06/01/2015 19:00:00","2015-01-06T20:00","CET","2015-01-06T19:00"
"06/01/2015 20:00:00 - 06/01/2015 21:00:00","BZN|DE-AT-LU","Without Sequence",32.92,"06/01/2015 20:00:00","2015-01-06T21:00","CET","2015-01-06T20:00"
"06/01/2015 21:00:00 - 06/01/2015 22:00:00","BZN|DE-AT-LU","Without Sequence",29.15,"06/01/2015 21:00:00","2015-01-06T22:00","CET","2015-01-06T21:00"
"06/01/2015 22:00:00 - 06/01/2015 23:00:00","BZN|DE-AT-LU","Without Sequence",28.46,"06/01/2015 22:00:00","2015-01-06T23:00","CET","2015-01-06T22:00"
"06/01/2015 23:00:00 - 07/01/2015 00:00:00","BZN|DE-AT-LU","Without Sequence",28.46,"06/01/2015 23:00:00","2015-01-07T00:00","CET","2015-01-06T23:00"
"07/01/2015 00:00:00 - 07/01/2015 01:00:00","BZN|DE-AT-LU","Without Sequence",24.97,"07/01/2015 00:00:00","2015-01-07T01:00","CET","2015-01-07T00:00"
"07/01/2015 01:00:00 - 07/01/2015 02:00:00","BZN|DE-AT-LU","Without Sequence",24.65,"07/01/2015 01:00:00","2015-01-07T02:00","CET","2015-01-07T01:00"
"07/01/2015 02:00:00 - 07/01/2015 03:00:00","BZN|DE-AT-LU","Without Sequence",24.68,"07/01/2015 02:00:00","2015-01-07T03:00","CET","2015-01-07T02:00"
"07/01/2015 03:00:00 - 07/01/2015 04:00:00","BZN|DE-AT-LU","Without Sequence",25.06,"07/01/2015 03:00:00","2015-01-07T04:00","CET","2015-01-07T03:00"
"07/01/2015 04:00:00 - 07/01/2015 05:00:00","BZN|DE-AT-LU","Without Sequence",26.1,"07/01/2015 04:00:00","2015-01-07T05:00","CET","2015-01-07T04:00"
"07/01/2015 05:00:00 - 07/01/2015 06:00:00","BZN|DE-AT-LU","Without Sequence",26.95,"07/01/2015 05:00:00","2015-01-07T06:00","CET","2015-01-07T05:00"
"07/01/2015 06:00:00 - 07/01/2015 07:00:00","BZN|DE-AT-LU","Without Sequence",31.43,"07/01/2015 06:00:00","2015-01-07T07:00","CET","2015-01-07T06:00"
"07/01/2015 07:00:00 - 07/01/2015 08:00:00","BZN|DE-AT-LU","Without Sequence",45.98,"07/01/2015 07:00:00","2015-01-07T08:00","CET","2015-01-07T07:00"
"07/01/2015 08:00:00 - 07/01/2015 09:00:00","BZN|DE-AT-LU","Without Sequence",47.91,"07/01/2015 08:00:00","2015-01-07T09:00","CET","2015-01-07T08:00"
"07/01/2015 09:00:00 - 07/01/2015 10:00:00","BZN|DE-AT-LU","Without Sequence",48.91,"07/01/2015 09:00:00","2015-01-07T10:00","CET","2015-01-07T09:00"
"07/01/2015 10:00:00 - 07/01/2015 11:00:00","BZN|DE-AT-LU","Without Sequence",50,"07/01/2015 10:00:00","2015-01-07T11:00","CET","2015-01-07T10:00"
"07/01/2015 11:00:00 - 07/01/2015 12:00:00","BZN|DE-AT-LU","Without Sequence",51.22,"07/01/2015 11:00:00","2015-01-07T12:00","CET","2015-01-07T11:00"
"07/01/2015 12:00:00 - 07/01/2015 13:00:00","BZN|DE-AT-LU","Without Sequence",50.15,"07/01/2015 12:00:00","2015-01-07T13:00","CET","2015-01-07T12:00"
"07/01/2015 13:00:00 - 07/01/2015 14:00:00","BZN|DE-AT-LU","Without Sequence",51.46,"07/01/2015 13:00:00","2015-01-07T14:00","CET","2015-01-07T13:00"
"07/01/2015 14:00:00 - 07/01/2015 15:00:00","BZN|DE-AT-LU","Without Sequence",50.88,"07/01/2015 14:00:00","2015-01-07T15:00","CET","2015-01-07T14:00"
"07/01/2015 15:00:00 - 07/01/2015 16:00:00","BZN|DE-AT-LU","Without Sequence",48,"07/01/2015 15:00:00","2015-01-07T16:00","CET","2015-01-07T15:00"
"07/01/2015 16:00:00 - 07/01/2015 17:00:00","BZN|DE-AT-LU","Without Sequence",47.14,"07/01/2015 16:00:00","2015-01-07T17:00","CET","2015-01-07T16:00"
"07/01/2015 17:00:00 - 07/01/2015 18:00:00","BZN|DE-AT-LU","Without Sequence",51.07,"07/01/2015 17:00:00","2015-01-07T18:00","CET","2015-01-07T17:00"
"07/01/2015 18:00:00 - 07/01/2015 19:00:00","BZN|DE-AT-LU","Without Sequence",47.42,"07/01/2015 18:00:00","2015-01-07T19:00","CET","2015-01-07T18:00"
"07/01/2015 19:00:00 - 07/01/2015 20:00:00","BZN|DE-AT-LU","Without Sequence",44.83,"07/01/2015 19:00:00","2015-01-07T20:00","CET","2015-01-07T19:00"
"07/01/2015 20:00:00 - 07/01/2015 21:00:00","BZN|DE-AT-LU","Without Sequence",33.86,"07/01/2015 20:00:00","2015-01-07T21:00","CET","2015-01-07T20:00"
"07/01/2015 21:00:00 - 07/01/2015 22:00:00","BZN|DE-AT-LU","Without Sequence",27.42,"07/01/2015 21:00:00","2015-01-07T22:00","CET","2015-01-07T21:00"
"07/01/2015 22:00:00 - 07/01/2015 23:00:00","BZN|DE-AT-LU","Without Sequence",27.02,"07/01/2015 22:00:00","2015-01-07T23:00","CET","2015-01-07T22:00"
"07/01/2015 23:00:00 - 08/01/2015 00:00:00","BZN|DE-AT-LU","Without Sequence",27.02,"07/01/2015 23:00:00","2015-01-08T00:00","CET","2015-01-07T23:00"
"08/01/2015 00:00:00 - 08/01/2015 01:00:00","BZN|DE-AT-LU","Without Sequence",21.92,"08/01/2015 00:00:00","2015-01-08T01:00","CET","2015-01-08T00:00"
"08/01/2015 01:00:00 - 08/01/2015 02:00:00","BZN|DE-AT-LU","Without Sequence",19.35,"08/01/2015 01:00:00","2015-01-08T02:00","CET","2015-01-08T01:00"
"08/01/2015 02:00:00 - 08/01/2015 03:00:00","BZN|DE-AT-LU","Without Sequence",16.11,"08/01/2015 02:00:00","2015-01-08T03:00","CET","2015-01-08T02:00"
"08/01/2015 03:00:00 - 08/01/2015 04:00:00","BZN|DE-AT-LU","Without Sequence",14.93,"08/01/2015 03:00:00","2015-01-08T04:00","CET","2015-01-08T03:00"
"08/01/2015 04:00:00 - 08/01/2015 05:00:00","BZN|DE-AT-LU","Without Sequence",15,"08/01/2015 04:00:00","2015-01-08T05:00","CET","2015-01-08T04:00"
"08/01/2015 05:00:00 - 08/01/2015 06:00:00","BZN|DE-AT-LU","Without Sequence",19.04,"08/01/2015 05:00:00","2015-01-08T06:00","CET","2015-01-08T05:00"
"08/01/2015 06:00:00 - 08/01/2015 07:00:00","BZN|DE-AT-LU","Without Sequence",26.17,"08/01/2015 06:00:00","2015-01-08T07:00","CET","2015-01-08T06:00"
"08/01/2015 07:00:00 - 08/01/2015 08:00:00","BZN|DE-AT-LU","Without Sequence",38.34,"08/01/2015 07:00:00","2015-01-08T08:00","CET","2015-01-08T07:00"
"08/01/2015 08:00:00 - 08/01/2015 09:00:00","BZN|DE-AT-LU","Without Sequence",37.7,"08/01/2015 08:00:00","2015-01-08T09:00","CET","2015-01-08T08:00"
"08/01/2015 09:00:00 - 08/01/2015 10:00:00","BZN|DE-AT-LU","Without Sequence",32.99,"08/01/2015 09:00:00","2015-01-08T10:00","CET","2015-01-08T09:00"
"08/01/2015 10:00:00 - 08/01/2015 11:00:00","BZN|DE-AT-LU","Without Sequence",31.95,"08/01/2015 10:00:00","2015-01-08T11:00","CET","2015-01-08T10:00"
"08/01/2015 11:00:00 - 08/01/2015 12:00:00","BZN|DE-AT-LU","Without Sequence",33.59,"08/01/2015 11:00:00","2015-01-08T12:00","CET","2015-01-08T11:00"
"08/01/2015 12:00:00 - 08/01/2015 13:00:00","BZN|DE-AT-LU","Without Sequence",34.37,"08/01/2015 12:00:00","2015-01-08T13:00","CET","2015-01-08T12:00"
"08/01/2015 13:00:00 - 08/01/2015 14:00:00","BZN|DE-AT-LU","Without Sequence",35.08,"08/01/2015 13:00:00","2015-01-08T14:00","CET","2015-01-08T13:00"
"08/01/2015 14:00:00 - 08/01/2015 15:00:00","BZN|DE-AT-LU","Without Sequence",34.45,"08/01/2015 14:00:00","2015-01-08T15:00","CET","2015-01-08T14:00"
"08/01/2015 15:00:00 - 08/01/2015 16:00:00","BZN|DE-AT-LU","Without Sequence",38.12,"08/01/2015 15:00:00","2015-01-08T16:00","CET","2015-01-08T15:00"
"08/01/2015 16:00:00 - 08/01/2015 17:00:00","BZN|DE-AT-LU","Without Sequence",32.47,"08/01/2015 16:00:00","2015-01-08T17:00","CET","2015-01-08T16:00"
"08/01/2015 17:00:00 - 08/01/2015 18:00:00","BZN|DE-AT-LU","Without Sequence",36.49,"08/01/2015 17:00:00","2015-01-08T18:00","CET","2015-01-08T17:00"
"08/01/2015 18:00:00 - 08/01/2015 19:00:00","BZN|DE-AT-LU","Without Sequence",31.82,"08/01/2015 18:00:00","2015-01-08T19:00","CET","2015-01-08T18:00"
"08/01/2015 19:00:00 - 08/01/2015 20:00:00","BZN|DE-AT-LU","Without Sequence",32.93,"08/01/2015 19:00:00","2015-01-08T20:00","CET","2015-01-08T19:00"
"08/01/2015 20:00:00 - 08/01/2015 21:00:00","BZN|DE-AT-LU","Without Sequence",29.44,"08/01/2015 20:00:00","2015-01-08T21:00","CET","2015-01-08T20:00"
"08/01/2015 21:00:00 - 08/01/2015 22:00:00","BZN|DE-AT-LU","Without Sequence",28.62,"08/01/2015 21:00:00","2015-01-08T22:00","CET","2015-01-08T21:00"
"08/01/2015 22:00:00 - 08/01/2015 23:00:00","BZN|DE-AT-LU","Without Sequence",26.71,"08/01/2015 22:00:00","2015-01-08T23:00","CET","2015-01-08T22:00"
"08/01/2015 23:00:00 - 09/01/2015 00:00:00","BZN|DE-AT-LU","Without Sequence",26.71,"08/01/2015 23:00:00","2015-01-09T00:00","CET","2015-01-08T23:00"
"09/01/2015 00:00:00 - 09/01/2015 01:00:00","BZN|DE-AT-LU","Without Sequence",11.55,"09/01/2015 00:00:00","2015-01-09T01:00","CET","2015-01-09T00:00"
"09/01/2015 01:00:00 - 09/01/2015 02:00:00","BZN|DE-AT-LU","Without Sequence",13.47,"09/01/2015 01:00:00","2015-01-09T02:00","CET","2015-01-09T01:00"
"09/01/2015 02:00:00 - 09/01/2015 03:00:00","BZN|DE-AT-LU","Without Sequence",11.23,"09/01/2015 02:00:00","2015-01-09T03:00","CET","2015-01-09T02:00"
"09/01/2015 03:00:00 - 09/01/2015 04:00:00","BZN|DE-AT-LU","Without Sequence",9.37,"09/01/2015 03:00:00","2015-01-09T04:00","CET","2015-01-09T03:00"
"09/01/2015 04:00:00 - 09/01/2015 05:00:00","BZN|DE-AT-LU","Without Sequence",10.33,"09/01/2015 04:00:00","2015-01-09T05:00","CET","2015-01-09T04:00"
"09/01/2015 05:00:00 - 09/01/2015 06:00:00","BZN|DE-AT-LU","Without Sequence",10.57,"09/01/2015 05:00:00","2015-01-09T06:00","CET","2015-01-09T05:00"
"09/01/2015 06:00:00 - 09/01/2015 07:00:00","BZN|DE-AT-LU","Without Sequence",20.08,"09/01/2015 06:00:00","2015-01-09T07:00","CET","2015-01-09T06:00"
"09/01/2015 07:00:00 - 09/01/2015 08:00:00","BZN|DE-AT-LU","Without Sequence",34.24,"09/01/2015 07:00:00","2015-01-09T08:00","CET","2015-01-09T07:00"
"09/01/2015 08:00:00 - 09/01/2015 09:00:00","BZN|DE-AT-LU","Without Sequence",29.99,"09/01/2015 08:00:00","2015-01-09T09:00","CET","2015-01-09T08:00"
"09/01/2015 09:00:00 - 09/01/2015 10:00:00","BZN|DE-AT-LU","Without Sequence",28.33,"09/01/2015 09:00:00","2015-01-09T10:00","CET","2015-01-09T09:00"
"09/01/2015 10:00:00 - 09/01/2015 11:00:00","BZN|DE-AT-LU","Without Sequence",28.51,"09/01/2015 10:00:00","2015-01-09T11:00","CET","2015-01-09T10:00"
"09/01/2015 11:00:00 - 09/01/2015 12:00:00","BZN|DE-AT-LU","Without Sequence",31.69,"09/01/2015 11:00:00","2015-01-09T12:00","CET","2015-01-09T11:00"
"09/01/2015 12:00:00 - 09/01/2015 13:00:00","BZN|DE-AT-LU","Without Sequence",31.11,"09/01/2015 12:00:00","2015-01-09T13:00","CET","2015-01-09T12:00"
"09/01/2015 13:00:00 - 09/01/2015 14:00:00","BZN|DE-AT-LU","Without Sequence",29.95,"09/01/2015 13:00:00","2015-01-09T14:00","CET","2015-01-09T13:00"
"09/01/2015 14:00:00 - 09/01/2015 15:00:00","BZN|DE-AT-LU","Without Sequence",29.17,"09/01/2015 14:00:00","2015-01-09T15:00","CET","2015-01-09T14:00"
"09/01/2015 15:00:00 - 09/01/2015 16:00:00","BZN|DE-AT-LU","Without Sequence",29.47,"09/01/2015 15:00:00","2015-01-09T16:00","CET","2015-01-09T15:00"
"09/01/2015 16:00:00 - 09/01/2015 17:00:00","BZN|DE-AT-LU","Without Sequence",30.09,"09/01/2015 16:00:00","2015-01-09T17:00","CET","2015-01-09T16:00"
"09/01/2015 17:00:00 - 09/01/2015 18:00:00","BZN|DE-AT-LU","Without Sequence",33.47,"09/01/2015 17:00:00","2015-01-09T18:00","CET","2015-01-09T17:00"
"09/01/2015 18:00:00 - 09/01/2015 19:00:00","BZN|DE-AT-LU","Without Sequence",32.78,"09/01/2015 18:00:00","2015-01-09T19:00","CET","2015-01-09T18:00"
"09/01/2015 19:00:00 - 09/01/2015 20:00:00","BZN|DE-AT-LU","Without Sequence",33.47,"09/01/2015 19:00:00","2015-01-09T20:00","CET","2015-01-09T19:00"
"09/01/2015 20:00:00 - 09/01/2015 21:00:00","BZN|DE-AT-LU","Without Sequence",30.11,"09/01/2015 20:00:00","2015-01-09T21:00","CET","2015-01-09T20:00"
"09/01/2015 21:00:00 - 09/01/2015 22:00:00","BZN|DE-AT-LU","Without Sequence",26.69,"09/01/2015 21:00:00","2015-01-09T22:00","CET","2015-01-09T21:00"
"09/01/2015 22:00:00 - 09/01/2015 23:00:00","BZN|DE-AT-LU","Without Sequence",21.64,"09/01/2015 22:00:00","2015-01-09T23:00","CET","2015-01-09T22:00"
"09/01/2015 23:00:00 - 10/01/2015 00:00:00","BZN|DE-AT-LU","Without Sequence",21.64,"09/01/2015 23:00:00","2015-01-10T00:00","CET","2015-01-09T23:00"
"10/01/2015 00:00:00 - 10/01/2015 01:00:00","BZN|DE-AT-LU","Without Sequence",17.1,"10/01/2015 00:00:00","2015-01-10T01:00","CET","2015-01-10T00:00"
"10/01/2015 01:00:00 - 10/01/2015 02:00:00","BZN|DE-AT-LU","Without Sequence",12.93,"10/01/2015 01:00:00","2015-01-10T02:00","CET","2015-01-10T01:00"
"10/01/2015 02:00:00 - 10/01/2015 03:00:00","BZN|DE-AT-LU","Without Sequence",13.7,"10/01/2015 02:00:00","2015-01-10T03:00","CET","2015-01-10T02:00"
"10/01/2015 03:00:00 - 10/01/2015 04:00:00","BZN|DE-AT-LU","Without Sequence",11.01,"10/01/2015 03:00:00","2015-01-10T04:00","CET","2015-01-10T03:00"
"10/01/2015 04:00:00 - 10/01/2015 05:00:00","BZN|DE-AT-LU","Without Sequence",9.08,"10/01/2015 04:00:00","2015-01-10T05:00","CET","2015-01-10T04:00"
"10/01/2015 05:00:00 - 10/01/2015 06:00:00","BZN|DE-AT-LU","Without Sequence",9.28,"10/01/2015 05:00:00","2015-01-10T06:00","CET","2015-01-10T05:00"
"10/01/2015 06:00:00 - 10/01/2015 07:00:00","BZN|DE-AT-LU","Without Sequence",7.19,"10/01/2015 06:00:00","2015-01-10T07:00","CET","2015-01-10T06:00"
"10/01/2015 07:00:00 - 10/01/2015 08:00:00","BZN|DE-AT-LU","Without Sequence",9.31,"10/01/2015 07:00:00","2015-01-10T08:00","CET","2015-01-10T07:00"
"10/01/2015 08:00:00 - 10/01/2015 09:00:00","BZN|DE-AT-LU","Without Sequence",11.35,"10/01/2015 08:00:00","2015-01-10T09:00","CET","2015-01-10T08:00"
"10/01/2015 09:00:00 - 10/01/2015 10:00:00","BZN|DE-AT-LU","Without Sequence",15.87,"10/01/2015 09:00:00","2015-01-10T10:00","CET","2015-01-10T09:00"
"10/01/2015 10:00:00 - 10/01/2015 11:00:00","BZN|DE-AT-LU","Without Sequence",15.84,"10/01/2015 10:00:00","2015-01-10T11:00","CET","2015-01-10T10:00"
"10/01/2015 11:00:00 - 10/01/2015 12:00:00","BZN|DE-AT-LU","Without Sequence",14.83,"10/01/2015 11:00:00","2015-01-10T12:00","CET","2015-01-10T11:00"
"10/01/2015 12:00:00 - 10/01/2015 13:00:00","BZN|DE-AT-LU","Without Sequence",15.83,"10/01/2015 12:00:00","2015-01-10T13:00","CET","2015-01-10T12:00"
"10/01/2015 13:00:00 - 10/01/2015 14:00:00","BZN|DE-AT-LU","Without Sequence",14.85,"10/01/2015 13:00:00","2015-01-10T14:00","CET","2015-01-10T13:00"
"10/01/2015 14:00:00 - 10/01/2015 15:00:00","BZN|DE-AT-LU","Without Sequence",11.42,"10/01/2015 14:00:00","2015-01-10T15:00","CET","2015-01-10T14:00"
"10/01/2015 15:00:00 - 10/01/2015 16:00:00","BZN|DE-AT-LU","Without Sequence",11.34,"10/01/2015 15:00:00","2015-01-10T16:00","CET","2015-01-10T15:00"
"10/01/2015 16:00:00 - 10/01/2015 17:00:00","BZN|DE-AT-LU","Without Sequence",14.15,"10/01/2015 16:00:00","2015-01-10T17:00","CET","2015-01-10T16:00"
"10/01/2015 17:00:00 - 10/01/2015 18:00:00","BZN|DE-AT-LU","Without Sequence",17.09,"10/01/2015 17:00:00","2015-01-10T18:00","CET","2015-01-10T17:00"
"10/01/2015 18:00:00 - 10/01/2015 19:00:00","BZN|DE-AT-LU","Without Sequence",18.87,"10/01/2015 18:00:00","2015-01-10T19:00","CET","2015-01-10T18:00"
"10/01/2015 19:00:00 - 10/01/2015 20:00:00","BZN|DE-AT-LU","Without Sequence",13.44,"10/01/2015 19:00:00","2015-01-10T20:00","CET","2015-01-10T19:00"
"10/01/2015 20:00:00 - 10/01/2015 21:00:00","BZN|DE-AT-LU","Without Sequence",15.82,"10/01/2015 20:00:00","2015-01-10T21:00","CET","2015-01-10T20:00"
"10/01/2015 21:00:00 - 10/01/2015 22:00:00","BZN|DE-AT-LU","Without Sequence",11.51,"10/01/2015 21:00:00","2015-01-10T22:00","CET","2015-01-10T21:00"
"10/01/2015 22:00:00 - 10/01/2015 23:00:00","BZN|DE-AT-LU","Without Sequence",11.81,"10/01/2015 22:00:00","2015-01-10T23:00","CET","2015-01-10T22:00"
"10/01/2015 23:00:00 - 11/01/2015 00:00:00","BZN|DE-AT-LU","Without Sequence",11.81,"10/01/2015 23:00:00","2015-01-11T00:00","CET","2015-01-10T23:00"
"11/01/2015 00:00:00 - 11/01/2015 01:00:00","BZN|DE-AT-LU","Without Sequence",0.05,"11/01/2015 00:00:00","2015-01-11T01:00","CET","2015-01-11T00:00"
"11/01/2015 01:00:00 - 11/01/2015 02:00:00","BZN|DE-AT-LU","Without Sequence",-2.06,"11/01/2015 01:00:00","2015-01-11T02:00","CET","2015-01-11T01:00"
"11/01/2015 02:00:00 - 11/01/2015 03:00:00","BZN|DE-AT-LU","Without Sequence",-4.11,"11/01/2015 02:00:00","2015-01-11T03:00","CET","2015-01-11T02:00"
"11/01/2015 03:00:00 - 11/01/2015 04:00:00","BZN|DE-AT-LU","Without Sequence",-5.06,"11/01/2015 03:00:00","2015-01-11T04:00","CET","2015-01-11T03:00"
"11/01/2015 04:00:00 - 11/01/2015 05:00:00","BZN|DE-AT-LU","Without Sequence",-4.12,"11/01/2015 04:00:00","2015-01-11T05:00","CET","2015-01-11T04:00"
"11/01/2015 05:00:00 - 11/01/2015 06:00:00","BZN|DE-AT-LU","Without Sequence",-0.74,"11/01/2015 05:00:00","2015-01-11T06:00","CET","2015-01-11T05:00"
"11/01/2015 06:00:00 - 11/01/2015 07:00:00","BZN|DE-AT-LU","Without Sequence",-25.02,"11/01/2015 06:00:00","2015-01-11T07:00","CET","2015-01-11T06:00"
"11/01/2015 07:00:00 - 11/01/2015 08:00:00","BZN|DE-AT-LU","Without Sequence",-16.94,"11/01/2015 07:00:00","2015-01-11T08:00","CET","2015-01-11T07:00"
"11/01/2015 08:00:00 - 11/01/2015 09:00:00","BZN|DE-AT-LU","Without Sequence",-6.86,"11/01/2015 08:00:00","2015-01-11T09:00","CET","2015-01-11T08:00"
"11/01/2015 09:00:00 - 11/01/2015 10:00:00","BZN|DE-AT-LU","Without Sequence",1.53,"11/01/2015 09:00:00","2015-01-11T10:00","CET","2015-01-11T09:00"
"11/01/2015 10:00:00 - 11/01/2015 11:00:00","BZN|DE-AT-LU","Without Sequence",5.61,"11/01/2015 10:00:00","2015-01-11T11:00","CET","2015-01-11T10:00"
"11/01/2015 11:00:00 - 11/01/2015 12:00:00","BZN|DE-AT-LU","Without Sequence",9.91,"11/01/2015 11:00:00","2015-01-11T12:00","CET","2015-01-11T11:00"
"11/01/2015 12:00:00 - 11/01/2015 13:00:00","BZN|DE-AT-LU","Without Sequence",8.71,"11/01/2015 12:00:00","2015-01-11T13:00","CET","2015-01-11T12:00"
"11/01/2015 13:00:00 - 11/01/2015 14:00:00","BZN|DE-AT-LU","Without Sequence",-0.09,"11/01/2015 13:00:00","2015-01-11T14:00","CET","2015-01-11T13:00"
"11/01/2015 14:00:00 - 11/01/2015 15:00:00","BZN|DE-AT-LU","Without Sequence",-0.07,"11/01/2015 14:00:00","2015-01-11T15:00","CET","2015-01-11T14:00"
"11/01/2015 15:00:00 - 11/01/2015 16:00:00","BZN|DE-AT-LU","Without Sequence",-1.8,"11/01/2015 15:00:00","2015-01-11T16:00","CET","2015-01-11T15:00"
"11/01/2015 16:00:00 - 11/01/2015 17:00:00","BZN|DE-AT-LU","Without Sequence",0.61,"11/01/2015 16:00:00","2015-01-11T17:00","CET","2015-01-11T16:00"
"11/01/2015 17:00:00 - 11/01/2015 18:00:00","BZN|DE-AT-LU","Without Sequence",13.51,"11/01/2015 17:00:00","2015-01-11T18:00","CET","2015-01-11T17:00"
"11/01/2015 18:00:00 - 11/01/2015 19:00:00","BZN|DE-AT-LU","Without Sequence",11.44,"11/01/2015 18:00:00","2015-01-11T19:00","CET","2015-01-11T18:00"
"11/01/2015 19:00:00 - 11/01/2015 20:00:00","BZN|DE-AT-LU","Without Sequence",14.88,"11/01/2015 19:00:00","2015-01-11T20:00","CET","2015-01-11T19:00"
"11/01/2015 20:00:00 - 11/01/2015 21:00:00","BZN|DE-AT-LU","Without Sequence",9.63,"11/01/2015 20:00:00","2015-01-11T21:00","CET","2015-01-11T20:00"
"11/01/2015 21:00:00 - 11/01/2015 22:00:00","BZN|DE-AT-LU","Without Sequence",9.29,"11/01/2015 21:00:00","2015-01-11T22:00","CET","2015-01-11T21:00"
"11/01/2015 22:00:00 - 11/01/2015 23:00:00","BZN|DE-AT-LU","Without Sequence",10.18,"11/01/2015 22:00:00","2015-01-11T23:00","CET","2015-01-11T22:00"
"11/01/2015 23:00:00 - 12/01/2015 00:00:00","BZN|DE-AT-LU","Without Sequence",10.18,"11/01/2015 23:00:00","2015-01-12T00:00","CET","2015-01-11T23:00"
"12/01/2015 00:00:00 - 12/01/2015 01:00:00","BZN|DE-AT-LU","Without Sequence",9.3,"12/01/2015 00:00:00","2015-01-12T01:00","CET","2015-01-12T00:00"
"12/01/2015 01:00:00 - 12/01/2015 02:00:00","BZN|DE-AT-LU","Without Sequence",2.87,"12/01/2015 01:00:00","2015-01-12T02:00","CET","2015-01-12T01:00"
"12/01/2015 02:00:00 - 12/01/2015 03:00:00","BZN|DE-AT-LU","Without Sequence",0.09,"12/01/2015 02:00:00","2015-01-12T03:00","CET","2015-01-12T02:00"
"12/01/2015 03:00:00 - 12/01/2015 04:00:00","BZN|DE-AT-LU","Without Sequence",0.26,"12/01/2015 03:00:00","2015-01-12T04:00","CET","2015-01-12T03:00"
"12/01/2015 04:00:00 - 12/01/2015 05:00:00","BZN|DE-AT-LU","Without Sequence",2.83,"12/01/2015 04:00:00","2015-01-12T05:00","CET","2015-01-12T04:00"
"12/01/2015 05:00:00 - 12/01/2015 06:00:00","BZN|DE-AT-LU","Without Sequence",10.4,"12/01/2015 05:00:00","2015-01-12T06:00","CET","2015-01-12T05:00"
"12/01/2015 06:00:00 - 12/01/2015 07:00:00","BZN|DE-AT-LU","Without Sequence",20.03,"12/01/2015 06:00:00","2015-01-12T07:00","CET","2015-01-12T06:00"
"12/01/2015 07:00:00 - 12/01/2015 08:00:00","BZN|DE-AT-LU","Without Sequence",44.95,"12/01/2015 07:00:00","2015-01-12T08:00","CET","2015-01-12T07:00"
"12/01/2015 08:00:00 - 12/01/2015 09:00:00","BZN|DE-AT-LU","Without Sequence",44.92,"12/01/2015 08:00:00","2015-01-12T09:00","CET","2015-01-12T08:00"
"12/01/2015 09:00:00 - 12/01/2015 10:00:00","BZN|DE-AT-LU","Without Sequence",36.33,"12/01/2015 09:00:00","2015-01-12T10:00","CET","2015-01-12T09:00"
"12/01/2015 10:00:00 - 12/01/2015 11:00:00","BZN|DE-AT-LU","Without Sequence",30.41,"12/01/2015 10:00:00","2015-01-12T11:00","CET","2015-01-12T10:00"
"12/01/2015 11:00:00 - 12/01/2015 12:00:00","BZN|DE-AT-LU","Without Sequence",30.07,"12/01/2015 11:00:00","2015-01-12T12:00","CET","2015-01-12T11:00"
"12/01/2015 12:00:00 - 12/01/2015 13:00:00","BZN|DE-AT-LU","Without Sequence",29.33,"12/01/2015 12:00:00","2015-01-12T13:00","CET","2015-01-12T12:00"
"12/01/2015 13:00:00 - 12/01/2015 14:00:00","BZN|DE-AT-LU","Without Sequence",29.39,"12/01/2015 13:00:00","2015-01-12T14:00","CET","2015-01-12T13:00"
"12/01/2015 14:00:00 - 12/01/2015 15:00:00","BZN|DE-AT-LU","Without Sequence",28.98,"12/01/2015 14:00:00","2015-01-12T15:00","CET","2015-01-12T14:00"
"12/01/2015 15:00:00 - 12/01/2015 16:00:00","BZN|DE-AT-LU","Without Sequence",29.49,"12/01/2015 15:00:00","2015-01-12T16:00","CET","2015-01-12T15:00"
"12/01/2015 16:00:00 - 12/01/2015 17:00:00","BZN|DE-AT-LU","Without Sequence",28.99,"12/01/2015 16:00:00","2015-01-12T17:00","CET","2015-01-12T16:00"
"12/01/2015 17:00:00 - 12/01/2015 18:00:00","BZN|DE-AT-LU","Without Sequence",34.41,"12/01/2015 17:00:00","2015-01-12T18:00","CET","2015-01-12T17:00"
"12/01/2015 18:00:00 - 12/01/2015 19:00:00","BZN|DE-AT-LU","Without Sequence",31.69,"12/01/2015 18:00:00","2015-01-12T19:00","CET","2015-01-12T18:00"
"12/01/2015 19:00:00 - 12/01/2015 20:00:00","BZN|DE-AT-LU","Without Sequence",29.59,"12/01/2015 19:00:00","2015-01-12T20:00","CET","2015-01-12T19:00"
"12/01/2015 20:00:00 - 12/01/2015 21:00:00","BZN|DE-AT-LU","Without Sequence",27.61,"12/01/2015 20:00:00","2015-01-12T21:00","CET","2015-01-12T20:00"
"12/01/2015 21:00:00 - 12/01/2015 22:00:00","BZN|DE-AT-LU","Without Sequence",15.55,"12/01/2015 21:00:00","2015-01-12T22:00","CET","2015-01-12T21:00"
"12/01/2015 22:00:00 - 12/01/2015 23:00:00","BZN|DE-AT-LU","Without Sequence",14.91,"12/01/2015 22:00:00","2015-01-12T23:00","CET","2015-01-12T22:00"
"12/01/2015 23:00:00 - 13/01/2015 00:00:00","BZN|DE-AT-LU","Without Sequence",14.91,"12/01/2015 23:00:00","2015-01-13T00:00","CET","2015-01-12T23:00"
"13/01/2015 00:00:00 - 13/01/2015 01:00:00","BZN|DE-AT-LU","Without Sequence",9.27,"13/01/2015 00:00:00","2015-01-13T01:00","CET","2015-01-13T00:00"
"13/01/2015 01:00:00 - 13/01/2015 02:00:00","BZN|DE-AT-LU","Without Sequence",10.42,"13/01/2015 01:00:00","2015-01-13T02:00","CET","2015-01-13T01:00"
"13/01/2015 02:00:00 - 13/01/2015 03:00:00","BZN|DE-AT-LU","Without Sequence",11.16,"13/01/2015 02:00:00","2015-01-13T03:00","CET","2015-01-13T02:00"
"13/01/2015 03:00:00 - 13/01/2015 04:00:00","BZN|DE-AT-LU","Without Sequence",10.71,"13/01/2015 03:00:00","2015-01-13T04:00","CET","2015-01-13T03:00"
"13/01/2015 04:00:00 - 13/01/2015 05:00:00","BZN|DE-AT-LU","Without Sequence",11.26,"13/01/2015 04:00:00","2015-01-13T05:00","CET","2015-01-13T04:00"
"13/01/2015 05:00:00 - 13/01/2015 06:00:00","BZN|DE-AT-LU","Without Sequence",11.69,"13/01/2015 05:00:00","2015-01-13T06:00","CET","2015-01-13T05:00"
"13/01/2015 06:00:00 - 13/01/2015 07:00:00","BZN|DE-AT-LU","Without Sequence",21.05,"13/01/2015 06:00:00","2015-01-13T07:00","CET","2015-01-13T06:00"
"13/01/2015 07:00:00 - 13/01/2015 08:00:00","BZN|DE-AT-LU","Without Sequence",32.37,"13/01/2015 07:00:00","2015-01-13T08:00","CET","2015-01-13T07:00"
"13/01/2015 08:00:00 - 13/01/2015 09:00:00","BZN|DE-AT-LU","Without Sequence",34.21,"13/01/2015 08:00:00","2015-01-13T09:00","CET","2015-01-13T08:00"
"13/01/2015 09:00:00 - 13/01/2015 10:00:00","BZN|DE-AT-LU","Without Sequence",28.47,"13/01/2015 09:00:00","2015-01-13T10:00","CET","2015-01-13T09:00"
"13/01/2015 10:00:00 - 13/01/2015 11:00:00","BZN|DE-AT-LU","Without Sequence",26.07,"13/01/2015 10:00:00","2015-01-13T11:00","CET","2015-01-13T10:00"
"13/01/2015 11:00:00 - 13/01/2015 12:00:00","BZN|DE-AT-LU","Without Sequence",23.74,"13/01/2015 11:00:00","2015-01-13T12:00","CET","2015-01-13T11:00"
"13/01/2015 12:00:00 - 13/01/2015 13:00:00","BZN|DE-AT-LU","Without Sequence",23.73,"13/01/2015 12:00:00","2015-01-13T13:00","CET","2015-01-13T12:00"
"13/01/2015 13:00:00 - 13/01/2015 14:00:00","BZN|DE-AT-LU","Without Sequence",23.76,"13/01/2015 13:00:00","2015-01-13T14:00","CET","2015-01-13T13:00"
"13/01/2015 14:00:00 - 13/01/2015 15:00:00","BZN|DE-AT-LU","Without Sequence",25.62,"13/01/2015 14:00:00","2015-01-13T15:00","CET","2015-01-13T14:00"
"13/01/2015 15:00:00 - 13/01/2015 16:00:00","BZN|DE-AT-LU","Without Sequence",28.91,"13/01/2015 15:00:00","2015-01-13T16:00","CET","2015-01-13T15:00"
"13/01/2015 16:00:00 - 13/01/2015 17:00:00","BZN|DE-AT-LU","Without Sequence",34.13,"13/01/2015 16:00:00","2015-01-13T17:00","CET","2015-01-13T16:00"
"13/01/2015 17:00:00 - 13/01/2015 18:00:00","BZN|DE-AT-LU","Without Sequence",42.16,"13/01/2015 17:00:00","2015-01-13T18:00","CET","2015-01-13T17:00"
"13/01/2015 18:00:00 - 13/01/2015 19:00:00","BZN|DE-AT-LU","Without Sequence",41.99,"13/01/2015 18:00:00","2015-01-13T19:00","CET","2015-01-13T18:00"
"13/01/2015 19:00:00 - 13/01/2015 20:00:00","BZN|DE-AT-LU","Without Sequence",37.91,"13/01/2015 19:00:00","2015-01-13T20:00","CET","2015-01-13T19:00"
"13/01/2015 20:00:00 - 13/01/2015 21:00:00","BZN|DE-AT-LU","Without Sequence",31.41,"13/01/2015 20:00:00","2015-01-13T21:00","CET","2015-01-13T20:00"
"13/01/2015 21:00:00 - 13/01/2015 22:00:00","BZN|DE-AT-LU","Without Sequence",29.91,"13/01/2015 21:00:00","2015-01-13T22:00","CET","2015-01-13T21:00"
"13/01/2015 22:00:00 - 13/01/2015 23:00:00","BZN|DE-AT-LU","Without Sequence",27.02,"13/01/2015 22:00:00","2015-01-13T23:00","CET","2015-01-13T22:00"
"13/01/2015 23:00:00 - 14/01/2015 00:00:00","BZN|DE-AT-LU","Without Sequence",27.02,"13/01/2015 23:00:00","2015-01-14T00:00","CET","2015-01-13T23:00"
"14/01/2015 00:00:00 - 14/01/2015 01:00:00","BZN|DE-AT-LU","Without Sequence",13.25,"14/01/2015 00:00:00","2015-01-14T01:00","CET","2015-01-14T00:00"
"14/01/2015 01:00:00 - 14/01/2015 02:00:00","BZN|DE-AT-LU","Without Sequence",15.02,"14/01/2015 01:00:00","2015-01-14T02:00","CET","2015-01-14T01:00"
"14/01/2015 02:00:00 - 14/01/2015 03:00:00","BZN|DE-AT-LU","Without Sequence",11.99,"14/01/2015 02:00:00","2015-01-14T03:00","CET","2015-01-14T02:00"
"14/01/2015 03:00:00 - 14/01/2015 04:00:00","BZN|DE-AT-LU","Without Sequence",13.68,"14/01/2015 03:00:00","2015-01-14T04:00","CET","2015-01-14T03:00"
"14/01/2015 04:00:00 - 14/01/2015 05:00:00","BZN|DE-AT-LU","Without Sequence",13.91,"14/01/2015 04:00:00","2015-01-14T05:00","CET","2015-01-14T04:00"
"14/01/2015 05:00:00 - 14/01/2015 06:00:00","BZN|DE-AT-LU","Without Sequence",16.26,"14/01/2015 05:00:00","2015-01-14T06:00","CET","2015-01-14T05:00"
"14/01/2015 06:00:00 - 14/01/2015 07:00:00","BZN|DE-AT-LU","Without Sequence",27.32,"14/01/2015 06:00:00","2015-01-14T07:00","CET","2015-01-14T06:00"
"14/01/2015 07:00:00 - 14/01/2015 08:00:00","BZN|DE-AT-LU","Without Sequence",31.62,"14/01/2015 07:00:00","2015-01-14T08:00","CET","2015-01-14T07:00"
"14/01/2015 08:00:00 - 14/01/2015 09:00:00","BZN|DE-AT-LU","Without Sequence",34.74,"14/01/2015 08:00:00","2015-01-14T09:00","CET","2015-01-14T08:00"
"14/01/2015 09:00:00 - 14/01/2015 10:00:00","BZN|DE-AT-LU","Without Sequence",32.41,"14/01/2015 09:00:00","2015-01-14T10:00","CET","2015-01-14T09:00"
"14/01/2015 10:00:00 - 14/01/2015 11:00:00","BZN|DE-AT-LU","Without Sequence",29.71,"14/01/2015 10:00:00","2015-01-14T11:00","CET","2015-01-14T10:00"
"14/01/2015 11:00:00 - 14/01/2015 12:00:00","BZN|DE-AT-LU","Without Sequence",30.32,"14/01/2015 11:00:00","2015-01-14T12:00","CET","2015-01-14T11:00"
"14/01/2015 12:00:00 - 14/01/2015 13:00:00","BZN|DE-AT-LU","Without Sequence",29.7,"14/01/2015 12:00:00","2015-01-14T13:00","CET","2015-01-14T12:00"
"14/01/2015 13:00:00 - 14/01/2015 14:00:00","BZN|DE-AT-LU","Without Sequence",29.28,"14/01/2015 13:00:00","2015-01-14T14:00","CET","2015-01-14T13:00"
"14/01/2015 14:00:00 - 14/01/2015 15:00:00","BZN|DE-AT-LU","Without Sequence",30.63,"14/01/2015 14:00:00","2015-01-14T15:00","CET","2015-01-14T14:00"
"14/01/2015 15:00:00 - 14/01/2015 16:00:00","BZN|DE-AT-LU","Without Sequence",35.61,"14/01/2015 15:00:00","2015-01-14T16:00","CET","2015-01-14T15:00"
"14/01/2015 16:00:00 - 14/01/2015 17:00:00","BZN|DE-AT-LU","Without Sequence",37.8,"14/01/2015 16:00:00","2015-01-14T17:00","CET","2015-01-14T16:00"
"14/01/2015 17:00:00 - 14/01/2015 18:00:00","BZN|DE-AT-LU","Without Sequence",44.69,"14/01/2015 17:00:00","2015-01-14T18:00","CET","2015-01-14T17:00"
"14/01/2015 18:00:00 - 14/01/2015 19:00:00","BZN|DE-AT-LU","Without Sequence",43.23,"14/01/2015 18:00:00","2015-01-14T19:00","CET","2015-01-14T18:00"
"14/01/2015 19:00:00 - 14/01/2015 20:00:00","BZN|DE-AT-LU","Without Sequence",34.51,"14/01/2015 19:00:00","2015-01-14T20:00","CET","2015-01-14T19:00"
"14/01/2015 20:00:00 - 14/01/2015 21:00:00","BZN|DE-AT-LU","Without Sequence",29.44,"14/01/2015 20:00:00","2015-01-14T21:00","CET","2015-01-14T20:00"
"14/01/2015 21:00:00 - 14/01/2015 22:00:00","BZN|DE-AT-LU","Without Sequence",27.96,"14/01/2015 21:00:00","2015-01-14T22:00","CET","2015-01-14T21:00"
"14/01/2015 22:00:00 - 14/01/2015 23:00:00","BZN|DE-AT-LU","Without Sequence",23.73,"14/01/2015 22:00:00","2015-01-14T23:00","CET","2015-01-14T22:00"
"14/01/2015 23:00:00 - 15/01/2015 00:00:00","BZN|DE-AT-LU","Without Sequence",23.73,"14/01/2015 23:00:00","2015-01-15T00:00","CET","2015-01-14T23:00"
"15/01/2015 00:00:00 - 15/01/2015 01:00:00","BZN|DE-AT-LU","Without Sequence",24.36,"15/01/2015 00:00:00","2015-01-15T01:00","CET","2015-01-15T00:00"
"15/01/2015 01:00:00 - 15/01/2015 02:00:00","BZN|DE-AT-LU","Without Sequence",21.59,"15/01/2015 01:00:00","2015-01-15T02:00","CET","2015-01-15T01:00"
"15/01/2015 02:00:00 - 15/01/2015 03:00:00","BZN|DE-AT-LU","Without Sequence",15.46,"15/01/2015 02:00:00","2015-01-15T03:00","CET","2015-01-15T02:00"
"15/01/2015 03:00:00 - 15/01/2015 04:00:00","BZN|DE-AT-LU","Without Sequence",15.44,"15/01/2015 03:00:00","2015-01-15T04:00","CET","2015-01-15T03:00"
"15/01/2015 04:00:00 - 15/01/2015 05:00:00","BZN|DE-AT-LU","Without Sequence",15.43,"15/01/2015 04:00:00","2015-01-15T05:00","CET","2015-01-15T04:00"
"15/01/2015 05:00:00 - 15/01/2015 06:00:00","BZN|DE-AT-LU","Without Sequence",15.47,"15/01/2015 05:00:00","2015-01-15T06:00","CET","2015-01-15T05:00"
"15/01/2015 06:00:00 - 15/01/2015 07:00:00","BZN|DE-AT-LU","Without Sequence",27.69,"15/01/2015 06:00:00","2015-01-15T07:00","CET","2015-01-15T06:00"
"15/01/2015 07:00:00 - 15/01/2015 08:00:00","BZN|DE-AT-LU","Without Sequence",33.89,"15/01/2015 07:00:00","2015-01-15T08:00","CET","2015-01-15T07:00"
"15/01/2015 08:00:00 - 15/01/2015 09:00:00","BZN|DE-AT-LU","Without Sequence",34.79,"15/01/2015 08:00:00","2015-01-15T09:00","CET","2015-01-15T08:00"
"15/01/2015 09:00:00 - 15/01/2015 10:00:00","BZN|DE-AT-LU","Without Sequence",30.9,"15/01/2015 09:00:00","2015-01-15T10:00","CET","2015-01-15T09:00"
"15/01/2015 10:00:00 - 15/01/2015 11:00:00","BZN|DE-AT-LU","Without Sequence",29.97,"15/01/2015 10:00:00","2015-01-15T11:00","CET","2015-01-15T10:00"
"15/01/2015 11:00:00 - 15/01/2015 12:00:00","BZN|DE-AT-LU","Without Sequence",29.42,"15/01/2015 11:00:00","2015-01-15T12:00","CET","2015-01-15T11:00"
"15/01/2015 12:00:00 - 15/01/2015 13:00:00","BZN|DE-AT-LU","Without Sequence",27.02,"15/01/2015 12:00:00","2015-01-15T13:00","CET","2015-01-15T12:00"
"15/01/2015 13:00:00 - 15/01/2015 14:00:00","BZN|DE-AT-LU","Without Sequence",26.18,"15/01/2015 13:00:00","2015-01-15T14:00","CET","2015-01-15T13:00"
"15/01/2015 14:00:00 - 15/01/2015 15:00:00","BZN|DE-AT-LU","Without Sequence",26.53,"15/01/2015 14:00:00","2015-01-15T15:00","CET","2015-01-15T14:00"
"15/01/2015 15:00:00 - 15/01/2015 16:00:00","BZN|DE-AT-LU","Without Sequence",28.21,"15/01/2015 15:00:00","2015-01-15T16:00","CET","2015-01-15T15:00"
"15/01/2015 16:00:00 - 15/01/2015 17:00:00","BZN|DE-AT-LU","Without Sequence",29.37,"15/01/2015 16:00:00","2015-01-15T17:00","CET","2015-01-15T16:00"
"15/01/2015 17:00:00 - 15/01/2015 18:00:00","BZN|DE-AT-LU","Without Sequence",32.54,"15/01/2015 17:00:00","2015-01-15T18:00","CET","2015-01-15T17:00"
"15/01/2015 18:00:00 - 15/01/2015 19:00:00","BZN|DE-AT-LU","Without Sequence",32.67,"15/01/2015 18:00:00","2015-01-15T19:00","CET","2015-01-15T18:00"
"15/01/2015 19:00:00 - 15/01/2015 20:00:00","BZN|DE-AT-LU","Without Sequence",30.49,"15/01/2015 19:00:00","2015-01-15T20:00","CET","2015-01-15T19:00"
"15/01/2015 20:00:00 - 15/01/2015 21:00:00","BZN|DE-AT-LU","Without Sequence",28.32,"15/01/2015 20:00:00","2015-01-15T21:00","CET","2015-01-15T20:00"
"15/01/2015 21:00:00 - 15/01/2015 22:00:00","BZN|DE-AT-LU","Without Sequence",22.05,"15/01/2015 21:00:00","2015-01-15T22:00","CET","2015-01-15T21:00"
"15/01/2015 22:00:00 - 15/01/2015 23:00:00","BZN|DE-AT-LU","Without Sequence",19.01,"15/01/2015 22:00:00","2015-01-15T23:00","CET","2015-01-15T22:00"
"15/01/2015 23:00:00 - 16/01/2015 00:00:00","BZN|DE-AT-LU","Without Sequence",19.01,"15/01/2015 23:00:00","2015-01-16T00:00","CET","2015-01-15T23:00"
"16/01/2015 00:00:00 - 16/01/2015 01:00:00","BZN|DE-AT-LU","Without Sequence",9.78,"16/01/2015 00:00:00","2015-01-16T01:00","CET","2015-01-16T00:00"
"16/01/2015 01:00:00 - 16/01/2015 02:00:00","BZN|DE-AT-LU","Without Sequence",11.64,"16/01/2015 01:00:00","2015-01-16T02:00","CET","2015-01-16T01:00"
"16/01/2015 02:00:00 - 16/01/2015 03:00:00","BZN|DE-AT-LU","Without Sequence",9.72,"16/01/2015 02:00:00","2015-01-16T03:00","CET","2015-01-16T02:00"
"16/01/2015 03:00:00 - 16/01/2015 04:00:00","BZN|DE-AT-LU","Without Sequence",10.56,"16/01/2015 03:00:00","2015-01-16T04:00","CET","2015-01-16T03:00"
"16/01/2015 04:00:00 - 16/01/2015 05:00:00","BZN|DE-AT-LU","Without Sequence",14.11,"16/01/2015 04:00:00","2015-01-16T05:00","CET","2015-01-16T04:00"
"16/01/2015 05:00:00 - 16/01/2015 06:00:00","BZN|DE-AT-LU","Without Sequence",16.02,"16/01/2015 05:00:00","2015-01-16T06:00","CET","2015-01-16T05:00"
"16/01/2015 06:00:00 - 16/01/2015 07:00:00","BZN|DE-AT-LU","Without Sequence",24.71,"16/01/2015 06:00:00","2015-01-16T07:00","CET","2015-01-16T06:00"
"16/01/2015 07:00:00 - 16/01/2015 08:00:00","BZN|DE-AT-LU","Without Sequence",34.04,"16/01/2015 07:00:00","2015-01-16T08:00","CET","2015-01-16T07:00"
"16/01/2015 08:00:00 - 16/01/2015 09:00:00","BZN|DE-AT-LU","Without Sequence",37.71,"16/01/2015 08:00:00","2015-01-16T09:00","CET","2015-01-16T08:00"
"16/01/2015 09:00:00 - 16/01/2015 10:00:00","BZN|DE-AT-LU","Without Sequence",36.92,"16/01/2015 09:00:00","2015-01-16T10:00","CET","2015-01-16T09:00"
"16/01/2015 10:00:00 - 16/01/2015 11:00:00","BZN|DE-AT-LU","Without Sequence",37.99,"16/01/2015 10:00:00","2015-01-16T11:00","CET","2015-01-16T10:00"
"16/01/2015 11:00:00 - 16/01/2015 12:00:00","BZN|DE-AT-LU","Without Sequence",39.97,"16/01/2015 11:00:00","2015-01-16T12:00","CET","2015-01-16T11:00"
"16/01/2015 12:00:00 - 16/01/2015 13:00:00","BZN|DE-AT-LU","Without Sequence",39.95,"16/01/2015 12:00:00","2015-01-16T13:00","CET","2015-01-16T12:00"
"16/01/2015 13:00:00 - 16/01/2015 14:00:00","BZN|DE-AT-LU","Without Sequence",40.02,"16/01/2015 13:00:00","2015-01-16T14:00","CET","2015-01-16T13:00"
"16/01/2015 14:00:00 - 16/01/2015 15:00:00","BZN|DE-AT-LU","Without Sequence",41.83,"16/01/2015 14:00:00","2015-01-16T15:00","CET","2015-01-16T14:00"
"16/01/2015 15:00:00 - 16/01/2015 16:00:00","BZN|DE-AT-LU","Without Sequence",44.05,"16/01/2015 15:00:00","2015-01-16T16:00","CET","2015-01-16T15:00"
"16/01/2015 16:00:00 - 16/01/2015 17:00:00","BZN|DE-AT-LU","Without Sequence",47.1,"16/01/2015 16:00:00","2015-01-16T17:00","CET","2015-01-16T16:00"
"16/01/2015 17:00:00 - 16/01/2015 18:00:00","BZN|DE-AT-LU","Without Sequence",52.49,"16/01/2015 17:00:00","2015-01-16T18:00","CET","2015-01-16T17:00"
"16/01/2015 18:00:00 - 16/01/2015 19:00:00","BZN|DE-AT-LU","Without Sequence",53.54,"16/01/2015 18:00:00","2015-01-16T19:00","CET","2015-01-16T18:00"
"16/01/2015 19:00:00 - 16/01/2015 20:00:00","BZN|DE-AT-LU","Without Sequence",48.02,"16/01/2015 19:00:00","2015-01-16T20:00","CET","2015-01-16T19:00"
"16/01/2015 20:00:00 - 16/01/2015 21:00:00","BZN|DE-AT-LU","Without Sequence",41.51,"16/01/2015 20:00:00","2015-01-16T21:00","CET","2015-01-16T20:00"
"16/01/2015 21:00:00 - 16/01/2015 22:00:00","BZN|DE-AT-LU","Without Sequence",37.92,"16/01/2015 21:00:00","2015-01-16T22:00","CET","2015-01-16T21:00"
"16/01/2015 22:00:00 - 16/01/2015 23:00:00","BZN|DE-AT-LU","Without Sequence",35.64,"16/01/2015 22:00:00","2015-01-16T23:00","CET","2015-01-16T22:00"
"16/01/2015 23:00:00 - 17/01/2015 00:00:00","BZN|DE-AT-LU","Without Sequence",35.64,"16/01/2015 23:00:00","2015-01-17T00:00","CET","2015-01-16T23:00"
"17/01/2015 00:00:00 - 17/01/2015 01:00:00","BZN|DE-AT-LU","Without Sequence",29.03,"17/01/2015 00:00:00","2015-01-17T01:00","CET","2015-01-17T00:00"
"17/01/2015 01:00:00 - 17/01/2015 02:00:00","BZN|DE-AT-LU","Without Sequence",27.47,"17/01/2015 01:00:00","2015-01-17T02:00","CET","2015-01-17T01:00"
"17/01/2015 02:00:00 - 17/01/2015 03:00:00","BZN|DE-AT-LU","Without Sequence",28.06,"17/01/2015 02:00:00","2015-01-17T03:00","CET","2015-01-17T02:00"
"17/01/2015 03:00:00 - 17/01/2015 04:00:00","BZN|DE-AT-LU","Without Sequence",27.92,"17/01/2015 03:00:00","2015-01-17T04:00","CET","2015-01-17T03:00"
"17/01/2015 04:00:00 - 17/01/2015 05:00:00","BZN|DE-AT-LU","Without Sequence",27.05,"17/01/2015 04:00:00","2015-01-17T05:00","CET","2015-01-17T04:00"
"17/01/2015 05:00:00 - 17/01/2015 06:00:00","BZN|DE-AT-LU","Without Sequence",27.24,"17/01/2015 05:00:00","2015-01-17T06:00","CET","2015-01-17T05:00"
"17/01/2015 06:00:00 - 17/01/2015 07:00:00","BZN|DE-AT-LU","Without Sequence",27.34,"17/01/2015 06:00:00","2015-01-17T07:00","CET","2015-01-17T06:00"
"17/01/2015 07:00:00 - 17/01/2015 08:00:00","BZN|DE-AT-LU","Without Sequence",27.74,"17/01/2015 07:00:00","2015-01-17T08:00","CET","2015-01-17T07:00"
"17/01/2015 08:00:00 - 17/01/2015 09:00:00","BZN|DE-AT-LU","Without Sequence",29.73,"17/01/2015 08:00:00","2015-01-17T09:00","CET","2015-01-17T08:00"
"17/01/2015 09:00:00 - 17/01/2015 10:00:00","BZN|DE-AT-LU","Without Sequence",35.05,"17/01/2015 09:00:00","2015-01-17T10:00","CET","2015-01-17T09:00"
"17/01/2015 10:00:00 - 17/01/2015 11:00:00","BZN|DE-AT-LU","Without Sequence",38.81,"17/01/2015 10:00:00","2015-01-17T11:00","CET","2015-01-17T10:00"
"17/01/2015 11:00:00 - 17/01/2015 12:00:00","BZN|DE-AT-LU","Without Sequence",38.89,"17/01/2015 11:00:00","2015-01-17T12:00","CET","2015-01-17T11:00"
"17/01/2015 12:00:00 - 17/01/2015 13:00:00","BZN|DE-AT-LU","Without Sequence",34.99,"17/01/2015 12:00:00","2015-01-17T13:00","CET","2015-01-17T12:00"
"17/01/2015 13:00:00 - 17/01/2015 14:00:00","BZN|DE-AT-LU","Without Sequence",31.96,"17/01/2015 13:00:00","2015-01-17T14:00","CET","2015-01-17T13:00"
"17/01/2015 14:00:00 - 17/01/2015 15:00:00","BZN|DE-AT-LU","Without Sequence",30.07,"17/01/2015 14:00:00","2015-01-17T15:00","CET","2015-01-17T14:00"
"17/01/2015 15:00:00 - 17/01/2015 16:00:00","BZN|DE-AT-LU","Without Sequence",31.27,"17/01/2015 15:00:00","2015-01-17T16:00","CET","2015-01-17T15:00"
"17/01/2015 16:00:00 - 17/01/2015 17:00:00","BZN|DE-AT-LU","Without Sequence",33.84,"17/01/2015 16:00:00","2015-01-17T17:00","CET","2015-01-17T16:00"
"17/01/2015 17:00:00 - 17/01/2015 18:00:00","BZN|DE-AT-LU","Without Sequence",42.44,"17/01/2015 17:00:00","2015-01-17T18:00","CET","2015-01-17T17:00"
"17/01/2015 18:00:00 - 17/01/2015 19:00:00","BZN|DE-AT-LU","Without Sequence",44.9,"17/01/2015 18:00:00","2015-01-17T19:00","CET","2015-01-17T18:00"
"17/01/2015 19:00:00 - 17/01/2015 20:00:00","BZN|DE-AT-LU","Without Sequence",34.24,"17/01/2015 19:00:00","2015-01-17T20:00","CET","2015-01-17T19:00"
"17/01/2015 20:00:00 - 17/01/2015 21:00:00","BZN|DE-AT-LU","Without Sequence",28.95,"17/01/2015 20:00:00","2015-01-17T21:00","CET","2015-01-17T20:00"
"17/01/2015 21:00:00 - 17/01/2015 22:00:00","BZN|DE-AT-LU","Without Sequence",27.02,"17/01/2015 21:00:00","2015-01-17T22:00","CET","2015-01-17T21:00"
"17/01/2015 22:00:00 - 17/01/2015 23:00:00","BZN|DE-AT-LU","Without Sequence",27.46,"17/01/2015 22:00:00","2015-01-17T23:00","CET","2015-01-17T22:00"
"17/01/2015 23:00:00 - 18/01/2015 00:00:00","BZN|DE-AT-LU","Without Sequence",27.46,"17/01/2015 23:00:00","2015-01-18T00:00","CET","2015-01-17T23:00"
"18/01/2015 00:00:00 - 18/01/2015 01:00:00","BZN|DE-AT-LU","Without Sequence",23.35,"18/01/2015 00:00:00","2015-01-18T01:00","CET","2015-01-18T00:00"
"18/01/2015 01:00:00 - 18/01/2015 02:00:00","BZN|DE-AT-LU","Without Sequence",21.19,"18/01/2015 01:00:00","2015-01-18T02:00","CET","2015-01-18T01:00"
"18/01/2015 02:00:00 - 18/01/2015 03:00:00","BZN|DE-AT-LU","Without Sequence",22.24,"18/01/2015 02:00:00","2015-01-18T03:00","CET","2015-01-18T02:00"
"18/01/2015 03:00:00 - 18/01/2015 04:00:00","BZN|DE-AT-LU","Without Sequence",22.31,"18/01/2015 03:00:00","2015-01-18T04:00","CET","2015-01-18T03:00"
"18/01/2015 04:00:00 - 18/01/2015 05:00:00","BZN|DE-AT-LU","Without Sequence",22.32,"18/01/2015 04:00:00","2015-01-18T05:00","CET","2015-01-18T04:00"
"18/01/2015 05:00:00 - 18/01/2015 06:00:00","BZN|DE-AT-LU","Without Sequence",22.11,"18/01/2015 05:00:00","2015-01-18T06:00","CET","2015-01-18T05:00"
"18/01/2015 06:00:00 - 18/01/2015 07:00:00","BZN|DE-AT-LU","Without Sequence",14.12,"18/01/2015 06:00:00","2015-01-18T07:00","CET","2015-01-18T06:00"
"18/01/2015 07:00:00 - 18/01/2015 08:00:00","BZN|DE-AT-LU","Without Sequence",15.17,"18/01/2015 07:00:00","2015-01-18T08:00","CET","2015-01-18T07:00"
"18/01/2015 08:00:00 - 18/01/2015 09:00:00","BZN|DE-AT-LU","Without Sequence",19.07,"18/01/2015 08:00:00","2015-01-18T09:00","CET","2015-01-18T08:00"
"18/01/2015 09:00:00 - 18/01/2015 10:00:00","BZN|DE-AT-LU","Without Sequence",24.94,"18/01/2015 09:00:00","2015-01-18T10:00","CET","2015-01-18T09:00"
"18/01/2015 10:00:00 - 18/01/2015 11:00:00","BZN|DE-AT-LU","Without Sequence",27.2,"18/01/2015 10:00:00","2015-01-18T11:00","CET","2015-01-18T10:00"
"18/01/2015 11:00:00 - 18/01/2015 12:00:00","BZN|DE-AT-LU","Without Sequence",28.22,"18/01/2015 11:00:00","2015-01-18T12:00","CET","2015-01-18T11:00"
"18/01/2015 12:00:00 - 18/01/2015 13:00:00","BZN|DE-AT-LU","Without Sequence",28.15,"18/01/2015 12:00:00","2015-01-18T13:00","CET","2015-01-18T12:00"
"18/01/2015 13:00:00 - 18/01/2015 14:00:00","BZN|DE-AT-LU","Without Sequence",27.85,"18/01/2015 13:00:00","2015-01-18T14:00","CET","2015-01-18T13:00"
"18/01/2015 14:00:00 - 18/01/2015 15:00:00","BZN|DE-AT-LU","Without Sequence",28.17,"18/01/2015 14:00:00","2015-01-18T15:00","CET","2015-01-18T14:00"
"18/01/2015 15:00:00 - 18/01/2015 16:00:00","BZN|DE-AT-LU","Without Sequence",29.91,"18/01/2015 15:00:00","2015-01-18T16:00","CET","2015-01-18T15:00"
"18/01/2015 16:00:00 - 18/01/2015 17:00:00","BZN|DE-AT-LU","Without Sequence",30.44,"18/01/2015 16:00:00","2015-01-18T17:00","CET","2015-01-18T16:00"
"18/01/2015 17:00:00 - 18/01/2015 18:00:00","BZN|DE-AT-LU","Without Sequence",38.42,"18/01/2015 17:00:00","2015-01-18T18:00","CET","2015-01-18T17:00"
"18/01/2015 18:00:00 - 18/01/2015 19:00:00","BZN|DE-AT-LU","Without Sequence",42.46,"18/01/2015 18:00:00","2015-01-18T19:00","CET","2015-01-18T18:00"
"18/01/2015 19:00:00 - 18/01/2015 20:00:00","BZN|DE-AT-LU","Without Sequence",39.8,"18/01/2015 19:00:00","2015-01-18T20:00","CET","2015-01-18T19:00"
"18/01/2015 20:00:00 - 18/01/2015 21:00:00","BZN|DE-AT-LU","Without Sequence",30.54,"18/01/2015 20:00:00","2015-01-18T21:00","CET","2015-01-18T20:00"
"18/01/2015 21:00:00 - 18/01/2015 22:00:00","BZN|DE-AT-LU","Without Sequence",30.4,"18/01/2015 21:00:00","2015-01-18T22:00","CET","2015-01-18T21:00"
"18/01/2015 22:00:00 - 18/01/2015 23:00:00","BZN|DE-AT-LU","Without Sequence",31,"18/01/2015 22:00:00","2015-01-18T23:00","CET","2015-01-18T22:00"
"18/01/2015 23:00:00 - 19/01/2015 00:00:00","BZN|DE-AT-LU","Without Sequence",31,"18/01/2015 23:00:00","2015-01-19T00:00","CET","2015-01-18T23:00"
"19/01/2015 00:00:00 - 19/01/2015 01:00:00","BZN|DE-AT-LU","Without Sequence",27.92,"19/01/2015 00:00:00","2015-01-19T01:00","CET","2015-01-19T00:00"
"19/01/2015 01:00:00 - 19/01/2015 02:00:00","BZN|DE-AT-LU","Without Sequence",27.76,"19/01/2015 01:00:00","2015-01-19T02:00","CET","2015-01-19T01:00"
"19/01/2015 02:00:00 - 19/01/2015 03:00:00","BZN|DE-AT-LU","Without Sequence",28.25,"19/01/2015 02:00:00","2015-01-19T03:00","CET","2015-01-19T02:00"
"19/01/2015 03:00:00 - 19/01/2015 04:00:00","BZN|DE-AT-LU","Without Sequence",28.41,"19/01/2015 03:00:00","2015-01-19T04:00","CET","2015-01-19T03:00"
"19/01/2015 04:00:00 - 19/01/2015 05:00:00","BZN|DE-AT-LU","Without Sequence",28.07,"19/01/2015 04:00:00","2015-01-19T05:00","CET","2015-01-19T04:00"
"19/01/2015 05:00:00 - 19/01/2015 06:00:00","BZN|DE-AT-LU","Without Sequence",29.63,"19/01/2015 05:00:00","2015-01-19T06:00","CET","2015-01-19T05:00"
"19/01/2015 06:00:00 - 19/01/2015 07:00:00","BZN|DE-AT-LU","Without Sequence",42.87,"19/01/2015 06:00:00","2015-01-19T07:00","CET","2015-01-19T06:00"
"19/01/2015 07:00:00 - 19/01/2015 08:00:00","BZN|DE-AT-LU","Without Sequence",52.07,"19/01/2015 07:00:00","2015-01-19T08:00","CET","2015-01-19T07:00"
"19/01/2015 08:00:00 - 19/01/2015 09:00:00","BZN|DE-AT-LU","Without Sequence",56.49,"19/01/2015 08:00:00","2015-01-19T09:00","CET","2015-01-19T08:00"
"19/01/2015 09:00:00 - 19/01/2015 10:00:00","BZN|DE-AT-LU","Without Sequence",52.38,"19/01/2015 09:00:00","2015-01-19T10:00","CET","2015-01-19T09:00"
"19/01/2015 10:00:00 - 19/01/2015 11:00:00","BZN|DE-AT-LU","Without Sequence",48.84,"19/01/2015 10:00:00","2015-01-19T11:00","CET","2015-01-19T10:00"
"19/01/2015 11:00:00 - 19/01/2015 12:00:00","BZN|DE-AT-LU","Without Sequence",47.95,"19/01/2015 11:00:00","2015-01-19T12:00","CET","2015-01-19T11:00"
"19/01/2015 12:00:00 - 19/01/2015 13:00:00","BZN|DE-AT-LU","Without Sequence",44.97,"19/01/2015 12:00:00","2015-01-19T13:00","CET","2015-01-19T12:00"
"19/01/2015 13:00:00 - 19/01/2015 14:00:00","BZN|DE-AT-LU","Without Sequence",47.95,"19/01/2015 13:00:00","2015-01-19T14:00","CET","2015-01-19T13:00"
"19/01/2015 14:00:00 - 19/01/2015 15:00:00","BZN|DE-AT-LU","Without Sequence",47.72,"19/01/2015 14:00:00","2015-01-19T15:00","CET","2015-01-19T14:00"
"19/01/2015 15:00:00 - 19/01/2015 16:00:00","BZN|DE-AT-LU","Without Sequence",47.43,"19/01/2015 15:00:00","2015-01-19T16:00","CET","2015-01-19T15:00"
"19/01/2015 16:00:00 - 19/01/2015 17:00:00","BZN|DE-AT-LU","Without Sequence",48.19,"19/01/2015 16:00:00","2015-01-19T17:00","CET","2015-01-19T16:00"
"19/01/2015 17:00:00 - 19/01/2015 18:00:00","BZN|DE-AT-LU","Without Sequence",52.16,"19/01/2015 17:00:00","2015-01-19T18:00","CET","2015-01-19T17:00"
"19/01/2015 18:00:00 - 19/01/2015 19:00:00","BZN|DE-AT-LU","Without Sequence",56.26,"19/01/2015 18:00:00","2015-01-19T19:00","CET","2015-01-19T18:00"
"19/01/2015 19:00:00 - 19/01/2015 20:00:00","BZN|DE-AT-LU","Without Sequence",52.96,"19/01/2015 19:00:00","2015-01-19T20:00","CET","2015-01-19T19:00"
"19/01/2015 20:00:00 - 19/01/2015 21:00:00","BZN|DE-AT-LU","Without Sequence",45,"19/01/2015 20:00:00","2015-01-19T21:00","CET","2015-01-19T20:00"
"19/01/2015 21:00:00 - 19/01/2015 22:00:00","BZN|DE-AT-LU","Without Sequence",40,"19/01/2015 21:00:00","2015-01-19T22:00","CET","2015-01-19T21:00"
"19/01/2015 22:00:00 - 19/01/2015 23:00:00","BZN|DE-AT-LU","Without Sequence",37.53,"19/01/2015 22:00:00","2015-01-19T23:00","CET","2015-01-19T22:00"
"19/01/2015 23:00:00 - 20/01/2015 00:00:00","BZN|DE-AT-LU","Without Sequence",37.53,"19/01/2015 23:00:00","2015-01-20T00:00","CET","2015-01-19T23:00"
"20/01/2015 00:00:00 - 20/01/2015 01:00:00","BZN|DE-AT-LU","Without Sequence",31.93,"20/01/2015 00:00:00","2015-01-20T01:00","CET","2015-01-20T00:00"
"20/01/2015 01:00:00 - 20/01/2015 02:00:00","BZN|DE-AT-LU","Without Sequence",31.08,"20/01/2015 01:00:00","2015-01-20T02:00","CET","2015-01-20T01:00"
"20/01/2015 02:00:00 - 20/01/2015 03:00:00","BZN|DE-AT-LU","Without Sequence",29.92,"20/01/2015 02:00:00","2015-01-20T03:00","CET","2015-01-20T02:00"
"20/01/2015 03:00:00 - 20/01/2015 04:00:00","BZN|DE-AT-LU","Without Sequence",29.97,"20/01/2015 03:00:00","2015-01-20T04:00","CET","2015-01-20T03:00"
"20/01/2015 04:00:00 - 20/01/2015 05:00:00","BZN|DE-AT-LU","Without Sequence",31.02,"20/01/2015 04:00:00","2015-01-20T05:00","CET","2015-01-20T04:00"
"20/01/2015 05:00:00 - 20/01/2015 06:00:00","BZN|DE-AT-LU","Without Sequence",34.81,"20/01/2015 05:00:00","2015-01-20T06:00","CET","2015-01-20T05:00"
"20/01/2015 06:00:00 - 20/01/2015 07:00:00","BZN|DE-AT-LU","Without Sequence",39.4,"20/01/2015 06:00:00","2015-01-20T07:00","CET","2015-01-20T06:00"
"20/01/2015 07:00:00 - 20/01/2015 08:00:00","BZN|DE-AT-LU","Without Sequence",53.39,"20/01/2015 07:00:00","2015-01-20T08:00","CET","2015-01-20T07:00"
"20/01/2015 08:00:00 - 20/01/2015 09:00:00","BZN|DE-AT-LU","Without Sequence",58.88,"20/01/2015 08:00:00","2015-01-20T09:00","CET","2015-01-20T08:00"
"20/01/2015 09:00:00 - 20/01/2015 10:00:00","BZN|DE-AT-LU","Without Sequence",58.8,"20/01/2015 09:00:00","2015-01-20T10:00","CET","2015-01-20T09:00"
"20/01/2015 10:00:00 - 20/01/2015 11:00:00","BZN|DE-AT-LU","Without Sequence",57.34,"20/01/2015 10:00:00","2015-01-20T11:00","CET","2015-01-20T10:00"
"20/01/2015 11:00:00 - 20/01/2015 12:00:00","BZN|DE-AT-LU","Without Sequence",57.46,"20/01/2015 11:00:00","2015-01-20T12:00","CET","2015-01-20T11:00"
"20/01/2015 12:00:00 - 20/01/2015 13:00:00","BZN|DE-AT-LU","Without Sequence",53.53,"20/01/2015 12:00:00","2015-01-20T13:00","CET","2015-01-20T12:00"
"20/01/2015 13:00:00 - 20/01/2015 14:00:00","BZN|DE-AT-LU","Without Sequence",52.93,"20/01/2015 13:00:00","2015-01-20T14:00","CET","2015-01-20T13:00"
"20/01/2015 14:00:00 - 20/01/2015 15:00:00","BZN|DE-AT-LU","Without Sequence",52.38,"20/01/2015 14:00:00","2015-01-20T15:00","CET","2015-01-20T14:00"
"20/01/2015 15:00:00 - 20/01/2015 16:00:00","BZN|DE-AT-LU","Without Sequence",52.1,"20/01/2015 15:00:00","2015-01-20T16:00","CET","2015-01-20T15:00"
"20/01/2015 16:00:00 - 20/01/2015 17:00:00","BZN|DE-AT-LU","Without Sequence",51.04,"20/01/2015 16:00:00","2015-01-20T17:00","CET","2015-01-20T16:00"
"20/01/2015 17:00:00 - 20/01/2015 18:00:00","BZN|DE-AT-LU","Without Sequence",58.55,"20/01/2015 17:00:00","2015-01-20T18:00","CET","2015-01-20T17:00"
"20/01/2015 18:00:00 - 20/01/2015 19:00:00","BZN|DE-AT-LU","Without Sequence",66.65,"20/01/2015 18:00:00","2015-01-20T19:00","CET","2015-01-20T18:00"
"20/01/2015 19:00:00 - 20/01/2015 20:00:00","BZN|DE-AT-LU","Without Sequence",56.02,"20/01/2015 19:00:00","2015-01-20T20:00","CET","2015-01-20T19:00"
"20/01/2015 20:00:00 - 20/01/2015 21:00:00","BZN|DE-AT-LU","Without Sequence",50.01,"20/01/2015 20:00:00","2015-01-20T21:00","CET","2015-01-20T20:00"
"20/01/2015 21:00:00 - 20/01/2015 22:00:00","BZN|DE-AT-LU","Without Sequence",42.73,"20/01/2015 21:00:00","2015-01-20T22:00","CET","2015-01-20T21:00"
"20/01/2015 22:00:00 - 20/01/2015 23:00:00","BZN|DE-AT-LU","Without Sequence",42.02,"20/01/2015 22:00:00","2015-01-20T23:00","CET","2015-01-20T22:00"
"20/01/2015 23:00:00 - 21/01/2015 00:00:00","BZN|DE-AT-LU","Without Sequence",42.02,"20/01/2015 23:00:00","2015-01-21T00:00","CET","2015-01-20T23:00"
"21/01/2015 00:00:00 - 21/01/2015 01:00:00","BZN|DE-AT-LU","Without Sequence",31.08,"21/01/2015 00:00:00","2015-01-21T01:00","CET","2015-01-21T00:00"
"21/01/2015 01:00:00 - 21/01/2015 02:00:00","BZN|DE-AT-LU","Without Sequence",32.07,"21/01/2015 01:00:00","2015-01-21T02:00","CET","2015-01-21T01:00"
"21/01/2015 02:00:00 - 21/01/2015 03:00:00","BZN|DE-AT-LU","Without Sequence",31.53,"21/01/2015 02:00:00","2015-01-21T03:00","CET","2015-01-21T02:00"
"21/01/2015 03:00:00 - 21/01/2015 04:00:00","BZN|DE-AT-LU","Without Sequence",31.2,"21/01/2015 03:00:00","2015-01-21T04:00","CET","2015-01-21T03:00"
"21/01/2015 04:00:00 - 21/01/2015 05:00:00","BZN|DE-AT-LU","Without Sequence",33.27,"21/01/2015 04:00:00","2015-01-21T05:00","CET","2015-01-21T04:00"
"21/01/2015 05:00:00 - 21/01/2015 06:00:00","BZN|DE-AT-LU","Without Sequence",35.07,"21/01/2015 05:00:00","2015-01-21T06:00","CET","2015-01-21T05:00"
"21/01/2015 06:00:00 - 21/01/2015 07:00:00","BZN|DE-AT-LU","Without Sequence",43.71,"21/01/2015 06:00:00","2015-01-21T07:00","CET","2015-01-21T06:00"
"21/01/2015 07:00:00 - 21/01/2015 08:00:00","BZN|DE-AT-LU","Without Sequence",54.12,"21/01/2015 07:00:00","2015-01-21T08:00","CET","2015-01-21T07:00"
"21/01/2015 08:00:00 - 21/01/2015 09:00:00","BZN|DE-AT-LU","Without Sequence",58.39,"21/01/2015 08:00:00","2015-01-21T09:00","CET","2015-01-21T08:00"
"21/01/2015 09:00:00 - 21/01/2015 10:00:00","BZN|DE-AT-LU","Without Sequence",56.6,"21/01/2015 09:00:00","2015-01-21T10:00","CET","2015-01-21T09:00"
"21/01/2015 10:00:00 - 21/01/2015 11:00:00","BZN|DE-AT-LU","Without Sequence",54.96,"21/01/2015 10:00:00","2015-01-21T11:00","CET","2015-01-21T10:00"
"21/01/2015 11:00:00 - 21/01/2015 12:00:00","BZN|DE-AT-LU","Without Sequence",53.99,"21/01/2015 11:00:00","2015-01-21T12:00","CET","2015-01-21T11:00"
"21/01/2015 12:00:00 - 21/01/2015 13:00:00","BZN|DE-AT-LU","Without Sequence",48.49,"21/01/2015 12:00:00","2015-01-21T13:00","CET","2015-01-21T12:00"
"21/01/2015 13:00:00 - 21/01/2015 14:00:00","BZN|DE-AT-LU","Without Sequence",49.59,"21/01/2015 13:00:00","2015-01-21T14:00","CET","2015-01-21T13:00"
"21/01/2015 14:00:00 - 21/01/2015 15:00:00","BZN|DE-AT-LU","Without Sequence",48,"21/01/2015 14:00:00","2015-01-21T15:00","CET","2015-01-21T14:00"
"21/01/2015 15:00:00 - 21/01/2015 16:00:00","BZN|DE-AT-LU","Without Sequence",50,"21/01/2015 15:00:00","2015-01-21T16:00","CET","2015-01-21T15:00"
"21/01/2015 16:00:00 - 21/01/2015 17:00:00","BZN|DE-AT-LU","Without Sequence",51.02,"21/01/2015 16:00:00","2015-01-21T17:00","CET","2015-01-21T16:00"
"21/01/2015 17:00:00 - 21/01/2015 18:00:00","BZN|DE-AT-LU","Without Sequence",55.47,"21/01/2015 17:00:00","2015-01-21T18:00","CET","2015-01-21T17:00"
"21/01/2015 18:00:00 - 21/01/2015 19:00:00","BZN|DE-AT-LU","Without Sequence",57.1,"21/01/2015 18:00:00","2015-01-21T19:00","CET","2015-01-21T18:00"
"21/01/2015 19:00:00 - 21/01/2015 20:00:00","BZN|DE-AT-LU","Without Sequence",51.95,"21/01/2015 19:00:00","2015-01-21T20:00","CET","2015-01-21T19:00"
"21/01/2015 20:00:00 - 21/01/2015 21:00:00","BZN|DE-AT-LU","Without Sequence",43.22,"21/01/2015 20:00:00","2015-01-21T21:00","CET","2015-01-21T20:00"
"21/01/2015 21:00:00 - 21/01/2015 22:00:00","BZN|DE-AT-LU","Without Sequence",38.98,"21/01/2015 21:00:00","2015-01-21T22:00","CET","2015-01-21T21:00"
"21/01/2015 22:00:00 - 21/01/2015 23:00:00","BZN|DE-AT-LU","Without Sequence",38.38,"21/01/2015 22:00:00","2015-01-21T23:00","CET","2015-01-21T22:00"
"21/01/2015 23:00:00 - 22/01/2015 00:00:00","BZN|DE-AT-LU","Without Sequence",38.38,"21/01/2015 23:00:00","2015-01-22T00:00","CET","2015-01-21T23:00"
"22/01/2015 00:00:00 - 22/01/2015 01:00:00","BZN|DE-AT-LU","Without Sequence",29.67,"22/01/2015 00:00:00","2015-01-22T01:00","CET","2015-01-22T00:00"
"22/01/2015 01:00:00 - 22/01/2015 02:00:00","BZN|DE-AT-LU","Without Sequence",29.93,"22/01/2015 01:00:00","2015-01-22T02:00","CET","2015-01-22T01:00"
"22/01/2015 02:00:00 - 22/01/2015 03:00:00","BZN|DE-AT-LU","Without Sequence",29,"22/01/2015 02:00:00","2015-01-22T03:00","CET","2015-01-22T02:00"
"22/01/2015 03:00:00 - 22/01/2015 04:00:00","BZN|DE-AT-LU","Without Sequence",28.96,"22/01/2015 03:00:00","2015-01-22T04:00","CET","2015-01-22T03:00"
"22/01/2015 04:00:00 - 22/01/2015 05:00:00","BZN|DE-AT-LU","Without Sequence",29.38,"22/01/2015 04:00:00","2015-01-22T05:00","CET","2015-01-22T04:00"
"22/01/2015 05:00:00 - 22/01/2015 06:00:00","BZN|DE-AT-LU","Without Sequence",31.09,"22/01/2015 05:00:00","2015-01-22T06:00","CET","2015-01-22T05:00"
"22/01/2015 06:00:00 - 22/01/2015 07:00:00","BZN|DE-AT-LU","Without Sequence",36.92,"22/01/2015 06:00:00","2015-01-22T07:00","CET","2015-01-22T06:00"
"22/01/2015 07:00:00 - 22/01/2015 08:00:00","BZN|DE-AT-LU","Without Sequence",48.42,"22/01/2015 07:00:00","2015-01-22T08:00","CET","2015-01-22T07:00"
"22/01/2015 08:00:00 - 22/01/2015 09:00:00","BZN|DE-AT-LU","Without Sequence",53.79,"22/01/2015 08:00:00","2015-01-22T09:00","CET","2015-01-22T08:00"
"22/01/2015 09:00:00 - 22/01/2015 10:00:00","BZN|DE-AT-LU","Without Sequence",50.52,"22/01/2015 09:00:00","2015-01-22T10:00","CET","2015-01-22T09:00"
"22/01/2015 10:00:00 - 22/01/2015 11:00:00","BZN|DE-AT-LU","Without Sequence",50.53,"22/01/2015 10:00:00","2015-01-22T11:00","CET","2015-01-22T10:00"
"22/01/2015 11:00:00 - 22/01/2015 12:00:00","BZN|DE-AT-LU","Without Sequence",49.89,"22/01/2015 11:00:00","2015-01-22T12:00","CET","2015-01-22T11:00"
"22/01/2015 12:00:00 - 22/01/2015 13:00:00","BZN|DE-AT-LU","Without Sequence",52.44,"22/01/2015 12:00:00","2015-01-22T13:00","CET","2015-01-22T12:00"
"22/01/2015 13:00:00 - 22/01/2015 14:00:00","BZN|DE-AT-LU","Without Sequence",54.01,"22/01/2015 13:00:00","2015-01-22T14:00","CET","2015-01-22T13:00"
"22/01/2015 14:00:00 - 22/01/2015 15:00:00","BZN|DE-AT-LU","Without Sequence",51.54,"22/01/2015 14:00:00","2015-01-22T15:00","CET","2015-01-22T14:00"
"22/01/2015 15:00:00 - 22/01/2015 16:00:00","BZN|DE-AT-LU","Without Sequence",49.99,"22/01/2015 15:00:00","2015-01-22T16:00","CET","2015-01-22T15:00"
"22/01/2015 16:00:00 - 22/01/2015 17:00:00","BZN|DE-AT-LU","Without Sequence",51.99,"22/01/2015 16:00:00","2015-01-22T17:00","CET","2015-01-22T16:00"
"22/01/2015 17:00:00 - 22/01/2015 18:00:00","BZN|DE-AT-LU","Without Sequence",59.2,"22/01/2015 17:00:00","2015-01-22T18:00","CET","2015-01-22T17:00"
"22/01/2015 18:00:00 - 22/01/2015 19:00:00","BZN|DE-AT-LU","Without Sequence",56.99,"22/01/2015 18:00:00","2015-01-22T19:00","CET","2015-01-22T18:00"
"22/01/2015 19:00:00 - 22/01/2015 20:00:00","BZN|DE-AT-LU","Without Sequence",53.81,"22/01/2015 19:00:00","2015-01-22T20:00","CET","2015-01-22T19:00"
"22/01/2015 20:00:00 - 22/01/2015 21:00:00","BZN|DE-AT-LU","Without Sequence",45.57,"22/01/2015 20:00:00","2015-01-22T21:00","CET","2015-01-22T20:00"
"22/01/2015 21:00:00 - 22/01/2015 22:00:00","BZN|DE-AT-LU","Without Sequence",39.86,"22/01/2015 21:00:00","2015-01-22T22:00","CET","2015-01-22T21:00"
"22/01/2015 22:00:00 - 22/01/2015 23:00:00","BZN|DE-AT-LU","Without Sequence",37.26,"22/01/2015 22:00:00","2015-01-22T23:00","CET","2015-01-22T22:00"
"22/01/2015 23:00:00 - 23/01/2015 00:00:00","BZN|DE-AT-LU","Without Sequence",37.26,"22/01/2015 23:00:00","2015-01-23T00:00","CET","2015-01-22T23:00"
"23/01/2015 00:00:00 - 23/01/2015 01:00:00","BZN|DE-AT-LU","Without Sequence",31.18,"23/01/2015 00:00:00","2015-01-23T01:00","CET","2015-01-23T00:00"
"23/01/2015 01:00:00 - 23/01/2015 02:00:00","BZN|DE-AT-LU","Without Sequence",29.97,"23/01/2015 01:00:00","2015-01-23T02:00","CET","2015-01-23T01:00"
"23/01/2015 02:00:00 - 23/01/2015 03:00:00","BZN|DE-AT-LU","Without Sequence",28.86,"23/01/2015 02:00:00","2015-01-23T03:00","CET","2015-01-23T02:00"
"23/01/2015 03:00:00 - 23/01/2015 04:00:00","BZN|DE-AT-LU","Without Sequence",28.78,"23/01/2015 03:00:00","2015-01-23T04:00","CET","2015-01-23T03:00"
"23/01/2015 04:00:00 - 23/01/2015 05:00:00","BZN|DE-AT-LU","Without Sequence",29.39,"23/01/2015 04:00:00","2015-01-23T05:00","CET","2015-01-23T04:00"
"23/01/2015 05:00:00 - 23/01/2015 06:00:00","BZN|DE-AT-LU","Without Sequence",32.49,"23/01/2015 05:00:00","2015-01-23T06:00","CET","2015-01-23T05:00"
"23/01/2015 06:00:00 - 23/01/2015 07:00:00","BZN|DE-AT-LU","Without Sequence",37.52,"23/01/2015 06:00:00","2015-01-23T07:00","CET","2015-01-23T06:00"
"23/01/2015 07:00:00 - 23/01/2015 08:00:00","BZN|DE-AT-LU","Without Sequence",54.28,"23/01/2015 07:00:00","2015-01-23T08:00","CET","2015-01-23T07:00"
"23/01/2015 08:00:00 - 23/01/2015 09:00:00","BZN|DE-AT-LU","Without Sequence",53.56,"23/01/2015 08:00:00","2015-01-23T09:00","CET","2015-01-23T08:00"
"23/01/2015 09:00:00 - 23/01/2015 10:00:00","BZN|DE-AT-LU","Without Sequence",57.68,"23/01/2015 09:00:00","2015-01-23T10:00","CET","2015-01-23T09:00"
"23/01/2015 10:00:00 - 23/01/2015 11:00:00","BZN|DE-AT-LU","Without Sequence",56.97,"23/01/2015 10:00:00","2015-01-23T11:00","CET","2015-01-23T10:00"
"23/01/2015 11:00:00 - 23/01/2015 12:00:00","BZN|DE-AT-LU","Without Sequence",55.75,"23/01/2015 11:00:00","2015-01-23T12:00","CET","2015-01-23T11:00"
"23/01/2015 12:00:00 - 23/01/2015 13:00:00","BZN|DE-AT-LU","Without Sequence",49.94,"23/01/2015 12:00:00","2015-01-23T13:00","CET","2015-01-23T12:00"
"23/01/2015 13:00:00 - 23/01/2015 14:00:00","BZN|DE-AT-LU","Without Sequence",47.77,"23/01/2015 13:00:00","2015-01-23T14:00","CET","2015-01-23T13:00"
"23/01/2015 14:00:00 - 23/01/2015 15:00:00","BZN|DE-AT-LU","Without Sequence",46.58,"23/01/2015 14:00:00","2015-01-23T15:00","CET","2015-01-23T14:00"
"23/01/2015 15:00:00 - 23/01/2015 16:00:00","BZN|DE-AT-LU","Without Sequence",44.09,"23/01/2015 15:00:00","2015-01-23T16:00","CET","2015-01-23T15:00"
"23/01/2015 16:00:00 - 23/01/2015 17:00:00","BZN|DE-AT-LU","Without Sequence",45.18,"23/01/2015 16:00:00","2015-01-23T17:00","CET","2015-01-23T16:00"
"23/01/2015 17:00:00 - 23/01/2015 18:00:00","BZN|DE-AT-LU","Without Sequence",49.98,"23/01/2015 17:00:00","2015-01-23T18:00","CET","2015-01-23T17:00"
"23/01/2015 18:00:00 - 23/01/2015 19:00:00","BZN|DE-AT-LU","Without Sequence",47.99,"23/01/2015 18:00:00","2015-01-23T19:00","CET","2015-01-23T18:00"
"23/01/2015 19:00:00 - 23/01/2015 20:00:00","BZN|DE-AT-LU","Without Sequence",46.98,"23/01/2015 19:00:00","2015-01-23T20:00","CET","2015-01-23T19:00"
"23/01/2015 20:00:00 - 23/01/2015 21:00:00","BZN|DE-AT-LU","Without Sequence",41.48,"23/01/2015 20:00:00","2015-01-23T21:00","CET","2015-01-23T20:00"
"23/01/2015 21:00:00 - 23/01/2015 22:00:00","BZN|DE-AT-LU","Without Sequence",35.12,"23/01/2015 21:00:00","2015-01-23T22:00","CET","2015-01-23T21:00"
"23/01/2015 22:00:00 - 23/01/2015 23:00:00","BZN|DE-AT-LU","Without Sequence",34.21,"23/01/2015 22:00:00","2015-01-23T23:00","CET","2015-01-23T22:00"
"23/01/2015 23:00:00 - 24/01/2015 00:00:00","BZN|DE-AT-LU","Without Sequence",34.21,"23/01/2015 23:00:00","2015-01-24T00:00","CET","2015-01-23T23:00"
"24/01/2015 00:00:00 - 24/01/2015 01:00:00","BZN|DE-AT-LU","Without Sequence",28.5,"24/01/2015 00:00:00","2015-01-24T01:00","CET","2015-01-24T00:00"
"24/01/2015 01:00:00 - 24/01/2015 02:00:00","BZN|DE-AT-LU","Without Sequence",27.04,"24/01/2015 01:00:00","2015-01-24T02:00","CET","2015-01-24T01:00"
"24/01/2015 02:00:00 - 24/01/2015 03:00:00","BZN|DE-AT-LU","Without Sequence",24.44,"24/01/2015 02:00:00","2015-01-24T03:00","CET","2015-01-24T02:00"
"24/01/2015 03:00:00 - 24/01/2015 04:00:00","BZN|DE-AT-LU","Without Sequence",24.29,"24/01/2015 03:00:00","2015-01-24T04:00","CET","2015-01-24T03:00"
"24/01/2015 04:00:00 - 24/01/2015 05:00:00","BZN|DE-AT-LU","Without Sequence",25.93,"24/01/2015 04:00:00","2015-01-24T05:00","CET","2015-01-24T04:00"
"24/01/2015 05:00:00 - 24/01/2015 06:00:00","BZN|DE-AT-LU","Without Sequence",24.99,"24/01/2015 05:00:00","2015-01-24T06:00","CET","2015-01-24T05:00"
"24/01/2015 06:00:00 - 24/01/2015 07:00:00","BZN|DE-AT-LU","Without Sequence",23.94,"24/01/2015 06:00:00","2015-01-24T07:00","CET","2015-01-24T06:00"
"24/01/2015 07:00:00 - 24/01/2015 08:00:00","BZN|DE-AT-LU","Without Sequence",24.26,"24/01/2015 07:00:00","2015-01-24T08:00","CET","2015-01-24T07:00"
"24/01/2015 08:00:00 - 24/01/2015 09:00:00","BZN|DE-AT-LU","Without Sequence",27.6,"24/01/2015 08:00:00","2015-01-24T09:00","CET","2015-01-24T08:00"
"24/01/2015 09:00:00 - 24/01/2015 10:00:00","BZN|DE-AT-LU","Without Sequence",29.53,"24/01/2015 09:00:00","2015-01-24T10:00","CET","2015-01-24T09:00"
"24/01/2015 10:00:00 - 24/01/2015 11:00:00","BZN|DE-AT-LU","Without Sequence",30.26,"24/01/2015 10:00:00","2015-01-24T11:00","CET","2015-01-24T10:00"
"24/01/2015 11:00:00 - 24/01/2015 12:00:00","BZN|DE-AT-LU","Without Sequence",37.81,"24/01/2015 11:00:00","2015-01-24T12:00","CET","2015-01-24T11:00"
"24/01/2015 12:00:00 - 24/01/2015 13:00:00","BZN|DE-AT-LU","Without Sequence",37.27,"24/01/2015 12:00:00","2015-01-24T13:00","CET","2015-01-24T12:00"
"24/01/2015 13:00:00 - 24/01/2015 14:00:00","BZN|DE-AT-LU","Without Sequence",34.37,"24/01/2015 13:00:00","2015-01-24T14:00","CET","2015-01-24T13:00"
"24/01/2015 14:00:00 - 24/01/2015 15:00:00","BZN|DE-AT-LU","Without Sequence",30.07,"24/01/2015 14:00:00","2015-01-24T15:00","CET","2015-01-24T14:00"
"24/01/2015 15:00:00 - 24/01/2015 16:00:00","BZN|DE-AT-LU","Without Sequence",30.25,"24/01/2015 15:00:00","2015-01-24T16:00","CET","2015-01-24T15:00"
"24/01/2015 16:00:00 - 24/01/2015 17:00:00","BZN|DE-AT-LU","Without Sequence",34.52,"24/01/2015 16:00:00","2015-01-24T17:00","CET","2015-01-24T16:00"
"24/01/2015 17:00:00 - 24/01/2015 18:00:00","BZN|DE-AT-LU","Without Sequence",36.09,"24/01/2015 17:00:00","2015-01-24T18:00","CET","2015-01-24T17:00"
"24/01/2015 18:00:00 - 24/01/2015 19:00:00","BZN|DE-AT-LU","Without Sequence",37.86,"24/01/2015 18:00:00","2015-01-24T19:00","CET","2015-01-24T18:00"
"24/01/2015 19:00:00 - 24/01/2015 20:00:00","BZN|DE-AT-LU","Without Sequence",34.56,"24/01/2015 19:00:00","2015-01-24T20:00","CET","2015-01-24T19:00"
"24/01/2015 20:00:00 - 24/01/2015 21:00:00","BZN|DE-AT-LU","Without Sequence",30.04,"24/01/2015 20:00:00","2015-01-24T21:00","CET","2015-01-24T20:00"
"24/01/2015 21:00:00 - 24/01/2015 22:00:00","BZN|DE-AT-LU","Without Sequence",27.97,"24/01/2015 21:00:00","2015-01-24T22:00","CET","2015-01-24T21:00"
"24/01/2015 22:00:00 - 24/01/2015 23:00:00","BZN|DE-AT-LU","Without Sequence",28.11,"24/01/2015 22:00:00","2015-01-24T23:00","CET","2015-01-24T22:00"
"24/01/2015 23:00:00 - 25/01/2015 00:00:00","BZN|DE-AT-LU","Without Sequence",28.11,"24/01/2015 23:00:00","2015-01-25T00:00","CET","2015-01-24T23:00"
"25/01/2015 00:00:00 - 25/01/2015 01:00:00","BZN|DE-AT-LU","Without Sequence",23.26,"25/01/2015 00:00:00","2015-01-25T01:00","CET","2015-01-25T00:00"
"25/01/2015 01:00:00 - 25/01/2015 02:00:00","BZN|DE-AT-LU","Without Sequence",22.13,"25/01/2015 01:00:00","2015-01-25T02:00","CET","2015-01-25T01:00"
"25/01/2015 02:00:00 - 25/01/2015 03:00:00","BZN|DE-AT-LU","Without Sequence",19.04,"25/01/2015 02:00:00","2015-01-25T03:00","CET","2015-01-25T02:00"
"25/01/2015 03:00:00 - 25/01/2015 04:00:00","BZN|DE-AT-LU","Without Sequence",19.91,"25/01/2015 03:00:00","2015-01-25T04:00","CET","2015-01-25T03:00"
"25/01/2015 04:00:00 - 25/01/2015 05:00:00","BZN|DE-AT-LU","Without Sequence",21.49,"25/01/2015 04:00:00","2015-01-25T05:00","CET","2015-01-25T04:00"
"25/01/2015 05:00:00 - 25/01/2015 06:00:00","BZN|DE-AT-LU","Without Sequence",21.75,"25/01/2015 05:00:00","2015-01-25T06:00","CET","2015-01-25T05:00"
"25/01/2015 06:00:00 - 25/01/2015 07:00:00","BZN|DE-AT-LU","Without Sequence",19.82,"25/01/2015 06:00:00","2015-01-25T07:00","CET","2015-01-25T06:00"
"25/01/2015 07:00:00 - 25/01/2015 08:00:00","BZN|DE-AT-LU","Without Sequence",22.35,"25/01/2015 07:00:00","2015-01-25T08:00","CET","2015-01-25T07:00"
"25/01/2015 08:00:00 - 25/01/2015 09:00:00","BZN|DE-AT-LU","Without Sequence",24.64,"25/01/2015 08:00:00","2015-01-25T09:00","CET","2015-01-25T08:00"
"25/01/2015 09:00:00 - 25/01/2015 10:00:00","BZN|DE-AT-LU","Without Sequence",28.03,"25/01/2015 09:00:00","2015-01-25T10:00","CET","2015-01-25T09:00"
"25/01/2015 10:00:00 - 25/01/2015 11:00:00","BZN|DE-AT-LU","Without Sequence",29.94,"25/01/2015 10:00:00","2015-01-25T11:00","CET","2015-01-25T10:00"
"25/01/2015 11:00:00 - 25/01/2015 12:00:00","BZN|DE-AT-LU","Without Sequence",36.65,"25/01/2015 11:00:00","2015-01-25T12:00","CET","2015-01-25T11:00"
"25/01/2015 12:00:00 - 25/01/2015 13:00:00","BZN|DE-AT-LU","Without Sequence",31.99,"25/01/2015 12:00:00","2015-01-25T13:00","CET","2015-01-25T12:00"
"25/01/2015 13:00:00 - 25/01/2015 14:00:00","BZN|DE-AT-LU","Without Sequence",29.25,"25/01/2015 13:00:00","2015-01-25T14:00","CET","2015-01-25T13:00"
"25/01/2015 14:00:00 - 25/01/2015 15:00:00","BZN|DE-AT-LU","Without Sequence",29.13,"25/01/2015 14:00:00","2015-01-25T15:00","CET","2015-01-25T14:00"
"25/01/2015 15:00:00 - 25/01/2015 16:00:00","BZN|DE-AT-LU","Without Sequence",29.26,"25/01/2015 15:00:00","2015-01-25T16:00","CET","2015-01-25T15:00"
"25/01/2015 16:00:00 - 25/01/2015 17:00:00","BZN|DE-AT-LU","Without Sequence",30.29,"25/01/2015 16:00:00","2015-01-25T17:00","CET","2015-01-25T16:00"
"25/01/2015 17:00:00 - 25/01/2015 18:00:00","BZN|DE-AT-LU","Without Sequence",36.5,"25/01/2015 17:00:00","2015-01-25T18:00","CET","2015-01-25T17:00"
"25/01/2015 18:00:00 - 25/01/2015 19:00:00","BZN|DE-AT-LU","Without Sequence",40.96,"25/01/2015 18:00:00","2015-01-25T19:00","CET","2015-01-25T18:00"
"25/01/2015 19:00:00 - 25/01/2015 20:00:00","BZN|DE-AT-LU","Without Sequence",39.03,"25/01/2015 19:00:00","2015-01-25T20:00","CET","2015-01-25T19:00"
"25/01/2015 20:00:00 - 25/01/2015 21:00:00","BZN|DE-AT-LU","Without Sequence",34.92,"25/01/2015 20:00:00","2015-01-25T21:00","CET","2015-01-25T20:00"
"25/01/2015 21:00:00 - 25/01/2015 22:00:00","BZN|DE-AT-LU","Without Sequence",30.2,"25/01/2015 21:00:00","2015-01-25T22:00","CET","2015-01-25T21:00"
"25/01/2015 22:00:00 - 25/01/2015 23:00:00","BZN|DE-AT-LU","Without Sequence",29.99,"25/01/2015 22:00:00","2015-01-25T23:00","CET","2015-01-25T22:00"
"25/01/2015 23:00:00 - 26/01/2015 00:00:00","BZN|DE-AT-LU","Without Sequence",29.99,"25/01/2015 23:00:00","2015-01-26T00:00","CET","2015-01-25T23:00"
"26/01/2015 00:00:00 - 26/01/2015 01:00:00","BZN|DE-AT-LU","Without Sequence",26.93,"26/01/2015 00:00:00","2015-01-26T01:00","CET","2015-01-26T00:00"
"26/01/2015 01:00:00 - 26/01/2015 02:00:00","BZN|DE-AT-LU","Without Sequence",26.13,"26/01/2015 01:00:00","2015-01-26T02:00","CET","2015-01-26T01:00"
"26/01/2015 02:00:00 - 26/01/2015 03:00:00","BZN|DE-AT-LU","Without Sequence",25.54,"26/01/2015 02:00:00","2015-01-26T03:00","CET","2015-01-26T02:00"
"26/01/2015 03:00:00 - 26/01/2015 04:00:00","BZN|DE-AT-LU","Without Sequence",25.41,"26/01/2015 03:00:00","2015-01-26T04:00","CET","2015-01-26T03:00"
"26/01/2015 04:00:00 - 26/01/2015 05:00:00","BZN|DE-AT-LU","Without Sequence",25.8,"26/01/2015 04:00:00","2015-01-26T05:00","CET","2015-01-26T04:00"
"26/01/2015 05:00:00 - 26/01/2015 06:00:00","BZN|DE-AT-LU","Without Sequence",27.1,"26/01/2015 05:00:00","2015-01-26T06:00","CET","2015-01-26T05:00"
"26/01/2015 06:00:00 - 26/01/2015 07:00:00","BZN|DE-AT-LU","Without Sequence",41.94,"26/01/2015 06:00:00","2015-01-26T07:00","CET","2015-01-26T06:00"
"26/01/2015 07:00:00 - 26/01/2015 08:00:00","BZN|DE-AT-LU","Without Sequence",55.16,"26/01/2015 07:00:00","2015-01-26T08:00","CET","2015-01-26T07:00"
"26/01/2015 08:00:00 - 26/01/2015 09:00:00","BZN|DE-AT-LU","Without Sequence",53.22,"26/01/2015 08:00:00","2015-01-26T09:00","CET","2015-01-26T08:00"
"26/01/2015 09:00:00 - 26/01/2015 10:00:00","BZN|DE-AT-LU","Without Sequence",47.28,"26/01/2015 09:00:00","2015-01-26T10:00","CET","2015-01-26T09:00"
"26/01/2015 10:00:00 - 26/01/2015 11:00:00","BZN|DE-AT-LU","Without Sequence",45.28,"26/01/2015 10:00:00","2015-01-26T11:00","CET","2015-01-26T10:00"
"26/01/2015 11:00:00 - 26/01/2015 12:00:00","BZN|DE-AT-LU","Without Sequence",47.43,"26/01/2015 11:00:00","2015-01-26T12:00","CET","2015-01-26T11:00"
"26/01/2015 12:00:00 - 26/01/2015 13:00:00","BZN|DE-AT-LU","Without Sequence",46.22,"26/01/2015 12:00:00","2015-01-26T13:00","CET","2015-01-26T12:00"
"26/01/2015 13:00:00 - 26/01/2015 14:00:00","BZN|DE-AT-LU","Without Sequence",46,"26/01/2015 13:00:00","2015-01-26T14:00","CET","2015-01-26T13:00"
"26/01/2015 14:00:00 - 26/01/2015 15:00:00","BZN|DE-AT-LU","Without Sequence",42.47,"26/01/2015 14:00:00","2015-01-26T15:00","CET","2015-01-26T14:00"
"26/01/2015 15:00:00 - 26/01/2015 16:00:00","BZN|DE-AT-LU","Without Sequence",42.44,"26/01/2015 15:00:00","2015-01-26T16:00","CET","2015-01-26T15:00"
"26/01/2015 16:00:00 - 26/01/2015 17:00:00","BZN|DE-AT-LU","Without Sequence",39.76,"26/01/2015 16:00:00","2015-01-26T17:00","CET","2015-01-26T16:00"
"26/01/2015 17:00:00 - 26/01/2015 18:00:00","BZN|DE-AT-LU","Without Sequence",44.92,"26/01/2015 17:00:00","2015-01-26T18:00","CET","2015-01-26T17:00"
"26/01/2015 18:00:00 - 26/01/2015 19:00:00","BZN|DE-AT-LU","Without Sequence",44.03,"26/01/2015 18:00:00","2015-01-26T19:00","CET","2015-01-26T18:00"
"26/01/2015 19:00:00 - 26/01/2015 20:00:00","BZN|DE-AT-LU","Without Sequence",36.98,"26/01/2015 19:00:00","2015-01-26T20:00","CET","2015-01-26T19:00"
"26/01/2015 20:00:00 - 26/01/2015 21:00:00","BZN|DE-AT-LU","Without Sequence",30.34,"26/01/2015 20:00:00","2015-01-26T21:00","CET","2015-01-26T20:00"
"26/01/2015 21:00:00 - 26/01/2015 22:00:00","BZN|DE-AT-LU","Without Sequence",28.49,"26/01/2015 21:00:00","2015-01-26T22:00","CET","2015-01-26T21:00"
"26/01/2015 22:00:00 - 26/01/2015 23:00:00","BZN|DE-AT-LU","Without Sequence",27.15,"26/01/2015 22:00:00","2015-01-26T23:00","CET","2015-01-26T22:00"
"26/01/2015 23:00:00 - 27/01/2015 00:00:00","BZN|DE-AT-LU","Without Sequence",27.15,"26/01/2015 23:00:00","2015-01-27T00:00","CET","2015-01-26T23:00"
"27/01/2015 00:00:00 - 27/01/2015 01:00:00","BZN|DE-AT-LU","Without Sequence",20.36,"27/01/2015 00:00:00","2015-01-27T01:00","CET","2015-01-27T00:00"
"27/01/2015 01:00:00 - 27/01/2015 02:00:00","BZN|DE-AT-LU","Without Sequence",16.31,"27/01/2015 01:00:00","2015-01-27T02:00","CET","2015-01-27T01:00"
"27/01/2015 02:00:00 - 27/01/2015 03:00:00","BZN|DE-AT-LU","Without Sequence",16.95,"27/01/2015 02:00:00","2015-01-27T03:00","CET","2015-01-27T02:00"
"27/01/2015 03:00:00 - 27/01/2015 04:00:00","BZN|DE-AT-LU","Without Sequence",16.34,"27/01/2015 03:00:00","2015-01-27T04:00","CET","2015-01-27T03:00"
"27/01/2015 04:00:00 - 27/01/2015 05:00:00","BZN|DE-AT-LU","Without Sequence",19.92,"27/01/2015 04:00:00","2015-01-27T05:00","CET","2015-01-27T04:00"
"27/01/2015 05:00:00 - 27/01/2015 06:00:00","BZN|DE-AT-LU","Without Sequence",22.92,"27/01/2015 05:00:00","2015-01-27T06:00","CET","2015-01-27T05:00"
"27/01/2015 06:00:00 - 27/01/2015 07:00:00","BZN|DE-AT-LU","Without Sequence",27.57,"27/01/2015 06:00:00","2015-01-27T07:00","CET","2015-01-27T06:00"
"27/01/2015 07:00:00 - 27/01/2015 08:00:00","BZN|DE-AT-LU","Without Sequence",34.27,"27/01/2015 07:00:00","2015-01-27T08:00","CET","2015-01-27T07:00"
"27/01/2015 08:00:00 - 27/01/2015 09:00:00","BZN|DE-AT-LU","Without Sequence",35.92,"27/01/2015 08:00:00","2015-01-27T09:00","CET","2015-01-27T08:00"
"27/01/2015 09:00:00 - 27/01/2015 10:00:00","BZN|DE-AT-LU","Without Sequence",36.97,"27/01/2015 09:00:00","2015-01-27T10:00","CET","2015-01-27T09:00"
"27/01/2015 10:00:00 - 27/01/2015 11:00:00","BZN|DE-AT-LU","Without Sequence",36.94,"27/01/2015 10:00:00","2015-01-27T11:00","CET","2015-01-27T10:00"
"27/01/2015 11:00:00 - 27/01/2015 12:00:00","BZN|DE-AT-LU","Without Sequence",38.33,"27/01/2015 11:00:00","2015-01-27T12:00","CET","2015-01-27T11:00"
"27/01/2015 12:00:00 - 27/01/2015 13:00:00","BZN|DE-AT-LU","Without Sequence",37.93,"27/01/2015 12:00:00","2015-01-27T13:00","CET","2015-01-27T12:00"
"27/01/2015 13:00:00 - 27/01/2015 14:00:00","BZN|DE-AT-LU","Without Sequence",38.19,"27/01/2015 13:00:00","2015-01-27T14:00","CET","2015-01-27T13:00"
"27/01/2015 14:00:00 - 27/01/2015 15:00:00","BZN|DE-AT-LU","Without Sequence",39.14,"27/01/2015 14:00:00","2015-01-27T15:00","CET","2015-01-27T14:00"
"27/01/2015 15:00:00 - 27/01/2015 16:00:00","BZN|DE-AT-LU","Without Sequence",40.96,"27/01/2015 15:00:00","2015-01-27T16:00","CET","2015-01-27T15:00"
"27/01/2015 16:00:00 - 27/01/2015 17:00:00","BZN|DE-AT-LU","Without Sequence",38.93,"27/01/2015 16:00:00","2015-01-27T17:00","CET","2015-01-27T16:00"
"27/01/2015 17:00:00 - 27/01/2015 18:00:00","BZN|DE-AT-LU","Without Sequence",50.65,"27/01/2015 17:00:00","2015-01-27T18:00","CET","2015-01-27T17:00"
"27/01/2015 18:00:00 - 27/01/2015 19:00:00","BZN|DE-AT-LU","Without Sequence",46.31,"27/01/2015 18:00:00","2015-01-27T19:00","CET","2015-01-27T18:00"
"27/01/2015 19:00:00 - 27/01/2015 20:00:00","BZN|DE-AT-LU","Without Sequence",42.26,"27/01/2015 19:00:00","2015-01-27T20:00","CET","2015-01-27T19:00"
"27/01/2015 20:00:00 - 27/01/2015 21:00:00","BZN|DE-AT-LU","Without Sequence",40,"27/01/2015 20:00:00","2015-01-27T21:00","CET","2015-01-27T20:00"
"27/01/2015 21:00:00 - 27/01/2015 22:00:00","BZN|DE-AT-LU","Without Sequence",35.23,"27/01/2015 21:00:00","2015-01-27T22:00","CET","2015-01-27T21:00"
"27/01/2015 22:00:00 - 27/01/2015 23:00:00","BZN|DE-AT-LU","Without Sequence",30.28,"27/01/2015 22:00:00","2015-01-27T23:00","CET","2015-01-27T22:00"
"27/01/2015 23:00:00 - 28/01/2015 00:00:00","BZN|DE-AT-LU","Without Sequence",30.28,"27/01/2015 23:00:00","2015-01-28T00:00","CET","2015-01-27T23:00"
"28/01/2015 00:00:00 - 28/01/2015 01:00:00","BZN|DE-AT-LU","Without Sequence",26.97,"28/01/2015 00:00:00","2015-01-28T01:00","CET","2015-01-28T00:00"
"28/01/2015 01:00:00 - 28/01/2015 02:00:00","BZN|DE-AT-LU","Without Sequence",26.59,"28/01/2015 01:00:00","2015-01-28T02:00","CET","2015-01-28T01:00"
"28/01/2015 02:00:00 - 28/01/2015 03:00:00","BZN|DE-AT-LU","Without Sequence",25.93,"28/01/2015 02:00:00","2015-01-28T03:00","CET","2015-01-28T02:00"
"28/01/2015 03:00:00 - 28/01/2015 04:00:00","BZN|DE-AT-LU","Without Sequence",25.27,"28/01/2015 03:00:00","2015-01-28T04:00","CET","2015-01-28T03:00"
"28/01/2015 04:00:00 - 28/01/2015 05:00:00","BZN|DE-AT-LU","Without Sequence",25.75,"28/01/2015 04:00:00","2015-01-28T05:00","CET","2015-01-28T04:00"
"28/01/2015 05:00:00 - 28/01/2015 06:00:00","BZN|DE-AT-LU","Without Sequence",25.94,"28/01/2015 05:00:00","2015-01-28T06:00","CET","2015-01-28T05:00"
"28/01/2015 06:00:00 - 28/01/2015 07:00:00","BZN|DE-AT-LU","Without Sequence",34.25,"28/01/2015 06:00:00","2015-01-28T07:00","CET","2015-01-28T06:00"
"28/01/2015 07:00:00 - 28/01/2015 08:00:00","BZN|DE-AT-LU","Without Sequence",44.31,"28/01/2015 07:00:00","2015-01-28T08:00","CET","2015-01-28T07:00"
"28/01/2015 08:00:00 - 28/01/2015 09:00:00","BZN|DE-AT-LU","Without Sequence",42.86,"28/01/2015 08:00:00","2015-01-28T09:00","CET","2015-01-28T08:00"
"28/01/2015 09:00:00 - 28/01/2015 10:00:00","BZN|DE-AT-LU","Without Sequence",33.96,"28/01/2015 09:00:00","2015-01-28T10:00","CET","2015-01-28T09:00"
"28/01/2015 10:00:00 - 28/01/2015 11:00:00","BZN|DE-AT-LU","Without Sequence",33.11,"28/01/2015 10:00:00","2015-01-28T11:00","CET","2015-01-28T10:00"
"28/01/2015 11:00:00 - 28/01/2015 12:00:00","BZN|DE-AT-LU","Without Sequence",29.72,"28/01/2015 11:00:00","2015-01-28T12:00","CET","2015-01-28T11:00"
"28/01/2015 12:00:00 - 28/01/2015 13:00:00","BZN|DE-AT-LU","Without Sequence",27.85,"28/01/2015 12:00:00","2015-01-28T13:00","CET","2015-01-28T12:00"
"28/01/2015 13:00:00 - 28/01/2015 14:00:00","BZN|DE-AT-LU","Without Sequence",27.63,"28/01/2015 13:00:00","2015-01-28T14:00","CET","2015-01-28T13:00"
"28/01/2015 14:00:00 - 28/01/2015 15:00:00","BZN|DE-AT-LU","Without Sequence",27.03,"28/01/2015 14:00:00","2015-01-28T15:00","CET","2015-01-28T14:00"
"28/01/2015 15:00:00 - 28/01/2015 16:00:00","BZN|DE-AT-LU","Without Sequence",26.59,"28/01/2015 15:00:00","2015-01-28T16:00","CET","2015-01-28T15:00"
"28/01/2015 16:00:00 - 28/01/2015 17:00:00","BZN|DE-AT-LU","Without Sequence",27,"28/01/2015 16:00:00","2015-01-28T17:00","CET","2015-01-28T16:00"
"28/01/2015 17:00:00 - 28/01/2015 18:00:00","BZN|DE-AT-LU","Without Sequence",29.95,"28/01/2015 17:00:00","2015-01-28T18:00","CET","2015-01-28T17:00"
"28/01/2015 18:00:00 - 28/01/2015 19:00:00","BZN|DE-AT-LU","Without Sequence",28.62,"28/01/2015 18:00:00","2015-01-28T19:00","CET","2015-01-28T18:00"
"28/01/2015 19:00:00 - 28/01/2015 20:00:00","BZN|DE-AT-LU","Without Sequence",28.01,"28/01/2015 19:00:00","2015-01-28T20:00","CET","2015-01-28T19:00"
"28/01/2015 20:00:00 - 28/01/2015 21:00:00","BZN|DE-AT-LU","Without Sequence",25.47,"28/01/2015 20:00:00","2015-01-28T21:00","CET","2015-01-28T20:00"
"28/01/2015 21:00:00 - 28/01/2015 22:00:00","BZN|DE-AT-LU","Without Sequence",21.69,"28/01/2015 21:00:00","2015-01-28T22:00","CET","2015-01-28T21:00"
"28/01/2015 22:00:00 - 28/01/2015 23:00:00","BZN|DE-AT-LU","Without Sequence",16.96,"28/01/2015 22:00:00","2015-01-28T23:00","CET","2015-01-28T22:00"
"28/01/2015 23:00:00 - 29/01/2015 00:00:00","BZN|DE-AT-LU","Without Sequence",16.96,"28/01/2015 23:00:00","2015-01-29T00:00","CET","2015-01-28T23:00"
"29/01/2015 00:00:00 - 29/01/2015 01:00:00","BZN|DE-AT-LU","Without Sequence",9.98,"29/01/2015 00:00:00","2015-01-29T01:00","CET","2015-01-29T00:00"
"29/01/2015 01:00:00 - 29/01/2015 02:00:00","BZN|DE-AT-LU","Without Sequence",10.74,"29/01/2015 01:00:00","2015-01-29T02:00","CET","2015-01-29T01:00"
"29/01/2015 02:00:00 - 29/01/2015 03:00:00","BZN|DE-AT-LU","Without Sequence",9.21,"29/01/2015 02:00:00","2015-01-29T03:00","CET","2015-01-29T02:00"
"29/01/2015 03:00:00 - 29/01/2015 04:00:00","BZN|DE-AT-LU","Without Sequence",9.37,"29/01/2015 03:00:00","2015-01-29T04:00","CET","2015-01-29T03:00"
"29/01/2015 04:00:00 - 29/01/2015 05:00:00","BZN|DE-AT-LU","Without Sequence",11.84,"29/01/2015 04:00:00","2015-01-29T05:00","CET","2015-01-29T04:00"
"29/01/2015 05:00:00 - 29/01/2015 06:00:00","BZN|DE-AT-LU","Without Sequence",13.37,"29/01/2015 05:00:00","2015-01-29T06:00","CET","2015-01-29T05:00"
"29/01/2015 06:00:00 - 29/01/2015 07:00:00","BZN|DE-AT-LU","Without Sequence",26.2,"29/01/2015 06:00:00","2015-01-29T07:00","CET","2015-01-29T06:00"
"29/01/2015 07:00:00 - 29/01/2015 08:00:00","BZN|DE-AT-LU","Without Sequence",30,"29/01/2015 07:00:00","2015-01-29T08:00","CET","2015-01-29T07:00"
"29/01/2015 08:00:00 - 29/01/2015 09:00:00","BZN|DE-AT-LU","Without Sequence",32.12,"29/01/2015 08:00:00","2015-01-29T09:00","CET","2015-01-29T08:00"
"29/01/2015 09:00:00 - 29/01/2015 10:00:00","BZN|DE-AT-LU","Without Sequence",28.89,"29/01/2015 09:00:00","2015-01-29T10:00","CET","2015-01-29T09:00"
"29/01/2015 10:00:00 - 29/01/2015 11:00:00","BZN|DE-AT-LU","Without Sequence",28.81,"29/01/2015 10:00:00","2015-01-29T11:00","CET","2015-01-29T10:00"
"29/01/2015 11:00:00 - 29/01/2015 12:00:00","BZN|DE-AT-LU","Without Sequence",29.81,"29/01/2015 11:00:00","2015-01-29T12:00","CET","2015-01-29T11:00"
"29/01/2015 12:00:00 - 29/01/2015 13:00:00","BZN|DE-AT-LU","Without Sequence",28.63,"29/01/2015 12:00:00","2015-01-29T13:00","CET","2015-01-29T12:00"
"29/01/2015 13:00:00 - 29/01/2015 14:00:00","BZN|DE-AT-LU","Without Sequence",28.56,"29/01/2015 13:00:00","2015-01-29T14:00","CET","2015-01-29T13:00"
"29/01/2015 14:00:00 - 29/01/2015 15:00:00","BZN|DE-AT-LU","Without Sequence",29.18,"29/01/2015 14:00:00","2015-01-29T15:00","CET","2015-01-29T14:00"
"29/01/2015 15:00:00 - 29/01/2015 16:00:00","BZN|DE-AT-LU","Without Sequence",33.82,"29/01/2015 15:00:00","2015-01-29T16:00","CET","2015-01-29T15:00"
"29/01/2015 16:00:00 - 29/01/2015 17:00:00","BZN|DE-AT-LU","Without Sequence",32.45,"29/01/2015 16:00:00","2015-01-29T17:00","CET","2015-01-29T16:00"
"29/01/2015 17:00:00 - 29/01/2015 18:00:00","BZN|DE-AT-LU","Without Sequence",41.35,"29/01/2015 17:00:00","2015-01-29T18:00","CET","2015-01-29T17:00"
"29/01/2015 18:00:00 - 29/01/2015 19:00:00","BZN|DE-AT-LU","Without Sequence",39.73,"29/01/2015 18:00:00","2015-01-29T19:00","CET","2015-01-29T18:00"
"29/01/2015 19:00:00 - 29/01/2015 20:00:00","BZN|DE-AT-LU","Without Sequence",39,"29/01/2015 19:00:00","2015-01-29T20:00","CET","2015-01-29T19:00"
"29/01/2015 20:00:00 - 29/01/2015 21:00:00","BZN|DE-AT-LU","Without Sequence",33.41,"29/01/2015 20:00:00","2015-01-29T21:00","CET","2015-01-29T20:00"
"29/01/2015 21:00:00 - 29/01/2015 22:00:00","BZN|DE-AT-LU","Without Sequence",29.09,"29/01/2015 21:00:00","2015-01-29T22:00","CET","2015-01-29T21:00"
"29/01/2015 22:00:00 - 29/01/2015 23:00:00","BZN|DE-AT-LU","Without Sequence",28.74,"29/01/2015 22:00:00","2015-01-29T23:00","CET","2015-01-29T22:00"
"29/01/2015 23:00:00 - 30/01/2015 00:00:00","BZN|DE-AT-LU","Without Sequence",28.74,"29/01/2015 23:00:00","2015-01-30T00:00","CET","2015-01-29T23:00"
"30/01/2015 00:00:00 - 30/01/2015 01:00:00","BZN|DE-AT-LU","Without Sequence",26.6,"30/01/2015 00:00:00","2015-01-30T01:00","CET","2015-01-30T00:00"
"30/01/2015 01:00:00 - 30/01/2015 02:00:00","BZN|DE-AT-LU","Without Sequence",25.61,"30/01/2015 01:00:00","2015-01-30T02:00","CET","2015-01-30T01:00"
"30/01/2015 02:00:00 - 30/01/2015 03:00:00","BZN|DE-AT-LU","Without Sequence",26.42,"30/01/2015 02:00:00","2015-01-30T03:00","CET","2015-01-30T02:00"
"30/01/2015 03:00:00 - 30/01/2015 04:00:00","BZN|DE-AT-LU","Without Sequence",24.74,"30/01/2015 03:00:00","2015-01-30T04:00","CET","2015-01-30T03:00"
"30/01/2015 04:00:00 - 30/01/2015 05:00:00","BZN|DE-AT-LU","Without Sequence",23.89,"30/01/2015 04:00:00","2015-01-30T05:00","CET","2015-01-30T04:00"
"30/01/2015 05:00:00 - 30/01/2015 06:00:00","BZN|DE-AT-LU","Without Sequence",26.07,"30/01/2015 05:00:00","2015-01-30T06:00","CET","2015-01-30T05:00"
"30/01/2015 06:00:00 - 30/01/2015 07:00:00","BZN|DE-AT-LU","Without Sequence",36.41,"30/01/2015 06:00:00","2015-01-30T07:00","CET","2015-01-30T06:00"
"30/01/2015 07:00:00 - 30/01/2015 08:00:00","BZN|DE-AT-LU","Without Sequence",48.76,"30/01/2015 07:00:00","2015-01-30T08:00","CET","2015-01-30T07:00"
"30/01/2015 08:00:00 - 30/01/2015 09:00:00","BZN|DE-AT-LU","Without Sequence",49.19,"30/01/2015 08:00:00","2015-01-30T09:00","CET","2015-01-30T08:00"
"30/01/2015 09:00:00 - 30/01/2015 10:00:00","BZN|DE-AT-LU","Without Sequence",46.35,"30/01/2015 09:00:00","2015-01-30T10:00","CET","2015-01-30T09:00"
"30/01/2015 10:00:00 - 30/01/2015 11:00:00","BZN|DE-AT-LU","Without Sequence",49.51,"30/01/2015 10:00:00","2015-01-30T11:00","CET","2015-01-30T10:00"
"30/01/2015 11:00:00 - 30/01/2015 12:00:00","BZN|DE-AT-LU","Without Sequence",47.47,"30/01/2015 11:00:00","2015-01-30T12:00","CET","2015-01-30T11:00"
"30/01/2015 12:00:00 - 30/01/2015 13:00:00","BZN|DE-AT-LU","Without Sequence",46,"30/01/2015 12:00:00","2015-01-30T13:00","CET","2015-01-30T12:00"
"30/01/2015 13:00:00 - 30/01/2015 14:00:00","BZN|DE-AT-LU","Without Sequence",44.95,"30/01/2015 13:00:00","2015-01-30T14:00","CET","2015-01-30T13:00"
"30/01/2015 14:00:00 - 30/01/2015 15:00:00","BZN|DE-AT-LU","Without Sequence",43.24,"30/01/2015 14:00:00","2015-01-30T15:00","CET","2015-01-30T14:00"
"30/01/2015 15:00:00 - 30/01/2015 16:00:00","BZN|DE-AT-LU","Without Sequence",43.71,"30/01/2015 15:00:00","2015-01-30T16:00","CET","2015-01-30T15:00"
"30/01/2015 16:00:00 - 30/01/2015 17:00:00","BZN|DE-AT-LU","Without Sequence",44,"30/01/2015 16:00:00","2015-01-30T17:00","CET","2015-01-30T16:00"
"30/01/2015 17:00:00 - 30/01/2015 18:00:00","BZN|DE-AT-LU","Without Sequence",46.69,"30/01/2015 17:00:00","2015-01-30T18:00","CET","2015-01-30T17:00"
"30/01/2015 18:00:00 - 30/01/2015 19:00:00","BZN|DE-AT-LU","Without Sequence",48.26,"30/01/2015 18:00:00","2015-01-30T19:00","CET","2015-01-30T18:00"
"30/01/2015 19:00:00 - 30/01/2015 20:00:00","BZN|DE-AT-LU","Without Sequence",43.11,"30/01/2015 19:00:00","2015-01-30T20:00","CET","2015-01-30T19:00"
"30/01/2015 20:00:00 - 30/01/2015 21:00:00","BZN|DE-AT-LU","Without Sequence",40.04,"30/01/2015 20:00:00","2015-01-30T21:00","CET","2015-01-30T20:00"
"30/01/2015 21:00:00 - 30/01/2015 22:00:00","BZN|DE-AT-LU","Without Sequence",30.17,"30/01/2015 21:00:00","2015-01-30T22:00","CET","2015-01-30T21:00"
"30/01/2015 22:00:00 - 30/01/2015 23:00:00","BZN|DE-AT-LU","Without Sequence",29.5,"30/01/2015 22:00:00","2015-01-30T23:00","CET","2015-01-30T22:00"
"30/01/2015 23:00:00 - 31/01/2015 00:00:00","BZN|DE-AT-LU","Without Sequence",29.5,"30/01/2015 23:00:00","2015-01-31T00:00","CET","2015-01-30T23:00"
"31/01/2015 00:00:00 - 31/01/2015 01:00:00","BZN|DE-AT-LU","Without Sequence",27.92,"31/01/2015 00:00:00","2015-01-31T01:00","CET","2015-01-31T00:00"
"31/01/2015 01:00:00 - 31/01/2015 02:00:00","BZN|DE-AT-LU","Without Sequence",26.5,"31/01/2015 01:00:00","2015-01-31T02:00","CET","2015-01-31T01:00"
"31/01/2015 02:00:00 - 31/01/2015 03:00:00","BZN|DE-AT-LU","Without Sequence",26.4,"31/01/2015 02:00:00","2015-01-31T03:00","CET","2015-01-31T02:00"
"31/01/2015 03:00:00 - 31/01/2015 04:00:00","BZN|DE-AT-LU","Without Sequence",25.75,"31/01/2015 03:00:00","2015-01-31T04:00","CET","2015-01-31T03:00"
"31/01/2015 04:00:00 - 31/01/2015 05:00:00","BZN|DE-AT-LU","Without Sequence",24.95,"31/01/2015 04:00:00","2015-01-31T05:00","CET","2015-01-31T04:00"
"31/01/2015 05:00:00 - 31/01/2015 06:00:00","BZN|DE-AT-LU","Without Sequence",25.13,"31/01/2015 05:00:00","2015-01-31T06:00","CET","2015-01-31T05:00"
"31/01/2015 06:00:00 - 31/01/2015 07:00:00","BZN|DE-AT-LU","Without Sequence",24.98,"31/01/2015 06:00:00","2015-01-31T07:00","CET","2015-01-31T06:00"
"31/01/2015 07:00:00 - 31/01/2015 08:00:00","BZN|DE-AT-LU","Without Sequence",26.55,"31/01/2015 07:00:00","2015-01-31T08:00","CET","2015-01-31T07:00"
"31/01/2015 08:00:00 - 31/01/2015 09:00:00","BZN|DE-AT-LU","Without Sequence",28.36,"31/01/2015 08:00:00","2015-01-31T09:00","CET","2015-01-31T08:00"
"31/01/2015 09:00:00 - 31/01/2015 10:00:00","BZN|DE-AT-LU","Without Sequence",29.51,"31/01/2015 09:00:00","2015-01-31T10:00","CET","2015-01-31T09:00"
"31/01/2015 10:00:00 - 31/01/2015 11:00:00","BZN|DE-AT-LU","Without Sequence",29.91,"31/01/2015 10:00:00","2015-01-31T11:00","CET","2015-01-31T10:00"
"31/01/2015 11:00:00 - 31/01/2015 12:00:00","BZN|DE-AT-LU","Without Sequence",28.79,"31/01/2015 11:00:00","2015-01-31T12:00","CET","2015-01-31T11:00"
"31/01/2015 12:00:00 - 31/01/2015 13:00:00","BZN|DE-AT-LU","Without Sequence",28.41,"31/01/2015 12:00:00","2015-01-31T13:00","CET","2015-01-31T12:00"
"31/01/2015 13:00:00 - 31/01/2015 14:00:00","BZN|DE-AT-LU","Without Sequence",28.23,"31/01/2015 13:00:00","2015-01-31T14:00","CET","2015-01-31T13:00"
"31/01/2015 14:00:00 - 31/01/2015 15:00:00","BZN|DE-AT-LU","Without Sequence",28.19,"31/01/2015 14:00:00","2015-01-31T15:00","CET","2015-01-31T14:00"
"31/01/2015 15:00:00 - 31/01/2015 16:00:00","BZN|DE-AT-LU","Without Sequence",29.17,"31/01/2015 15:00:00","2015-01-31T16:00","CET","2015-01-31T15:00"
"31/01/2015 16:00:00 - 31/01/2015 17:00:00","BZN|DE-AT-LU","Without Sequence",32.12,"31/01/2015 16:00:00","2015-01-31T17:00","CET","2015-01-31T16:00"
"31/01/2015 17:00:00 - 31/01/2015 18:00:00","BZN|DE-AT-LU","Without Sequence",42.99,"31/01/2015 17:00:00","2015-01-31T18:00","CET","2015-01-31T17:00"
"31/01/2015 18:00:00 - 31/01/2015 19:00:00","BZN|DE-AT-LU","Without Sequence",44.31,"31/01/2015 18:00:00","2015-01-31T19:00","CET","2015-01-31T18:00"
"31/01/2015 19:00:00 - 31/01/2015 20:00:00","BZN|DE-AT-LU","Without Sequence",42.15,"31/01/2015 19:00:00","2015-01-31T20:00","CET","2015-01-31T19:00"
"31/01/2015 20:00:00 - 31/01/2015 21:00:00","BZN|DE-AT-LU","Without Sequence",32.83,"31/01/2015 20:00:00","2015-01-31T21:00","CET","2015-01-31T20:00"
"31/01/2015 21:00:00 - 31/01/2015 22:00:00","BZN|DE-AT-LU","Without Sequence",28.34,"31/01/2015 21:00:00","2015-01-31T22:00","CET","2015-01-31T21:00"
"31/01/2015 22:00:00 - 31/01/2015 23:00:00","BZN|DE-AT-LU","Without Sequence",28.5,"31/01/2015 22:00:00","2015-01-31T23:00","CET","2015-01-31T22:00"
"31/01/2015 23:00:00 - 01/02/2015 00:00:00","BZN|DE-AT-LU","Without Sequence",28.5,"31/01/2015 23:00:00","2015-02-01T00:00","CET","2015-01-31T23:00"
"01/02/2015 00:00:00 - 01/02/2015 01:00:00","BZN|DE-AT-LU","Without Sequence",27.04,"01/02/2015 00:00:00","2015-02-01T01:00","CET","2015-02-01T00:00"
"01/02/2015 01:00:00 - 01/02/2015 02:00:00","BZN|DE-AT-LU","Without Sequence",26.32,"01/02/2015 01:00:00","2015-02-01T02:00","CET","2015-02-01T01:00"
"01/02/2015 02:00:00 - 01/02/2015 03:00:00","BZN|DE-AT-LU","Without Sequence",25.98,"01/02/2015 02:00:00","2015-02-01T03:00","CET","2015-02-01T02:00"
"01/02/2015 03:00:00 - 01/02/2015 04:00:00","BZN|DE-AT-LU","Without Sequence",25.63,"01/02/2015 03:00:00","2015-02-01T04:00","CET","2015-02-01T03:00"
"01/02/2015 04:00:00 - 01/02/2015 05:00:00","BZN|DE-AT-LU","Without Sequence",25.78,"01/02/2015 04:00:00","2015-02-01T05:00","CET","2015-02-01T04:00"
"01/02/2015 05:00:00 - 01/02/2015 06:00:00","BZN|DE-AT-LU","Without Sequence",25.99,"01/02/2015 05:00:00","2015-02-01T06:00","CET","2015-02-01T05:00"
"01/02/2015 06:00:00 - 01/02/2015 07:00:00","BZN|DE-AT-LU","Without Sequence",24.26,"01/02/2015 06:00:00","2015-02-01T07:00","CET","2015-02-01T06:00"
"01/02/2015 07:00:00 - 01/02/2015 08:00:00","BZN|DE-AT-LU","Without Sequence",26.48,"01/02/2015 07:00:00","2015-02-01T08:00","CET","2015-02-01T07:00"
"01/02/2015 08:00:00 - 01/02/2015 09:00:00","BZN|DE-AT-LU","Without Sequence",27.84,"01/02/2015 08:00:00","2015-02-01T09:00","CET","2015-02-01T08:00"
"01/02/2015 09:00:00 - 01/02/2015 10:00:00","BZN|DE-AT-LU","Without Sequence",29.09,"01/02/2015 09:00:00","2015-02-01T10:00","CET","2015-02-01T09:00"
"01/02/2015 10:00:00 - 01/02/2015 11:00:00","BZN|DE-AT-LU","Without Sequence",34.15,"01/02/2015 10:00:00","2015-02-01T11:00","CET","2015-02-01T10:00"
"01/02/2015 11:00:00 - 01/02/2015 12:00:00","BZN|DE-AT-LU","Without Sequence",37.74,"01/02/2015 11:00:00","2015-02-01T12:00","CET","2015-02-01T11:00"
"01/02/2015 12:00:00 - 01/02/2015 13:00:00","BZN|DE-AT-LU","Without Sequence",34.95,"01/02/2015 12:00:00","2015-02-01T13:00","CET","2015-02-01T12:00"
"01/02/2015 13:00:00 - 01/02/2015 14:00:00","BZN|DE-AT-LU","Without Sequence",28.24,"01/02/2015 13:00:00","2015-02-01T14:00","CET","2015-02-01T13:00"
"01/02/2015 14:00:00 - 01/02/2015 15:00:00","BZN|DE-AT-LU","Without Sequence",28.21,"01/02/2015 14:00:00","2015-02-01T15:00","CET","2015-02-01T14:00"
"01/02/2015 15:00:00 - 01/02/2015 16:00:00","BZN|DE-AT-LU","Without Sequence",28.47,"01/02/2015 15:00:00","2015-02-01T16:00","CET","2015-02-01T15:00"
"01/02/2015 16:00:00 - 01/02/2015 17:00:00","BZN|DE-AT-LU","Without Sequence",29.89,"01/02/2015 16:00:00","2015-02-01T17:00","CET","2015-02-01T16:00"
"01/02/2015 17:00:00 - 01/02/2015 18:00:00","BZN|DE-AT-LU","Without Sequence",36.85,"01/02/2015 17:00:00","2015-02-01T18:00","CET","2015-02-01T17:00"
