"MTU (CET/CEST)","Area","Sequence","Day-ahead Price (EUR/MWh)","MTU (CET/CEST) Start","MTU (CET/CEST) End","SummerIndicator","MTU (CET/CEST) End UTC"
"01/01/2016 00:00:00 - 01/01/2016 01:00:00","BZN|DE-AT-LU","Without Sequence",23.86,"01/01/2016 00:00:00","2016-01-01T01:00","CET","2016-01-01T00:00"
"01/01/2016 01:00:00 - 01/01/2016 02:00:00","BZN|DE-AT-LU","Without Sequence",22.39,"01/01/2016 01:00:00","2016-01-01T02:00","CET","2016-01-01T01:00"
"01/01/2016 02:00:00 - 01/01/2016 03:00:00","BZN|DE-AT-LU","Without Sequence",20.59,"01/01/2016 02:00:00","2016-01-01T03:00","CET","2016-01-01T02:00"
"01/01/2016 03:00:00 - 01/01/2016 04:00:00","BZN|DE-AT-LU","Without Sequence",16.81,"01/01/2016 03:00:00","2016-01-01T04:00","CET","2016-01-01T03:00"
"01/01/2016 04:00:00 - 01/01/2016 05:00:00","BZN|DE-AT-LU","Without Sequence",17.41,"01/01/2016 04:00:00","2016-01-01T05:00","CET","2016-01-01T04:00"
"01/01/2016 05:00:00 - 01/01/2016 06:00:00","BZN|DE-AT-LU","Without Sequence",17.02,"01/01/2016 05:00:00","2016-01-01T06:00","CET","2016-01-01T05:00"
"01/01/2016 06:00:00 - 01/01/2016 07:00:00","BZN|DE-AT-LU","Without Sequence",15.86,"01/01/2016 06:00:00","2016-01-01T07:00","CET","2016-01-01T06:00"
"01/01/2016 07:00:00 - 01/01/2016 08:00:00","BZN|DE-AT-LU","Without Sequence",18.16,"01/01/2016 07:00:00","2016-01-01T08:00","CET","2016-01-01T07:00"
"01/01/2016 08:00:00 - 01/01/2016 09:00:00","BZN|DE-AT-LU","Without Sequence",17.73,"01/01/2016 08:00:00","2016-01-01T09:00","CET","2016-01-01T08:00"
"01/01/2016 09:00:00 - 01/01/2016 10:00:00","BZN|DE-AT-LU","Without Sequence",19.77,"01/01/2016 09:00:00","2016-01-01T10:00","CET","2016-01-01T09:00"
"01/01/2016 10:00:00 - 01/01/2016 11:00:00","BZN|DE-AT-LU","Without Sequence",23.75,"01/01/2016 10:00:00","2016-01-01T11:00","CET","2016-01-01T10:00"
"01/01/2016 11:00:00 - 01/01/2016 12:00:00","BZN|DE-AT-LU","Without Sequence",26.03,"01/01/2016 11:00:00","2016-01-01T12:00","CET","2016-01-01T11:00"
"01/01/2016 12:00:00 - 01/01/2016 13:00:00","BZN|DE-AT-LU","Without Sequence",27.06,"01/01/2016 12:00:00","2016-01-01T13:00","CET","2016-01-01T12:00"
"01/01/2016 13:00:00 - 01/01/2016 14:00:00","BZN|DE-AT-LU","Without Sequence",26.59,"01/01/2016 13:00:00","2016-01-01T14:00","CET","2016-01-01T13:00"
"01/01/2016 14:00:00 - 01/01/2016 15:00:00","BZN|DE-AT-LU","Without Sequence",25,"01/01/2016 14:00:00","2016-01-01T15:00","CET","2016-01-01T14:00"
"01/01/2016 15:00:00 - 01/01/2016 16:00:00","BZN|DE-AT-LU","Without Sequence",24.43,"01/01/2016 15:00:00","2016-01-01T16:00","CET","2016-01-01T15:00"
"01/01/2016 16:00:00 - 01/01/2016 17:00:00","BZN|DE-AT-LU","Without Sequence",28.87,"01/01/2016 16:00:00","2016-01-01T17:00","CET","2016-01-01T16:00"
"01/01/2016 17:00:00 - 01/01/2016 18:00:00","BZN|DE-AT-LU","Without Sequence",37.44,"01/01/2016 17:00:00","2016-01-01T18:00","CET","2016-01-01T17:00"
"01/01/2016 18:00:00 - 01/01/2016 19:00:00","BZN|DE-AT-LU","Without Sequence",37.41,"01/01/2016 18:00:00","2016-01-01T19:00","CET","2016-01-01T18:00"
"01/01/2016 19:00:00 - 01/01/2016 20:00:00","BZN|DE-AT-LU","Without Sequence",35.34,"01/01/2016 19:00:00","2016-01-01T20:00","CET","2016-01-01T19:00"
"01/01/2016 20:00:00 - 01/01/2016 21:00:00","BZN|DE-AT-LU","Without Sequence",33.07,"01/01/2016 20:00:00","2016-01-01T21:00","CET","2016-01-01T20:00"
"01/01/2016 21:00:00 - 01/01/2016 22:00:00","BZN|DE-AT-LU","Without Sequence",29.52,"01/01/2016 21:00:00","2016-01-01T22:00","CET","2016-01-01T21:00"
"01/01/2016 22:00:00 - 01/01/2016 23:00:00","BZN|DE-AT-LU","Without Sequence",30.1,"01/01/2016 22:00:00","2016-01-01T23:00","CET","2016-01-01T22:00"
"01/01/2016 23:00:00 - 02/01/2016 00:00:00","BZN|DE-AT-LU","Without Sequence",30.1,"01/01/2016 23:00:00","2016-01-02T00:00","CET","2016-01-01T23:00"
"02/01/2016 00:00:00 - 02/01/2016 01:00:00","BZN|DE-AT-LU","Without Sequence",22.2,"02/01/2016 00:00:00","2016-01-02T01:00","CET","2016-01-02T00:00"
"02/01/2016 01:00:00 - 02/01/2016 02:00:00","BZN|DE-AT-LU","Without Sequence",16.57,"02/01/2016 01:00:00","2016-01-02T02:00","CET","2016-01-02T01:00"
"02/01/2016 02:00:00 - 02/01/2016 03:00:00","BZN|DE-AT-LU","Without Sequence",15.35,"02/01/2016 02:00:00","2016-01-02T03:00","CET","2016-01-02T02:00"
"02/01/2016 03:00:00 - 02/01/2016 04:00:00","BZN|DE-AT-LU","Without Sequence",12.77,"02/01/2016 03:00:00","2016-01-02T04:00","CET","2016-01-02T03:00"
"02/01/2016 04:00:00 - 02/01/2016 05:00:00","BZN|DE-AT-LU","Without Sequence",11.27,"02/01/2016 04:00:00","2016-01-02T05:00","CET","2016-01-02T04:00"
"02/01/2016 05:00:00 - 02/01/2016 06:00:00","BZN|DE-AT-LU","Without Sequence",11.91,"02/01/2016 05:00:00","2016-01-02T06:00","CET","2016-01-02T05:00"
"02/01/2016 06:00:00 - 02/01/2016 07:00:00","BZN|DE-AT-LU","Without Sequence",12.62,"02/01/2016 06:00:00","2016-01-02T07:00","CET","2016-01-02T06:00"
"02/01/2016 07:00:00 - 02/01/2016 08:00:00","BZN|DE-AT-LU","Without Sequence",13.83,"02/01/2016 07:00:00","2016-01-02T08:00","CET","2016-01-02T07:00"
"02/01/2016 08:00:00 - 02/01/2016 09:00:00","BZN|DE-AT-LU","Without Sequence",16.12,"02/01/2016 08:00:00","2016-01-02T09:00","CET","2016-01-02T08:00"
"02/01/2016 09:00:00 - 02/01/2016 10:00:00","BZN|DE-AT-LU","Without Sequence",18.12,"02/01/2016 09:00:00","2016-01-02T10:00","CET","2016-01-02T09:00"
"02/01/2016 10:00:00 - 02/01/2016 11:00:00","BZN|DE-AT-LU","Without Sequence",19.59,"02/01/2016 10:00:00","2016-01-02T11:00","CET","2016-01-02T10:00"
"02/01/2016 11:00:00 - 02/01/2016 12:00:00","BZN|DE-AT-LU","Without Sequence",21.07,"02/01/2016 11:00:00","2016-01-02T12:00","CET","2016-01-02T11:00"
"02/01/2016 12:00:00 - 02/01/2016 13:00:00","BZN|DE-AT-LU","Without Sequence",22.54,"02/01/2016 12:00:00","2016-01-02T13:00","CET","2016-01-02T12:00"
"02/01/2016 13:00:00 - 02/01/2016 14:00:00","BZN|DE-AT-LU","Without Sequence",19.79,"02/01/2016 13:00:00","2016-01-02T14:00","CET","2016-01-02T13:00"
"02/01/2016 14:00:00 - 02/01/2016 15:00:00","BZN|DE-AT-LU","Without Sequence",16.9,"02/01/2016 14:00:00","2016-01-02T15:00","CET","2016-01-02T14:00"
"02/01/2016 15:00:00 - 02/01/2016 16:00:00","BZN|DE-AT-LU","Without Sequence",16.97,"02/01/2016 15:00:00","2016-01-02T16:00","CET","2016-01-02T15:00"
"02/01/2016 16:00:00 - 02/01/2016 17:00:00","BZN|DE-AT-LU","Without Sequence",19.25,"02/01/2016 16:00:00","2016-01-02T17:00","CET","2016-01-02T16:00"
"02/01/2016 17:00:00 - 02/01/2016 18:00:00","BZN|DE-AT-LU","Without Sequence",28.01,"02/01/2016 17:00:00","2016-01-02T18:00","CET","2016-01-02T17:00"
"02/01/2016 18:00:00 - 02/01/2016 19:00:00","BZN|DE-AT-LU","Without Sequence",28.36,"02/01/2016 18:00:00","2016-01-02T19:00","CET","2016-01-02T18:00"
"02/01/2016 19:00:00 - 02/01/2016 20:00:00","BZN|DE-AT-LU","Without Sequence",26.56,"02/01/2016 19:00:00","2016-01-02T20:00","CET","2016-01-02T19:00"
"02/01/2016 20:00:00 - 02/01/2016 21:00:00","BZN|DE-AT-LU","Without Sequence",17.38,"02/01/2016 20:00:00","2016-01-02T21:00","CET","2016-01-02T20:00"
"02/01/2016 21:00:00 - 02/01/2016 22:00:00","BZN|DE-AT-LU","Without Sequence",15.83,"02/01/2016 21:00:00","2016-01-02T22:00","CET","2016-01-02T21:00"
"02/01/2016 22:00:00 - 02/01/2016 23:00:00","BZN|DE-AT-LU","Without Sequence",16.97,"02/01/2016 22:00:00","2016-01-02T23:00","CET","2016-01-02T22:00"
"02/01/2016 23:00:00 - 03/01/2016 00:00:00","BZN|DE-AT-LU","Without Sequence",16.97,"02/01/2016 23:00:00","2016-01-03T00:00","CET","2016-01-02T23:00"
"03/01/2016 00:00:00 - 03/01/2016 01:00:00","BZN|DE-AT-LU","Without Sequence",6.99,"03/01/2016 00:00:00","2016-01-03T01:00","CET","2016-01-03T00:00"
"03/01/2016 01:00:00 - 03/01/2016 02:00:00","BZN|DE-AT-LU","Without Sequence",-0.01,"03/01/2016 01:00:00","2016-01-03T02:00","CET","2016-01-03T01:00"
"03/01/2016 02:00:00 - 03/01/2016 03:00:00","BZN|DE-AT-LU","Without Sequence",0.23,"03/01/2016 02:00:00","2016-01-03T03:00","CET","2016-01-03T02:00"
"03/01/2016 03:00:00 - 03/01/2016 04:00:00","BZN|DE-AT-LU","Without Sequence",4.51,"03/01/2016 03:00:00","2016-01-03T04:00","CET","2016-01-03T03:00"
"03/01/2016 04:00:00 - 03/01/2016 05:00:00","BZN|DE-AT-LU","Without Sequence",4.12,"03/01/2016 04:00:00","2016-01-03T05:00","CET","2016-01-03T04:00"
"03/01/2016 05:00:00 - 03/01/2016 06:00:00","BZN|DE-AT-LU","Without Sequence",6.76,"03/01/2016 05:00:00","2016-01-03T06:00","CET","2016-01-03T05:00"
"03/01/2016 06:00:00 - 03/01/2016 07:00:00","BZN|DE-AT-LU","Without Sequence",0.75,"03/01/2016 06:00:00","2016-01-03T07:00","CET","2016-01-03T06:00"
"03/01/2016 07:00:00 - 03/01/2016 08:00:00","BZN|DE-AT-LU","Without Sequence",4.27,"03/01/2016 07:00:00","2016-01-03T08:00","CET","2016-01-03T07:00"
"03/01/2016 08:00:00 - 03/01/2016 09:00:00","BZN|DE-AT-LU","Without Sequence",9.11,"03/01/2016 08:00:00","2016-01-03T09:00","CET","2016-01-03T08:00"
"03/01/2016 09:00:00 - 03/01/2016 10:00:00","BZN|DE-AT-LU","Without Sequence",15.92,"03/01/2016 09:00:00","2016-01-03T10:00","CET","2016-01-03T09:00"
"03/01/2016 10:00:00 - 03/01/2016 11:00:00","BZN|DE-AT-LU","Without Sequence",17.06,"03/01/2016 10:00:00","2016-01-03T11:00","CET","2016-01-03T10:00"
"03/01/2016 11:00:00 - 03/01/2016 12:00:00","BZN|DE-AT-LU","Without Sequence",19.28,"03/01/2016 11:00:00","2016-01-03T12:00","CET","2016-01-03T11:00"
"03/01/2016 12:00:00 - 03/01/2016 13:00:00","BZN|DE-AT-LU","Without Sequence",20.25,"03/01/2016 12:00:00","2016-01-03T13:00","CET","2016-01-03T12:00"
"03/01/2016 13:00:00 - 03/01/2016 14:00:00","BZN|DE-AT-LU","Without Sequence",17.66,"03/01/2016 13:00:00","2016-01-03T14:00","CET","2016-01-03T13:00"
"03/01/2016 14:00:00 - 03/01/2016 15:00:00","BZN|DE-AT-LU","Without Sequence",18.49,"03/01/2016 14:00:00","2016-01-03T15:00","CET","2016-01-03T14:00"
"03/01/2016 15:00:00 - 03/01/2016 16:00:00","BZN|DE-AT-LU","Without Sequence",16.51,"03/01/2016 15:00:00","2016-01-03T16:00","CET","2016-01-03T15:00"
"03/01/2016 16:00:00 - 03/01/2016 17:00:00","BZN|DE-AT-LU","Without Sequence",18.76,"03/01/2016 16:00:00","2016-01-03T17:00","CET","2016-01-03T16:00"
"03/01/2016 17:00:00 - 03/01/2016 18:00:00","BZN|DE-AT-LU","Without Sequence",22.21,"03/01/2016 17:00:00","2016-01-03T18:00","CET","2016-01-03T17:00"
"03/01/2016 18:00:00 - 03/01/2016 19:00:00","BZN|DE-AT-LU","Without Sequence",26.76,"03/01/2016 18:00:00","2016-01-03T19:00","CET","2016-01-03T18:00"
"03/01/2016 19:00:00 - 03/01/2016 20:00:00","BZN|DE-AT-LU","Without Sequence",27.08,"03/01/2016 19:00:00","2016-01-03T20:00","CET","2016-01-03T19:00"
"03/01/2016 20:00:00 - 03/01/2016 21:00:00","BZN|DE-AT-LU","Without Sequence",25.33,"03/01/2016 20:00:00","2016-01-03T21:00","CET","2016-01-03T20:00"
"03/01/2016 21:00:00 - 03/01/2016 22:00:00","BZN|DE-AT-LU","Without Sequence",22.11,"03/01/2016 21:00:00","2016-01-03T22:00","CET","2016-01-03T21:00"
"03/01/2016 22:00:00 - 03/01/2016 23:00:00","BZN|DE-AT-LU","Without Sequence",20.91,"03/01/2016 22:00:00","2016-01-03T23:00","CET","2016-01-03T22:00"
"03/01/2016 23:00:00 - 04/01/2016 00:00:00","BZN|DE-AT-LU","Without Sequence",20.91,"03/01/2016 23:00:00","2016-01-04T00:00","CET","2016-01-03T23:00"
"04/01/2016 00:00:00 - 04/01/2016 01:00:00","BZN|DE-AT-LU","Without Sequence",13.78,"04/01/2016 00:00:00","2016-01-04T01:00","CET","2016-01-04T00:00"
"04/01/2016 01:00:00 - 04/01/2016 02:00:00","BZN|DE-AT-LU","Without Sequence",12.77,"04/01/2016 01:00:00","2016-01-04T02:00","CET","2016-01-04T01:00"
"04/01/2016 02:00:00 - 04/01/2016 03:00:00","BZN|DE-AT-LU","Without Sequence",10.56,"04/01/2016 02:00:00","2016-01-04T03:00","CET","2016-01-04T02:00"
"04/01/2016 03:00:00 - 04/01/2016 04:00:00","BZN|DE-AT-LU","Without Sequence",3.87,"04/01/2016 03:00:00","2016-01-04T04:00","CET","2016-01-04T03:00"
"04/01/2016 04:00:00 - 04/01/2016 05:00:00","BZN|DE-AT-LU","Without Sequence",3.2,"04/01/2016 04:00:00","2016-01-04T05:00","CET","2016-01-04T04:00"
"04/01/2016 05:00:00 - 04/01/2016 06:00:00","BZN|DE-AT-LU","Without Sequence",8.67,"04/01/2016 05:00:00","2016-01-04T06:00","CET","2016-01-04T05:00"
"04/01/2016 06:00:00 - 04/01/2016 07:00:00","BZN|DE-AT-LU","Without Sequence",18.01,"04/01/2016 06:00:00","2016-01-04T07:00","CET","2016-01-04T06:00"
"04/01/2016 07:00:00 - 04/01/2016 08:00:00","BZN|DE-AT-LU","Without Sequence",28.52,"04/01/2016 07:00:00","2016-01-04T08:00","CET","2016-01-04T07:00"
"04/01/2016 08:00:00 - 04/01/2016 09:00:00","BZN|DE-AT-LU","Without Sequence",34.74,"04/01/2016 08:00:00","2016-01-04T09:00","CET","2016-01-04T08:00"
"04/01/2016 09:00:00 - 04/01/2016 10:00:00","BZN|DE-AT-LU","Without Sequence",33.46,"04/01/2016 09:00:00","2016-01-04T10:00","CET","2016-01-04T09:00"
"04/01/2016 10:00:00 - 04/01/2016 11:00:00","BZN|DE-AT-LU","Without Sequence",33.24,"04/01/2016 10:00:00","2016-01-04T11:00","CET","2016-01-04T10:00"
"04/01/2016 11:00:00 - 04/01/2016 12:00:00","BZN|DE-AT-LU","Without Sequence",35.09,"04/01/2016 11:00:00","2016-01-04T12:00","CET","2016-01-04T11:00"
"04/01/2016 12:00:00 - 04/01/2016 13:00:00","BZN|DE-AT-LU","Without Sequence",35,"04/01/2016 12:00:00","2016-01-04T13:00","CET","2016-01-04T12:00"
"04/01/2016 13:00:00 - 04/01/2016 14:00:00","BZN|DE-AT-LU","Without Sequence",35,"04/01/2016 13:00:00","2016-01-04T14:00","CET","2016-01-04T13:00"
"04/01/2016 14:00:00 - 04/01/2016 15:00:00","BZN|DE-AT-LU","Without Sequence",34.94,"04/01/2016 14:00:00","2016-01-04T15:00","CET","2016-01-04T14:00"
"04/01/2016 15:00:00 - 04/01/2016 16:00:00","BZN|DE-AT-LU","Without Sequence",34.92,"04/01/2016 15:00:00","2016-01-04T16:00","CET","2016-01-04T15:00"
"04/01/2016 16:00:00 - 04/01/2016 17:00:00","BZN|DE-AT-LU","Without Sequence",38,"04/01/2016 16:00:00","2016-01-04T17:00","CET","2016-01-04T16:00"
"04/01/2016 17:00:00 - 04/01/2016 18:00:00","BZN|DE-AT-LU","Without Sequence",41.21,"04/01/2016 17:00:00","2016-01-04T18:00","CET","2016-01-04T17:00"
"04/01/2016 18:00:00 - 04/01/2016 19:00:00","BZN|DE-AT-LU","Without Sequence",42.95,"04/01/2016 18:00:00","2016-01-04T19:00","CET","2016-01-04T18:00"
"04/01/2016 19:00:00 - 04/01/2016 20:00:00","BZN|DE-AT-LU","Without Sequence",41.96,"04/01/2016 19:00:00","2016-01-04T20:00","CET","2016-01-04T19:00"
"04/01/2016 20:00:00 - 04/01/2016 21:00:00","BZN|DE-AT-LU","Without Sequence",34.94,"04/01/2016 20:00:00","2016-01-04T21:00","CET","2016-01-04T20:00"
"04/01/2016 21:00:00 - 04/01/2016 22:00:00","BZN|DE-AT-LU","Without Sequence",30.66,"04/01/2016 21:00:00","2016-01-04T22:00","CET","2016-01-04T21:00"
"04/01/2016 22:00:00 - 04/01/2016 23:00:00","BZN|DE-AT-LU","Without Sequence",30,"04/01/2016 22:00:00","2016-01-04T23:00","CET","2016-01-04T22:00"
"04/01/2016 23:00:00 - 05/01/2016 00:00:00","BZN|DE-AT-LU","Without Sequence",30,"04/01/2016 23:00:00","2016-01-05T00:00","CET","2016-01-04T23:00"
"05/01/2016 00:00:00 - 05/01/2016 01:00:00","BZN|DE-AT-LU","Without Sequence",25.03,"05/01/2016 00:00:00","2016-01-05T01:00","CET","2016-01-05T00:00"
"05/01/2016 01:00:00 - 05/01/2016 02:00:00","BZN|DE-AT-LU","Without Sequence",24.42,"05/01/2016 01:00:00","2016-01-05T02:00","CET","2016-01-05T01:00"
"05/01/2016 02:00:00 - 05/01/2016 03:00:00","BZN|DE-AT-LU","Without Sequence",22.34,"05/01/2016 02:00:00","2016-01-05T03:00","CET","2016-01-05T02:00"
"05/01/2016 03:00:00 - 05/01/2016 04:00:00","BZN|DE-AT-LU","Without Sequence",21.5,"05/01/2016 03:00:00","2016-01-05T04:00","CET","2016-01-05T03:00"
"05/01/2016 04:00:00 - 05/01/2016 05:00:00","BZN|DE-AT-LU","Without Sequence",20,"05/01/2016 04:00:00","2016-01-05T05:00","CET","2016-01-05T04:00"
"05/01/2016 05:00:00 - 05/01/2016 06:00:00","BZN|DE-AT-LU","Without Sequence",23.53,"05/01/2016 05:00:00","2016-01-05T06:00","CET","2016-01-05T05:00"
"05/01/2016 06:00:00 - 05/01/2016 07:00:00","BZN|DE-AT-LU","Without Sequence",28.96,"05/01/2016 06:00:00","2016-01-05T07:00","CET","2016-01-05T06:00"
"05/01/2016 07:00:00 - 05/01/2016 08:00:00","BZN|DE-AT-LU","Without Sequence",38.32,"05/01/2016 07:00:00","2016-01-05T08:00","CET","2016-01-05T07:00"
"05/01/2016 08:00:00 - 05/01/2016 09:00:00","BZN|DE-AT-LU","Without Sequence",41.45,"05/01/2016 08:00:00","2016-01-05T09:00","CET","2016-01-05T08:00"
"05/01/2016 09:00:00 - 05/01/2016 10:00:00","BZN|DE-AT-LU","Without Sequence",40.72,"05/01/2016 09:00:00","2016-01-05T10:00","CET","2016-01-05T09:00"
"05/01/2016 10:00:00 - 05/01/2016 11:00:00","BZN|DE-AT-LU","Without Sequence",40.66,"05/01/2016 10:00:00","2016-01-05T11:00","CET","2016-01-05T10:00"
"05/01/2016 11:00:00 - 05/01/2016 12:00:00","BZN|DE-AT-LU","Without Sequence",40.33,"05/01/2016 11:00:00","2016-01-05T12:00","CET","2016-01-05T11:00"
"05/01/2016 12:00:00 - 05/01/2016 13:00:00","BZN|DE-AT-LU","Without Sequence",38.25,"05/01/2016 12:00:00","2016-01-05T13:00","CET","2016-01-05T12:00"
"05/01/2016 13:00:00 - 05/01/2016 14:00:00","BZN|DE-AT-LU","Without Sequence",36.98,"05/01/2016 13:00:00","2016-01-05T14:00","CET","2016-01-05T13:00"
"05/01/2016 14:00:00 - 05/01/2016 15:00:00","BZN|DE-AT-LU","Without Sequence",34.91,"05/01/2016 14:00:00","2016-01-05T15:00","CET","2016-01-05T14:00"
"05/01/2016 15:00:00 - 05/01/2016 16:00:00","BZN|DE-AT-LU","Without Sequence",33.5,"05/01/2016 15:00:00","2016-01-05T16:00","CET","2016-01-05T15:00"
"05/01/2016 16:00:00 - 05/01/2016 17:00:00","BZN|DE-AT-LU","Without Sequence",35.1,"05/01/2016 16:00:00","2016-01-05T17:00","CET","2016-01-05T16:00"
"05/01/2016 17:00:00 - 05/01/2016 18:00:00","BZN|DE-AT-LU","Without Sequence",42.44,"05/01/2016 17:00:00","2016-01-05T18:00","CET","2016-01-05T17:00"
"05/01/2016 18:00:00 - 05/01/2016 19:00:00","BZN|DE-AT-LU","Without Sequence",42.94,"05/01/2016 18:00:00","2016-01-05T19:00","CET","2016-01-05T18:00"
"05/01/2016 19:00:00 - 05/01/2016 20:00:00","BZN|DE-AT-LU","Without Sequence",41.74,"05/01/2016 19:00:00","2016-01-05T20:00","CET","2016-01-05T19:00"
"05/01/2016 20:00:00 - 05/01/2016 21:00:00","BZN|DE-AT-LU","Without Sequence",36.47,"05/01/2016 20:00:00","2016-01-05T21:00","CET","2016-01-05T20:00"
"05/01/2016 21:00:00 - 05/01/2016 22:00:00","BZN|DE-AT-LU","Without Sequence",33.01,"05/01/2016 21:00:00","2016-01-05T22:00","CET","2016-01-05T21:00"
"05/01/2016 22:00:00 - 05/01/2016 23:00:00","BZN|DE-AT-LU","Without Sequence",31.75,"05/01/2016 22:00:00","2016-01-05T23:00","CET","2016-01-05T22:00"
"05/01/2016 23:00:00 - 06/01/2016 00:00:00","BZN|DE-AT-LU","Without Sequence",31.75,"05/01/2016 23:00:00","2016-01-06T00:00","CET","2016-01-05T23:00"
"06/01/2016 00:00:00 - 06/01/2016 01:00:00","BZN|DE-AT-LU","Without Sequence",26.62,"06/01/2016 00:00:00","2016-01-06T01:00","CET","2016-01-06T00:00"
"06/01/2016 01:00:00 - 06/01/2016 02:00:00","BZN|DE-AT-LU","Without Sequence",25.58,"06/01/2016 01:00:00","2016-01-06T02:00","CET","2016-01-06T01:00"
"06/01/2016 02:00:00 - 06/01/2016 03:00:00","BZN|DE-AT-LU","Without Sequence",24.59,"06/01/2016 02:00:00","2016-01-06T03:00","CET","2016-01-06T02:00"
"06/01/2016 03:00:00 - 06/01/2016 04:00:00","BZN|DE-AT-LU","Without Sequence",22.5,"06/01/2016 03:00:00","2016-01-06T04:00","CET","2016-01-06T03:00"
"06/01/2016 04:00:00 - 06/01/2016 05:00:00","BZN|DE-AT-LU","Without Sequence",23.16,"06/01/2016 04:00:00","2016-01-06T05:00","CET","2016-01-06T04:00"
"06/01/2016 05:00:00 - 06/01/2016 06:00:00","BZN|DE-AT-LU","Without Sequence",24.99,"06/01/2016 05:00:00","2016-01-06T06:00","CET","2016-01-06T05:00"
"06/01/2016 06:00:00 - 06/01/2016 07:00:00","BZN|DE-AT-LU","Without Sequence",26.62,"06/01/2016 06:00:00","2016-01-06T07:00","CET","2016-01-06T06:00"
"06/01/2016 07:00:00 - 06/01/2016 08:00:00","BZN|DE-AT-LU","Without Sequence",28.03,"06/01/2016 07:00:00","2016-01-06T08:00","CET","2016-01-06T07:00"
"06/01/2016 08:00:00 - 06/01/2016 09:00:00","BZN|DE-AT-LU","Without Sequence",29.34,"06/01/2016 08:00:00","2016-01-06T09:00","CET","2016-01-06T08:00"
"06/01/2016 09:00:00 - 06/01/2016 10:00:00","BZN|DE-AT-LU","Without Sequence",32.94,"06/01/2016 09:00:00","2016-01-06T10:00","CET","2016-01-06T09:00"
"06/01/2016 10:00:00 - 06/01/2016 11:00:00","BZN|DE-AT-LU","Without Sequence",37.71,"06/01/2016 10:00:00","2016-01-06T11:00","CET","2016-01-06T10:00"
"06/01/2016 11:00:00 - 06/01/2016 12:00:00","BZN|DE-AT-LU","Without Sequence",40.08,"06/01/2016 11:00:00","2016-01-06T12:00","CET","2016-01-06T11:00"
"06/01/2016 12:00:00 - 06/01/2016 13:00:00","BZN|DE-AT-LU","Without Sequence",40.73,"06/01/2016 12:00:00","2016-01-06T13:00","CET","2016-01-06T12:00"
"06/01/2016 13:00:00 - 06/01/2016 14:00:00","BZN|DE-AT-LU","Without Sequence",38.26,"06/01/2016 13:00:00","2016-01-06T14:00","CET","2016-01-06T13:00"
"06/01/2016 14:00:00 - 06/01/2016 15:00:00","BZN|DE-AT-LU","Without Sequence",35.44,"06/01/2016 14:00:00","2016-01-06T15:00","CET","2016-01-06T14:00"
"06/01/2016 15:00:00 - 06/01/2016 16:00:00","BZN|DE-AT-LU","Without Sequence",36.92,"06/01/2016 15:00:00","2016-01-06T16:00","CET","2016-01-06T15:00"
"06/01/2016 16:00:00 - 06/01/2016 17:00:00","BZN|DE-AT-LU","Without Sequence",41.28,"06/01/2016 16:00:00","2016-01-06T17:00","CET","2016-01-06T16:00"
"06/01/2016 17:00:00 - 06/01/2016 18:00:00","BZN|DE-AT-LU","Without Sequence",44.95,"06/01/2016 17:00:00","2016-01-06T18:00","CET","2016-01-06T17:00"
"06/01/2016 18:00:00 - 06/01/2016 19:00:00","BZN|DE-AT-LU","Without Sequence",46.9,"06/01/2016 18:00:00","2016-01-06T19:00","CET","2016-01-06T18:00"
"06/01/2016 19:00:00 - 06/01/2016 20:00:00","BZN|DE-AT-LU","Without Sequence",43.95,"06/01/2016 19:00:00","2016-01-06T20:00","CET","2016-01-06T19:00"
"06/01/2016 20:00:00 - 06/01/2016 21:00:00","BZN|DE-AT-LU","Without Sequence",39.94,"06/01/2016 20:00:00","2016-01-06T21:00","CET","2016-01-06T20:00"
"06/01/2016 21:00:00 - 06/01/2016 22:00:00","BZN|DE-AT-LU","Without Sequence",32.4,"06/01/2016 21:00:00","2016-01-06T22:00","CET","2016-01-06T21:00"
"06/01/2016 22:00:00 - 06/01/2016 23:00:00","BZN|DE-AT-LU","Without Sequence",33.51,"06/01/2016 22:00:00","2016-01-06T23:00","CET","2016-01-06T22:00"
"06/01/2016 23:00:00 - 07/01/2016 00:00:00","BZN|DE-AT-LU","Without Sequence",33.51,"06/01/2016 23:00:00","2016-01-07T00:00","CET","2016-01-06T23:00"
"07/01/2016 00:00:00 - 07/01/2016 01:00:00","BZN|DE-AT-LU","Without Sequence",26.41,"07/01/2016 00:00:00","2016-01-07T01:00","CET","2016-01-07T00:00"
"07/01/2016 01:00:00 - 07/01/2016 02:00:00","BZN|DE-AT-LU","Without Sequence",26.05,"07/01/2016 01:00:00","2016-01-07T02:00","CET","2016-01-07T01:00"
"07/01/2016 02:00:00 - 07/01/2016 03:00:00","BZN|DE-AT-LU","Without Sequence",24.93,"07/01/2016 02:00:00","2016-01-07T03:00","CET","2016-01-07T02:00"
"07/01/2016 03:00:00 - 07/01/2016 04:00:00","BZN|DE-AT-LU","Without Sequence",22.39,"07/01/2016 03:00:00","2016-01-07T04:00","CET","2016-01-07T03:00"
"07/01/2016 04:00:00 - 07/01/2016 05:00:00","BZN|DE-AT-LU","Without Sequence",22.32,"07/01/2016 04:00:00","2016-01-07T05:00","CET","2016-01-07T04:00"
"07/01/2016 05:00:00 - 07/01/2016 06:00:00","BZN|DE-AT-LU","Without Sequence",24.2,"07/01/2016 05:00:00","2016-01-07T06:00","CET","2016-01-07T05:00"
"07/01/2016 06:00:00 - 07/01/2016 07:00:00","BZN|DE-AT-LU","Without Sequence",31,"07/01/2016 06:00:00","2016-01-07T07:00","CET","2016-01-07T06:00"
"07/01/2016 07:00:00 - 07/01/2016 08:00:00","BZN|DE-AT-LU","Without Sequence",42.47,"07/01/2016 07:00:00","2016-01-07T08:00","CET","2016-01-07T07:00"
"07/01/2016 08:00:00 - 07/01/2016 09:00:00","BZN|DE-AT-LU","Without Sequence",42.97,"07/01/2016 08:00:00","2016-01-07T09:00","CET","2016-01-07T08:00"
"07/01/2016 09:00:00 - 07/01/2016 10:00:00","BZN|DE-AT-LU","Without Sequence",41.93,"07/01/2016 09:00:00","2016-01-07T10:00","CET","2016-01-07T09:00"
"07/01/2016 10:00:00 - 07/01/2016 11:00:00","BZN|DE-AT-LU","Without Sequence",41.62,"07/01/2016 10:00:00","2016-01-07T11:00","CET","2016-01-07T10:00"
"07/01/2016 11:00:00 - 07/01/2016 12:00:00","BZN|DE-AT-LU","Without Sequence",41.5,"07/01/2016 11:00:00","2016-01-07T12:00","CET","2016-01-07T11:00"
"07/01/2016 12:00:00 - 07/01/2016 13:00:00","BZN|DE-AT-LU","Without Sequence",40.66,"07/01/2016 12:00:00","2016-01-07T13:00","CET","2016-01-07T12:00"
"07/01/2016 13:00:00 - 07/01/2016 14:00:00","BZN|DE-AT-LU","Without Sequence",40.33,"07/01/2016 13:00:00","2016-01-07T14:00","CET","2016-01-07T13:00"
"07/01/2016 14:00:00 - 07/01/2016 15:00:00","BZN|DE-AT-LU","Without Sequence",36.51,"07/01/2016 14:00:00","2016-01-07T15:00","CET","2016-01-07T14:00"
"07/01/2016 15:00:00 - 07/01/2016 16:00:00","BZN|DE-AT-LU","Without Sequence",33.49,"07/01/2016 15:00:00","2016-01-07T16:00","CET","2016-01-07T15:00"
"07/01/2016 16:00:00 - 07/01/2016 17:00:00","BZN|DE-AT-LU","Without Sequence",34.19,"07/01/2016 16:00:00","2016-01-07T17:00","CET","2016-01-07T16:00"
"07/01/2016 17:00:00 - 07/01/2016 18:00:00","BZN|DE-AT-LU","Without Sequence",40.66,"07/01/2016 17:00:00","2016-01-07T18:00","CET","2016-01-07T17:00"
"07/01/2016 18:00:00 - 07/01/2016 19:00:00","BZN|DE-AT-LU","Without Sequence",40.8,"07/01/2016 18:00:00","2016-01-07T19:00","CET","2016-01-07T18:00"
"07/01/2016 19:00:00 - 07/01/2016 20:00:00","BZN|DE-AT-LU","Without Sequence",37.19,"07/01/2016 19:00:00","2016-01-07T20:00","CET","2016-01-07T19:00"
"07/01/2016 20:00:00 - 07/01/2016 21:00:00","BZN|DE-AT-LU","Without Sequence",31.94,"07/01/2016 20:00:00","2016-01-07T21:00","CET","2016-01-07T20:00"
"07/01/2016 21:00:00 - 07/01/2016 22:00:00","BZN|DE-AT-LU","Without Sequence",27.01,"07/01/2016 21:00:00","2016-01-07T22:00","CET","2016-01-07T21:00"
"07/01/2016 22:00:00 - 07/01/2016 23:00:00","BZN|DE-AT-LU","Without Sequence",27.52,"07/01/2016 22:00:00","2016-01-07T23:00","CET","2016-01-07T22:00"
"07/01/2016 23:00:00 - 08/01/2016 00:00:00","BZN|DE-AT-LU","Without Sequence",27.52,"07/01/2016 23:00:00","2016-01-08T00:00","CET","2016-01-07T23:00"
"08/01/2016 00:00:00 - 08/01/2016 01:00:00","BZN|DE-AT-LU","Without Sequence",12.12,"08/01/2016 00:00:00","2016-01-08T01:00","CET","2016-01-08T00:00"
"08/01/2016 01:00:00 - 08/01/2016 02:00:00","BZN|DE-AT-LU","Without Sequence",17.23,"08/01/2016 01:00:00","2016-01-08T02:00","CET","2016-01-08T01:00"
"08/01/2016 02:00:00 - 08/01/2016 03:00:00","BZN|DE-AT-LU","Without Sequence",13.9,"08/01/2016 02:00:00","2016-01-08T03:00","CET","2016-01-08T02:00"
"08/01/2016 03:00:00 - 08/01/2016 04:00:00","BZN|DE-AT-LU","Without Sequence",12.11,"08/01/2016 03:00:00","2016-01-08T04:00","CET","2016-01-08T03:00"
"08/01/2016 04:00:00 - 08/01/2016 05:00:00","BZN|DE-AT-LU","Without Sequence",12.99,"08/01/2016 04:00:00","2016-01-08T05:00","CET","2016-01-08T04:00"
"08/01/2016 05:00:00 - 08/01/2016 06:00:00","BZN|DE-AT-LU","Without Sequence",16.98,"08/01/2016 05:00:00","2016-01-08T06:00","CET","2016-01-08T05:00"
"08/01/2016 06:00:00 - 08/01/2016 07:00:00","BZN|DE-AT-LU","Without Sequence",22.02,"08/01/2016 06:00:00","2016-01-08T07:00","CET","2016-01-08T06:00"
"08/01/2016 07:00:00 - 08/01/2016 08:00:00","BZN|DE-AT-LU","Without Sequence",28.4,"08/01/2016 07:00:00","2016-01-08T08:00","CET","2016-01-08T07:00"
"08/01/2016 08:00:00 - 08/01/2016 09:00:00","BZN|DE-AT-LU","Without Sequence",29.31,"08/01/2016 08:00:00","2016-01-08T09:00","CET","2016-01-08T08:00"
"08/01/2016 09:00:00 - 08/01/2016 10:00:00","BZN|DE-AT-LU","Without Sequence",26.6,"08/01/2016 09:00:00","2016-01-08T10:00","CET","2016-01-08T09:00"
"08/01/2016 10:00:00 - 08/01/2016 11:00:00","BZN|DE-AT-LU","Without Sequence",25.55,"08/01/2016 10:00:00","2016-01-08T11:00","CET","2016-01-08T10:00"
"08/01/2016 11:00:00 - 08/01/2016 12:00:00","BZN|DE-AT-LU","Without Sequence",25.76,"08/01/2016 11:00:00","2016-01-08T12:00","CET","2016-01-08T11:00"
"08/01/2016 12:00:00 - 08/01/2016 13:00:00","BZN|DE-AT-LU","Without Sequence",25.13,"08/01/2016 12:00:00","2016-01-08T13:00","CET","2016-01-08T12:00"
"08/01/2016 13:00:00 - 08/01/2016 14:00:00","BZN|DE-AT-LU","Without Sequence",25.58,"08/01/2016 13:00:00","2016-01-08T14:00","CET","2016-01-08T13:00"
"08/01/2016 14:00:00 - 08/01/2016 15:00:00","BZN|DE-AT-LU","Without Sequence",27.6,"08/01/2016 14:00:00","2016-01-08T15:00","CET","2016-01-08T14:00"
"08/01/2016 15:00:00 - 08/01/2016 16:00:00","BZN|DE-AT-LU","Without Sequence",32.08,"08/01/2016 15:00:00","2016-01-08T16:00","CET","2016-01-08T15:00"
"08/01/2016 16:00:00 - 08/01/2016 17:00:00","BZN|DE-AT-LU","Without Sequence",37.16,"08/01/2016 16:00:00","2016-01-08T17:00","CET","2016-01-08T16:00"
"08/01/2016 17:00:00 - 08/01/2016 18:00:00","BZN|DE-AT-LU","Without Sequence",45,"08/01/2016 17:00:00","2016-01-08T18:00","CET","2016-01-08T17:00"
"08/01/2016 18:00:00 - 08/01/2016 19:00:00","BZN|DE-AT-LU","Without Sequence",46.97,"08/01/2016 18:00:00","2016-01-08T19:00","CET","2016-01-08T18:00"
"08/01/2016 19:00:00 - 08/01/2016 20:00:00","BZN|DE-AT-LU","Without Sequence",40.09,"08/01/2016 19:00:00","2016-01-08T20:00","CET","2016-01-08T19:00"
"08/01/2016 20:00:00 - 08/01/2016 21:00:00","BZN|DE-AT-LU","Without Sequence",34.61,"08/01/2016 20:00:00","2016-01-08T21:00","CET","2016-01-08T20:00"
"08/01/2016 21:00:00 - 08/01/2016 22:00:00","BZN|DE-AT-LU","Without Sequence",31.52,"08/01/2016 21:00:00","2016-01-08T22:00","CET","2016-01-08T21:00"
"08/01/2016 22:00:00 - 08/01/2016 23:00:00","BZN|DE-AT-LU","Without Sequence",32.5,"08/01/2016 22:00:00","2016-01-08T23:00","CET","2016-01-08T22:00"
"08/01/2016 23:00:00 - 09/01/2016 00:00:00","BZN|DE-AT-LU","Without Sequence",32.5,"08/01/2016 23:00:00","2016-01-09T00:00","CET","2016-01-08T23:00"
"09/01/2016 00:00:00 - 09/01/2016 01:00:00","BZN|DE-AT-LU","Without Sequence",26.1,"09/01/2016 00:00:00","2016-01-09T01:00","CET","2016-01-09T00:00"
"09/01/2016 01:00:00 - 09/01/2016 02:00:00","BZN|DE-AT-LU","Without Sequence",25.1,"09/01/2016 01:00:00","2016-01-09T02:00","CET","2016-01-09T01:00"
"09/01/2016 02:00:00 - 09/01/2016 03:00:00","BZN|DE-AT-LU","Without Sequence",24.3,"09/01/2016 02:00:00","2016-01-09T03:00","CET","2016-01-09T02:00"
"09/01/2016 03:00:00 - 09/01/2016 04:00:00","BZN|DE-AT-LU","Without Sequence",23.23,"09/01/2016 03:00:00","2016-01-09T04:00","CET","2016-01-09T03:00"
"09/01/2016 04:00:00 - 09/01/2016 05:00:00","BZN|DE-AT-LU","Without Sequence",21.96,"09/01/2016 04:00:00","2016-01-09T05:00","CET","2016-01-09T04:00"
"09/01/2016 05:00:00 - 09/01/2016 06:00:00","BZN|DE-AT-LU","Without Sequence",22.45,"09/01/2016 05:00:00","2016-01-09T06:00","CET","2016-01-09T05:00"
"09/01/2016 06:00:00 - 09/01/2016 07:00:00","BZN|DE-AT-LU","Without Sequence",23.07,"09/01/2016 06:00:00","2016-01-09T07:00","CET","2016-01-09T06:00"
"09/01/2016 07:00:00 - 09/01/2016 08:00:00","BZN|DE-AT-LU","Without Sequence",25,"09/01/2016 07:00:00","2016-01-09T08:00","CET","2016-01-09T07:00"
"09/01/2016 08:00:00 - 09/01/2016 09:00:00","BZN|DE-AT-LU","Without Sequence",32.11,"09/01/2016 08:00:00","2016-01-09T09:00","CET","2016-01-09T08:00"
"09/01/2016 09:00:00 - 09/01/2016 10:00:00","BZN|DE-AT-LU","Without Sequence",37.12,"09/01/2016 09:00:00","2016-01-09T10:00","CET","2016-01-09T09:00"
"09/01/2016 10:00:00 - 09/01/2016 11:00:00","BZN|DE-AT-LU","Without Sequence",36.13,"09/01/2016 10:00:00","2016-01-09T11:00","CET","2016-01-09T10:00"
"09/01/2016 11:00:00 - 09/01/2016 12:00:00","BZN|DE-AT-LU","Without Sequence",35.76,"09/01/2016 11:00:00","2016-01-09T12:00","CET","2016-01-09T11:00"
"09/01/2016 12:00:00 - 09/01/2016 13:00:00","BZN|DE-AT-LU","Without Sequence",34.06,"09/01/2016 12:00:00","2016-01-09T13:00","CET","2016-01-09T12:00"
"09/01/2016 13:00:00 - 09/01/2016 14:00:00","BZN|DE-AT-LU","Without Sequence",31.54,"09/01/2016 13:00:00","2016-01-09T14:00","CET","2016-01-09T13:00"
"09/01/2016 14:00:00 - 09/01/2016 15:00:00","BZN|DE-AT-LU","Without Sequence",27.92,"09/01/2016 14:00:00","2016-01-09T15:00","CET","2016-01-09T14:00"
"09/01/2016 15:00:00 - 09/01/2016 16:00:00","BZN|DE-AT-LU","Without Sequence",27,"09/01/2016 15:00:00","2016-01-09T16:00","CET","2016-01-09T15:00"
"09/01/2016 16:00:00 - 09/01/2016 17:00:00","BZN|DE-AT-LU","Without Sequence",30.5,"09/01/2016 16:00:00","2016-01-09T17:00","CET","2016-01-09T16:00"
"09/01/2016 17:00:00 - 09/01/2016 18:00:00","BZN|DE-AT-LU","Without Sequence",36.99,"09/01/2016 17:00:00","2016-01-09T18:00","CET","2016-01-09T17:00"
"09/01/2016 18:00:00 - 09/01/2016 19:00:00","BZN|DE-AT-LU","Without Sequence",36.8,"09/01/2016 18:00:00","2016-01-09T19:00","CET","2016-01-09T18:00"
"09/01/2016 19:00:00 - 09/01/2016 20:00:00","BZN|DE-AT-LU","Without Sequence",35,"09/01/2016 19:00:00","2016-01-09T20:00","CET","2016-01-09T19:00"
"09/01/2016 20:00:00 - 09/01/2016 21:00:00","BZN|DE-AT-LU","Without Sequence",29,"09/01/2016 20:00:00","2016-01-09T21:00","CET","2016-01-09T20:00"
"09/01/2016 21:00:00 - 09/01/2016 22:00:00","BZN|DE-AT-LU","Without Sequence",25.01,"09/01/2016 21:00:00","2016-01-09T22:00","CET","2016-01-09T21:00"
"09/01/2016 22:00:00 - 09/01/2016 23:00:00","BZN|DE-AT-LU","Without Sequence",25.1,"09/01/2016 22:00:00","2016-01-09T23:00","CET","2016-01-09T22:00"
"09/01/2016 23:00:00 - 10/01/2016 00:00:00","BZN|DE-AT-LU","Without Sequence",25.1,"09/01/2016 23:00:00","2016-01-10T00:00","CET","2016-01-09T23:00"
"10/01/2016 00:00:00 - 10/01/2016 01:00:00","BZN|DE-AT-LU","Without Sequence",15.58,"10/01/2016 00:00:00","2016-01-10T01:00","CET","2016-01-10T00:00"
"10/01/2016 01:00:00 - 10/01/2016 02:00:00","BZN|DE-AT-LU","Without Sequence",19.05,"10/01/2016 01:00:00","2016-01-10T02:00","CET","2016-01-10T01:00"
"10/01/2016 02:00:00 - 10/01/2016 03:00:00","BZN|DE-AT-LU","Without Sequence",16.87,"10/01/2016 02:00:00","2016-01-10T03:00","CET","2016-01-10T02:00"
"10/01/2016 03:00:00 - 10/01/2016 04:00:00","BZN|DE-AT-LU","Without Sequence",12.75,"10/01/2016 03:00:00","2016-01-10T04:00","CET","2016-01-10T03:00"
"10/01/2016 04:00:00 - 10/01/2016 05:00:00","BZN|DE-AT-LU","Without Sequence",10.81,"10/01/2016 04:00:00","2016-01-10T05:00","CET","2016-01-10T04:00"
"10/01/2016 05:00:00 - 10/01/2016 06:00:00","BZN|DE-AT-LU","Without Sequence",10.85,"10/01/2016 05:00:00","2016-01-10T06:00","CET","2016-01-10T05:00"
"10/01/2016 06:00:00 - 10/01/2016 07:00:00","BZN|DE-AT-LU","Without Sequence",9.85,"10/01/2016 06:00:00","2016-01-10T07:00","CET","2016-01-10T06:00"
"10/01/2016 07:00:00 - 10/01/2016 08:00:00","BZN|DE-AT-LU","Without Sequence",11.92,"10/01/2016 07:00:00","2016-01-10T08:00","CET","2016-01-10T07:00"
"10/01/2016 08:00:00 - 10/01/2016 09:00:00","BZN|DE-AT-LU","Without Sequence",15.44,"10/01/2016 08:00:00","2016-01-10T09:00","CET","2016-01-10T08:00"
"10/01/2016 09:00:00 - 10/01/2016 10:00:00","BZN|DE-AT-LU","Without Sequence",18.99,"10/01/2016 09:00:00","2016-01-10T10:00","CET","2016-01-10T09:00"
"10/01/2016 10:00:00 - 10/01/2016 11:00:00","BZN|DE-AT-LU","Without Sequence",19.66,"10/01/2016 10:00:00","2016-01-10T11:00","CET","2016-01-10T10:00"
"10/01/2016 11:00:00 - 10/01/2016 12:00:00","BZN|DE-AT-LU","Without Sequence",21.59,"10/01/2016 11:00:00","2016-01-10T12:00","CET","2016-01-10T11:00"
"10/01/2016 12:00:00 - 10/01/2016 13:00:00","BZN|DE-AT-LU","Without Sequence",21.83,"10/01/2016 12:00:00","2016-01-10T13:00","CET","2016-01-10T12:00"
"10/01/2016 13:00:00 - 10/01/2016 14:00:00","BZN|DE-AT-LU","Without Sequence",20.82,"10/01/2016 13:00:00","2016-01-10T14:00","CET","2016-01-10T13:00"
"10/01/2016 14:00:00 - 10/01/2016 15:00:00","BZN|DE-AT-LU","Without Sequence",20.06,"10/01/2016 14:00:00","2016-01-10T15:00","CET","2016-01-10T14:00"
"10/01/2016 15:00:00 - 10/01/2016 16:00:00","BZN|DE-AT-LU","Without Sequence",21.45,"10/01/2016 15:00:00","2016-01-10T16:00","CET","2016-01-10T15:00"
"10/01/2016 16:00:00 - 10/01/2016 17:00:00","BZN|DE-AT-LU","Without Sequence",23.92,"10/01/2016 16:00:00","2016-01-10T17:00","CET","2016-01-10T16:00"
"10/01/2016 17:00:00 - 10/01/2016 18:00:00","BZN|DE-AT-LU","Without Sequence",27.93,"10/01/2016 17:00:00","2016-01-10T18:00","CET","2016-01-10T17:00"
"10/01/2016 18:00:00 - 10/01/2016 19:00:00","BZN|DE-AT-LU","Without Sequence",35,"10/01/2016 18:00:00","2016-01-10T19:00","CET","2016-01-10T18:00"
"10/01/2016 19:00:00 - 10/01/2016 20:00:00","BZN|DE-AT-LU","Without Sequence",33,"10/01/2016 19:00:00","2016-01-10T20:00","CET","2016-01-10T19:00"
"10/01/2016 20:00:00 - 10/01/2016 21:00:00","BZN|DE-AT-LU","Without Sequence",30.03,"10/01/2016 20:00:00","2016-01-10T21:00","CET","2016-01-10T20:00"
"10/01/2016 21:00:00 - 10/01/2016 22:00:00","BZN|DE-AT-LU","Without Sequence",26.06,"10/01/2016 21:00:00","2016-01-10T22:00","CET","2016-01-10T21:00"
"10/01/2016 22:00:00 - 10/01/2016 23:00:00","BZN|DE-AT-LU","Without Sequence",26.93,"10/01/2016 22:00:00","2016-01-10T23:00","CET","2016-01-10T22:00"
"10/01/2016 23:00:00 - 11/01/2016 00:00:00","BZN|DE-AT-LU","Without Sequence",26.93,"10/01/2016 23:00:00","2016-01-11T00:00","CET","2016-01-10T23:00"
"11/01/2016 00:00:00 - 11/01/2016 01:00:00","BZN|DE-AT-LU","Without Sequence",21.95,"11/01/2016 00:00:00","2016-01-11T01:00","CET","2016-01-11T00:00"
"11/01/2016 01:00:00 - 11/01/2016 02:00:00","BZN|DE-AT-LU","Without Sequence",20.04,"11/01/2016 01:00:00","2016-01-11T02:00","CET","2016-01-11T01:00"
"11/01/2016 02:00:00 - 11/01/2016 03:00:00","BZN|DE-AT-LU","Without Sequence",19.78,"11/01/2016 02:00:00","2016-01-11T03:00","CET","2016-01-11T02:00"
"11/01/2016 03:00:00 - 11/01/2016 04:00:00","BZN|DE-AT-LU","Without Sequence",19.36,"11/01/2016 03:00:00","2016-01-11T04:00","CET","2016-01-11T03:00"
"11/01/2016 04:00:00 - 11/01/2016 05:00:00","BZN|DE-AT-LU","Without Sequence",19.56,"11/01/2016 04:00:00","2016-01-11T05:00","CET","2016-01-11T04:00"
"11/01/2016 05:00:00 - 11/01/2016 06:00:00","BZN|DE-AT-LU","Without Sequence",21.67,"11/01/2016 05:00:00","2016-01-11T06:00","CET","2016-01-11T05:00"
"11/01/2016 06:00:00 - 11/01/2016 07:00:00","BZN|DE-AT-LU","Without Sequence",28.5,"11/01/2016 06:00:00","2016-01-11T07:00","CET","2016-01-11T06:00"
"11/01/2016 07:00:00 - 11/01/2016 08:00:00","BZN|DE-AT-LU","Without Sequence",41.61,"11/01/2016 07:00:00","2016-01-11T08:00","CET","2016-01-11T07:00"
"11/01/2016 08:00:00 - 11/01/2016 09:00:00","BZN|DE-AT-LU","Without Sequence",45.93,"11/01/2016 08:00:00","2016-01-11T09:00","CET","2016-01-11T08:00"
"11/01/2016 09:00:00 - 11/01/2016 10:00:00","BZN|DE-AT-LU","Without Sequence",44,"11/01/2016 09:00:00","2016-01-11T10:00","CET","2016-01-11T09:00"
"11/01/2016 10:00:00 - 11/01/2016 11:00:00","BZN|DE-AT-LU","Without Sequence",41.94,"11/01/2016 10:00:00","2016-01-11T11:00","CET","2016-01-11T10:00"
"11/01/2016 11:00:00 - 11/01/2016 12:00:00","BZN|DE-AT-LU","Without Sequence",41.96,"11/01/2016 11:00:00","2016-01-11T12:00","CET","2016-01-11T11:00"
"11/01/2016 12:00:00 - 11/01/2016 13:00:00","BZN|DE-AT-LU","Without Sequence",42.33,"11/01/2016 12:00:00","2016-01-11T13:00","CET","2016-01-11T12:00"
"11/01/2016 13:00:00 - 11/01/2016 14:00:00","BZN|DE-AT-LU","Without Sequence",42.1,"11/01/2016 13:00:00","2016-01-11T14:00","CET","2016-01-11T13:00"
"11/01/2016 14:00:00 - 11/01/2016 15:00:00","BZN|DE-AT-LU","Without Sequence",39.88,"11/01/2016 14:00:00","2016-01-11T15:00","CET","2016-01-11T14:00"
"11/01/2016 15:00:00 - 11/01/2016 16:00:00","BZN|DE-AT-LU","Without Sequence",37.5,"11/01/2016 15:00:00","2016-01-11T16:00","CET","2016-01-11T15:00"
"11/01/2016 16:00:00 - 11/01/2016 17:00:00","BZN|DE-AT-LU","Without Sequence",37.95,"11/01/2016 16:00:00","2016-01-11T17:00","CET","2016-01-11T16:00"
"11/01/2016 17:00:00 - 11/01/2016 18:00:00","BZN|DE-AT-LU","Without Sequence",44.69,"11/01/2016 17:00:00","2016-01-11T18:00","CET","2016-01-11T17:00"
"11/01/2016 18:00:00 - 11/01/2016 19:00:00","BZN|DE-AT-LU","Without Sequence",42.88,"11/01/2016 18:00:00","2016-01-11T19:00","CET","2016-01-11T18:00"
"11/01/2016 19:00:00 - 11/01/2016 20:00:00","BZN|DE-AT-LU","Without Sequence",40,"11/01/2016 19:00:00","2016-01-11T20:00","CET","2016-01-11T19:00"
"11/01/2016 20:00:00 - 11/01/2016 21:00:00","BZN|DE-AT-LU","Without Sequence",33.09,"11/01/2016 20:00:00","2016-01-11T21:00","CET","2016-01-11T20:00"
"11/01/2016 21:00:00 - 11/01/2016 22:00:00","BZN|DE-AT-LU","Without Sequence",27.93,"11/01/2016 21:00:00","2016-01-11T22:00","CET","2016-01-11T21:00"
"11/01/2016 22:00:00 - 11/01/2016 23:00:00","BZN|DE-AT-LU","Without Sequence",28,"11/01/2016 22:00:00","2016-01-11T23:00","CET","2016-01-11T22:00"
"11/01/2016 23:00:00 - 12/01/2016 00:00:00","BZN|DE-AT-LU","Without Sequence",28,"11/01/2016 23:00:00","2016-01-12T00:00","CET","2016-01-11T23:00"
"12/01/2016 00:00:00 - 12/01/2016 01:00:00","BZN|DE-AT-LU","Without Sequence",21.51,"12/01/2016 00:00:00","2016-01-12T01:00","CET","2016-01-12T00:00"
"12/01/2016 01:00:00 - 12/01/2016 02:00:00","BZN|DE-AT-LU","Without Sequence",19.81,"12/01/2016 01:00:00","2016-01-12T02:00","CET","2016-01-12T01:00"
"12/01/2016 02:00:00 - 12/01/2016 03:00:00","BZN|DE-AT-LU","Without Sequence",19.1,"12/01/2016 02:00:00","2016-01-12T03:00","CET","2016-01-12T02:00"
"12/01/2016 03:00:00 - 12/01/2016 04:00:00","BZN|DE-AT-LU","Without Sequence",15.74,"12/01/2016 03:00:00","2016-01-12T04:00","CET","2016-01-12T03:00"
"12/01/2016 04:00:00 - 12/01/2016 05:00:00","BZN|DE-AT-LU","Without Sequence",15.54,"12/01/2016 04:00:00","2016-01-12T05:00","CET","2016-01-12T04:00"
"12/01/2016 05:00:00 - 12/01/2016 06:00:00","BZN|DE-AT-LU","Without Sequence",20.19,"12/01/2016 05:00:00","2016-01-12T06:00","CET","2016-01-12T05:00"
"12/01/2016 06:00:00 - 12/01/2016 07:00:00","BZN|DE-AT-LU","Without Sequence",24.38,"12/01/2016 06:00:00","2016-01-12T07:00","CET","2016-01-12T06:00"
"12/01/2016 07:00:00 - 12/01/2016 08:00:00","BZN|DE-AT-LU","Without Sequence",35.92,"12/01/2016 07:00:00","2016-01-12T08:00","CET","2016-01-12T07:00"
"12/01/2016 08:00:00 - 12/01/2016 09:00:00","BZN|DE-AT-LU","Without Sequence",40.5,"12/01/2016 08:00:00","2016-01-12T09:00","CET","2016-01-12T08:00"
"12/01/2016 09:00:00 - 12/01/2016 10:00:00","BZN|DE-AT-LU","Without Sequence",41,"12/01/2016 09:00:00","2016-01-12T10:00","CET","2016-01-12T09:00"
"12/01/2016 10:00:00 - 12/01/2016 11:00:00","BZN|DE-AT-LU","Without Sequence",38.66,"12/01/2016 10:00:00","2016-01-12T11:00","CET","2016-01-12T10:00"
"12/01/2016 11:00:00 - 12/01/2016 12:00:00","BZN|DE-AT-LU","Without Sequence",36.46,"12/01/2016 11:00:00","2016-01-12T12:00","CET","2016-01-12T11:00"
"12/01/2016 12:00:00 - 12/01/2016 13:00:00","BZN|DE-AT-LU","Without Sequence",35,"12/01/2016 12:00:00","2016-01-12T13:00","CET","2016-01-12T12:00"
"12/01/2016 13:00:00 - 12/01/2016 14:00:00","BZN|DE-AT-LU","Without Sequence",33.3,"12/01/2016 13:00:00","2016-01-12T14:00","CET","2016-01-12T13:00"
"12/01/2016 14:00:00 - 12/01/2016 15:00:00","BZN|DE-AT-LU","Without Sequence",32.21,"12/01/2016 14:00:00","2016-01-12T15:00","CET","2016-01-12T14:00"
"12/01/2016 15:00:00 - 12/01/2016 16:00:00","BZN|DE-AT-LU","Without Sequence",33,"12/01/2016 15:00:00","2016-01-12T16:00","CET","2016-01-12T15:00"
"12/01/2016 16:00:00 - 12/01/2016 17:00:00","BZN|DE-AT-LU","Without Sequence",36.08,"12/01/2016 16:00:00","2016-01-12T17:00","CET","2016-01-12T16:00"
"12/01/2016 17:00:00 - 12/01/2016 18:00:00","BZN|DE-AT-LU","Without Sequence",41.94,"12/01/2016 17:00:00","2016-01-12T18:00","CET","2016-01-12T17:00"
"12/01/2016 18:00:00 - 12/01/2016 19:00:00","BZN|DE-AT-LU","Without Sequence",40.33,"12/01/2016 18:00:00","2016-01-12T19:00","CET","2016-01-12T18:00"
"12/01/2016 19:00:00 - 12/01/2016 20:00:00","BZN|DE-AT-LU","Without Sequence",29.69,"12/01/2016 19:00:00","2016-01-12T20:00","CET","2016-01-12T19:00"
"12/01/2016 20:00:00 - 12/01/2016 21:00:00","BZN|DE-AT-LU","Without Sequence",26.05,"12/01/2016 20:00:00","2016-01-12T21:00","CET","2016-01-12T20:00"
"12/01/2016 21:00:00 - 12/01/2016 22:00:00","BZN|DE-AT-LU","Without Sequence",24.76,"12/01/2016 21:00:00","2016-01-12T22:00","CET","2016-01-12T21:00"
"12/01/2016 22:00:00 - 12/01/2016 23:00:00","BZN|DE-AT-LU","Without Sequence",24.03,"12/01/2016 22:00:00","2016-01-12T23:00","CET","2016-01-12T22:00"
"12/01/2016 23:00:00 - 13/01/2016 00:00:00","BZN|DE-AT-LU","Without Sequence",24.03,"12/01/2016 23:00:00","2016-01-13T00:00","CET","2016-01-12T23:00"
"13/01/2016 00:00:00 - 13/01/2016 01:00:00","BZN|DE-AT-LU","Without Sequence",21,"13/01/2016 00:00:00","2016-01-13T01:00","CET","2016-01-13T00:00"
"13/01/2016 01:00:00 - 13/01/2016 02:00:00","BZN|DE-AT-LU","Without Sequence",19.66,"13/01/2016 01:00:00","2016-01-13T02:00","CET","2016-01-13T01:00"
"13/01/2016 02:00:00 - 13/01/2016 03:00:00","BZN|DE-AT-LU","Without Sequence",18.13,"13/01/2016 02:00:00","2016-01-13T03:00","CET","2016-01-13T02:00"
"13/01/2016 03:00:00 - 13/01/2016 04:00:00","BZN|DE-AT-LU","Without Sequence",15.3,"13/01/2016 03:00:00","2016-01-13T04:00","CET","2016-01-13T03:00"
"13/01/2016 04:00:00 - 13/01/2016 05:00:00","BZN|DE-AT-LU","Without Sequence",18.05,"13/01/2016 04:00:00","2016-01-13T05:00","CET","2016-01-13T04:00"
"13/01/2016 05:00:00 - 13/01/2016 06:00:00","BZN|DE-AT-LU","Without Sequence",20.83,"13/01/2016 05:00:00","2016-01-13T06:00","CET","2016-01-13T05:00"
"13/01/2016 06:00:00 - 13/01/2016 07:00:00","BZN|DE-AT-LU","Without Sequence",24.1,"13/01/2016 06:00:00","2016-01-13T07:00","CET","2016-01-13T06:00"
"13/01/2016 07:00:00 - 13/01/2016 08:00:00","BZN|DE-AT-LU","Without Sequence",27.87,"13/01/2016 07:00:00","2016-01-13T08:00","CET","2016-01-13T07:00"
"13/01/2016 08:00:00 - 13/01/2016 09:00:00","BZN|DE-AT-LU","Without Sequence",29.98,"13/01/2016 08:00:00","2016-01-13T09:00","CET","2016-01-13T08:00"
"13/01/2016 09:00:00 - 13/01/2016 10:00:00","BZN|DE-AT-LU","Without Sequence",30.73,"13/01/2016 09:00:00","2016-01-13T10:00","CET","2016-01-13T09:00"
"13/01/2016 10:00:00 - 13/01/2016 11:00:00","BZN|DE-AT-LU","Without Sequence",31.45,"13/01/2016 10:00:00","2016-01-13T11:00","CET","2016-01-13T10:00"
"13/01/2016 11:00:00 - 13/01/2016 12:00:00","BZN|DE-AT-LU","Without Sequence",33.56,"13/01/2016 11:00:00","2016-01-13T12:00","CET","2016-01-13T11:00"
"13/01/2016 12:00:00 - 13/01/2016 13:00:00","BZN|DE-AT-LU","Without Sequence",33.99,"13/01/2016 12:00:00","2016-01-13T13:00","CET","2016-01-13T12:00"
"13/01/2016 13:00:00 - 13/01/2016 14:00:00","BZN|DE-AT-LU","Without Sequence",34.09,"13/01/2016 13:00:00","2016-01-13T14:00","CET","2016-01-13T13:00"
"13/01/2016 14:00:00 - 13/01/2016 15:00:00","BZN|DE-AT-LU","Without Sequence",34.02,"13/01/2016 14:00:00","2016-01-13T15:00","CET","2016-01-13T14:00"
"13/01/2016 15:00:00 - 13/01/2016 16:00:00","BZN|DE-AT-LU","Without Sequence",37.44,"13/01/2016 15:00:00","2016-01-13T16:00","CET","2016-01-13T15:00"
"13/01/2016 16:00:00 - 13/01/2016 17:00:00","BZN|DE-AT-LU","Without Sequence",39.58,"13/01/2016 16:00:00","2016-01-13T17:00","CET","2016-01-13T16:00"
"13/01/2016 17:00:00 - 13/01/2016 18:00:00","BZN|DE-AT-LU","Without Sequence",43,"13/01/2016 17:00:00","2016-01-13T18:00","CET","2016-01-13T17:00"
"13/01/2016 18:00:00 - 13/01/2016 19:00:00","BZN|DE-AT-LU","Without Sequence",42.22,"13/01/2016 18:00:00","2016-01-13T19:00","CET","2016-01-13T18:00"
"13/01/2016 19:00:00 - 13/01/2016 20:00:00","BZN|DE-AT-LU","Without Sequence",38.86,"13/01/2016 19:00:00","2016-01-13T20:00","CET","2016-01-13T19:00"
"13/01/2016 20:00:00 - 13/01/2016 21:00:00","BZN|DE-AT-LU","Without Sequence",29.62,"13/01/2016 20:00:00","2016-01-13T21:00","CET","2016-01-13T20:00"
"13/01/2016 21:00:00 - 13/01/2016 22:00:00","BZN|DE-AT-LU","Without Sequence",26.97,"13/01/2016 21:00:00","2016-01-13T22:00","CET","2016-01-13T21:00"
"13/01/2016 22:00:00 - 13/01/2016 23:00:00","BZN|DE-AT-LU","Without Sequence",25.88,"13/01/2016 22:00:00","2016-01-13T23:00","CET","2016-01-13T22:00"
"13/01/2016 23:00:00 - 14/01/2016 00:00:00","BZN|DE-AT-LU","Without Sequence",25.88,"13/01/2016 23:00:00","2016-01-14T00:00","CET","2016-01-13T23:00"
"14/01/2016 00:00:00 - 14/01/2016 01:00:00","BZN|DE-AT-LU","Without Sequence",24.29,"14/01/2016 00:00:00","2016-01-14T01:00","CET","2016-01-14T00:00"
"14/01/2016 01:00:00 - 14/01/2016 02:00:00","BZN|DE-AT-LU","Without Sequence",23.06,"14/01/2016 01:00:00","2016-01-14T02:00","CET","2016-01-14T01:00"
"14/01/2016 02:00:00 - 14/01/2016 03:00:00","BZN|DE-AT-LU","Without Sequence",22.22,"14/01/2016 02:00:00","2016-01-14T03:00","CET","2016-01-14T02:00"
"14/01/2016 03:00:00 - 14/01/2016 04:00:00","BZN|DE-AT-LU","Without Sequence",22.03,"14/01/2016 03:00:00","2016-01-14T04:00","CET","2016-01-14T03:00"
"14/01/2016 04:00:00 - 14/01/2016 05:00:00","BZN|DE-AT-LU","Without Sequence",22.53,"14/01/2016 04:00:00","2016-01-14T05:00","CET","2016-01-14T04:00"
"14/01/2016 05:00:00 - 14/01/2016 06:00:00","BZN|DE-AT-LU","Without Sequence",23.9,"14/01/2016 05:00:00","2016-01-14T06:00","CET","2016-01-14T05:00"
"14/01/2016 06:00:00 - 14/01/2016 07:00:00","BZN|DE-AT-LU","Without Sequence",29.99,"14/01/2016 06:00:00","2016-01-14T07:00","CET","2016-01-14T06:00"
"14/01/2016 07:00:00 - 14/01/2016 08:00:00","BZN|DE-AT-LU","Without Sequence",44.07,"14/01/2016 07:00:00","2016-01-14T08:00","CET","2016-01-14T07:00"
"14/01/2016 08:00:00 - 14/01/2016 09:00:00","BZN|DE-AT-LU","Without Sequence",44.99,"14/01/2016 08:00:00","2016-01-14T09:00","CET","2016-01-14T08:00"
"14/01/2016 09:00:00 - 14/01/2016 10:00:00","BZN|DE-AT-LU","Without Sequence",41.39,"14/01/2016 09:00:00","2016-01-14T10:00","CET","2016-01-14T09:00"
"14/01/2016 10:00:00 - 14/01/2016 11:00:00","BZN|DE-AT-LU","Without Sequence",34.95,"14/01/2016 10:00:00","2016-01-14T11:00","CET","2016-01-14T10:00"
"14/01/2016 11:00:00 - 14/01/2016 12:00:00","BZN|DE-AT-LU","Without Sequence",33.18,"14/01/2016 11:00:00","2016-01-14T12:00","CET","2016-01-14T11:00"
"14/01/2016 12:00:00 - 14/01/2016 13:00:00","BZN|DE-AT-LU","Without Sequence",31.17,"14/01/2016 12:00:00","2016-01-14T13:00","CET","2016-01-14T12:00"
"14/01/2016 13:00:00 - 14/01/2016 14:00:00","BZN|DE-AT-LU","Without Sequence",33.52,"14/01/2016 13:00:00","2016-01-14T14:00","CET","2016-01-14T13:00"
"14/01/2016 14:00:00 - 14/01/2016 15:00:00","BZN|DE-AT-LU","Without Sequence",39.97,"14/01/2016 14:00:00","2016-01-14T15:00","CET","2016-01-14T14:00"
"14/01/2016 15:00:00 - 14/01/2016 16:00:00","BZN|DE-AT-LU","Without Sequence",42.99,"14/01/2016 15:00:00","2016-01-14T16:00","CET","2016-01-14T15:00"
"14/01/2016 16:00:00 - 14/01/2016 17:00:00","BZN|DE-AT-LU","Without Sequence",42.34,"14/01/2016 16:00:00","2016-01-14T17:00","CET","2016-01-14T16:00"
"14/01/2016 17:00:00 - 14/01/2016 18:00:00","BZN|DE-AT-LU","Without Sequence",45.5,"14/01/2016 17:00:00","2016-01-14T18:00","CET","2016-01-14T17:00"
"14/01/2016 18:00:00 - 14/01/2016 19:00:00","BZN|DE-AT-LU","Without Sequence",41.06,"14/01/2016 18:00:00","2016-01-14T19:00","CET","2016-01-14T18:00"
"14/01/2016 19:00:00 - 14/01/2016 20:00:00","BZN|DE-AT-LU","Without Sequence",40.02,"14/01/2016 19:00:00","2016-01-14T20:00","CET","2016-01-14T19:00"
"14/01/2016 20:00:00 - 14/01/2016 21:00:00","BZN|DE-AT-LU","Without Sequence",38.34,"14/01/2016 20:00:00","2016-01-14T21:00","CET","2016-01-14T20:00"
"14/01/2016 21:00:00 - 14/01/2016 22:00:00","BZN|DE-AT-LU","Without Sequence",30.86,"14/01/2016 21:00:00","2016-01-14T22:00","CET","2016-01-14T21:00"
"14/01/2016 22:00:00 - 14/01/2016 23:00:00","BZN|DE-AT-LU","Without Sequence",28.16,"14/01/2016 22:00:00","2016-01-14T23:00","CET","2016-01-14T22:00"
"14/01/2016 23:00:00 - 15/01/2016 00:00:00","BZN|DE-AT-LU","Without Sequence",28.16,"14/01/2016 23:00:00","2016-01-15T00:00","CET","2016-01-14T23:00"
"15/01/2016 00:00:00 - 15/01/2016 01:00:00","BZN|DE-AT-LU","Without Sequence",24.58,"15/01/2016 00:00:00","2016-01-15T01:00","CET","2016-01-15T00:00"
"15/01/2016 01:00:00 - 15/01/2016 02:00:00","BZN|DE-AT-LU","Without Sequence",25.03,"15/01/2016 01:00:00","2016-01-15T02:00","CET","2016-01-15T01:00"
"15/01/2016 02:00:00 - 15/01/2016 03:00:00","BZN|DE-AT-LU","Without Sequence",24.36,"15/01/2016 02:00:00","2016-01-15T03:00","CET","2016-01-15T02:00"
"15/01/2016 03:00:00 - 15/01/2016 04:00:00","BZN|DE-AT-LU","Without Sequence",23.5,"15/01/2016 03:00:00","2016-01-15T04:00","CET","2016-01-15T03:00"
"15/01/2016 04:00:00 - 15/01/2016 05:00:00","BZN|DE-AT-LU","Without Sequence",22.94,"15/01/2016 04:00:00","2016-01-15T05:00","CET","2016-01-15T04:00"
"15/01/2016 05:00:00 - 15/01/2016 06:00:00","BZN|DE-AT-LU","Without Sequence",23.17,"15/01/2016 05:00:00","2016-01-15T06:00","CET","2016-01-15T05:00"
"15/01/2016 06:00:00 - 15/01/2016 07:00:00","BZN|DE-AT-LU","Without Sequence",26.35,"15/01/2016 06:00:00","2016-01-15T07:00","CET","2016-01-15T06:00"
"15/01/2016 07:00:00 - 15/01/2016 08:00:00","BZN|DE-AT-LU","Without Sequence",40.9,"15/01/2016 07:00:00","2016-01-15T08:00","CET","2016-01-15T07:00"
"15/01/2016 08:00:00 - 15/01/2016 09:00:00","BZN|DE-AT-LU","Without Sequence",45.21,"15/01/2016 08:00:00","2016-01-15T09:00","CET","2016-01-15T08:00"
"15/01/2016 09:00:00 - 15/01/2016 10:00:00","BZN|DE-AT-LU","Without Sequence",45.46,"15/01/2016 09:00:00","2016-01-15T10:00","CET","2016-01-15T09:00"
"15/01/2016 10:00:00 - 15/01/2016 11:00:00","BZN|DE-AT-LU","Without Sequence",45.99,"15/01/2016 10:00:00","2016-01-15T11:00","CET","2016-01-15T10:00"
"15/01/2016 11:00:00 - 15/01/2016 12:00:00","BZN|DE-AT-LU","Without Sequence",46.95,"15/01/2016 11:00:00","2016-01-15T12:00","CET","2016-01-15T11:00"
"15/01/2016 12:00:00 - 15/01/2016 13:00:00","BZN|DE-AT-LU","Without Sequence",44,"15/01/2016 12:00:00","2016-01-15T13:00","CET","2016-01-15T12:00"
"15/01/2016 13:00:00 - 15/01/2016 14:00:00","BZN|DE-AT-LU","Without Sequence",42.05,"15/01/2016 13:00:00","2016-01-15T14:00","CET","2016-01-15T13:00"
"15/01/2016 14:00:00 - 15/01/2016 15:00:00","BZN|DE-AT-LU","Without Sequence",39.99,"15/01/2016 14:00:00","2016-01-15T15:00","CET","2016-01-15T14:00"
"15/01/2016 15:00:00 - 15/01/2016 16:00:00","BZN|DE-AT-LU","Without Sequence",37.65,"15/01/2016 15:00:00","2016-01-15T16:00","CET","2016-01-15T15:00"
"15/01/2016 16:00:00 - 15/01/2016 17:00:00","BZN|DE-AT-LU","Without Sequence",38,"15/01/2016 16:00:00","2016-01-15T17:00","CET","2016-01-15T16:00"
"15/01/2016 17:00:00 - 15/01/2016 18:00:00","BZN|DE-AT-LU","Without Sequence",45.26,"15/01/2016 17:00:00","2016-01-15T18:00","CET","2016-01-15T17:00"
"15/01/2016 18:00:00 - 15/01/2016 19:00:00","BZN|DE-AT-LU","Without Sequence",48.04,"15/01/2016 18:00:00","2016-01-15T19:00","CET","2016-01-15T18:00"
"15/01/2016 19:00:00 - 15/01/2016 20:00:00","BZN|DE-AT-LU","Without Sequence",44.36,"15/01/2016 19:00:00","2016-01-15T20:00","CET","2016-01-15T19:00"
"15/01/2016 20:00:00 - 15/01/2016 21:00:00","BZN|DE-AT-LU","Without Sequence",34.38,"15/01/2016 20:00:00","2016-01-15T21:00","CET","2016-01-15T20:00"
"15/01/2016 21:00:00 - 15/01/2016 22:00:00","BZN|DE-AT-LU","Without Sequence",29.34,"15/01/2016 21:00:00","2016-01-15T22:00","CET","2016-01-15T21:00"
"15/01/2016 22:00:00 - 15/01/2016 23:00:00","BZN|DE-AT-LU","Without Sequence",27.17,"15/01/2016 22:00:00","2016-01-15T23:00","CET","2016-01-15T22:00"
"15/01/2016 23:00:00 - 16/01/2016 00:00:00","BZN|DE-AT-LU","Without Sequence",27.17,"15/01/2016 23:00:00","2016-01-16T00:00","CET","2016-01-15T23:00"
"16/01/2016 00:00:00 - 16/01/2016 01:00:00","BZN|DE-AT-LU","Without Sequence",27.13,"16/01/2016 00:00:00","2016-01-16T01:00","CET","2016-01-16T00:00"
"16/01/2016 01:00:00 - 16/01/2016 02:00:00","BZN|DE-AT-LU","Without Sequence",26.37,"16/01/2016 01:00:00","2016-01-16T02:00","CET","2016-01-16T01:00"
"16/01/2016 02:00:00 - 16/01/2016 03:00:00","BZN|DE-AT-LU","Without Sequence",25.58,"16/01/2016 02:00:00","2016-01-16T03:00","CET","2016-01-16T02:00"
"16/01/2016 03:00:00 - 16/01/2016 04:00:00","BZN|DE-AT-LU","Without Sequence",24.73,"16/01/2016 03:00:00","2016-01-16T04:00","CET","2016-01-16T03:00"
"16/01/2016 04:00:00 - 16/01/2016 05:00:00","BZN|DE-AT-LU","Without Sequence",24.08,"16/01/2016 04:00:00","2016-01-16T05:00","CET","2016-01-16T04:00"
"16/01/2016 05:00:00 - 16/01/2016 06:00:00","BZN|DE-AT-LU","Without Sequence",25.32,"16/01/2016 05:00:00","2016-01-16T06:00","CET","2016-01-16T05:00"
"16/01/2016 06:00:00 - 16/01/2016 07:00:00","BZN|DE-AT-LU","Without Sequence",24.77,"16/01/2016 06:00:00","2016-01-16T07:00","CET","2016-01-16T06:00"
"16/01/2016 07:00:00 - 16/01/2016 08:00:00","BZN|DE-AT-LU","Without Sequence",25.03,"16/01/2016 07:00:00","2016-01-16T08:00","CET","2016-01-16T07:00"
"16/01/2016 08:00:00 - 16/01/2016 09:00:00","BZN|DE-AT-LU","Without Sequence",27.55,"16/01/2016 08:00:00","2016-01-16T09:00","CET","2016-01-16T08:00"
"16/01/2016 09:00:00 - 16/01/2016 10:00:00","BZN|DE-AT-LU","Without Sequence",32.4,"16/01/2016 09:00:00","2016-01-16T10:00","CET","2016-01-16T09:00"
"16/01/2016 10:00:00 - 16/01/2016 11:00:00","BZN|DE-AT-LU","Without Sequence",34.21,"16/01/2016 10:00:00","2016-01-16T11:00","CET","2016-01-16T10:00"
"16/01/2016 11:00:00 - 16/01/2016 12:00:00","BZN|DE-AT-LU","Without Sequence",33.23,"16/01/2016 11:00:00","2016-01-16T12:00","CET","2016-01-16T11:00"
"16/01/2016 12:00:00 - 16/01/2016 13:00:00","BZN|DE-AT-LU","Without Sequence",29.16,"16/01/2016 12:00:00","2016-01-16T13:00","CET","2016-01-16T12:00"
"16/01/2016 13:00:00 - 16/01/2016 14:00:00","BZN|DE-AT-LU","Without Sequence",26.31,"16/01/2016 13:00:00","2016-01-16T14:00","CET","2016-01-16T13:00"
"16/01/2016 14:00:00 - 16/01/2016 15:00:00","BZN|DE-AT-LU","Without Sequence",25.47,"16/01/2016 14:00:00","2016-01-16T15:00","CET","2016-01-16T14:00"
"16/01/2016 15:00:00 - 16/01/2016 16:00:00","BZN|DE-AT-LU","Without Sequence",25.6,"16/01/2016 15:00:00","2016-01-16T16:00","CET","2016-01-16T15:00"
"16/01/2016 16:00:00 - 16/01/2016 17:00:00","BZN|DE-AT-LU","Without Sequence",30.15,"16/01/2016 16:00:00","2016-01-16T17:00","CET","2016-01-16T16:00"
"16/01/2016 17:00:00 - 16/01/2016 18:00:00","BZN|DE-AT-LU","Without Sequence",39.77,"16/01/2016 17:00:00","2016-01-16T18:00","CET","2016-01-16T17:00"
"16/01/2016 18:00:00 - 16/01/2016 19:00:00","BZN|DE-AT-LU","Without Sequence",40.03,"16/01/2016 18:00:00","2016-01-16T19:00","CET","2016-01-16T18:00"
"16/01/2016 19:00:00 - 16/01/2016 20:00:00","BZN|DE-AT-LU","Without Sequence",30.99,"16/01/2016 19:00:00","2016-01-16T20:00","CET","2016-01-16T19:00"
"16/01/2016 20:00:00 - 16/01/2016 21:00:00","BZN|DE-AT-LU","Without Sequence",26.19,"16/01/2016 20:00:00","2016-01-16T21:00","CET","2016-01-16T20:00"
"16/01/2016 21:00:00 - 16/01/2016 22:00:00","BZN|DE-AT-LU","Without Sequence",25.9,"16/01/2016 21:00:00","2016-01-16T22:00","CET","2016-01-16T21:00"
"16/01/2016 22:00:00 - 16/01/2016 23:00:00","BZN|DE-AT-LU","Without Sequence",25.53,"16/01/2016 22:00:00","2016-01-16T23:00","CET","2016-01-16T22:00"
"16/01/2016 23:00:00 - 17/01/2016 00:00:00","BZN|DE-AT-LU","Without Sequence",25.53,"16/01/2016 23:00:00","2016-01-17T00:00","CET","2016-01-16T23:00"
"17/01/2016 00:00:00 - 17/01/2016 01:00:00","BZN|DE-AT-LU","Without Sequence",20.86,"17/01/2016 00:00:00","2016-01-17T01:00","CET","2016-01-17T00:00"
"17/01/2016 01:00:00 - 17/01/2016 02:00:00","BZN|DE-AT-LU","Without Sequence",20.25,"17/01/2016 01:00:00","2016-01-17T02:00","CET","2016-01-17T01:00"
"17/01/2016 02:00:00 - 17/01/2016 03:00:00","BZN|DE-AT-LU","Without Sequence",20.76,"17/01/2016 02:00:00","2016-01-17T03:00","CET","2016-01-17T02:00"
"17/01/2016 03:00:00 - 17/01/2016 04:00:00","BZN|DE-AT-LU","Without Sequence",20.97,"17/01/2016 03:00:00","2016-01-17T04:00","CET","2016-01-17T03:00"
"17/01/2016 04:00:00 - 17/01/2016 05:00:00","BZN|DE-AT-LU","Without Sequence",20.89,"17/01/2016 04:00:00","2016-01-17T05:00","CET","2016-01-17T04:00"
"17/01/2016 05:00:00 - 17/01/2016 06:00:00","BZN|DE-AT-LU","Without Sequence",20.94,"17/01/2016 05:00:00","2016-01-17T06:00","CET","2016-01-17T05:00"
"17/01/2016 06:00:00 - 17/01/2016 07:00:00","BZN|DE-AT-LU","Without Sequence",19.64,"17/01/2016 06:00:00","2016-01-17T07:00","CET","2016-01-17T06:00"
"17/01/2016 07:00:00 - 17/01/2016 08:00:00","BZN|DE-AT-LU","Without Sequence",22.35,"17/01/2016 07:00:00","2016-01-17T08:00","CET","2016-01-17T07:00"
"17/01/2016 08:00:00 - 17/01/2016 09:00:00","BZN|DE-AT-LU","Without Sequence",23.52,"17/01/2016 08:00:00","2016-01-17T09:00","CET","2016-01-17T08:00"
"17/01/2016 09:00:00 - 17/01/2016 10:00:00","BZN|DE-AT-LU","Without Sequence",26.54,"17/01/2016 09:00:00","2016-01-17T10:00","CET","2016-01-17T09:00"
"17/01/2016 10:00:00 - 17/01/2016 11:00:00","BZN|DE-AT-LU","Without Sequence",30.11,"17/01/2016 10:00:00","2016-01-17T11:00","CET","2016-01-17T10:00"
"17/01/2016 11:00:00 - 17/01/2016 12:00:00","BZN|DE-AT-LU","Without Sequence",36.29,"17/01/2016 11:00:00","2016-01-17T12:00","CET","2016-01-17T11:00"
"17/01/2016 12:00:00 - 17/01/2016 13:00:00","BZN|DE-AT-LU","Without Sequence",32.44,"17/01/2016 12:00:00","2016-01-17T13:00","CET","2016-01-17T12:00"
"17/01/2016 13:00:00 - 17/01/2016 14:00:00","BZN|DE-AT-LU","Without Sequence",26.93,"17/01/2016 13:00:00","2016-01-17T14:00","CET","2016-01-17T13:00"
"17/01/2016 14:00:00 - 17/01/2016 15:00:00","BZN|DE-AT-LU","Without Sequence",26.19,"17/01/2016 14:00:00","2016-01-17T15:00","CET","2016-01-17T14:00"
"17/01/2016 15:00:00 - 17/01/2016 16:00:00","BZN|DE-AT-LU","Without Sequence",27.07,"17/01/2016 15:00:00","2016-01-17T16:00","CET","2016-01-17T15:00"
"17/01/2016 16:00:00 - 17/01/2016 17:00:00","BZN|DE-AT-LU","Without Sequence",31.94,"17/01/2016 16:00:00","2016-01-17T17:00","CET","2016-01-17T16:00"
"17/01/2016 17:00:00 - 17/01/2016 18:00:00","BZN|DE-AT-LU","Without Sequence",39.49,"17/01/2016 17:00:00","2016-01-17T18:00","CET","2016-01-17T17:00"
"17/01/2016 18:00:00 - 17/01/2016 19:00:00","BZN|DE-AT-LU","Without Sequence",42.8,"17/01/2016 18:00:00","2016-01-17T19:00","CET","2016-01-17T18:00"
"17/01/2016 19:00:00 - 17/01/2016 20:00:00","BZN|DE-AT-LU","Without Sequence",39.23,"17/01/2016 19:00:00","2016-01-17T20:00","CET","2016-01-17T19:00"
"17/01/2016 20:00:00 - 17/01/2016 21:00:00","BZN|DE-AT-LU","Without Sequence",33.3,"17/01/2016 20:00:00","2016-01-17T21:00","CET","2016-01-17T20:00"
"17/01/2016 21:00:00 - 17/01/2016 22:00:00","BZN|DE-AT-LU","Without Sequence",27.04,"17/01/2016 21:00:00","2016-01-17T22:00","CET","2016-01-17T21:00"
"17/01/2016 22:00:00 - 17/01/2016 23:00:00","BZN|DE-AT-LU","Without Sequence",27.05,"17/01/2016 22:00:00","2016-01-17T23:00","CET","2016-01-17T22:00"
"17/01/2016 23:00:00 - 18/01/2016 00:00:00","BZN|DE-AT-LU","Without Sequence",27.05,"17/01/2016 23:00:00","2016-01-18T00:00","CET","2016-01-17T23:00"
"18/01/2016 00:00:00 - 18/01/2016 01:00:00","BZN|DE-AT-LU","Without Sequence",23.96,"18/01/2016 00:00:00","2016-01-18T01:00","CET","2016-01-18T00:00"
"18/01/2016 01:00:00 - 18/01/2016 02:00:00","BZN|DE-AT-LU","Without Sequence",23.47,"18/01/2016 01:00:00","2016-01-18T02:00","CET","2016-01-18T01:00"
"18/01/2016 02:00:00 - 18/01/2016 03:00:00","BZN|DE-AT-LU","Without Sequence",23.56,"18/01/2016 02:00:00","2016-01-18T03:00","CET","2016-01-18T02:00"
"18/01/2016 03:00:00 - 18/01/2016 04:00:00","BZN|DE-AT-LU","Without Sequence",23.48,"18/01/2016 03:00:00","2016-01-18T04:00","CET","2016-01-18T03:00"
"18/01/2016 04:00:00 - 18/01/2016 05:00:00","BZN|DE-AT-LU","Without Sequence",23.51,"18/01/2016 04:00:00","2016-01-18T05:00","CET","2016-01-18T04:00"
"18/01/2016 05:00:00 - 18/01/2016 06:00:00","BZN|DE-AT-LU","Without Sequence",24.25,"18/01/2016 05:00:00","2016-01-18T06:00","CET","2016-01-18T05:00"
"18/01/2016 06:00:00 - 18/01/2016 07:00:00","BZN|DE-AT-LU","Without Sequence",27.61,"18/01/2016 06:00:00","2016-01-18T07:00","CET","2016-01-18T06:00"
"18/01/2016 07:00:00 - 18/01/2016 08:00:00","BZN|DE-AT-LU","Without Sequence",46.01,"18/01/2016 07:00:00","2016-01-18T08:00","CET","2016-01-18T07:00"
"18/01/2016 08:00:00 - 18/01/2016 09:00:00","BZN|DE-AT-LU","Without Sequence",49.98,"18/01/2016 08:00:00","2016-01-18T09:00","CET","2016-01-18T08:00"
"18/01/2016 09:00:00 - 18/01/2016 10:00:00","BZN|DE-AT-LU","Without Sequence",50.54,"18/01/2016 09:00:00","2016-01-18T10:00","CET","2016-01-18T09:00"
"18/01/2016 10:00:00 - 18/01/2016 11:00:00","BZN|DE-AT-LU","Without Sequence",49.91,"18/01/2016 10:00:00","2016-01-18T11:00","CET","2016-01-18T10:00"
"18/01/2016 11:00:00 - 18/01/2016 12:00:00","BZN|DE-AT-LU","Without Sequence",48.44,"18/01/2016 11:00:00","2016-01-18T12:00","CET","2016-01-18T11:00"
"18/01/2016 12:00:00 - 18/01/2016 13:00:00","BZN|DE-AT-LU","Without Sequence",46.93,"18/01/2016 12:00:00","2016-01-18T13:00","CET","2016-01-18T12:00"
"18/01/2016 13:00:00 - 18/01/2016 14:00:00","BZN|DE-AT-LU","Without Sequence",46.32,"18/01/2016 13:00:00","2016-01-18T14:00","CET","2016-01-18T13:00"
"18/01/2016 14:00:00 - 18/01/2016 15:00:00","BZN|DE-AT-LU","Without Sequence",45.76,"18/01/2016 14:00:00","2016-01-18T15:00","CET","2016-01-18T14:00"
"18/01/2016 15:00:00 - 18/01/2016 16:00:00","BZN|DE-AT-LU","Without Sequence",49.53,"18/01/2016 15:00:00","2016-01-18T16:00","CET","2016-01-18T15:00"
"18/01/2016 16:00:00 - 18/01/2016 17:00:00","BZN|DE-AT-LU","Without Sequence",49.66,"18/01/2016 16:00:00","2016-01-18T17:00","CET","2016-01-18T16:00"
"18/01/2016 17:00:00 - 18/01/2016 18:00:00","BZN|DE-AT-LU","Without Sequence",62.55,"18/01/2016 17:00:00","2016-01-18T18:00","CET","2016-01-18T17:00"
"18/01/2016 18:00:00 - 18/01/2016 19:00:00","BZN|DE-AT-LU","Without Sequence",56.07,"18/01/2016 18:00:00","2016-01-18T19:00","CET","2016-01-18T18:00"
"18/01/2016 19:00:00 - 18/01/2016 20:00:00","BZN|DE-AT-LU","Without Sequence",47.18,"18/01/2016 19:00:00","2016-01-18T20:00","CET","2016-01-18T19:00"
"18/01/2016 20:00:00 - 18/01/2016 21:00:00","BZN|DE-AT-LU","Without Sequence",35.09,"18/01/2016 20:00:00","2016-01-18T21:00","CET","2016-01-18T20:00"
"18/01/2016 21:00:00 - 18/01/2016 22:00:00","BZN|DE-AT-LU","Without Sequence",26.95,"18/01/2016 21:00:00","2016-01-18T22:00","CET","2016-01-18T21:00"
"18/01/2016 22:00:00 - 18/01/2016 23:00:00","BZN|DE-AT-LU","Without Sequence",26.94,"18/01/2016 22:00:00","2016-01-18T23:00","CET","2016-01-18T22:00"
"18/01/2016 23:00:00 - 19/01/2016 00:00:00","BZN|DE-AT-LU","Without Sequence",26.94,"18/01/2016 23:00:00","2016-01-19T00:00","CET","2016-01-18T23:00"
"19/01/2016 00:00:00 - 19/01/2016 01:00:00","BZN|DE-AT-LU","Without Sequence",31.95,"19/01/2016 00:00:00","2016-01-19T01:00","CET","2016-01-19T00:00"
"19/01/2016 01:00:00 - 19/01/2016 02:00:00","BZN|DE-AT-LU","Without Sequence",32.16,"19/01/2016 01:00:00","2016-01-19T02:00","CET","2016-01-19T01:00"
"19/01/2016 02:00:00 - 19/01/2016 03:00:00","BZN|DE-AT-LU","Without Sequence",28.97,"19/01/2016 02:00:00","2016-01-19T03:00","CET","2016-01-19T02:00"
"19/01/2016 03:00:00 - 19/01/2016 04:00:00","BZN|DE-AT-LU","Without Sequence",30.01,"19/01/2016 03:00:00","2016-01-19T04:00","CET","2016-01-19T03:00"
"19/01/2016 04:00:00 - 19/01/2016 05:00:00","BZN|DE-AT-LU","Without Sequence",30.45,"19/01/2016 04:00:00","2016-01-19T05:00","CET","2016-01-19T04:00"
"19/01/2016 05:00:00 - 19/01/2016 06:00:00","BZN|DE-AT-LU","Without Sequence",27.01,"19/01/2016 05:00:00","2016-01-19T06:00","CET","2016-01-19T05:00"
"19/01/2016 06:00:00 - 19/01/2016 07:00:00","BZN|DE-AT-LU","Without Sequence",31.9,"19/01/2016 06:00:00","2016-01-19T07:00","CET","2016-01-19T06:00"
"19/01/2016 07:00:00 - 19/01/2016 08:00:00","BZN|DE-AT-LU","Without Sequence",54.1,"19/01/2016 07:00:00","2016-01-19T08:00","CET","2016-01-19T07:00"
"19/01/2016 08:00:00 - 19/01/2016 09:00:00","BZN|DE-AT-LU","Without Sequence",64.9,"19/01/2016 08:00:00","2016-01-19T09:00","CET","2016-01-19T08:00"
"19/01/2016 09:00:00 - 19/01/2016 10:00:00","BZN|DE-AT-LU","Without Sequence",65.35,"19/01/2016 09:00:00","2016-01-19T10:00","CET","2016-01-19T09:00"
"19/01/2016 10:00:00 - 19/01/2016 11:00:00","BZN|DE-AT-LU","Without Sequence",61.31,"19/01/2016 10:00:00","2016-01-19T11:00","CET","2016-01-19T10:00"
"19/01/2016 11:00:00 - 19/01/2016 12:00:00","BZN|DE-AT-LU","Without Sequence",61.43,"19/01/2016 11:00:00","2016-01-19T12:00","CET","2016-01-19T11:00"
"19/01/2016 12:00:00 - 19/01/2016 13:00:00","BZN|DE-AT-LU","Without Sequence",58.98,"19/01/2016 12:00:00","2016-01-19T13:00","CET","2016-01-19T12:00"
"19/01/2016 13:00:00 - 19/01/2016 14:00:00","BZN|DE-AT-LU","Without Sequence",58.53,"19/01/2016 13:00:00","2016-01-19T14:00","CET","2016-01-19T13:00"
"19/01/2016 14:00:00 - 19/01/2016 15:00:00","BZN|DE-AT-LU","Without Sequence",55.81,"19/01/2016 14:00:00","2016-01-19T15:00","CET","2016-01-19T14:00"
"19/01/2016 15:00:00 - 19/01/2016 16:00:00","BZN|DE-AT-LU","Without Sequence",55.5,"19/01/2016 15:00:00","2016-01-19T16:00","CET","2016-01-19T15:00"
"19/01/2016 16:00:00 - 19/01/2016 17:00:00","BZN|DE-AT-LU","Without Sequence",56.21,"19/01/2016 16:00:00","2016-01-19T17:00","CET","2016-01-19T16:00"
"19/01/2016 17:00:00 - 19/01/2016 18:00:00","BZN|DE-AT-LU","Without Sequence",70.07,"19/01/2016 17:00:00","2016-01-19T18:00","CET","2016-01-19T17:00"
"19/01/2016 18:00:00 - 19/01/2016 19:00:00","BZN|DE-AT-LU","Without Sequence",74.97,"19/01/2016 18:00:00","2016-01-19T19:00","CET","2016-01-19T18:00"
"19/01/2016 19:00:00 - 19/01/2016 20:00:00","BZN|DE-AT-LU","Without Sequence",57.56,"19/01/2016 19:00:00","2016-01-19T20:00","CET","2016-01-19T19:00"
"19/01/2016 20:00:00 - 19/01/2016 21:00:00","BZN|DE-AT-LU","Without Sequence",48.24,"19/01/2016 20:00:00","2016-01-19T21:00","CET","2016-01-19T20:00"
"19/01/2016 21:00:00 - 19/01/2016 22:00:00","BZN|DE-AT-LU","Without Sequence",37.98,"19/01/2016 21:00:00","2016-01-19T22:00","CET","2016-01-19T21:00"
"19/01/2016 22:00:00 - 19/01/2016 23:00:00","BZN|DE-AT-LU","Without Sequence",33.67,"19/01/2016 22:00:00","2016-01-19T23:00","CET","2016-01-19T22:00"
"19/01/2016 23:00:00 - 20/01/2016 00:00:00","BZN|DE-AT-LU","Without Sequence",33.67,"19/01/2016 23:00:00","2016-01-20T00:00","CET","2016-01-19T23:00"
"20/01/2016 00:00:00 - 20/01/2016 01:00:00","BZN|DE-AT-LU","Without Sequence",26.05,"20/01/2016 00:00:00","2016-01-20T01:00","CET","2016-01-20T00:00"
"20/01/2016 01:00:00 - 20/01/2016 02:00:00","BZN|DE-AT-LU","Without Sequence",26.17,"20/01/2016 01:00:00","2016-01-20T02:00","CET","2016-01-20T01:00"
"20/01/2016 02:00:00 - 20/01/2016 03:00:00","BZN|DE-AT-LU","Without Sequence",26.42,"20/01/2016 02:00:00","2016-01-20T03:00","CET","2016-01-20T02:00"
"20/01/2016 03:00:00 - 20/01/2016 04:00:00","BZN|DE-AT-LU","Without Sequence",25.36,"20/01/2016 03:00:00","2016-01-20T04:00","CET","2016-01-20T03:00"
"20/01/2016 04:00:00 - 20/01/2016 05:00:00","BZN|DE-AT-LU","Without Sequence",25.76,"20/01/2016 04:00:00","2016-01-20T05:00","CET","2016-01-20T04:00"
"20/01/2016 05:00:00 - 20/01/2016 06:00:00","BZN|DE-AT-LU","Without Sequence",26.54,"20/01/2016 05:00:00","2016-01-20T06:00","CET","2016-01-20T05:00"
"20/01/2016 06:00:00 - 20/01/2016 07:00:00","BZN|DE-AT-LU","Without Sequence",32.7,"20/01/2016 06:00:00","2016-01-20T07:00","CET","2016-01-20T06:00"
"20/01/2016 07:00:00 - 20/01/2016 08:00:00","BZN|DE-AT-LU","Without Sequence",55.08,"20/01/2016 07:00:00","2016-01-20T08:00","CET","2016-01-20T07:00"
"20/01/2016 08:00:00 - 20/01/2016 09:00:00","BZN|DE-AT-LU","Without Sequence",61.08,"20/01/2016 08:00:00","2016-01-20T09:00","CET","2016-01-20T08:00"
"20/01/2016 09:00:00 - 20/01/2016 10:00:00","BZN|DE-AT-LU","Without Sequence",58.43,"20/01/2016 09:00:00","2016-01-20T10:00","CET","2016-01-20T09:00"
"20/01/2016 10:00:00 - 20/01/2016 11:00:00","BZN|DE-AT-LU","Without Sequence",58.97,"20/01/2016 10:00:00","2016-01-20T11:00","CET","2016-01-20T10:00"
"20/01/2016 11:00:00 - 20/01/2016 12:00:00","BZN|DE-AT-LU","Without Sequence",56.14,"20/01/2016 11:00:00","2016-01-20T12:00","CET","2016-01-20T11:00"
"20/01/2016 12:00:00 - 20/01/2016 13:00:00","BZN|DE-AT-LU","Without Sequence",58.6,"20/01/2016 12:00:00","2016-01-20T13:00","CET","2016-01-20T12:00"
"20/01/2016 13:00:00 - 20/01/2016 14:00:00","BZN|DE-AT-LU","Without Sequence",57.58,"20/01/2016 13:00:00","2016-01-20T14:00","CET","2016-01-20T13:00"
"20/01/2016 14:00:00 - 20/01/2016 15:00:00","BZN|DE-AT-LU","Without Sequence",54.95,"20/01/2016 14:00:00","2016-01-20T15:00","CET","2016-01-20T14:00"
"20/01/2016 15:00:00 - 20/01/2016 16:00:00","BZN|DE-AT-LU","Without Sequence",52.42,"20/01/2016 15:00:00","2016-01-20T16:00","CET","2016-01-20T15:00"
"20/01/2016 16:00:00 - 20/01/2016 17:00:00","BZN|DE-AT-LU","Without Sequence",72.01,"20/01/2016 16:00:00","2016-01-20T17:00","CET","2016-01-20T16:00"
"20/01/2016 17:00:00 - 20/01/2016 18:00:00","BZN|DE-AT-LU","Without Sequence",92.75,"20/01/2016 17:00:00","2016-01-20T18:00","CET","2016-01-20T17:00"
"20/01/2016 18:00:00 - 20/01/2016 19:00:00","BZN|DE-AT-LU","Without Sequence",79.09,"20/01/2016 18:00:00","2016-01-20T19:00","CET","2016-01-20T18:00"
"20/01/2016 19:00:00 - 20/01/2016 20:00:00","BZN|DE-AT-LU","Without Sequence",70.03,"20/01/2016 19:00:00","2016-01-20T20:00","CET","2016-01-20T19:00"
"20/01/2016 20:00:00 - 20/01/2016 21:00:00","BZN|DE-AT-LU","Without Sequence",50.1,"20/01/2016 20:00:00","2016-01-20T21:00","CET","2016-01-20T20:00"
"20/01/2016 21:00:00 - 20/01/2016 22:00:00","BZN|DE-AT-LU","Without Sequence",40.06,"20/01/2016 21:00:00","2016-01-20T22:00","CET","2016-01-20T21:00"
"20/01/2016 22:00:00 - 20/01/2016 23:00:00","BZN|DE-AT-LU","Without Sequence",33.52,"20/01/2016 22:00:00","2016-01-20T23:00","CET","2016-01-20T22:00"
"20/01/2016 23:00:00 - 21/01/2016 00:00:00","BZN|DE-AT-LU","Without Sequence",33.52,"20/01/2016 23:00:00","2016-01-21T00:00","CET","2016-01-20T23:00"
"21/01/2016 00:00:00 - 21/01/2016 01:00:00","BZN|DE-AT-LU","Without Sequence",29.65,"21/01/2016 00:00:00","2016-01-21T01:00","CET","2016-01-21T00:00"
"21/01/2016 01:00:00 - 21/01/2016 02:00:00","BZN|DE-AT-LU","Without Sequence",27.82,"21/01/2016 01:00:00","2016-01-21T02:00","CET","2016-01-21T01:00"
"21/01/2016 02:00:00 - 21/01/2016 03:00:00","BZN|DE-AT-LU","Without Sequence",26.65,"21/01/2016 02:00:00","2016-01-21T03:00","CET","2016-01-21T02:00"
"21/01/2016 03:00:00 - 21/01/2016 04:00:00","BZN|DE-AT-LU","Without Sequence",26.96,"21/01/2016 03:00:00","2016-01-21T04:00","CET","2016-01-21T03:00"
"21/01/2016 04:00:00 - 21/01/2016 05:00:00","BZN|DE-AT-LU","Without Sequence",27.47,"21/01/2016 04:00:00","2016-01-21T05:00","CET","2016-01-21T04:00"
"21/01/2016 05:00:00 - 21/01/2016 06:00:00","BZN|DE-AT-LU","Without Sequence",29.09,"21/01/2016 05:00:00","2016-01-21T06:00","CET","2016-01-21T05:00"
"21/01/2016 06:00:00 - 21/01/2016 07:00:00","BZN|DE-AT-LU","Without Sequence",40.78,"21/01/2016 06:00:00","2016-01-21T07:00","CET","2016-01-21T06:00"
"21/01/2016 07:00:00 - 21/01/2016 08:00:00","BZN|DE-AT-LU","Without Sequence",70.01,"21/01/2016 07:00:00","2016-01-21T08:00","CET","2016-01-21T07:00"
"21/01/2016 08:00:00 - 21/01/2016 09:00:00","BZN|DE-AT-LU","Without Sequence",85.05,"21/01/2016 08:00:00","2016-01-21T09:00","CET","2016-01-21T08:00"
"21/01/2016 09:00:00 - 21/01/2016 10:00:00","BZN|DE-AT-LU","Without Sequence",83.54,"21/01/2016 09:00:00","2016-01-21T10:00","CET","2016-01-21T09:00"
"21/01/2016 10:00:00 - 21/01/2016 11:00:00","BZN|DE-AT-LU","Without Sequence",74.94,"21/01/2016 10:00:00","2016-01-21T11:00","CET","2016-01-21T10:00"
"21/01/2016 11:00:00 - 21/01/2016 12:00:00","BZN|DE-AT-LU","Without Sequence",70.12,"21/01/2016 11:00:00","2016-01-21T12:00","CET","2016-01-21T11:00"
"21/01/2016 12:00:00 - 21/01/2016 13:00:00","BZN|DE-AT-LU","Without Sequence",59.91,"21/01/2016 12:00:00","2016-01-21T13:00","CET","2016-01-21T12:00"
"21/01/2016 13:00:00 - 21/01/2016 14:00:00","BZN|DE-AT-LU","Without Sequence",57.69,"21/01/2016 13:00:00","2016-01-21T14:00","CET","2016-01-21T13:00"
"21/01/2016 14:00:00 - 21/01/2016 15:00:00","BZN|DE-AT-LU","Without Sequence",57.99,"21/01/2016 14:00:00","2016-01-21T15:00","CET","2016-01-21T14:00"
"21/01/2016 15:00:00 - 21/01/2016 16:00:00","BZN|DE-AT-LU","Without Sequence",61.05,"21/01/2016 15:00:00","2016-01-21T16:00","CET","2016-01-21T15:00"
"21/01/2016 16:00:00 - 21/01/2016 17:00:00","BZN|DE-AT-LU","Without Sequence",57.43,"21/01/2016 16:00:00","2016-01-21T17:00","CET","2016-01-21T16:00"
"21/01/2016 17:00:00 - 21/01/2016 18:00:00","BZN|DE-AT-LU","Without Sequence",77.13,"21/01/2016 17:00:00","2016-01-21T18:00","CET","2016-01-21T17:00"
"21/01/2016 18:00:00 - 21/01/2016 19:00:00","BZN|DE-AT-LU","Without Sequence",86.01,"21/01/2016 18:00:00","2016-01-21T19:00","CET","2016-01-21T18:00"
"21/01/2016 19:00:00 - 21/01/2016 20:00:00","BZN|DE-AT-LU","Without Sequence",60.13,"21/01/2016 19:00:00","2016-01-21T20:00","CET","2016-01-21T19:00"
"21/01/2016 20:00:00 - 21/01/2016 21:00:00","BZN|DE-AT-LU","Without Sequence",50.09,"21/01/2016 20:00:00","2016-01-21T21:00","CET","2016-01-21T20:00"
"21/01/2016 21:00:00 - 21/01/2016 22:00:00","BZN|DE-AT-LU","Without Sequence",35.47,"21/01/2016 21:00:00","2016-01-21T22:00","CET","2016-01-21T21:00"
"21/01/2016 22:00:00 - 21/01/2016 23:00:00","BZN|DE-AT-LU","Without Sequence",30.36,"21/01/2016 22:00:00","2016-01-21T23:00","CET","2016-01-21T22:00"
"21/01/2016 23:00:00 - 22/01/2016 00:00:00","BZN|DE-AT-LU","Without Sequence",30.36,"21/01/2016 23:00:00","2016-01-22T00:00","CET","2016-01-21T23:00"
"22/01/2016 00:00:00 - 22/01/2016 01:00:00","BZN|DE-AT-LU","Without Sequence",28.05,"22/01/2016 00:00:00","2016-01-22T01:00","CET","2016-01-22T00:00"
"22/01/2016 01:00:00 - 22/01/2016 02:00:00","BZN|DE-AT-LU","Without Sequence",27.92,"22/01/2016 01:00:00","2016-01-22T02:00","CET","2016-01-22T01:00"
"22/01/2016 02:00:00 - 22/01/2016 03:00:00","BZN|DE-AT-LU","Without Sequence",26.78,"22/01/2016 02:00:00","2016-01-22T03:00","CET","2016-01-22T02:00"
"22/01/2016 03:00:00 - 22/01/2016 04:00:00","BZN|DE-AT-LU","Without Sequence",26.57,"22/01/2016 03:00:00","2016-01-22T04:00","CET","2016-01-22T03:00"
"22/01/2016 04:00:00 - 22/01/2016 05:00:00","BZN|DE-AT-LU","Without Sequence",27.02,"22/01/2016 04:00:00","2016-01-22T05:00","CET","2016-01-22T04:00"
"22/01/2016 05:00:00 - 22/01/2016 06:00:00","BZN|DE-AT-LU","Without Sequence",28.07,"22/01/2016 05:00:00","2016-01-22T06:00","CET","2016-01-22T05:00"
"22/01/2016 06:00:00 - 22/01/2016 07:00:00","BZN|DE-AT-LU","Without Sequence",30.82,"22/01/2016 06:00:00","2016-01-22T07:00","CET","2016-01-22T06:00"
"22/01/2016 07:00:00 - 22/01/2016 08:00:00","BZN|DE-AT-LU","Without Sequence",48.46,"22/01/2016 07:00:00","2016-01-22T08:00","CET","2016-01-22T07:00"
"22/01/2016 08:00:00 - 22/01/2016 09:00:00","BZN|DE-AT-LU","Without Sequence",52.5,"22/01/2016 08:00:00","2016-01-22T09:00","CET","2016-01-22T08:00"
"22/01/2016 09:00:00 - 22/01/2016 10:00:00","BZN|DE-AT-LU","Without Sequence",48.66,"22/01/2016 09:00:00","2016-01-22T10:00","CET","2016-01-22T09:00"
"22/01/2016 10:00:00 - 22/01/2016 11:00:00","BZN|DE-AT-LU","Without Sequence",45.11,"22/01/2016 10:00:00","2016-01-22T11:00","CET","2016-01-22T10:00"
"22/01/2016 11:00:00 - 22/01/2016 12:00:00","BZN|DE-AT-LU","Without Sequence",44.96,"22/01/2016 11:00:00","2016-01-22T12:00","CET","2016-01-22T11:00"
"22/01/2016 12:00:00 - 22/01/2016 13:00:00","BZN|DE-AT-LU","Without Sequence",42.06,"22/01/2016 12:00:00","2016-01-22T13:00","CET","2016-01-22T12:00"
"22/01/2016 13:00:00 - 22/01/2016 14:00:00","BZN|DE-AT-LU","Without Sequence",37.02,"22/01/2016 13:00:00","2016-01-22T14:00","CET","2016-01-22T13:00"
"22/01/2016 14:00:00 - 22/01/2016 15:00:00","BZN|DE-AT-LU","Without Sequence",32.27,"22/01/2016 14:00:00","2016-01-22T15:00","CET","2016-01-22T14:00"
"22/01/2016 15:00:00 - 22/01/2016 16:00:00","BZN|DE-AT-LU","Without Sequence",32.65,"22/01/2016 15:00:00","2016-01-22T16:00","CET","2016-01-22T15:00"
"22/01/2016 16:00:00 - 22/01/2016 17:00:00","BZN|DE-AT-LU","Without Sequence",32.84,"22/01/2016 16:00:00","2016-01-22T17:00","CET","2016-01-22T16:00"
"22/01/2016 17:00:00 - 22/01/2016 18:00:00","BZN|DE-AT-LU","Without Sequence",34.83,"22/01/2016 17:00:00","2016-01-22T18:00","CET","2016-01-22T17:00"
"22/01/2016 18:00:00 - 22/01/2016 19:00:00","BZN|DE-AT-LU","Without Sequence",28.3,"22/01/2016 18:00:00","2016-01-22T19:00","CET","2016-01-22T18:00"
"22/01/2016 19:00:00 - 22/01/2016 20:00:00","BZN|DE-AT-LU","Without Sequence",26.88,"22/01/2016 19:00:00","2016-01-22T20:00","CET","2016-01-22T19:00"
"22/01/2016 20:00:00 - 22/01/2016 21:00:00","BZN|DE-AT-LU","Without Sequence",25.46,"22/01/2016 20:00:00","2016-01-22T21:00","CET","2016-01-22T20:00"
"22/01/2016 21:00:00 - 22/01/2016 22:00:00","BZN|DE-AT-LU","Without Sequence",24.88,"22/01/2016 21:00:00","2016-01-22T22:00","CET","2016-01-22T21:00"
"22/01/2016 22:00:00 - 22/01/2016 23:00:00","BZN|DE-AT-LU","Without Sequence",24.28,"22/01/2016 22:00:00","2016-01-22T23:00","CET","2016-01-22T22:00"
"22/01/2016 23:00:00 - 23/01/2016 00:00:00","BZN|DE-AT-LU","Without Sequence",24.28,"22/01/2016 23:00:00","2016-01-23T00:00","CET","2016-01-22T23:00"
"23/01/2016 00:00:00 - 23/01/2016 01:00:00","BZN|DE-AT-LU","Without Sequence",24.44,"23/01/2016 00:00:00","2016-01-23T01:00","CET","2016-01-23T00:00"
"23/01/2016 01:00:00 - 23/01/2016 02:00:00","BZN|DE-AT-LU","Without Sequence",24.02,"23/01/2016 01:00:00","2016-01-23T02:00","CET","2016-01-23T01:00"
"23/01/2016 02:00:00 - 23/01/2016 03:00:00","BZN|DE-AT-LU","Without Sequence",23.03,"23/01/2016 02:00:00","2016-01-23T03:00","CET","2016-01-23T02:00"
"23/01/2016 03:00:00 - 23/01/2016 04:00:00","BZN|DE-AT-LU","Without Sequence",22.99,"23/01/2016 03:00:00","2016-01-23T04:00","CET","2016-01-23T03:00"
"23/01/2016 04:00:00 - 23/01/2016 05:00:00","BZN|DE-AT-LU","Without Sequence",22.68,"23/01/2016 04:00:00","2016-01-23T05:00","CET","2016-01-23T04:00"
"23/01/2016 05:00:00 - 23/01/2016 06:00:00","BZN|DE-AT-LU","Without Sequence",22.44,"23/01/2016 05:00:00","2016-01-23T06:00","CET","2016-01-23T05:00"
"23/01/2016 06:00:00 - 23/01/2016 07:00:00","BZN|DE-AT-LU","Without Sequence",21.46,"23/01/2016 06:00:00","2016-01-23T07:00","CET","2016-01-23T06:00"
"23/01/2016 07:00:00 - 23/01/2016 08:00:00","BZN|DE-AT-LU","Without Sequence",23.35,"23/01/2016 07:00:00","2016-01-23T08:00","CET","2016-01-23T07:00"
"23/01/2016 08:00:00 - 23/01/2016 09:00:00","BZN|DE-AT-LU","Without Sequence",24.68,"23/01/2016 08:00:00","2016-01-23T09:00","CET","2016-01-23T08:00"
"23/01/2016 09:00:00 - 23/01/2016 10:00:00","BZN|DE-AT-LU","Without Sequence",28.9,"23/01/2016 09:00:00","2016-01-23T10:00","CET","2016-01-23T09:00"
"23/01/2016 10:00:00 - 23/01/2016 11:00:00","BZN|DE-AT-LU","Without Sequence",31.32,"23/01/2016 10:00:00","2016-01-23T11:00","CET","2016-01-23T10:00"
"23/01/2016 11:00:00 - 23/01/2016 12:00:00","BZN|DE-AT-LU","Without Sequence",34.75,"23/01/2016 11:00:00","2016-01-23T12:00","CET","2016-01-23T11:00"
"23/01/2016 12:00:00 - 23/01/2016 13:00:00","BZN|DE-AT-LU","Without Sequence",34.39,"23/01/2016 12:00:00","2016-01-23T13:00","CET","2016-01-23T12:00"
"23/01/2016 13:00:00 - 23/01/2016 14:00:00","BZN|DE-AT-LU","Without Sequence",30.45,"23/01/2016 13:00:00","2016-01-23T14:00","CET","2016-01-23T13:00"
"23/01/2016 14:00:00 - 23/01/2016 15:00:00","BZN|DE-AT-LU","Without Sequence",28.04,"23/01/2016 14:00:00","2016-01-23T15:00","CET","2016-01-23T14:00"
"23/01/2016 15:00:00 - 23/01/2016 16:00:00","BZN|DE-AT-LU","Without Sequence",29.1,"23/01/2016 15:00:00","2016-01-23T16:00","CET","2016-01-23T15:00"
"23/01/2016 16:00:00 - 23/01/2016 17:00:00","BZN|DE-AT-LU","Without Sequence",29.7,"23/01/2016 16:00:00","2016-01-23T17:00","CET","2016-01-23T16:00"
"23/01/2016 17:00:00 - 23/01/2016 18:00:00","BZN|DE-AT-LU","Without Sequence",36.97,"23/01/2016 17:00:00","2016-01-23T18:00","CET","2016-01-23T17:00"
"23/01/2016 18:00:00 - 23/01/2016 19:00:00","BZN|DE-AT-LU","Without Sequence",42.6,"23/01/2016 18:00:00","2016-01-23T19:00","CET","2016-01-23T18:00"
"23/01/2016 19:00:00 - 23/01/2016 20:00:00","BZN|DE-AT-LU","Without Sequence",35.83,"23/01/2016 19:00:00","2016-01-23T20:00","CET","2016-01-23T19:00"
"23/01/2016 20:00:00 - 23/01/2016 21:00:00","BZN|DE-AT-LU","Without Sequence",28.84,"23/01/2016 20:00:00","2016-01-23T21:00","CET","2016-01-23T20:00"
"23/01/2016 21:00:00 - 23/01/2016 22:00:00","BZN|DE-AT-LU","Without Sequence",25.4,"23/01/2016 21:00:00","2016-01-23T22:00","CET","2016-01-23T21:00"
"23/01/2016 22:00:00 - 23/01/2016 23:00:00","BZN|DE-AT-LU","Without Sequence",26.27,"23/01/2016 22:00:00","2016-01-23T23:00","CET","2016-01-23T22:00"
"23/01/2016 23:00:00 - 24/01/2016 00:00:00","BZN|DE-AT-LU","Without Sequence",26.27,"23/01/2016 23:00:00","2016-01-24T00:00","CET","2016-01-23T23:00"
"24/01/2016 00:00:00 - 24/01/2016 01:00:00","BZN|DE-AT-LU","Without Sequence",24.08,"24/01/2016 00:00:00","2016-01-24T01:00","CET","2016-01-24T00:00"
"24/01/2016 01:00:00 - 24/01/2016 02:00:00","BZN|DE-AT-LU","Without Sequence",23.99,"24/01/2016 01:00:00","2016-01-24T02:00","CET","2016-01-24T01:00"
"24/01/2016 02:00:00 - 24/01/2016 03:00:00","BZN|DE-AT-LU","Without Sequence",24.83,"24/01/2016 02:00:00","2016-01-24T03:00","CET","2016-01-24T02:00"
"24/01/2016 03:00:00 - 24/01/2016 04:00:00","BZN|DE-AT-LU","Without Sequence",23.24,"24/01/2016 03:00:00","2016-01-24T04:00","CET","2016-01-24T03:00"
"24/01/2016 04:00:00 - 24/01/2016 05:00:00","BZN|DE-AT-LU","Without Sequence",22.54,"24/01/2016 04:00:00","2016-01-24T05:00","CET","2016-01-24T04:00"
"24/01/2016 05:00:00 - 24/01/2016 06:00:00","BZN|DE-AT-LU","Without Sequence",23.41,"24/01/2016 05:00:00","2016-01-24T06:00","CET","2016-01-24T05:00"
"24/01/2016 06:00:00 - 24/01/2016 07:00:00","BZN|DE-AT-LU","Without Sequence",21.41,"24/01/2016 06:00:00","2016-01-24T07:00","CET","2016-01-24T06:00"
"24/01/2016 07:00:00 - 24/01/2016 08:00:00","BZN|DE-AT-LU","Without Sequence",21.4,"24/01/2016 07:00:00","2016-01-24T08:00","CET","2016-01-24T07:00"
"24/01/2016 08:00:00 - 24/01/2016 09:00:00","BZN|DE-AT-LU","Without Sequence",22.12,"24/01/2016 08:00:00","2016-01-24T09:00","CET","2016-01-24T08:00"
"24/01/2016 09:00:00 - 24/01/2016 10:00:00","BZN|DE-AT-LU","Without Sequence",24.63,"24/01/2016 09:00:00","2016-01-24T10:00","CET","2016-01-24T09:00"
"24/01/2016 10:00:00 - 24/01/2016 11:00:00","BZN|DE-AT-LU","Without Sequence",27.05,"24/01/2016 10:00:00","2016-01-24T11:00","CET","2016-01-24T10:00"
"24/01/2016 11:00:00 - 24/01/2016 12:00:00","BZN|DE-AT-LU","Without Sequence",32.66,"24/01/2016 11:00:00","2016-01-24T12:00","CET","2016-01-24T11:00"
"24/01/2016 12:00:00 - 24/01/2016 13:00:00","BZN|DE-AT-LU","Without Sequence",28.94,"24/01/2016 12:00:00","2016-01-24T13:00","CET","2016-01-24T12:00"
"24/01/2016 13:00:00 - 24/01/2016 14:00:00","BZN|DE-AT-LU","Without Sequence",26.04,"24/01/2016 13:00:00","2016-01-24T14:00","CET","2016-01-24T13:00"
"24/01/2016 14:00:00 - 24/01/2016 15:00:00","BZN|DE-AT-LU","Without Sequence",24.84,"24/01/2016 14:00:00","2016-01-24T15:00","CET","2016-01-24T14:00"
"24/01/2016 15:00:00 - 24/01/2016 16:00:00","BZN|DE-AT-LU","Without Sequence",23.99,"24/01/2016 15:00:00","2016-01-24T16:00","CET","2016-01-24T15:00"
"24/01/2016 16:00:00 - 24/01/2016 17:00:00","BZN|DE-AT-LU","Without Sequence",25.04,"24/01/2016 16:00:00","2016-01-24T17:00","CET","2016-01-24T16:00"
"24/01/2016 17:00:00 - 24/01/2016 18:00:00","BZN|DE-AT-LU","Without Sequence",32.88,"24/01/2016 17:00:00","2016-01-24T18:00","CET","2016-01-24T17:00"
"24/01/2016 18:00:00 - 24/01/2016 19:00:00","BZN|DE-AT-LU","Without Sequence",36.09,"24/01/2016 18:00:00","2016-01-24T19:00","CET","2016-01-24T18:00"
"24/01/2016 19:00:00 - 24/01/2016 20:00:00","BZN|DE-AT-LU","Without Sequence",35.87,"24/01/2016 19:00:00","2016-01-24T20:00","CET","2016-01-24T19:00"
"24/01/2016 20:00:00 - 24/01/2016 21:00:00","BZN|DE-AT-LU","Without Sequence",31.07,"24/01/2016 20:00:00","2016-01-24T21:00","CET","2016-01-24T20:00"
"24/01/2016 21:00:00 - 24/01/2016 22:00:00","BZN|DE-AT-LU","Without Sequence",26,"24/01/2016 21:00:00","2016-01-24T22:00","CET","2016-01-24T21:00"
"24/01/2016 22:00:00 - 24/01/2016 23:00:00","BZN|DE-AT-LU","Without Sequence",27.09,"24/01/2016 22:00:00","2016-01-24T23:00","CET","2016-01-24T22:00"
"24/01/2016 23:00:00 - 25/01/2016 00:00:00","BZN|DE-AT-LU","Without Sequence",27.09,"24/01/2016 23:00:00","2016-01-25T00:00","CET","2016-01-24T23:00"
"25/01/2016 00:00:00 - 25/01/2016 01:00:00","BZN|DE-AT-LU","Without Sequence",20.07,"25/01/2016 00:00:00","2016-01-25T01:00","CET","2016-01-25T00:00"
"25/01/2016 01:00:00 - 25/01/2016 02:00:00","BZN|DE-AT-LU","Without Sequence",19.65,"25/01/2016 01:00:00","2016-01-25T02:00","CET","2016-01-25T01:00"
"25/01/2016 02:00:00 - 25/01/2016 03:00:00","BZN|DE-AT-LU","Without Sequence",19.68,"25/01/2016 02:00:00","2016-01-25T03:00","CET","2016-01-25T02:00"
"25/01/2016 03:00:00 - 25/01/2016 04:00:00","BZN|DE-AT-LU","Without Sequence",19.98,"25/01/2016 03:00:00","2016-01-25T04:00","CET","2016-01-25T03:00"
"25/01/2016 04:00:00 - 25/01/2016 05:00:00","BZN|DE-AT-LU","Without Sequence",20.33,"25/01/2016 04:00:00","2016-01-25T05:00","CET","2016-01-25T04:00"
"25/01/2016 05:00:00 - 25/01/2016 06:00:00","BZN|DE-AT-LU","Without Sequence",21.32,"25/01/2016 05:00:00","2016-01-25T06:00","CET","2016-01-25T05:00"
"25/01/2016 06:00:00 - 25/01/2016 07:00:00","BZN|DE-AT-LU","Without Sequence",25.01,"25/01/2016 06:00:00","2016-01-25T07:00","CET","2016-01-25T06:00"
"25/01/2016 07:00:00 - 25/01/2016 08:00:00","BZN|DE-AT-LU","Without Sequence",34.94,"25/01/2016 07:00:00","2016-01-25T08:00","CET","2016-01-25T07:00"
"25/01/2016 08:00:00 - 25/01/2016 09:00:00","BZN|DE-AT-LU","Without Sequence",35,"25/01/2016 08:00:00","2016-01-25T09:00","CET","2016-01-25T08:00"
"25/01/2016 09:00:00 - 25/01/2016 10:00:00","BZN|DE-AT-LU","Without Sequence",36.04,"25/01/2016 09:00:00","2016-01-25T10:00","CET","2016-01-25T09:00"
"25/01/2016 10:00:00 - 25/01/2016 11:00:00","BZN|DE-AT-LU","Without Sequence",36.62,"25/01/2016 10:00:00","2016-01-25T11:00","CET","2016-01-25T10:00"
"25/01/2016 11:00:00 - 25/01/2016 12:00:00","BZN|DE-AT-LU","Without Sequence",35.6,"25/01/2016 11:00:00","2016-01-25T12:00","CET","2016-01-25T11:00"
"25/01/2016 12:00:00 - 25/01/2016 13:00:00","BZN|DE-AT-LU","Without Sequence",34.75,"25/01/2016 12:00:00","2016-01-25T13:00","CET","2016-01-25T12:00"
"25/01/2016 13:00:00 - 25/01/2016 14:00:00","BZN|DE-AT-LU","Without Sequence",32.26,"25/01/2016 13:00:00","2016-01-25T14:00","CET","2016-01-25T13:00"
"25/01/2016 14:00:00 - 25/01/2016 15:00:00","BZN|DE-AT-LU","Without Sequence",30.61,"25/01/2016 14:00:00","2016-01-25T15:00","CET","2016-01-25T14:00"
"25/01/2016 15:00:00 - 25/01/2016 16:00:00","BZN|DE-AT-LU","Without Sequence",29.73,"25/01/2016 15:00:00","2016-01-25T16:00","CET","2016-01-25T15:00"
"25/01/2016 16:00:00 - 25/01/2016 17:00:00","BZN|DE-AT-LU","Without Sequence",31.17,"25/01/2016 16:00:00","2016-01-25T17:00","CET","2016-01-25T16:00"
"25/01/2016 17:00:00 - 25/01/2016 18:00:00","BZN|DE-AT-LU","Without Sequence",34.96,"25/01/2016 17:00:00","2016-01-25T18:00","CET","2016-01-25T17:00"
"25/01/2016 18:00:00 - 25/01/2016 19:00:00","BZN|DE-AT-LU","Without Sequence",36.33,"25/01/2016 18:00:00","2016-01-25T19:00","CET","2016-01-25T18:00"
"25/01/2016 19:00:00 - 25/01/2016 20:00:00","BZN|DE-AT-LU","Without Sequence",31.96,"25/01/2016 19:00:00","2016-01-25T20:00","CET","2016-01-25T19:00"
"25/01/2016 20:00:00 - 25/01/2016 21:00:00","BZN|DE-AT-LU","Without Sequence",26.8,"25/01/2016 20:00:00","2016-01-25T21:00","CET","2016-01-25T20:00"
"25/01/2016 21:00:00 - 25/01/2016 22:00:00","BZN|DE-AT-LU","Without Sequence",25.32,"25/01/2016 21:00:00","2016-01-25T22:00","CET","2016-01-25T21:00"
"25/01/2016 22:00:00 - 25/01/2016 23:00:00","BZN|DE-AT-LU","Without Sequence",23.93,"25/01/2016 22:00:00","2016-01-25T23:00","CET","2016-01-25T22:00"
"25/01/2016 23:00:00 - 26/01/2016 00:00:00","BZN|DE-AT-LU","Without Sequence",23.93,"25/01/2016 23:00:00","2016-01-26T00:00","CET","2016-01-25T23:00"
"26/01/2016 00:00:00 - 26/01/2016 01:00:00","BZN|DE-AT-LU","Without Sequence",20.23,"26/01/2016 00:00:00","2016-01-26T01:00","CET","2016-01-26T00:00"
"26/01/2016 01:00:00 - 26/01/2016 02:00:00","BZN|DE-AT-LU","Without Sequence",18.02,"26/01/2016 01:00:00","2016-01-26T02:00","CET","2016-01-26T01:00"
"26/01/2016 02:00:00 - 26/01/2016 03:00:00","BZN|DE-AT-LU","Without Sequence",15.9,"26/01/2016 02:00:00","2016-01-26T03:00","CET","2016-01-26T02:00"
"26/01/2016 03:00:00 - 26/01/2016 04:00:00","BZN|DE-AT-LU","Without Sequence",15.91,"26/01/2016 03:00:00","2016-01-26T04:00","CET","2016-01-26T03:00"
"26/01/2016 04:00:00 - 26/01/2016 05:00:00","BZN|DE-AT-LU","Without Sequence",17.1,"26/01/2016 04:00:00","2016-01-26T05:00","CET","2016-01-26T04:00"
"26/01/2016 05:00:00 - 26/01/2016 06:00:00","BZN|DE-AT-LU","Without Sequence",21.8,"26/01/2016 05:00:00","2016-01-26T06:00","CET","2016-01-26T05:00"
"26/01/2016 06:00:00 - 26/01/2016 07:00:00","BZN|DE-AT-LU","Without Sequence",27.09,"26/01/2016 06:00:00","2016-01-26T07:00","CET","2016-01-26T06:00"
"26/01/2016 07:00:00 - 26/01/2016 08:00:00","BZN|DE-AT-LU","Without Sequence",34.13,"26/01/2016 07:00:00","2016-01-26T08:00","CET","2016-01-26T07:00"
"26/01/2016 08:00:00 - 26/01/2016 09:00:00","BZN|DE-AT-LU","Without Sequence",38.11,"26/01/2016 08:00:00","2016-01-26T09:00","CET","2016-01-26T08:00"
"26/01/2016 09:00:00 - 26/01/2016 10:00:00","BZN|DE-AT-LU","Without Sequence",32.31,"26/01/2016 09:00:00","2016-01-26T10:00","CET","2016-01-26T09:00"
"26/01/2016 10:00:00 - 26/01/2016 11:00:00","BZN|DE-AT-LU","Without Sequence",29.99,"26/01/2016 10:00:00","2016-01-26T11:00","CET","2016-01-26T10:00"
"26/01/2016 11:00:00 - 26/01/2016 12:00:00","BZN|DE-AT-LU","Without Sequence",29.55,"26/01/2016 11:00:00","2016-01-26T12:00","CET","2016-01-26T11:00"
"26/01/2016 12:00:00 - 26/01/2016 13:00:00","BZN|DE-AT-LU","Without Sequence",28.52,"26/01/2016 12:00:00","2016-01-26T13:00","CET","2016-01-26T12:00"
"26/01/2016 13:00:00 - 26/01/2016 14:00:00","BZN|DE-AT-LU","Without Sequence",29.33,"26/01/2016 13:00:00","2016-01-26T14:00","CET","2016-01-26T13:00"
"26/01/2016 14:00:00 - 26/01/2016 15:00:00","BZN|DE-AT-LU","Without Sequence",27.97,"26/01/2016 14:00:00","2016-01-26T15:00","CET","2016-01-26T14:00"
"26/01/2016 15:00:00 - 26/01/2016 16:00:00","BZN|DE-AT-LU","Without Sequence",30.09,"26/01/2016 15:00:00","2016-01-26T16:00","CET","2016-01-26T15:00"
"26/01/2016 16:00:00 - 26/01/2016 17:00:00","BZN|DE-AT-LU","Without Sequence",30.62,"26/01/2016 16:00:00","2016-01-26T17:00","CET","2016-01-26T16:00"
"26/01/2016 17:00:00 - 26/01/2016 18:00:00","BZN|DE-AT-LU","Without Sequence",32.87,"26/01/2016 17:00:00","2016-01-26T18:00","CET","2016-01-26T17:00"
"26/01/2016 18:00:00 - 26/01/2016 19:00:00","BZN|DE-AT-LU","Without Sequence",29.27,"26/01/2016 18:00:00","2016-01-26T19:00","CET","2016-01-26T18:00"
"26/01/2016 19:00:00 - 26/01/2016 20:00:00","BZN|DE-AT-LU","Without Sequence",24.94,"26/01/2016 19:00:00","2016-01-26T20:00","CET","2016-01-26T19:00"
"26/01/2016 20:00:00 - 26/01/2016 21:00:00","BZN|DE-AT-LU","Without Sequence",23.17,"26/01/2016 20:00:00","2016-01-26T21:00","CET","2016-01-26T20:00"
"26/01/2016 21:00:00 - 26/01/2016 22:00:00","BZN|DE-AT-LU","Without Sequence",21.66,"26/01/2016 21:00:00","2016-01-26T22:00","CET","2016-01-26T21:00"
"26/01/2016 22:00:00 - 26/01/2016 23:00:00","BZN|DE-AT-LU","Without Sequence",20.24,"26/01/2016 22:00:00","2016-01-26T23:00","CET","2016-01-26T22:00"
"26/01/2016 23:00:00 - 27/01/2016 00:00:00","BZN|DE-AT-LU","Without Sequence",20.24,"26/01/2016 23:00:00","2016-01-27T00:00","CET","2016-01-26T23:00"
"27/01/2016 00:00:00 - 27/01/2016 01:00:00","BZN|DE-AT-LU","Without Sequence",10.97,"27/01/2016 00:00:00","2016-01-27T01:00","CET","2016-01-27T00:00"
"27/01/2016 01:00:00 - 27/01/2016 02:00:00","BZN|DE-AT-LU","Without Sequence",3.18,"27/01/2016 01:00:00","2016-01-27T02:00","CET","2016-01-27T01:00"
"27/01/2016 02:00:00 - 27/01/2016 03:00:00","BZN|DE-AT-LU","Without Sequence",0.05,"27/01/2016 02:00:00","2016-01-27T03:00","CET","2016-01-27T02:00"
"27/01/2016 03:00:00 - 27/01/2016 04:00:00","BZN|DE-AT-LU","Without Sequence",0.13,"27/01/2016 03:00:00","2016-01-27T04:00","CET","2016-01-27T03:00"
"27/01/2016 04:00:00 - 27/01/2016 05:00:00","BZN|DE-AT-LU","Without Sequence",8.82,"27/01/2016 04:00:00","2016-01-27T05:00","CET","2016-01-27T04:00"
"27/01/2016 05:00:00 - 27/01/2016 06:00:00","BZN|DE-AT-LU","Without Sequence",13.3,"27/01/2016 05:00:00","2016-01-27T06:00","CET","2016-01-27T05:00"
"27/01/2016 06:00:00 - 27/01/2016 07:00:00","BZN|DE-AT-LU","Without Sequence",17.33,"27/01/2016 06:00:00","2016-01-27T07:00","CET","2016-01-27T06:00"
"27/01/2016 07:00:00 - 27/01/2016 08:00:00","BZN|DE-AT-LU","Without Sequence",22.97,"27/01/2016 07:00:00","2016-01-27T08:00","CET","2016-01-27T07:00"
"27/01/2016 08:00:00 - 27/01/2016 09:00:00","BZN|DE-AT-LU","Without Sequence",23.93,"27/01/2016 08:00:00","2016-01-27T09:00","CET","2016-01-27T08:00"
"27/01/2016 09:00:00 - 27/01/2016 10:00:00","BZN|DE-AT-LU","Without Sequence",28.95,"27/01/2016 09:00:00","2016-01-27T10:00","CET","2016-01-27T09:00"
"27/01/2016 10:00:00 - 27/01/2016 11:00:00","BZN|DE-AT-LU","Without Sequence",29.94,"27/01/2016 10:00:00","2016-01-27T11:00","CET","2016-01-27T10:00"
"27/01/2016 11:00:00 - 27/01/2016 12:00:00","BZN|DE-AT-LU","Without Sequence",25.55,"27/01/2016 11:00:00","2016-01-27T12:00","CET","2016-01-27T11:00"
"27/01/2016 12:00:00 - 27/01/2016 13:00:00","BZN|DE-AT-LU","Without Sequence",24.12,"27/01/2016 12:00:00","2016-01-27T13:00","CET","2016-01-27T12:00"
"27/01/2016 13:00:00 - 27/01/2016 14:00:00","BZN|DE-AT-LU","Without Sequence",22.95,"27/01/2016 13:00:00","2016-01-27T14:00","CET","2016-01-27T13:00"
"27/01/2016 14:00:00 - 27/01/2016 15:00:00","BZN|DE-AT-LU","Without Sequence",20.95,"27/01/2016 14:00:00","2016-01-27T15:00","CET","2016-01-27T14:00"
"27/01/2016 15:00:00 - 27/01/2016 16:00:00","BZN|DE-AT-LU","Without Sequence",23.91,"27/01/2016 15:00:00","2016-01-27T16:00","CET","2016-01-27T15:00"
"27/01/2016 16:00:00 - 27/01/2016 17:00:00","BZN|DE-AT-LU","Without Sequence",23.97,"27/01/2016 16:00:00","2016-01-27T17:00","CET","2016-01-27T16:00"
"27/01/2016 17:00:00 - 27/01/2016 18:00:00","BZN|DE-AT-LU","Without Sequence",28.93,"27/01/2016 17:00:00","2016-01-27T18:00","CET","2016-01-27T17:00"
"27/01/2016 18:00:00 - 27/01/2016 19:00:00","BZN|DE-AT-LU","Without Sequence",30.98,"27/01/2016 18:00:00","2016-01-27T19:00","CET","2016-01-27T18:00"
"27/01/2016 19:00:00 - 27/01/2016 20:00:00","BZN|DE-AT-LU","Without Sequence",29.07,"27/01/2016 19:00:00","2016-01-27T20:00","CET","2016-01-27T19:00"
"27/01/2016 20:00:00 - 27/01/2016 21:00:00","BZN|DE-AT-LU","Without Sequence",21.5,"27/01/2016 20:00:00","2016-01-27T21:00","CET","2016-01-27T20:00"
"27/01/2016 21:00:00 - 27/01/2016 22:00:00","BZN|DE-AT-LU","Without Sequence",19.06,"27/01/2016 21:00:00","2016-01-27T22:00","CET","2016-01-27T21:00"
"27/01/2016 22:00:00 - 27/01/2016 23:00:00","BZN|DE-AT-LU","Without Sequence",16.34,"27/01/2016 22:00:00","2016-01-27T23:00","CET","2016-01-27T22:00"
"27/01/2016 23:00:00 - 28/01/2016 00:00:00","BZN|DE-AT-LU","Without Sequence",16.34,"27/01/2016 23:00:00","2016-01-28T00:00","CET","2016-01-27T23:00"
"28/01/2016 00:00:00 - 28/01/2016 01:00:00","BZN|DE-AT-LU","Without Sequence",14.5,"28/01/2016 00:00:00","2016-01-28T01:00","CET","2016-01-28T00:00"
"28/01/2016 01:00:00 - 28/01/2016 02:00:00","BZN|DE-AT-LU","Without Sequence",12.83,"28/01/2016 01:00:00","2016-01-28T02:00","CET","2016-01-28T01:00"
"28/01/2016 02:00:00 - 28/01/2016 03:00:00","BZN|DE-AT-LU","Without Sequence",12.88,"28/01/2016 02:00:00","2016-01-28T03:00","CET","2016-01-28T02:00"
"28/01/2016 03:00:00 - 28/01/2016 04:00:00","BZN|DE-AT-LU","Without Sequence",12.14,"28/01/2016 03:00:00","2016-01-28T04:00","CET","2016-01-28T03:00"
"28/01/2016 04:00:00 - 28/01/2016 05:00:00","BZN|DE-AT-LU","Without Sequence",13.2,"28/01/2016 04:00:00","2016-01-28T05:00","CET","2016-01-28T04:00"
"28/01/2016 05:00:00 - 28/01/2016 06:00:00","BZN|DE-AT-LU","Without Sequence",17.39,"28/01/2016 05:00:00","2016-01-28T06:00","CET","2016-01-28T05:00"
"28/01/2016 06:00:00 - 28/01/2016 07:00:00","BZN|DE-AT-LU","Without Sequence",23.41,"28/01/2016 06:00:00","2016-01-28T07:00","CET","2016-01-28T06:00"
"28/01/2016 07:00:00 - 28/01/2016 08:00:00","BZN|DE-AT-LU","Without Sequence",28.49,"28/01/2016 07:00:00","2016-01-28T08:00","CET","2016-01-28T07:00"
"28/01/2016 08:00:00 - 28/01/2016 09:00:00","BZN|DE-AT-LU","Without Sequence",30.96,"28/01/2016 08:00:00","2016-01-28T09:00","CET","2016-01-28T08:00"
"28/01/2016 09:00:00 - 28/01/2016 10:00:00","BZN|DE-AT-LU","Without Sequence",29.97,"28/01/2016 09:00:00","2016-01-28T10:00","CET","2016-01-28T09:00"
"28/01/2016 10:00:00 - 28/01/2016 11:00:00","BZN|DE-AT-LU","Without Sequence",29.07,"28/01/2016 10:00:00","2016-01-28T11:00","CET","2016-01-28T10:00"
"28/01/2016 11:00:00 - 28/01/2016 12:00:00","BZN|DE-AT-LU","Without Sequence",25.21,"28/01/2016 11:00:00","2016-01-28T12:00","CET","2016-01-28T11:00"
"28/01/2016 12:00:00 - 28/01/2016 13:00:00","BZN|DE-AT-LU","Without Sequence",24.01,"28/01/2016 12:00:00","2016-01-28T13:00","CET","2016-01-28T12:00"
"28/01/2016 13:00:00 - 28/01/2016 14:00:00","BZN|DE-AT-LU","Without Sequence",25.56,"28/01/2016 13:00:00","2016-01-28T14:00","CET","2016-01-28T13:00"
"28/01/2016 14:00:00 - 28/01/2016 15:00:00","BZN|DE-AT-LU","Without Sequence",26.73,"28/01/2016 14:00:00","2016-01-28T15:00","CET","2016-01-28T14:00"
"28/01/2016 15:00:00 - 28/01/2016 16:00:00","BZN|DE-AT-LU","Without Sequence",31.02,"28/01/2016 15:00:00","2016-01-28T16:00","CET","2016-01-28T15:00"
"28/01/2016 16:00:00 - 28/01/2016 17:00:00","BZN|DE-AT-LU","Without Sequence",33.58,"28/01/2016 16:00:00","2016-01-28T17:00","CET","2016-01-28T16:00"
"28/01/2016 17:00:00 - 28/01/2016 18:00:00","BZN|DE-AT-LU","Without Sequence",39.05,"28/01/2016 17:00:00","2016-01-28T18:00","CET","2016-01-28T17:00"
