"MTU (CET/CEST)","Area","Sequence","Day-ahead Price (EUR/MWh)","MTU (CET/CEST) Start","MTU (CET/CEST) End","SummerIndicator","MTU (CET/CEST) End UTC"
"01/01/2018 00:00:00 - 01/01/2018 01:00:00","BZN|DE-AT-LU","Without Sequence",-5.27,"01/01/2018 00:00:00","2018-01-01T01:00","CET","2018-01-01T00:00"
"01/01/2018 01:00:00 - 01/01/2018 02:00:00","BZN|DE-AT-LU","Without Sequence",-29.99,"01/01/2018 01:00:00","2018-01-01T02:00","CET","2018-01-01T01:00"
"01/01/2018 02:00:00 - 01/01/2018 03:00:00","BZN|DE-AT-LU","Without Sequence",-56.65,"01/01/2018 02:00:00","2018-01-01T03:00","CET","2018-01-01T02:00"
"01/01/2018 03:00:00 - 01/01/2018 04:00:00","BZN|DE-AT-LU","Without Sequence",-63.14,"01/01/2018 03:00:00","2018-01-01T04:00","CET","2018-01-01T03:00"
"01/01/2018 04:00:00 - 01/01/2018 05:00:00","BZN|DE-AT-LU","Without Sequence",-64.62,"01/01/2018 04:00:00","2018-01-01T05:00","CET","2018-01-01T04:00"
"01/01/2018 05:00:00 - 01/01/2018 06:00:00","BZN|DE-AT-LU","Without Sequence",-67,"01/01/2018 05:00:00","2018-01-01T06:00","CET","2018-01-01T05:00"
"01/01/2018 06:00:00 - 01/01/2018 07:00:00","BZN|DE-AT-LU","Without Sequence",-72.54,"01/01/2018 06:00:00","2018-01-01T07:00","CET","2018-01-01T06:00"
"01/01/2018 07:00:00 - 01/01/2018 08:00:00","BZN|DE-AT-LU","Without Sequence",-76.01,"01/01/2018 07:00:00","2018-01-01T08:00","CET","2018-01-01T07:00"
"01/01/2018 08:00:00 - 01/01/2018 09:00:00","BZN|DE-AT-LU","Without Sequence",-71.45,"01/01/2018 08:00:00","2018-01-01T09:00","CET","2018-01-01T08:00"
"01/01/2018 09:00:00 - 01/01/2018 10:00:00","BZN|DE-AT-LU","Without Sequence",-66.88,"01/01/2018 09:00:00","2018-01-01T10:00","CET","2018-01-01T09:00"
"01/01/2018 10:00:00 - 01/01/2018 11:00:00","BZN|DE-AT-LU","Without Sequence",-62,"01/01/2018 10:00:00","2018-01-01T11:00","CET","2018-01-01T10:00"
"01/01/2018 11:00:00 - 01/01/2018 12:00:00","BZN|DE-AT-LU","Without Sequence",-56.08,"01/01/2018 11:00:00","2018-01-01T12:00","CET","2018-01-01T11:00"
"01/01/2018 12:00:00 - 01/01/2018 13:00:00","BZN|DE-AT-LU","Without Sequence",-49.96,"01/01/2018 12:00:00","2018-01-01T13:00","CET","2018-01-01T12:00"
"01/01/2018 13:00:00 - 01/01/2018 14:00:00","BZN|DE-AT-LU","Without Sequence",-24.29,"01/01/2018 13:00:00","2018-01-01T14:00","CET","2018-01-01T13:00"
"01/01/2018 14:00:00 - 01/01/2018 15:00:00","BZN|DE-AT-LU","Without Sequence",-5.59,"01/01/2018 14:00:00","2018-01-01T15:00","CET","2018-01-01T14:00"
"01/01/2018 15:00:00 - 01/01/2018 16:00:00","BZN|DE-AT-LU","Without Sequence",0.23,"01/01/2018 15:00:00","2018-01-01T16:00","CET","2018-01-01T15:00"
"01/01/2018 16:00:00 - 01/01/2018 17:00:00","BZN|DE-AT-LU","Without Sequence",11.02,"01/01/2018 16:00:00","2018-01-01T17:00","CET","2018-01-01T16:00"
"01/01/2018 17:00:00 - 01/01/2018 18:00:00","BZN|DE-AT-LU","Without Sequence",23.5,"01/01/2018 17:00:00","2018-01-01T18:00","CET","2018-01-01T17:00"
"01/01/2018 18:00:00 - 01/01/2018 19:00:00","BZN|DE-AT-LU","Without Sequence",22.91,"01/01/2018 18:00:00","2018-01-01T19:00","CET","2018-01-01T18:00"
"01/01/2018 19:00:00 - 01/01/2018 20:00:00","BZN|DE-AT-LU","Without Sequence",21.02,"01/01/2018 19:00:00","2018-01-01T20:00","CET","2018-01-01T19:00"
"01/01/2018 20:00:00 - 01/01/2018 21:00:00","BZN|DE-AT-LU","Without Sequence",21.05,"01/01/2018 20:00:00","2018-01-01T21:00","CET","2018-01-01T20:00"
"01/01/2018 21:00:00 - 01/01/2018 22:00:00","BZN|DE-AT-LU","Without Sequence",21.95,"01/01/2018 21:00:00","2018-01-01T22:00","CET","2018-01-01T21:00"
"01/01/2018 22:00:00 - 01/01/2018 23:00:00","BZN|DE-AT-LU","Without Sequence",23.52,"01/01/2018 22:00:00","2018-01-01T23:00","CET","2018-01-01T22:00"
"01/01/2018 23:00:00 - 02/01/2018 00:00:00","BZN|DE-AT-LU","Without Sequence",23.52,"01/01/2018 23:00:00","2018-01-02T00:00","CET","2018-01-01T23:00"
"02/01/2018 00:00:00 - 02/01/2018 01:00:00","BZN|DE-AT-LU","Without Sequence",18.12,"02/01/2018 00:00:00","2018-01-02T01:00","CET","2018-01-02T00:00"
"02/01/2018 01:00:00 - 02/01/2018 02:00:00","BZN|DE-AT-LU","Without Sequence",14.99,"02/01/2018 01:00:00","2018-01-02T02:00","CET","2018-01-02T01:00"
"02/01/2018 02:00:00 - 02/01/2018 03:00:00","BZN|DE-AT-LU","Without Sequence",13.63,"02/01/2018 02:00:00","2018-01-02T03:00","CET","2018-01-02T02:00"
"02/01/2018 03:00:00 - 02/01/2018 04:00:00","BZN|DE-AT-LU","Without Sequence",12.15,"02/01/2018 03:00:00","2018-01-02T04:00","CET","2018-01-02T03:00"
"02/01/2018 04:00:00 - 02/01/2018 05:00:00","BZN|DE-AT-LU","Without Sequence",11.83,"02/01/2018 04:00:00","2018-01-02T05:00","CET","2018-01-02T04:00"
"02/01/2018 05:00:00 - 02/01/2018 06:00:00","BZN|DE-AT-LU","Without Sequence",14.55,"02/01/2018 05:00:00","2018-01-02T06:00","CET","2018-01-02T05:00"
"02/01/2018 06:00:00 - 02/01/2018 07:00:00","BZN|DE-AT-LU","Without Sequence",22.58,"02/01/2018 06:00:00","2018-01-02T07:00","CET","2018-01-02T06:00"
"02/01/2018 07:00:00 - 02/01/2018 08:00:00","BZN|DE-AT-LU","Without Sequence",41.92,"02/01/2018 07:00:00","2018-01-02T08:00","CET","2018-01-02T07:00"
"02/01/2018 08:00:00 - 02/01/2018 09:00:00","BZN|DE-AT-LU","Without Sequence",47.95,"02/01/2018 08:00:00","2018-01-02T09:00","CET","2018-01-02T08:00"
"02/01/2018 09:00:00 - 02/01/2018 10:00:00","BZN|DE-AT-LU","Without Sequence",49.9,"02/01/2018 09:00:00","2018-01-02T10:00","CET","2018-01-02T09:00"
"02/01/2018 10:00:00 - 02/01/2018 11:00:00","BZN|DE-AT-LU","Without Sequence",50,"02/01/2018 10:00:00","2018-01-02T11:00","CET","2018-01-02T10:00"
"02/01/2018 11:00:00 - 02/01/2018 12:00:00","BZN|DE-AT-LU","Without Sequence",49.7,"02/01/2018 11:00:00","2018-01-02T12:00","CET","2018-01-02T11:00"
"02/01/2018 12:00:00 - 02/01/2018 13:00:00","BZN|DE-AT-LU","Without Sequence",48.16,"02/01/2018 12:00:00","2018-01-02T13:00","CET","2018-01-02T12:00"
"02/01/2018 13:00:00 - 02/01/2018 14:00:00","BZN|DE-AT-LU","Without Sequence",47.24,"02/01/2018 13:00:00","2018-01-02T14:00","CET","2018-01-02T13:00"
"02/01/2018 14:00:00 - 02/01/2018 15:00:00","BZN|DE-AT-LU","Without Sequence",46.1,"02/01/2018 14:00:00","2018-01-02T15:00","CET","2018-01-02T14:00"
"02/01/2018 15:00:00 - 02/01/2018 16:00:00","BZN|DE-AT-LU","Without Sequence",43.86,"02/01/2018 15:00:00","2018-01-02T16:00","CET","2018-01-02T15:00"
"02/01/2018 16:00:00 - 02/01/2018 17:00:00","BZN|DE-AT-LU","Without Sequence",43.64,"02/01/2018 16:00:00","2018-01-02T17:00","CET","2018-01-02T16:00"
"02/01/2018 17:00:00 - 02/01/2018 18:00:00","BZN|DE-AT-LU","Without Sequence",47.37,"02/01/2018 17:00:00","2018-01-02T18:00","CET","2018-01-02T17:00"
"02/01/2018 18:00:00 - 02/01/2018 19:00:00","BZN|DE-AT-LU","Without Sequence",46.08,"02/01/2018 18:00:00","2018-01-02T19:00","CET","2018-01-02T18:00"
"02/01/2018 19:00:00 - 02/01/2018 20:00:00","BZN|DE-AT-LU","Without Sequence",41.08,"02/01/2018 19:00:00","2018-01-02T20:00","CET","2018-01-02T19:00"
"02/01/2018 20:00:00 - 02/01/2018 21:00:00","BZN|DE-AT-LU","Without Sequence",34.94,"02/01/2018 20:00:00","2018-01-02T21:00","CET","2018-01-02T20:00"
"02/01/2018 21:00:00 - 02/01/2018 22:00:00","BZN|DE-AT-LU","Without Sequence",25.46,"02/01/2018 21:00:00","2018-01-02T22:00","CET","2018-01-02T21:00"
"02/01/2018 22:00:00 - 02/01/2018 23:00:00","BZN|DE-AT-LU","Without Sequence",21.3,"02/01/2018 22:00:00","2018-01-02T23:00","CET","2018-01-02T22:00"
"02/01/2018 23:00:00 - 03/01/2018 00:00:00","BZN|DE-AT-LU","Without Sequence",21.3,"02/01/2018 23:00:00","2018-01-03T00:00","CET","2018-01-02T23:00"
"03/01/2018 00:00:00 - 03/01/2018 01:00:00","BZN|DE-AT-LU","Without Sequence",7.93,"03/01/2018 00:00:00","2018-01-03T01:00","CET","2018-01-03T00:00"
"03/01/2018 01:00:00 - 03/01/2018 02:00:00","BZN|DE-AT-LU","Without Sequence",0.03,"03/01/2018 01:00:00","2018-01-03T02:00","CET","2018-01-03T01:00"
"03/01/2018 02:00:00 - 03/01/2018 03:00:00","BZN|DE-AT-LU","Without Sequence",0.02,"03/01/2018 02:00:00","2018-01-03T03:00","CET","2018-01-03T02:00"
"03/01/2018 03:00:00 - 03/01/2018 04:00:00","BZN|DE-AT-LU","Without Sequence",-5.99,"03/01/2018 03:00:00","2018-01-03T04:00","CET","2018-01-03T03:00"
"03/01/2018 04:00:00 - 03/01/2018 05:00:00","BZN|DE-AT-LU","Without Sequence",-9.21,"03/01/2018 04:00:00","2018-01-03T05:00","CET","2018-01-03T04:00"
"03/01/2018 05:00:00 - 03/01/2018 06:00:00","BZN|DE-AT-LU","Without Sequence",-4.64,"03/01/2018 05:00:00","2018-01-03T06:00","CET","2018-01-03T05:00"
"03/01/2018 06:00:00 - 03/01/2018 07:00:00","BZN|DE-AT-LU","Without Sequence",8.02,"03/01/2018 06:00:00","2018-01-03T07:00","CET","2018-01-03T06:00"
"03/01/2018 07:00:00 - 03/01/2018 08:00:00","BZN|DE-AT-LU","Without Sequence",11.03,"03/01/2018 07:00:00","2018-01-03T08:00","CET","2018-01-03T07:00"
"03/01/2018 08:00:00 - 03/01/2018 09:00:00","BZN|DE-AT-LU","Without Sequence",13.28,"03/01/2018 08:00:00","2018-01-03T09:00","CET","2018-01-03T08:00"
"03/01/2018 09:00:00 - 03/01/2018 10:00:00","BZN|DE-AT-LU","Without Sequence",13.18,"03/01/2018 09:00:00","2018-01-03T10:00","CET","2018-01-03T09:00"
"03/01/2018 10:00:00 - 03/01/2018 11:00:00","BZN|DE-AT-LU","Without Sequence",13.71,"03/01/2018 10:00:00","2018-01-03T11:00","CET","2018-01-03T10:00"
"03/01/2018 11:00:00 - 03/01/2018 12:00:00","BZN|DE-AT-LU","Without Sequence",15.42,"03/01/2018 11:00:00","2018-01-03T12:00","CET","2018-01-03T11:00"
"03/01/2018 12:00:00 - 03/01/2018 13:00:00","BZN|DE-AT-LU","Without Sequence",15.84,"03/01/2018 12:00:00","2018-01-03T13:00","CET","2018-01-03T12:00"
"03/01/2018 13:00:00 - 03/01/2018 14:00:00","BZN|DE-AT-LU","Without Sequence",16,"03/01/2018 13:00:00","2018-01-03T14:00","CET","2018-01-03T13:00"
"03/01/2018 14:00:00 - 03/01/2018 15:00:00","BZN|DE-AT-LU","Without Sequence",15.75,"03/01/2018 14:00:00","2018-01-03T15:00","CET","2018-01-03T14:00"
"03/01/2018 15:00:00 - 03/01/2018 16:00:00","BZN|DE-AT-LU","Without Sequence",15.14,"03/01/2018 15:00:00","2018-01-03T16:00","CET","2018-01-03T15:00"
"03/01/2018 16:00:00 - 03/01/2018 17:00:00","BZN|DE-AT-LU","Without Sequence",16,"03/01/2018 16:00:00","2018-01-03T17:00","CET","2018-01-03T16:00"
"03/01/2018 17:00:00 - 03/01/2018 18:00:00","BZN|DE-AT-LU","Without Sequence",15.11,"03/01/2018 17:00:00","2018-01-03T18:00","CET","2018-01-03T17:00"
"03/01/2018 18:00:00 - 03/01/2018 19:00:00","BZN|DE-AT-LU","Without Sequence",13.37,"03/01/2018 18:00:00","2018-01-03T19:00","CET","2018-01-03T18:00"
"03/01/2018 19:00:00 - 03/01/2018 20:00:00","BZN|DE-AT-LU","Without Sequence",11.06,"03/01/2018 19:00:00","2018-01-03T20:00","CET","2018-01-03T19:00"
"03/01/2018 20:00:00 - 03/01/2018 21:00:00","BZN|DE-AT-LU","Without Sequence",10.06,"03/01/2018 20:00:00","2018-01-03T21:00","CET","2018-01-03T20:00"
"03/01/2018 21:00:00 - 03/01/2018 22:00:00","BZN|DE-AT-LU","Without Sequence",9.3,"03/01/2018 21:00:00","2018-01-03T22:00","CET","2018-01-03T21:00"
"03/01/2018 22:00:00 - 03/01/2018 23:00:00","BZN|DE-AT-LU","Without Sequence",9.87,"03/01/2018 22:00:00","2018-01-03T23:00","CET","2018-01-03T22:00"
"03/01/2018 23:00:00 - 04/01/2018 00:00:00","BZN|DE-AT-LU","Without Sequence",9.87,"03/01/2018 23:00:00","2018-01-04T00:00","CET","2018-01-03T23:00"
"04/01/2018 00:00:00 - 04/01/2018 01:00:00","BZN|DE-AT-LU","Without Sequence",-0.36,"04/01/2018 00:00:00","2018-01-04T01:00","CET","2018-01-04T00:00"
"04/01/2018 01:00:00 - 04/01/2018 02:00:00","BZN|DE-AT-LU","Without Sequence",-5.57,"04/01/2018 01:00:00","2018-01-04T02:00","CET","2018-01-04T01:00"
"04/01/2018 02:00:00 - 04/01/2018 03:00:00","BZN|DE-AT-LU","Without Sequence",-7.85,"04/01/2018 02:00:00","2018-01-04T03:00","CET","2018-01-04T02:00"
"04/01/2018 03:00:00 - 04/01/2018 04:00:00","BZN|DE-AT-LU","Without Sequence",-5.29,"04/01/2018 03:00:00","2018-01-04T04:00","CET","2018-01-04T03:00"
"04/01/2018 04:00:00 - 04/01/2018 05:00:00","BZN|DE-AT-LU","Without Sequence",-1.75,"04/01/2018 04:00:00","2018-01-04T05:00","CET","2018-01-04T04:00"
"04/01/2018 05:00:00 - 04/01/2018 06:00:00","BZN|DE-AT-LU","Without Sequence",6.01,"04/01/2018 05:00:00","2018-01-04T06:00","CET","2018-01-04T05:00"
"04/01/2018 06:00:00 - 04/01/2018 07:00:00","BZN|DE-AT-LU","Without Sequence",19.96,"04/01/2018 06:00:00","2018-01-04T07:00","CET","2018-01-04T06:00"
"04/01/2018 07:00:00 - 04/01/2018 08:00:00","BZN|DE-AT-LU","Without Sequence",33.59,"04/01/2018 07:00:00","2018-01-04T08:00","CET","2018-01-04T07:00"
"04/01/2018 08:00:00 - 04/01/2018 09:00:00","BZN|DE-AT-LU","Without Sequence",40.45,"04/01/2018 08:00:00","2018-01-04T09:00","CET","2018-01-04T08:00"
"04/01/2018 09:00:00 - 04/01/2018 10:00:00","BZN|DE-AT-LU","Without Sequence",41.97,"04/01/2018 09:00:00","2018-01-04T10:00","CET","2018-01-04T09:00"
"04/01/2018 10:00:00 - 04/01/2018 11:00:00","BZN|DE-AT-LU","Without Sequence",44.91,"04/01/2018 10:00:00","2018-01-04T11:00","CET","2018-01-04T10:00"
"04/01/2018 11:00:00 - 04/01/2018 12:00:00","BZN|DE-AT-LU","Without Sequence",48.22,"04/01/2018 11:00:00","2018-01-04T12:00","CET","2018-01-04T11:00"
"04/01/2018 12:00:00 - 04/01/2018 13:00:00","BZN|DE-AT-LU","Without Sequence",46.04,"04/01/2018 12:00:00","2018-01-04T13:00","CET","2018-01-04T12:00"
"04/01/2018 13:00:00 - 04/01/2018 14:00:00","BZN|DE-AT-LU","Without Sequence",42,"04/01/2018 13:00:00","2018-01-04T14:00","CET","2018-01-04T13:00"
"04/01/2018 14:00:00 - 04/01/2018 15:00:00","BZN|DE-AT-LU","Without Sequence",41.08,"04/01/2018 14:00:00","2018-01-04T15:00","CET","2018-01-04T14:00"
"04/01/2018 15:00:00 - 04/01/2018 16:00:00","BZN|DE-AT-LU","Without Sequence",42.04,"04/01/2018 15:00:00","2018-01-04T16:00","CET","2018-01-04T15:00"
"04/01/2018 16:00:00 - 04/01/2018 17:00:00","BZN|DE-AT-LU","Without Sequence",42.53,"04/01/2018 16:00:00","2018-01-04T17:00","CET","2018-01-04T16:00"
"04/01/2018 17:00:00 - 04/01/2018 18:00:00","BZN|DE-AT-LU","Without Sequence",51.43,"04/01/2018 17:00:00","2018-01-04T18:00","CET","2018-01-04T17:00"
"04/01/2018 18:00:00 - 04/01/2018 19:00:00","BZN|DE-AT-LU","Without Sequence",49.96,"04/01/2018 18:00:00","2018-01-04T19:00","CET","2018-01-04T18:00"
"04/01/2018 19:00:00 - 04/01/2018 20:00:00","BZN|DE-AT-LU","Without Sequence",46.73,"04/01/2018 19:00:00","2018-01-04T20:00","CET","2018-01-04T19:00"
"04/01/2018 20:00:00 - 04/01/2018 21:00:00","BZN|DE-AT-LU","Without Sequence",41.57,"04/01/2018 20:00:00","2018-01-04T21:00","CET","2018-01-04T20:00"
"04/01/2018 21:00:00 - 04/01/2018 22:00:00","BZN|DE-AT-LU","Without Sequence",37.09,"04/01/2018 21:00:00","2018-01-04T22:00","CET","2018-01-04T21:00"
"04/01/2018 22:00:00 - 04/01/2018 23:00:00","BZN|DE-AT-LU","Without Sequence",33.92,"04/01/2018 22:00:00","2018-01-04T23:00","CET","2018-01-04T22:00"
"04/01/2018 23:00:00 - 05/01/2018 00:00:00","BZN|DE-AT-LU","Without Sequence",33.92,"04/01/2018 23:00:00","2018-01-05T00:00","CET","2018-01-04T23:00"
"05/01/2018 00:00:00 - 05/01/2018 01:00:00","BZN|DE-AT-LU","Without Sequence",5.96,"05/01/2018 00:00:00","2018-01-05T01:00","CET","2018-01-05T00:00"
"05/01/2018 01:00:00 - 05/01/2018 02:00:00","BZN|DE-AT-LU","Without Sequence",-0.94,"05/01/2018 01:00:00","2018-01-05T02:00","CET","2018-01-05T01:00"
"05/01/2018 02:00:00 - 05/01/2018 03:00:00","BZN|DE-AT-LU","Without Sequence",-0.03,"05/01/2018 02:00:00","2018-01-05T03:00","CET","2018-01-05T02:00"
"05/01/2018 03:00:00 - 05/01/2018 04:00:00","BZN|DE-AT-LU","Without Sequence",0.55,"05/01/2018 03:00:00","2018-01-05T04:00","CET","2018-01-05T03:00"
"05/01/2018 04:00:00 - 05/01/2018 05:00:00","BZN|DE-AT-LU","Without Sequence",-11.81,"05/01/2018 04:00:00","2018-01-05T05:00","CET","2018-01-05T04:00"
"05/01/2018 05:00:00 - 05/01/2018 06:00:00","BZN|DE-AT-LU","Without Sequence",8.92,"05/01/2018 05:00:00","2018-01-05T06:00","CET","2018-01-05T05:00"
"05/01/2018 06:00:00 - 05/01/2018 07:00:00","BZN|DE-AT-LU","Without Sequence",21.68,"05/01/2018 06:00:00","2018-01-05T07:00","CET","2018-01-05T06:00"
"05/01/2018 07:00:00 - 05/01/2018 08:00:00","BZN|DE-AT-LU","Without Sequence",30.44,"05/01/2018 07:00:00","2018-01-05T08:00","CET","2018-01-05T07:00"
"05/01/2018 08:00:00 - 05/01/2018 09:00:00","BZN|DE-AT-LU","Without Sequence",36.2,"05/01/2018 08:00:00","2018-01-05T09:00","CET","2018-01-05T08:00"
"05/01/2018 09:00:00 - 05/01/2018 10:00:00","BZN|DE-AT-LU","Without Sequence",36.3,"05/01/2018 09:00:00","2018-01-05T10:00","CET","2018-01-05T09:00"
"05/01/2018 10:00:00 - 05/01/2018 11:00:00","BZN|DE-AT-LU","Without Sequence",38.95,"05/01/2018 10:00:00","2018-01-05T11:00","CET","2018-01-05T10:00"
"05/01/2018 11:00:00 - 05/01/2018 12:00:00","BZN|DE-AT-LU","Without Sequence",39.4,"05/01/2018 11:00:00","2018-01-05T12:00","CET","2018-01-05T11:00"
"05/01/2018 12:00:00 - 05/01/2018 13:00:00","BZN|DE-AT-LU","Without Sequence",41.69,"05/01/2018 12:00:00","2018-01-05T13:00","CET","2018-01-05T12:00"
"05/01/2018 13:00:00 - 05/01/2018 14:00:00","BZN|DE-AT-LU","Without Sequence",43.69,"05/01/2018 13:00:00","2018-01-05T14:00","CET","2018-01-05T13:00"
"05/01/2018 14:00:00 - 05/01/2018 15:00:00","BZN|DE-AT-LU","Without Sequence",44.08,"05/01/2018 14:00:00","2018-01-05T15:00","CET","2018-01-05T14:00"
"05/01/2018 15:00:00 - 05/01/2018 16:00:00","BZN|DE-AT-LU","Without Sequence",47.1,"05/01/2018 15:00:00","2018-01-05T16:00","CET","2018-01-05T15:00"
"05/01/2018 16:00:00 - 05/01/2018 17:00:00","BZN|DE-AT-LU","Without Sequence",47.77,"05/01/2018 16:00:00","2018-01-05T17:00","CET","2018-01-05T16:00"
"05/01/2018 17:00:00 - 05/01/2018 18:00:00","BZN|DE-AT-LU","Without Sequence",56.35,"05/01/2018 17:00:00","2018-01-05T18:00","CET","2018-01-05T17:00"
"05/01/2018 18:00:00 - 05/01/2018 19:00:00","BZN|DE-AT-LU","Without Sequence",57.42,"05/01/2018 18:00:00","2018-01-05T19:00","CET","2018-01-05T18:00"
"05/01/2018 19:00:00 - 05/01/2018 20:00:00","BZN|DE-AT-LU","Without Sequence",53.99,"05/01/2018 19:00:00","2018-01-05T20:00","CET","2018-01-05T19:00"
"05/01/2018 20:00:00 - 05/01/2018 21:00:00","BZN|DE-AT-LU","Without Sequence",42.36,"05/01/2018 20:00:00","2018-01-05T21:00","CET","2018-01-05T20:00"
"05/01/2018 21:00:00 - 05/01/2018 22:00:00","BZN|DE-AT-LU","Without Sequence",39.9,"05/01/2018 21:00:00","2018-01-05T22:00","CET","2018-01-05T21:00"
"05/01/2018 22:00:00 - 05/01/2018 23:00:00","BZN|DE-AT-LU","Without Sequence",39.97,"05/01/2018 22:00:00","2018-01-05T23:00","CET","2018-01-05T22:00"
"05/01/2018 23:00:00 - 06/01/2018 00:00:00","BZN|DE-AT-LU","Without Sequence",39.97,"05/01/2018 23:00:00","2018-01-06T00:00","CET","2018-01-05T23:00"
"06/01/2018 00:00:00 - 06/01/2018 01:00:00","BZN|DE-AT-LU","Without Sequence",29.45,"06/01/2018 00:00:00","2018-01-06T01:00","CET","2018-01-06T00:00"
"06/01/2018 01:00:00 - 06/01/2018 02:00:00","BZN|DE-AT-LU","Without Sequence",28.55,"06/01/2018 01:00:00","2018-01-06T02:00","CET","2018-01-06T01:00"
"06/01/2018 02:00:00 - 06/01/2018 03:00:00","BZN|DE-AT-LU","Without Sequence",28.18,"06/01/2018 02:00:00","2018-01-06T03:00","CET","2018-01-06T02:00"
"06/01/2018 03:00:00 - 06/01/2018 04:00:00","BZN|DE-AT-LU","Without Sequence",27.33,"06/01/2018 03:00:00","2018-01-06T04:00","CET","2018-01-06T03:00"
"06/01/2018 04:00:00 - 06/01/2018 05:00:00","BZN|DE-AT-LU","Without Sequence",27.08,"06/01/2018 04:00:00","2018-01-06T05:00","CET","2018-01-06T04:00"
"06/01/2018 05:00:00 - 06/01/2018 06:00:00","BZN|DE-AT-LU","Without Sequence",28.7,"06/01/2018 05:00:00","2018-01-06T06:00","CET","2018-01-06T05:00"
"06/01/2018 06:00:00 - 06/01/2018 07:00:00","BZN|DE-AT-LU","Without Sequence",30,"06/01/2018 06:00:00","2018-01-06T07:00","CET","2018-01-06T06:00"
"06/01/2018 07:00:00 - 06/01/2018 08:00:00","BZN|DE-AT-LU","Without Sequence",31.36,"06/01/2018 07:00:00","2018-01-06T08:00","CET","2018-01-06T07:00"
"06/01/2018 08:00:00 - 06/01/2018 09:00:00","BZN|DE-AT-LU","Without Sequence",34.19,"06/01/2018 08:00:00","2018-01-06T09:00","CET","2018-01-06T08:00"
"06/01/2018 09:00:00 - 06/01/2018 10:00:00","BZN|DE-AT-LU","Without Sequence",41.11,"06/01/2018 09:00:00","2018-01-06T10:00","CET","2018-01-06T09:00"
"06/01/2018 10:00:00 - 06/01/2018 11:00:00","BZN|DE-AT-LU","Without Sequence",44,"06/01/2018 10:00:00","2018-01-06T11:00","CET","2018-01-06T10:00"
"06/01/2018 11:00:00 - 06/01/2018 12:00:00","BZN|DE-AT-LU","Without Sequence",43.74,"06/01/2018 11:00:00","2018-01-06T12:00","CET","2018-01-06T11:00"
"06/01/2018 12:00:00 - 06/01/2018 13:00:00","BZN|DE-AT-LU","Without Sequence",44.01,"06/01/2018 12:00:00","2018-01-06T13:00","CET","2018-01-06T12:00"
"06/01/2018 13:00:00 - 06/01/2018 14:00:00","BZN|DE-AT-LU","Without Sequence",42.9,"06/01/2018 13:00:00","2018-01-06T14:00","CET","2018-01-06T13:00"
"06/01/2018 14:00:00 - 06/01/2018 15:00:00","BZN|DE-AT-LU","Without Sequence",38.7,"06/01/2018 14:00:00","2018-01-06T15:00","CET","2018-01-06T14:00"
"06/01/2018 15:00:00 - 06/01/2018 16:00:00","BZN|DE-AT-LU","Without Sequence",37.4,"06/01/2018 15:00:00","2018-01-06T16:00","CET","2018-01-06T15:00"
"06/01/2018 16:00:00 - 06/01/2018 17:00:00","BZN|DE-AT-LU","Without Sequence",40.52,"06/01/2018 16:00:00","2018-01-06T17:00","CET","2018-01-06T16:00"
"06/01/2018 17:00:00 - 06/01/2018 18:00:00","BZN|DE-AT-LU","Without Sequence",45.46,"06/01/2018 17:00:00","2018-01-06T18:00","CET","2018-01-06T17:00"
"06/01/2018 18:00:00 - 06/01/2018 19:00:00","BZN|DE-AT-LU","Without Sequence",49.98,"06/01/2018 18:00:00","2018-01-06T19:00","CET","2018-01-06T18:00"
"06/01/2018 19:00:00 - 06/01/2018 20:00:00","BZN|DE-AT-LU","Without Sequence",45.9,"06/01/2018 19:00:00","2018-01-06T20:00","CET","2018-01-06T19:00"
"06/01/2018 20:00:00 - 06/01/2018 21:00:00","BZN|DE-AT-LU","Without Sequence",40.9,"06/01/2018 20:00:00","2018-01-06T21:00","CET","2018-01-06T20:00"
"06/01/2018 21:00:00 - 06/01/2018 22:00:00","BZN|DE-AT-LU","Without Sequence",33.69,"06/01/2018 21:00:00","2018-01-06T22:00","CET","2018-01-06T21:00"
"06/01/2018 22:00:00 - 06/01/2018 23:00:00","BZN|DE-AT-LU","Without Sequence",36.26,"06/01/2018 22:00:00","2018-01-06T23:00","CET","2018-01-06T22:00"
"06/01/2018 23:00:00 - 07/01/2018 00:00:00","BZN|DE-AT-LU","Without Sequence",36.26,"06/01/2018 23:00:00","2018-01-07T00:00","CET","2018-01-06T23:00"
"07/01/2018 00:00:00 - 07/01/2018 01:00:00","BZN|DE-AT-LU","Without Sequence",21.87,"07/01/2018 00:00:00","2018-01-07T01:00","CET","2018-01-07T00:00"
"07/01/2018 01:00:00 - 07/01/2018 02:00:00","BZN|DE-AT-LU","Without Sequence",15.98,"07/01/2018 01:00:00","2018-01-07T02:00","CET","2018-01-07T01:00"
"07/01/2018 02:00:00 - 07/01/2018 03:00:00","BZN|DE-AT-LU","Without Sequence",15.99,"07/01/2018 02:00:00","2018-01-07T03:00","CET","2018-01-07T02:00"
"07/01/2018 03:00:00 - 07/01/2018 04:00:00","BZN|DE-AT-LU","Without Sequence",14,"07/01/2018 03:00:00","2018-01-07T04:00","CET","2018-01-07T03:00"
"07/01/2018 04:00:00 - 07/01/2018 05:00:00","BZN|DE-AT-LU","Without Sequence",12.51,"07/01/2018 04:00:00","2018-01-07T05:00","CET","2018-01-07T04:00"
"07/01/2018 05:00:00 - 07/01/2018 06:00:00","BZN|DE-AT-LU","Without Sequence",13.21,"07/01/2018 05:00:00","2018-01-07T06:00","CET","2018-01-07T05:00"
"07/01/2018 06:00:00 - 07/01/2018 07:00:00","BZN|DE-AT-LU","Without Sequence",12.17,"07/01/2018 06:00:00","2018-01-07T07:00","CET","2018-01-07T06:00"
"07/01/2018 07:00:00 - 07/01/2018 08:00:00","BZN|DE-AT-LU","Without Sequence",13.02,"07/01/2018 07:00:00","2018-01-07T08:00","CET","2018-01-07T07:00"
"07/01/2018 08:00:00 - 07/01/2018 09:00:00","BZN|DE-AT-LU","Without Sequence",20.52,"07/01/2018 08:00:00","2018-01-07T09:00","CET","2018-01-07T08:00"
"07/01/2018 09:00:00 - 07/01/2018 10:00:00","BZN|DE-AT-LU","Without Sequence",23.22,"07/01/2018 09:00:00","2018-01-07T10:00","CET","2018-01-07T09:00"
"07/01/2018 10:00:00 - 07/01/2018 11:00:00","BZN|DE-AT-LU","Without Sequence",24.81,"07/01/2018 10:00:00","2018-01-07T11:00","CET","2018-01-07T10:00"
"07/01/2018 11:00:00 - 07/01/2018 12:00:00","BZN|DE-AT-LU","Without Sequence",28.95,"07/01/2018 11:00:00","2018-01-07T12:00","CET","2018-01-07T11:00"
"07/01/2018 12:00:00 - 07/01/2018 13:00:00","BZN|DE-AT-LU","Without Sequence",28.96,"07/01/2018 12:00:00","2018-01-07T13:00","CET","2018-01-07T12:00"
"07/01/2018 13:00:00 - 07/01/2018 14:00:00","BZN|DE-AT-LU","Without Sequence",27.08,"07/01/2018 13:00:00","2018-01-07T14:00","CET","2018-01-07T13:00"
"07/01/2018 14:00:00 - 07/01/2018 15:00:00","BZN|DE-AT-LU","Without Sequence",23.46,"07/01/2018 14:00:00","2018-01-07T15:00","CET","2018-01-07T14:00"
"07/01/2018 15:00:00 - 07/01/2018 16:00:00","BZN|DE-AT-LU","Without Sequence",23.7,"07/01/2018 15:00:00","2018-01-07T16:00","CET","2018-01-07T15:00"
"07/01/2018 16:00:00 - 07/01/2018 17:00:00","BZN|DE-AT-LU","Without Sequence",27.21,"07/01/2018 16:00:00","2018-01-07T17:00","CET","2018-01-07T16:00"
"07/01/2018 17:00:00 - 07/01/2018 18:00:00","BZN|DE-AT-LU","Without Sequence",30.88,"07/01/2018 17:00:00","2018-01-07T18:00","CET","2018-01-07T17:00"
"07/01/2018 18:00:00 - 07/01/2018 19:00:00","BZN|DE-AT-LU","Without Sequence",34.34,"07/01/2018 18:00:00","2018-01-07T19:00","CET","2018-01-07T18:00"
"07/01/2018 19:00:00 - 07/01/2018 20:00:00","BZN|DE-AT-LU","Without Sequence",32.33,"07/01/2018 19:00:00","2018-01-07T20:00","CET","2018-01-07T19:00"
"07/01/2018 20:00:00 - 07/01/2018 21:00:00","BZN|DE-AT-LU","Without Sequence",31.44,"07/01/2018 20:00:00","2018-01-07T21:00","CET","2018-01-07T20:00"
"07/01/2018 21:00:00 - 07/01/2018 22:00:00","BZN|DE-AT-LU","Without Sequence",28.94,"07/01/2018 21:00:00","2018-01-07T22:00","CET","2018-01-07T21:00"
"07/01/2018 22:00:00 - 07/01/2018 23:00:00","BZN|DE-AT-LU","Without Sequence",29.69,"07/01/2018 22:00:00","2018-01-07T23:00","CET","2018-01-07T22:00"
"07/01/2018 23:00:00 - 08/01/2018 00:00:00","BZN|DE-AT-LU","Without Sequence",29.69,"07/01/2018 23:00:00","2018-01-08T00:00","CET","2018-01-07T23:00"
"08/01/2018 00:00:00 - 08/01/2018 01:00:00","BZN|DE-AT-LU","Without Sequence",18.91,"08/01/2018 00:00:00","2018-01-08T01:00","CET","2018-01-08T00:00"
"08/01/2018 01:00:00 - 08/01/2018 02:00:00","BZN|DE-AT-LU","Without Sequence",15.15,"08/01/2018 01:00:00","2018-01-08T02:00","CET","2018-01-08T01:00"
"08/01/2018 02:00:00 - 08/01/2018 03:00:00","BZN|DE-AT-LU","Without Sequence",15.11,"08/01/2018 02:00:00","2018-01-08T03:00","CET","2018-01-08T02:00"
"08/01/2018 03:00:00 - 08/01/2018 04:00:00","BZN|DE-AT-LU","Without Sequence",13.42,"08/01/2018 03:00:00","2018-01-08T04:00","CET","2018-01-08T03:00"
"08/01/2018 04:00:00 - 08/01/2018 05:00:00","BZN|DE-AT-LU","Without Sequence",12.91,"08/01/2018 04:00:00","2018-01-08T05:00","CET","2018-01-08T04:00"
"08/01/2018 05:00:00 - 08/01/2018 06:00:00","BZN|DE-AT-LU","Without Sequence",17.1,"08/01/2018 05:00:00","2018-01-08T06:00","CET","2018-01-08T05:00"
"08/01/2018 06:00:00 - 08/01/2018 07:00:00","BZN|DE-AT-LU","Without Sequence",30.03,"08/01/2018 06:00:00","2018-01-08T07:00","CET","2018-01-08T06:00"
"08/01/2018 07:00:00 - 08/01/2018 08:00:00","BZN|DE-AT-LU","Without Sequence",42.93,"08/01/2018 07:00:00","2018-01-08T08:00","CET","2018-01-08T07:00"
"08/01/2018 08:00:00 - 08/01/2018 09:00:00","BZN|DE-AT-LU","Without Sequence",44.95,"08/01/2018 08:00:00","2018-01-08T09:00","CET","2018-01-08T08:00"
"08/01/2018 09:00:00 - 08/01/2018 10:00:00","BZN|DE-AT-LU","Without Sequence",42.57,"08/01/2018 09:00:00","2018-01-08T10:00","CET","2018-01-08T09:00"
"08/01/2018 10:00:00 - 08/01/2018 11:00:00","BZN|DE-AT-LU","Without Sequence",41.98,"08/01/2018 10:00:00","2018-01-08T11:00","CET","2018-01-08T10:00"
"08/01/2018 11:00:00 - 08/01/2018 12:00:00","BZN|DE-AT-LU","Without Sequence",41.54,"08/01/2018 11:00:00","2018-01-08T12:00","CET","2018-01-08T11:00"
"08/01/2018 12:00:00 - 08/01/2018 13:00:00","BZN|DE-AT-LU","Without Sequence",42.9,"08/01/2018 12:00:00","2018-01-08T13:00","CET","2018-01-08T12:00"
"08/01/2018 13:00:00 - 08/01/2018 14:00:00","BZN|DE-AT-LU","Without Sequence",42.9,"08/01/2018 13:00:00","2018-01-08T14:00","CET","2018-01-08T13:00"
"08/01/2018 14:00:00 - 08/01/2018 15:00:00","BZN|DE-AT-LU","Without Sequence",40.91,"08/01/2018 14:00:00","2018-01-08T15:00","CET","2018-01-08T14:00"
"08/01/2018 15:00:00 - 08/01/2018 16:00:00","BZN|DE-AT-LU","Without Sequence",40.97,"08/01/2018 15:00:00","2018-01-08T16:00","CET","2018-01-08T15:00"
"08/01/2018 16:00:00 - 08/01/2018 17:00:00","BZN|DE-AT-LU","Without Sequence",39.69,"08/01/2018 16:00:00","2018-01-08T17:00","CET","2018-01-08T16:00"
"08/01/2018 17:00:00 - 08/01/2018 18:00:00","BZN|DE-AT-LU","Without Sequence",40.26,"08/01/2018 17:00:00","2018-01-08T18:00","CET","2018-01-08T17:00"
"08/01/2018 18:00:00 - 08/01/2018 19:00:00","BZN|DE-AT-LU","Without Sequence",37.99,"08/01/2018 18:00:00","2018-01-08T19:00","CET","2018-01-08T18:00"
"08/01/2018 19:00:00 - 08/01/2018 20:00:00","BZN|DE-AT-LU","Without Sequence",31.92,"08/01/2018 19:00:00","2018-01-08T20:00","CET","2018-01-08T19:00"
"08/01/2018 20:00:00 - 08/01/2018 21:00:00","BZN|DE-AT-LU","Without Sequence",28.02,"08/01/2018 20:00:00","2018-01-08T21:00","CET","2018-01-08T20:00"
"08/01/2018 21:00:00 - 08/01/2018 22:00:00","BZN|DE-AT-LU","Without Sequence",22.35,"08/01/2018 21:00:00","2018-01-08T22:00","CET","2018-01-08T21:00"
"08/01/2018 22:00:00 - 08/01/2018 23:00:00","BZN|DE-AT-LU","Without Sequence",22.7,"08/01/2018 22:00:00","2018-01-08T23:00","CET","2018-01-08T22:00"
"08/01/2018 23:00:00 - 09/01/2018 00:00:00","BZN|DE-AT-LU","Without Sequence",22.7,"08/01/2018 23:00:00","2018-01-09T00:00","CET","2018-01-08T23:00"
"09/01/2018 00:00:00 - 09/01/2018 01:00:00","BZN|DE-AT-LU","Without Sequence",13.09,"09/01/2018 00:00:00","2018-01-09T01:00","CET","2018-01-09T00:00"
"09/01/2018 01:00:00 - 09/01/2018 02:00:00","BZN|DE-AT-LU","Without Sequence",12.62,"09/01/2018 01:00:00","2018-01-09T02:00","CET","2018-01-09T01:00"
"09/01/2018 02:00:00 - 09/01/2018 03:00:00","BZN|DE-AT-LU","Without Sequence",9.79,"09/01/2018 02:00:00","2018-01-09T03:00","CET","2018-01-09T02:00"
"09/01/2018 03:00:00 - 09/01/2018 04:00:00","BZN|DE-AT-LU","Without Sequence",4.99,"09/01/2018 03:00:00","2018-01-09T04:00","CET","2018-01-09T03:00"
"09/01/2018 04:00:00 - 09/01/2018 05:00:00","BZN|DE-AT-LU","Without Sequence",9.24,"09/01/2018 04:00:00","2018-01-09T05:00","CET","2018-01-09T04:00"
"09/01/2018 05:00:00 - 09/01/2018 06:00:00","BZN|DE-AT-LU","Without Sequence",14.66,"09/01/2018 05:00:00","2018-01-09T06:00","CET","2018-01-09T05:00"
"09/01/2018 06:00:00 - 09/01/2018 07:00:00","BZN|DE-AT-LU","Without Sequence",28.17,"09/01/2018 06:00:00","2018-01-09T07:00","CET","2018-01-09T06:00"
"09/01/2018 07:00:00 - 09/01/2018 08:00:00","BZN|DE-AT-LU","Without Sequence",32.36,"09/01/2018 07:00:00","2018-01-09T08:00","CET","2018-01-09T07:00"
"09/01/2018 08:00:00 - 09/01/2018 09:00:00","BZN|DE-AT-LU","Without Sequence",32.53,"09/01/2018 08:00:00","2018-01-09T09:00","CET","2018-01-09T08:00"
"09/01/2018 09:00:00 - 09/01/2018 10:00:00","BZN|DE-AT-LU","Without Sequence",32.38,"09/01/2018 09:00:00","2018-01-09T10:00","CET","2018-01-09T09:00"
"09/01/2018 10:00:00 - 09/01/2018 11:00:00","BZN|DE-AT-LU","Without Sequence",32.35,"09/01/2018 10:00:00","2018-01-09T11:00","CET","2018-01-09T10:00"
"09/01/2018 11:00:00 - 09/01/2018 12:00:00","BZN|DE-AT-LU","Without Sequence",34.04,"09/01/2018 11:00:00","2018-01-09T12:00","CET","2018-01-09T11:00"
"09/01/2018 12:00:00 - 09/01/2018 13:00:00","BZN|DE-AT-LU","Without Sequence",35.99,"09/01/2018 12:00:00","2018-01-09T13:00","CET","2018-01-09T12:00"
"09/01/2018 13:00:00 - 09/01/2018 14:00:00","BZN|DE-AT-LU","Without Sequence",39.58,"09/01/2018 13:00:00","2018-01-09T14:00","CET","2018-01-09T13:00"
"09/01/2018 14:00:00 - 09/01/2018 15:00:00","BZN|DE-AT-LU","Without Sequence",40.62,"09/01/2018 14:00:00","2018-01-09T15:00","CET","2018-01-09T14:00"
"09/01/2018 15:00:00 - 09/01/2018 16:00:00","BZN|DE-AT-LU","Without Sequence",40.98,"09/01/2018 15:00:00","2018-01-09T16:00","CET","2018-01-09T15:00"
"09/01/2018 16:00:00 - 09/01/2018 17:00:00","BZN|DE-AT-LU","Without Sequence",42.88,"09/01/2018 16:00:00","2018-01-09T17:00","CET","2018-01-09T16:00"
"09/01/2018 17:00:00 - 09/01/2018 18:00:00","BZN|DE-AT-LU","Without Sequence",44.06,"09/01/2018 17:00:00","2018-01-09T18:00","CET","2018-01-09T17:00"
"09/01/2018 18:00:00 - 09/01/2018 19:00:00","BZN|DE-AT-LU","Without Sequence",42.91,"09/01/2018 18:00:00","2018-01-09T19:00","CET","2018-01-09T18:00"
"09/01/2018 19:00:00 - 09/01/2018 20:00:00","BZN|DE-AT-LU","Without Sequence",40.98,"09/01/2018 19:00:00","2018-01-09T20:00","CET","2018-01-09T19:00"
"09/01/2018 20:00:00 - 09/01/2018 21:00:00","BZN|DE-AT-LU","Without Sequence",40.9,"09/01/2018 20:00:00","2018-01-09T21:00","CET","2018-01-09T20:00"
"09/01/2018 21:00:00 - 09/01/2018 22:00:00","BZN|DE-AT-LU","Without Sequence",38,"09/01/2018 21:00:00","2018-01-09T22:00","CET","2018-01-09T21:00"
"09/01/2018 22:00:00 - 09/01/2018 23:00:00","BZN|DE-AT-LU","Without Sequence",32.6,"09/01/2018 22:00:00","2018-01-09T23:00","CET","2018-01-09T22:00"
"09/01/2018 23:00:00 - 10/01/2018 00:00:00","BZN|DE-AT-LU","Without Sequence",32.6,"09/01/2018 23:00:00","2018-01-10T00:00","CET","2018-01-09T23:00"
"10/01/2018 00:00:00 - 10/01/2018 01:00:00","BZN|DE-AT-LU","Without Sequence",30,"10/01/2018 00:00:00","2018-01-10T01:00","CET","2018-01-10T00:00"
"10/01/2018 01:00:00 - 10/01/2018 02:00:00","BZN|DE-AT-LU","Without Sequence",28.3,"10/01/2018 01:00:00","2018-01-10T02:00","CET","2018-01-10T01:00"
"10/01/2018 02:00:00 - 10/01/2018 03:00:00","BZN|DE-AT-LU","Without Sequence",27.95,"10/01/2018 02:00:00","2018-01-10T03:00","CET","2018-01-10T02:00"
"10/01/2018 03:00:00 - 10/01/2018 04:00:00","BZN|DE-AT-LU","Without Sequence",26.91,"10/01/2018 03:00:00","2018-01-10T04:00","CET","2018-01-10T03:00"
"10/01/2018 04:00:00 - 10/01/2018 05:00:00","BZN|DE-AT-LU","Without Sequence",26.63,"10/01/2018 04:00:00","2018-01-10T05:00","CET","2018-01-10T04:00"
"10/01/2018 05:00:00 - 10/01/2018 06:00:00","BZN|DE-AT-LU","Without Sequence",30.91,"10/01/2018 05:00:00","2018-01-10T06:00","CET","2018-01-10T05:00"
"10/01/2018 06:00:00 - 10/01/2018 07:00:00","BZN|DE-AT-LU","Without Sequence",34.87,"10/01/2018 06:00:00","2018-01-10T07:00","CET","2018-01-10T06:00"
"10/01/2018 07:00:00 - 10/01/2018 08:00:00","BZN|DE-AT-LU","Without Sequence",45.09,"10/01/2018 07:00:00","2018-01-10T08:00","CET","2018-01-10T07:00"
"10/01/2018 08:00:00 - 10/01/2018 09:00:00","BZN|DE-AT-LU","Without Sequence",49.16,"10/01/2018 08:00:00","2018-01-10T09:00","CET","2018-01-10T08:00"
"10/01/2018 09:00:00 - 10/01/2018 10:00:00","BZN|DE-AT-LU","Without Sequence",48.94,"10/01/2018 09:00:00","2018-01-10T10:00","CET","2018-01-10T09:00"
"10/01/2018 10:00:00 - 10/01/2018 11:00:00","BZN|DE-AT-LU","Without Sequence",48.04,"10/01/2018 10:00:00","2018-01-10T11:00","CET","2018-01-10T10:00"
"10/01/2018 11:00:00 - 10/01/2018 12:00:00","BZN|DE-AT-LU","Without Sequence",47.78,"10/01/2018 11:00:00","2018-01-10T12:00","CET","2018-01-10T11:00"
"10/01/2018 12:00:00 - 10/01/2018 13:00:00","BZN|DE-AT-LU","Without Sequence",47.19,"10/01/2018 12:00:00","2018-01-10T13:00","CET","2018-01-10T12:00"
"10/01/2018 13:00:00 - 10/01/2018 14:00:00","BZN|DE-AT-LU","Without Sequence",45.24,"10/01/2018 13:00:00","2018-01-10T14:00","CET","2018-01-10T13:00"
"10/01/2018 14:00:00 - 10/01/2018 15:00:00","BZN|DE-AT-LU","Without Sequence",47.1,"10/01/2018 14:00:00","2018-01-10T15:00","CET","2018-01-10T14:00"
"10/01/2018 15:00:00 - 10/01/2018 16:00:00","BZN|DE-AT-LU","Without Sequence",47.98,"10/01/2018 15:00:00","2018-01-10T16:00","CET","2018-01-10T15:00"
"10/01/2018 16:00:00 - 10/01/2018 17:00:00","BZN|DE-AT-LU","Without Sequence",48.9,"10/01/2018 16:00:00","2018-01-10T17:00","CET","2018-01-10T16:00"
"10/01/2018 17:00:00 - 10/01/2018 18:00:00","BZN|DE-AT-LU","Without Sequence",51.9,"10/01/2018 17:00:00","2018-01-10T18:00","CET","2018-01-10T17:00"
"10/01/2018 18:00:00 - 10/01/2018 19:00:00","BZN|DE-AT-LU","Without Sequence",52.69,"10/01/2018 18:00:00","2018-01-10T19:00","CET","2018-01-10T18:00"
"10/01/2018 19:00:00 - 10/01/2018 20:00:00","BZN|DE-AT-LU","Without Sequence",49.1,"10/01/2018 19:00:00","2018-01-10T20:00","CET","2018-01-10T19:00"
"10/01/2018 20:00:00 - 10/01/2018 21:00:00","BZN|DE-AT-LU","Without Sequence",44,"10/01/2018 20:00:00","2018-01-10T21:00","CET","2018-01-10T20:00"
"10/01/2018 21:00:00 - 10/01/2018 22:00:00","BZN|DE-AT-LU","Without Sequence",36.99,"10/01/2018 21:00:00","2018-01-10T22:00","CET","2018-01-10T21:00"
"10/01/2018 22:00:00 - 10/01/2018 23:00:00","BZN|DE-AT-LU","Without Sequence",38.43,"10/01/2018 22:00:00","2018-01-10T23:00","CET","2018-01-10T22:00"
"10/01/2018 23:00:00 - 11/01/2018 00:00:00","BZN|DE-AT-LU","Without Sequence",38.43,"10/01/2018 23:00:00","2018-01-11T00:00","CET","2018-01-10T23:00"
"11/01/2018 00:00:00 - 11/01/2018 01:00:00","BZN|DE-AT-LU","Without Sequence",37.33,"11/01/2018 00:00:00","2018-01-11T01:00","CET","2018-01-11T00:00"
"11/01/2018 01:00:00 - 11/01/2018 02:00:00","BZN|DE-AT-LU","Without Sequence",36.3,"11/01/2018 01:00:00","2018-01-11T02:00","CET","2018-01-11T01:00"
"11/01/2018 02:00:00 - 11/01/2018 03:00:00","BZN|DE-AT-LU","Without Sequence",34.2,"11/01/2018 02:00:00","2018-01-11T03:00","CET","2018-01-11T02:00"
"11/01/2018 03:00:00 - 11/01/2018 04:00:00","BZN|DE-AT-LU","Without Sequence",33,"11/01/2018 03:00:00","2018-01-11T04:00","CET","2018-01-11T03:00"
"11/01/2018 04:00:00 - 11/01/2018 05:00:00","BZN|DE-AT-LU","Without Sequence",33.05,"11/01/2018 04:00:00","2018-01-11T05:00","CET","2018-01-11T04:00"
"11/01/2018 05:00:00 - 11/01/2018 06:00:00","BZN|DE-AT-LU","Without Sequence",37.09,"11/01/2018 05:00:00","2018-01-11T06:00","CET","2018-01-11T05:00"
"11/01/2018 06:00:00 - 11/01/2018 07:00:00","BZN|DE-AT-LU","Without Sequence",41.5,"11/01/2018 06:00:00","2018-01-11T07:00","CET","2018-01-11T06:00"
"11/01/2018 07:00:00 - 11/01/2018 08:00:00","BZN|DE-AT-LU","Without Sequence",53.07,"11/01/2018 07:00:00","2018-01-11T08:00","CET","2018-01-11T07:00"
"11/01/2018 08:00:00 - 11/01/2018 09:00:00","BZN|DE-AT-LU","Without Sequence",57.02,"11/01/2018 08:00:00","2018-01-11T09:00","CET","2018-01-11T08:00"
"11/01/2018 09:00:00 - 11/01/2018 10:00:00","BZN|DE-AT-LU","Without Sequence",55.91,"11/01/2018 09:00:00","2018-01-11T10:00","CET","2018-01-11T09:00"
"11/01/2018 10:00:00 - 11/01/2018 11:00:00","BZN|DE-AT-LU","Without Sequence",55.13,"11/01/2018 10:00:00","2018-01-11T11:00","CET","2018-01-11T10:00"
"11/01/2018 11:00:00 - 11/01/2018 12:00:00","BZN|DE-AT-LU","Without Sequence",55.91,"11/01/2018 11:00:00","2018-01-11T12:00","CET","2018-01-11T11:00"
"11/01/2018 12:00:00 - 11/01/2018 13:00:00","BZN|DE-AT-LU","Without Sequence",54.61,"11/01/2018 12:00:00","2018-01-11T13:00","CET","2018-01-11T12:00"
"11/01/2018 13:00:00 - 11/01/2018 14:00:00","BZN|DE-AT-LU","Without Sequence",54.83,"11/01/2018 13:00:00","2018-01-11T14:00","CET","2018-01-11T13:00"
"11/01/2018 14:00:00 - 11/01/2018 15:00:00","BZN|DE-AT-LU","Without Sequence",54.74,"11/01/2018 14:00:00","2018-01-11T15:00","CET","2018-01-11T14:00"
"11/01/2018 15:00:00 - 11/01/2018 16:00:00","BZN|DE-AT-LU","Without Sequence",54.01,"11/01/2018 15:00:00","2018-01-11T16:00","CET","2018-01-11T15:00"
"11/01/2018 16:00:00 - 11/01/2018 17:00:00","BZN|DE-AT-LU","Without Sequence",54.96,"11/01/2018 16:00:00","2018-01-11T17:00","CET","2018-01-11T16:00"
"11/01/2018 17:00:00 - 11/01/2018 18:00:00","BZN|DE-AT-LU","Without Sequence",57.04,"11/01/2018 17:00:00","2018-01-11T18:00","CET","2018-01-11T17:00"
"11/01/2018 18:00:00 - 11/01/2018 19:00:00","BZN|DE-AT-LU","Without Sequence",57.48,"11/01/2018 18:00:00","2018-01-11T19:00","CET","2018-01-11T18:00"
"11/01/2018 19:00:00 - 11/01/2018 20:00:00","BZN|DE-AT-LU","Without Sequence",54.9,"11/01/2018 19:00:00","2018-01-11T20:00","CET","2018-01-11T19:00"
"11/01/2018 20:00:00 - 11/01/2018 21:00:00","BZN|DE-AT-LU","Without Sequence",50,"11/01/2018 20:00:00","2018-01-11T21:00","CET","2018-01-11T20:00"
"11/01/2018 21:00:00 - 11/01/2018 22:00:00","BZN|DE-AT-LU","Without Sequence",43.13,"11/01/2018 21:00:00","2018-01-11T22:00","CET","2018-01-11T21:00"
"11/01/2018 22:00:00 - 11/01/2018 23:00:00","BZN|DE-AT-LU","Without Sequence",42.4,"11/01/2018 22:00:00","2018-01-11T23:00","CET","2018-01-11T22:00"
"11/01/2018 23:00:00 - 12/01/2018 00:00:00","BZN|DE-AT-LU","Without Sequence",42.4,"11/01/2018 23:00:00","2018-01-12T00:00","CET","2018-01-11T23:00"
"12/01/2018 00:00:00 - 12/01/2018 01:00:00","BZN|DE-AT-LU","Without Sequence",33.09,"12/01/2018 00:00:00","2018-01-12T01:00","CET","2018-01-12T00:00"
"12/01/2018 01:00:00 - 12/01/2018 02:00:00","BZN|DE-AT-LU","Without Sequence",33.45,"12/01/2018 01:00:00","2018-01-12T02:00","CET","2018-01-12T01:00"
"12/01/2018 02:00:00 - 12/01/2018 03:00:00","BZN|DE-AT-LU","Without Sequence",34,"12/01/2018 02:00:00","2018-01-12T03:00","CET","2018-01-12T02:00"
"12/01/2018 03:00:00 - 12/01/2018 04:00:00","BZN|DE-AT-LU","Without Sequence",33.08,"12/01/2018 03:00:00","2018-01-12T04:00","CET","2018-01-12T03:00"
"12/01/2018 04:00:00 - 12/01/2018 05:00:00","BZN|DE-AT-LU","Without Sequence",33.03,"12/01/2018 04:00:00","2018-01-12T05:00","CET","2018-01-12T04:00"
"12/01/2018 05:00:00 - 12/01/2018 06:00:00","BZN|DE-AT-LU","Without Sequence",35.1,"12/01/2018 05:00:00","2018-01-12T06:00","CET","2018-01-12T05:00"
"12/01/2018 06:00:00 - 12/01/2018 07:00:00","BZN|DE-AT-LU","Without Sequence",39.93,"12/01/2018 06:00:00","2018-01-12T07:00","CET","2018-01-12T06:00"
"12/01/2018 07:00:00 - 12/01/2018 08:00:00","BZN|DE-AT-LU","Without Sequence",48.5,"12/01/2018 07:00:00","2018-01-12T08:00","CET","2018-01-12T07:00"
"12/01/2018 08:00:00 - 12/01/2018 09:00:00","BZN|DE-AT-LU","Without Sequence",48.23,"12/01/2018 08:00:00","2018-01-12T09:00","CET","2018-01-12T08:00"
"12/01/2018 09:00:00 - 12/01/2018 10:00:00","BZN|DE-AT-LU","Without Sequence",45.99,"12/01/2018 09:00:00","2018-01-12T10:00","CET","2018-01-12T09:00"
"12/01/2018 10:00:00 - 12/01/2018 11:00:00","BZN|DE-AT-LU","Without Sequence",45.95,"12/01/2018 10:00:00","2018-01-12T11:00","CET","2018-01-12T10:00"
"12/01/2018 11:00:00 - 12/01/2018 12:00:00","BZN|DE-AT-LU","Without Sequence",46.91,"12/01/2018 11:00:00","2018-01-12T12:00","CET","2018-01-12T11:00"
"12/01/2018 12:00:00 - 12/01/2018 13:00:00","BZN|DE-AT-LU","Without Sequence",48.49,"12/01/2018 12:00:00","2018-01-12T13:00","CET","2018-01-12T12:00"
"12/01/2018 13:00:00 - 12/01/2018 14:00:00","BZN|DE-AT-LU","Without Sequence",48.45,"12/01/2018 13:00:00","2018-01-12T14:00","CET","2018-01-12T13:00"
"12/01/2018 14:00:00 - 12/01/2018 15:00:00","BZN|DE-AT-LU","Without Sequence",45.96,"12/01/2018 14:00:00","2018-01-12T15:00","CET","2018-01-12T14:00"
"12/01/2018 15:00:00 - 12/01/2018 16:00:00","BZN|DE-AT-LU","Without Sequence",45.92,"12/01/2018 15:00:00","2018-01-12T16:00","CET","2018-01-12T15:00"
"12/01/2018 16:00:00 - 12/01/2018 17:00:00","BZN|DE-AT-LU","Without Sequence",46.5,"12/01/2018 16:00:00","2018-01-12T17:00","CET","2018-01-12T16:00"
"12/01/2018 17:00:00 - 12/01/2018 18:00:00","BZN|DE-AT-LU","Without Sequence",50.52,"12/01/2018 17:00:00","2018-01-12T18:00","CET","2018-01-12T17:00"
"12/01/2018 18:00:00 - 12/01/2018 19:00:00","BZN|DE-AT-LU","Without Sequence",47,"12/01/2018 18:00:00","2018-01-12T19:00","CET","2018-01-12T18:00"
"12/01/2018 19:00:00 - 12/01/2018 20:00:00","BZN|DE-AT-LU","Without Sequence",44.91,"12/01/2018 19:00:00","2018-01-12T20:00","CET","2018-01-12T19:00"
"12/01/2018 20:00:00 - 12/01/2018 21:00:00","BZN|DE-AT-LU","Without Sequence",43.01,"12/01/2018 20:00:00","2018-01-12T21:00","CET","2018-01-12T20:00"
"12/01/2018 21:00:00 - 12/01/2018 22:00:00","BZN|DE-AT-LU","Without Sequence",38.79,"12/01/2018 21:00:00","2018-01-12T22:00","CET","2018-01-12T21:00"
"12/01/2018 22:00:00 - 12/01/2018 23:00:00","BZN|DE-AT-LU","Without Sequence",35.02,"12/01/2018 22:00:00","2018-01-12T23:00","CET","2018-01-12T22:00"
"12/01/2018 23:00:00 - 13/01/2018 00:00:00","BZN|DE-AT-LU","Without Sequence",35.02,"12/01/2018 23:00:00","2018-01-13T00:00","CET","2018-01-12T23:00"
"13/01/2018 00:00:00 - 13/01/2018 01:00:00","BZN|DE-AT-LU","Without Sequence",39.03,"13/01/2018 00:00:00","2018-01-13T01:00","CET","2018-01-13T00:00"
"13/01/2018 01:00:00 - 13/01/2018 02:00:00","BZN|DE-AT-LU","Without Sequence",30.97,"13/01/2018 01:00:00","2018-01-13T02:00","CET","2018-01-13T01:00"
"13/01/2018 02:00:00 - 13/01/2018 03:00:00","BZN|DE-AT-LU","Without Sequence",29.87,"13/01/2018 02:00:00","2018-01-13T03:00","CET","2018-01-13T02:00"
"13/01/2018 03:00:00 - 13/01/2018 04:00:00","BZN|DE-AT-LU","Without Sequence",28.93,"13/01/2018 03:00:00","2018-01-13T04:00","CET","2018-01-13T03:00"
"13/01/2018 04:00:00 - 13/01/2018 05:00:00","BZN|DE-AT-LU","Without Sequence",28.79,"13/01/2018 04:00:00","2018-01-13T05:00","CET","2018-01-13T04:00"
"13/01/2018 05:00:00 - 13/01/2018 06:00:00","BZN|DE-AT-LU","Without Sequence",28.98,"13/01/2018 05:00:00","2018-01-13T06:00","CET","2018-01-13T05:00"
"13/01/2018 06:00:00 - 13/01/2018 07:00:00","BZN|DE-AT-LU","Without Sequence",29.35,"13/01/2018 06:00:00","2018-01-13T07:00","CET","2018-01-13T06:00"
"13/01/2018 07:00:00 - 13/01/2018 08:00:00","BZN|DE-AT-LU","Without Sequence",31.43,"13/01/2018 07:00:00","2018-01-13T08:00","CET","2018-01-13T07:00"
"13/01/2018 08:00:00 - 13/01/2018 09:00:00","BZN|DE-AT-LU","Without Sequence",36.43,"13/01/2018 08:00:00","2018-01-13T09:00","CET","2018-01-13T08:00"
"13/01/2018 09:00:00 - 13/01/2018 10:00:00","BZN|DE-AT-LU","Without Sequence",39.92,"13/01/2018 09:00:00","2018-01-13T10:00","CET","2018-01-13T09:00"
"13/01/2018 10:00:00 - 13/01/2018 11:00:00","BZN|DE-AT-LU","Without Sequence",39.34,"13/01/2018 10:00:00","2018-01-13T11:00","CET","2018-01-13T10:00"
"13/01/2018 11:00:00 - 13/01/2018 12:00:00","BZN|DE-AT-LU","Without Sequence",40.96,"13/01/2018 11:00:00","2018-01-13T12:00","CET","2018-01-13T11:00"
"13/01/2018 12:00:00 - 13/01/2018 13:00:00","BZN|DE-AT-LU","Without Sequence",41.02,"13/01/2018 12:00:00","2018-01-13T13:00","CET","2018-01-13T12:00"
"13/01/2018 13:00:00 - 13/01/2018 14:00:00","BZN|DE-AT-LU","Without Sequence",38.81,"13/01/2018 13:00:00","2018-01-13T14:00","CET","2018-01-13T13:00"
"13/01/2018 14:00:00 - 13/01/2018 15:00:00","BZN|DE-AT-LU","Without Sequence",32.16,"13/01/2018 14:00:00","2018-01-13T15:00","CET","2018-01-13T14:00"
"13/01/2018 15:00:00 - 13/01/2018 16:00:00","BZN|DE-AT-LU","Without Sequence",31.88,"13/01/2018 15:00:00","2018-01-13T16:00","CET","2018-01-13T15:00"
"13/01/2018 16:00:00 - 13/01/2018 17:00:00","BZN|DE-AT-LU","Without Sequence",34.86,"13/01/2018 16:00:00","2018-01-13T17:00","CET","2018-01-13T16:00"
"13/01/2018 17:00:00 - 13/01/2018 18:00:00","BZN|DE-AT-LU","Without Sequence",38.9,"13/01/2018 17:00:00","2018-01-13T18:00","CET","2018-01-13T17:00"
"13/01/2018 18:00:00 - 13/01/2018 19:00:00","BZN|DE-AT-LU","Without Sequence",37.62,"13/01/2018 18:00:00","2018-01-13T19:00","CET","2018-01-13T18:00"
"13/01/2018 19:00:00 - 13/01/2018 20:00:00","BZN|DE-AT-LU","Without Sequence",32.86,"13/01/2018 19:00:00","2018-01-13T20:00","CET","2018-01-13T19:00"
"13/01/2018 20:00:00 - 13/01/2018 21:00:00","BZN|DE-AT-LU","Without Sequence",30.59,"13/01/2018 20:00:00","2018-01-13T21:00","CET","2018-01-13T20:00"
"13/01/2018 21:00:00 - 13/01/2018 22:00:00","BZN|DE-AT-LU","Without Sequence",29.8,"13/01/2018 21:00:00","2018-01-13T22:00","CET","2018-01-13T21:00"
"13/01/2018 22:00:00 - 13/01/2018 23:00:00","BZN|DE-AT-LU","Without Sequence",29.34,"13/01/2018 22:00:00","2018-01-13T23:00","CET","2018-01-13T22:00"
"13/01/2018 23:00:00 - 14/01/2018 00:00:00","BZN|DE-AT-LU","Without Sequence",29.34,"13/01/2018 23:00:00","2018-01-14T00:00","CET","2018-01-13T23:00"
"14/01/2018 00:00:00 - 14/01/2018 01:00:00","BZN|DE-AT-LU","Without Sequence",23.25,"14/01/2018 00:00:00","2018-01-14T01:00","CET","2018-01-14T00:00"
"14/01/2018 01:00:00 - 14/01/2018 02:00:00","BZN|DE-AT-LU","Without Sequence",22.82,"14/01/2018 01:00:00","2018-01-14T02:00","CET","2018-01-14T01:00"
"14/01/2018 02:00:00 - 14/01/2018 03:00:00","BZN|DE-AT-LU","Without Sequence",24.01,"14/01/2018 02:00:00","2018-01-14T03:00","CET","2018-01-14T02:00"
"14/01/2018 03:00:00 - 14/01/2018 04:00:00","BZN|DE-AT-LU","Without Sequence",22.37,"14/01/2018 03:00:00","2018-01-14T04:00","CET","2018-01-14T03:00"
"14/01/2018 04:00:00 - 14/01/2018 05:00:00","BZN|DE-AT-LU","Without Sequence",22.35,"14/01/2018 04:00:00","2018-01-14T05:00","CET","2018-01-14T04:00"
"14/01/2018 05:00:00 - 14/01/2018 06:00:00","BZN|DE-AT-LU","Without Sequence",21.66,"14/01/2018 05:00:00","2018-01-14T06:00","CET","2018-01-14T05:00"
"14/01/2018 06:00:00 - 14/01/2018 07:00:00","BZN|DE-AT-LU","Without Sequence",20.45,"14/01/2018 06:00:00","2018-01-14T07:00","CET","2018-01-14T06:00"
"14/01/2018 07:00:00 - 14/01/2018 08:00:00","BZN|DE-AT-LU","Without Sequence",22.02,"14/01/2018 07:00:00","2018-01-14T08:00","CET","2018-01-14T07:00"
"14/01/2018 08:00:00 - 14/01/2018 09:00:00","BZN|DE-AT-LU","Without Sequence",28.09,"14/01/2018 08:00:00","2018-01-14T09:00","CET","2018-01-14T08:00"
"14/01/2018 09:00:00 - 14/01/2018 10:00:00","BZN|DE-AT-LU","Without Sequence",29.41,"14/01/2018 09:00:00","2018-01-14T10:00","CET","2018-01-14T09:00"
"14/01/2018 10:00:00 - 14/01/2018 11:00:00","BZN|DE-AT-LU","Without Sequence",29.74,"14/01/2018 10:00:00","2018-01-14T11:00","CET","2018-01-14T10:00"
"14/01/2018 11:00:00 - 14/01/2018 12:00:00","BZN|DE-AT-LU","Without Sequence",30.13,"14/01/2018 11:00:00","2018-01-14T12:00","CET","2018-01-14T11:00"
"14/01/2018 12:00:00 - 14/01/2018 13:00:00","BZN|DE-AT-LU","Without Sequence",29.81,"14/01/2018 12:00:00","2018-01-14T13:00","CET","2018-01-14T12:00"
"14/01/2018 13:00:00 - 14/01/2018 14:00:00","BZN|DE-AT-LU","Without Sequence",29.44,"14/01/2018 13:00:00","2018-01-14T14:00","CET","2018-01-14T13:00"
"14/01/2018 14:00:00 - 14/01/2018 15:00:00","BZN|DE-AT-LU","Without Sequence",29.94,"14/01/2018 14:00:00","2018-01-14T15:00","CET","2018-01-14T14:00"
"14/01/2018 15:00:00 - 14/01/2018 16:00:00","BZN|DE-AT-LU","Without Sequence",32.09,"14/01/2018 15:00:00","2018-01-14T16:00","CET","2018-01-14T15:00"
"14/01/2018 16:00:00 - 14/01/2018 17:00:00","BZN|DE-AT-LU","Without Sequence",34.8,"14/01/2018 16:00:00","2018-01-14T17:00","CET","2018-01-14T16:00"
"14/01/2018 17:00:00 - 14/01/2018 18:00:00","BZN|DE-AT-LU","Without Sequence",37.99,"14/01/2018 17:00:00","2018-01-14T18:00","CET","2018-01-14T17:00"
"14/01/2018 18:00:00 - 14/01/2018 19:00:00","BZN|DE-AT-LU","Without Sequence",37.22,"14/01/2018 18:00:00","2018-01-14T19:00","CET","2018-01-14T18:00"
"14/01/2018 19:00:00 - 14/01/2018 20:00:00","BZN|DE-AT-LU","Without Sequence",34.72,"14/01/2018 19:00:00","2018-01-14T20:00","CET","2018-01-14T19:00"
"14/01/2018 20:00:00 - 14/01/2018 21:00:00","BZN|DE-AT-LU","Without Sequence",32.65,"14/01/2018 20:00:00","2018-01-14T21:00","CET","2018-01-14T20:00"
"14/01/2018 21:00:00 - 14/01/2018 22:00:00","BZN|DE-AT-LU","Without Sequence",30.42,"14/01/2018 21:00:00","2018-01-14T22:00","CET","2018-01-14T21:00"
"14/01/2018 22:00:00 - 14/01/2018 23:00:00","BZN|DE-AT-LU","Without Sequence",32.51,"14/01/2018 22:00:00","2018-01-14T23:00","CET","2018-01-14T22:00"
"14/01/2018 23:00:00 - 15/01/2018 00:00:00","BZN|DE-AT-LU","Without Sequence",32.51,"14/01/2018 23:00:00","2018-01-15T00:00","CET","2018-01-14T23:00"
"15/01/2018 00:00:00 - 15/01/2018 01:00:00","BZN|DE-AT-LU","Without Sequence",23.15,"15/01/2018 00:00:00","2018-01-15T01:00","CET","2018-01-15T00:00"
"15/01/2018 01:00:00 - 15/01/2018 02:00:00","BZN|DE-AT-LU","Without Sequence",24.02,"15/01/2018 01:00:00","2018-01-15T02:00","CET","2018-01-15T01:00"
"15/01/2018 02:00:00 - 15/01/2018 03:00:00","BZN|DE-AT-LU","Without Sequence",23.1,"15/01/2018 02:00:00","2018-01-15T03:00","CET","2018-01-15T02:00"
"15/01/2018 03:00:00 - 15/01/2018 04:00:00","BZN|DE-AT-LU","Without Sequence",20.29,"15/01/2018 03:00:00","2018-01-15T04:00","CET","2018-01-15T03:00"
"15/01/2018 04:00:00 - 15/01/2018 05:00:00","BZN|DE-AT-LU","Without Sequence",22.81,"15/01/2018 04:00:00","2018-01-15T05:00","CET","2018-01-15T04:00"
"15/01/2018 05:00:00 - 15/01/2018 06:00:00","BZN|DE-AT-LU","Without Sequence",25.17,"15/01/2018 05:00:00","2018-01-15T06:00","CET","2018-01-15T05:00"
"15/01/2018 06:00:00 - 15/01/2018 07:00:00","BZN|DE-AT-LU","Without Sequence",40.7,"15/01/2018 06:00:00","2018-01-15T07:00","CET","2018-01-15T06:00"
"15/01/2018 07:00:00 - 15/01/2018 08:00:00","BZN|DE-AT-LU","Without Sequence",49.91,"15/01/2018 07:00:00","2018-01-15T08:00","CET","2018-01-15T07:00"
"15/01/2018 08:00:00 - 15/01/2018 09:00:00","BZN|DE-AT-LU","Without Sequence",52.73,"15/01/2018 08:00:00","2018-01-15T09:00","CET","2018-01-15T08:00"
"15/01/2018 09:00:00 - 15/01/2018 10:00:00","BZN|DE-AT-LU","Without Sequence",43.7,"15/01/2018 09:00:00","2018-01-15T10:00","CET","2018-01-15T09:00"
"15/01/2018 10:00:00 - 15/01/2018 11:00:00","BZN|DE-AT-LU","Without Sequence",32.32,"15/01/2018 10:00:00","2018-01-15T11:00","CET","2018-01-15T10:00"
"15/01/2018 11:00:00 - 15/01/2018 12:00:00","BZN|DE-AT-LU","Without Sequence",30.3,"15/01/2018 11:00:00","2018-01-15T12:00","CET","2018-01-15T11:00"
"15/01/2018 12:00:00 - 15/01/2018 13:00:00","BZN|DE-AT-LU","Without Sequence",29.43,"15/01/2018 12:00:00","2018-01-15T13:00","CET","2018-01-15T12:00"
"15/01/2018 13:00:00 - 15/01/2018 14:00:00","BZN|DE-AT-LU","Without Sequence",29.29,"15/01/2018 13:00:00","2018-01-15T14:00","CET","2018-01-15T13:00"
"15/01/2018 14:00:00 - 15/01/2018 15:00:00","BZN|DE-AT-LU","Without Sequence",29.42,"15/01/2018 14:00:00","2018-01-15T15:00","CET","2018-01-15T14:00"
"15/01/2018 15:00:00 - 15/01/2018 16:00:00","BZN|DE-AT-LU","Without Sequence",28.08,"15/01/2018 15:00:00","2018-01-15T16:00","CET","2018-01-15T15:00"
"15/01/2018 16:00:00 - 15/01/2018 17:00:00","BZN|DE-AT-LU","Without Sequence",24.1,"15/01/2018 16:00:00","2018-01-15T17:00","CET","2018-01-15T16:00"
"15/01/2018 17:00:00 - 15/01/2018 18:00:00","BZN|DE-AT-LU","Without Sequence",30.01,"15/01/2018 17:00:00","2018-01-15T18:00","CET","2018-01-15T17:00"
"15/01/2018 18:00:00 - 15/01/2018 19:00:00","BZN|DE-AT-LU","Without Sequence",28.04,"15/01/2018 18:00:00","2018-01-15T19:00","CET","2018-01-15T18:00"
"15/01/2018 19:00:00 - 15/01/2018 20:00:00","BZN|DE-AT-LU","Without Sequence",18.08,"15/01/2018 19:00:00","2018-01-15T20:00","CET","2018-01-15T19:00"
"15/01/2018 20:00:00 - 15/01/2018 21:00:00","BZN|DE-AT-LU","Without Sequence",13.59,"15/01/2018 20:00:00","2018-01-15T21:00","CET","2018-01-15T20:00"
"15/01/2018 21:00:00 - 15/01/2018 22:00:00","BZN|DE-AT-LU","Without Sequence",10.69,"15/01/2018 21:00:00","2018-01-15T22:00","CET","2018-01-15T21:00"
"15/01/2018 22:00:00 - 15/01/2018 23:00:00","BZN|DE-AT-LU","Without Sequence",10.01,"15/01/2018 22:00:00","2018-01-15T23:00","CET","2018-01-15T22:00"
"15/01/2018 23:00:00 - 16/01/2018 00:00:00","BZN|DE-AT-LU","Without Sequence",10.01,"15/01/2018 23:00:00","2018-01-16T00:00","CET","2018-01-15T23:00"
"16/01/2018 00:00:00 - 16/01/2018 01:00:00","BZN|DE-AT-LU","Without Sequence",-9.61,"16/01/2018 00:00:00","2018-01-16T01:00","CET","2018-01-16T00:00"
"16/01/2018 01:00:00 - 16/01/2018 02:00:00","BZN|DE-AT-LU","Without Sequence",-6.62,"16/01/2018 01:00:00","2018-01-16T02:00","CET","2018-01-16T01:00"
"16/01/2018 02:00:00 - 16/01/2018 03:00:00","BZN|DE-AT-LU","Without Sequence",-2.33,"16/01/2018 02:00:00","2018-01-16T03:00","CET","2018-01-16T02:00"
"16/01/2018 03:00:00 - 16/01/2018 04:00:00","BZN|DE-AT-LU","Without Sequence",-4.92,"16/01/2018 03:00:00","2018-01-16T04:00","CET","2018-01-16T03:00"
"16/01/2018 04:00:00 - 16/01/2018 05:00:00","BZN|DE-AT-LU","Without Sequence",-0.08,"16/01/2018 04:00:00","2018-01-16T05:00","CET","2018-01-16T04:00"
"16/01/2018 05:00:00 - 16/01/2018 06:00:00","BZN|DE-AT-LU","Without Sequence",10.59,"16/01/2018 05:00:00","2018-01-16T06:00","CET","2018-01-16T05:00"
"16/01/2018 06:00:00 - 16/01/2018 07:00:00","BZN|DE-AT-LU","Without Sequence",27.72,"16/01/2018 06:00:00","2018-01-16T07:00","CET","2018-01-16T06:00"
"16/01/2018 07:00:00 - 16/01/2018 08:00:00","BZN|DE-AT-LU","Without Sequence",38.92,"16/01/2018 07:00:00","2018-01-16T08:00","CET","2018-01-16T07:00"
"16/01/2018 08:00:00 - 16/01/2018 09:00:00","BZN|DE-AT-LU","Without Sequence",42.13,"16/01/2018 08:00:00","2018-01-16T09:00","CET","2018-01-16T08:00"
"16/01/2018 09:00:00 - 16/01/2018 10:00:00","BZN|DE-AT-LU","Without Sequence",39.27,"16/01/2018 09:00:00","2018-01-16T10:00","CET","2018-01-16T09:00"
"16/01/2018 10:00:00 - 16/01/2018 11:00:00","BZN|DE-AT-LU","Without Sequence",40.68,"16/01/2018 10:00:00","2018-01-16T11:00","CET","2018-01-16T10:00"
"16/01/2018 11:00:00 - 16/01/2018 12:00:00","BZN|DE-AT-LU","Without Sequence",37.99,"16/01/2018 11:00:00","2018-01-16T12:00","CET","2018-01-16T11:00"
"16/01/2018 12:00:00 - 16/01/2018 13:00:00","BZN|DE-AT-LU","Without Sequence",37.56,"16/01/2018 12:00:00","2018-01-16T13:00","CET","2018-01-16T12:00"
"16/01/2018 13:00:00 - 16/01/2018 14:00:00","BZN|DE-AT-LU","Without Sequence",36.92,"16/01/2018 13:00:00","2018-01-16T14:00","CET","2018-01-16T13:00"
"16/01/2018 14:00:00 - 16/01/2018 15:00:00","BZN|DE-AT-LU","Without Sequence",36.06,"16/01/2018 14:00:00","2018-01-16T15:00","CET","2018-01-16T14:00"
"16/01/2018 15:00:00 - 16/01/2018 16:00:00","BZN|DE-AT-LU","Without Sequence",34.61,"16/01/2018 15:00:00","2018-01-16T16:00","CET","2018-01-16T15:00"
"16/01/2018 16:00:00 - 16/01/2018 17:00:00","BZN|DE-AT-LU","Without Sequence",36.94,"16/01/2018 16:00:00","2018-01-16T17:00","CET","2018-01-16T16:00"
"16/01/2018 17:00:00 - 16/01/2018 18:00:00","BZN|DE-AT-LU","Without Sequence",43.21,"16/01/2018 17:00:00","2018-01-16T18:00","CET","2018-01-16T17:00"
"16/01/2018 18:00:00 - 16/01/2018 19:00:00","BZN|DE-AT-LU","Without Sequence",45.43,"16/01/2018 18:00:00","2018-01-16T19:00","CET","2018-01-16T18:00"
"16/01/2018 19:00:00 - 16/01/2018 20:00:00","BZN|DE-AT-LU","Without Sequence",43.45,"16/01/2018 19:00:00","2018-01-16T20:00","CET","2018-01-16T19:00"
"16/01/2018 20:00:00 - 16/01/2018 21:00:00","BZN|DE-AT-LU","Without Sequence",39.9,"16/01/2018 20:00:00","2018-01-16T21:00","CET","2018-01-16T20:00"
"16/01/2018 21:00:00 - 16/01/2018 22:00:00","BZN|DE-AT-LU","Without Sequence",30.72,"16/01/2018 21:00:00","2018-01-16T22:00","CET","2018-01-16T21:00"
"16/01/2018 22:00:00 - 16/01/2018 23:00:00","BZN|DE-AT-LU","Without Sequence",30.1,"16/01/2018 22:00:00","2018-01-16T23:00","CET","2018-01-16T22:00"
"16/01/2018 23:00:00 - 17/01/2018 00:00:00","BZN|DE-AT-LU","Without Sequence",30.1,"16/01/2018 23:00:00","2018-01-17T00:00","CET","2018-01-16T23:00"
"17/01/2018 00:00:00 - 17/01/2018 01:00:00","BZN|DE-AT-LU","Without Sequence",22.08,"17/01/2018 00:00:00","2018-01-17T01:00","CET","2018-01-17T00:00"
"17/01/2018 01:00:00 - 17/01/2018 02:00:00","BZN|DE-AT-LU","Without Sequence",14.82,"17/01/2018 01:00:00","2018-01-17T02:00","CET","2018-01-17T01:00"
"17/01/2018 02:00:00 - 17/01/2018 03:00:00","BZN|DE-AT-LU","Without Sequence",13.49,"17/01/2018 02:00:00","2018-01-17T03:00","CET","2018-01-17T02:00"
"17/01/2018 03:00:00 - 17/01/2018 04:00:00","BZN|DE-AT-LU","Without Sequence",12.35,"17/01/2018 03:00:00","2018-01-17T04:00","CET","2018-01-17T03:00"
"17/01/2018 04:00:00 - 17/01/2018 05:00:00","BZN|DE-AT-LU","Without Sequence",10.77,"17/01/2018 04:00:00","2018-01-17T05:00","CET","2018-01-17T04:00"
"17/01/2018 05:00:00 - 17/01/2018 06:00:00","BZN|DE-AT-LU","Without Sequence",21.09,"17/01/2018 05:00:00","2018-01-17T06:00","CET","2018-01-17T05:00"
"17/01/2018 06:00:00 - 17/01/2018 07:00:00","BZN|DE-AT-LU","Without Sequence",31.94,"17/01/2018 06:00:00","2018-01-17T07:00","CET","2018-01-17T06:00"
"17/01/2018 07:00:00 - 17/01/2018 08:00:00","BZN|DE-AT-LU","Without Sequence",40,"17/01/2018 07:00:00","2018-01-17T08:00","CET","2018-01-17T07:00"
"17/01/2018 08:00:00 - 17/01/2018 09:00:00","BZN|DE-AT-LU","Without Sequence",44.95,"17/01/2018 08:00:00","2018-01-17T09:00","CET","2018-01-17T08:00"
"17/01/2018 09:00:00 - 17/01/2018 10:00:00","BZN|DE-AT-LU","Without Sequence",42.49,"17/01/2018 09:00:00","2018-01-17T10:00","CET","2018-01-17T09:00"
"17/01/2018 10:00:00 - 17/01/2018 11:00:00","BZN|DE-AT-LU","Without Sequence",39.88,"17/01/2018 10:00:00","2018-01-17T11:00","CET","2018-01-17T10:00"
"17/01/2018 11:00:00 - 17/01/2018 12:00:00","BZN|DE-AT-LU","Without Sequence",38.99,"17/01/2018 11:00:00","2018-01-17T12:00","CET","2018-01-17T11:00"
"17/01/2018 12:00:00 - 17/01/2018 13:00:00","BZN|DE-AT-LU","Without Sequence",34.75,"17/01/2018 12:00:00","2018-01-17T13:00","CET","2018-01-17T12:00"
"17/01/2018 13:00:00 - 17/01/2018 14:00:00","BZN|DE-AT-LU","Without Sequence",32.54,"17/01/2018 13:00:00","2018-01-17T14:00","CET","2018-01-17T13:00"
"17/01/2018 14:00:00 - 17/01/2018 15:00:00","BZN|DE-AT-LU","Without Sequence",32.31,"17/01/2018 14:00:00","2018-01-17T15:00","CET","2018-01-17T14:00"
"17/01/2018 15:00:00 - 17/01/2018 16:00:00","BZN|DE-AT-LU","Without Sequence",33.11,"17/01/2018 15:00:00","2018-01-17T16:00","CET","2018-01-17T15:00"
"17/01/2018 16:00:00 - 17/01/2018 17:00:00","BZN|DE-AT-LU","Without Sequence",38.04,"17/01/2018 16:00:00","2018-01-17T17:00","CET","2018-01-17T16:00"
"17/01/2018 17:00:00 - 17/01/2018 18:00:00","BZN|DE-AT-LU","Without Sequence",38.9,"17/01/2018 17:00:00","2018-01-17T18:00","CET","2018-01-17T17:00"
"17/01/2018 18:00:00 - 17/01/2018 19:00:00","BZN|DE-AT-LU","Without Sequence",38.44,"17/01/2018 18:00:00","2018-01-17T19:00","CET","2018-01-17T18:00"
"17/01/2018 19:00:00 - 17/01/2018 20:00:00","BZN|DE-AT-LU","Without Sequence",34.26,"17/01/2018 19:00:00","2018-01-17T20:00","CET","2018-01-17T19:00"
"17/01/2018 20:00:00 - 17/01/2018 21:00:00","BZN|DE-AT-LU","Without Sequence",31.2,"17/01/2018 20:00:00","2018-01-17T21:00","CET","2018-01-17T20:00"
"17/01/2018 21:00:00 - 17/01/2018 22:00:00","BZN|DE-AT-LU","Without Sequence",22.36,"17/01/2018 21:00:00","2018-01-17T22:00","CET","2018-01-17T21:00"
"17/01/2018 22:00:00 - 17/01/2018 23:00:00","BZN|DE-AT-LU","Without Sequence",19.24,"17/01/2018 22:00:00","2018-01-17T23:00","CET","2018-01-17T22:00"
"17/01/2018 23:00:00 - 18/01/2018 00:00:00","BZN|DE-AT-LU","Without Sequence",19.24,"17/01/2018 23:00:00","2018-01-18T00:00","CET","2018-01-17T23:00"
"18/01/2018 00:00:00 - 18/01/2018 01:00:00","BZN|DE-AT-LU","Without Sequence",12.66,"18/01/2018 00:00:00","2018-01-18T01:00","CET","2018-01-18T00:00"
"18/01/2018 01:00:00 - 18/01/2018 02:00:00","BZN|DE-AT-LU","Without Sequence",9.29,"18/01/2018 01:00:00","2018-01-18T02:00","CET","2018-01-18T01:00"
"18/01/2018 02:00:00 - 18/01/2018 03:00:00","BZN|DE-AT-LU","Without Sequence",9.73,"18/01/2018 02:00:00","2018-01-18T03:00","CET","2018-01-18T02:00"
"18/01/2018 03:00:00 - 18/01/2018 04:00:00","BZN|DE-AT-LU","Without Sequence",9.33,"18/01/2018 03:00:00","2018-01-18T04:00","CET","2018-01-18T03:00"
"18/01/2018 04:00:00 - 18/01/2018 05:00:00","BZN|DE-AT-LU","Without Sequence",9.73,"18/01/2018 04:00:00","2018-01-18T05:00","CET","2018-01-18T04:00"
"18/01/2018 05:00:00 - 18/01/2018 06:00:00","BZN|DE-AT-LU","Without Sequence",14.96,"18/01/2018 05:00:00","2018-01-18T06:00","CET","2018-01-18T05:00"
"18/01/2018 06:00:00 - 18/01/2018 07:00:00","BZN|DE-AT-LU","Without Sequence",30.45,"18/01/2018 06:00:00","2018-01-18T07:00","CET","2018-01-18T06:00"
"18/01/2018 07:00:00 - 18/01/2018 08:00:00","BZN|DE-AT-LU","Without Sequence",42.93,"18/01/2018 07:00:00","2018-01-18T08:00","CET","2018-01-18T07:00"
"18/01/2018 08:00:00 - 18/01/2018 09:00:00","BZN|DE-AT-LU","Without Sequence",42.15,"18/01/2018 08:00:00","2018-01-18T09:00","CET","2018-01-18T08:00"
"18/01/2018 09:00:00 - 18/01/2018 10:00:00","BZN|DE-AT-LU","Without Sequence",42,"18/01/2018 09:00:00","2018-01-18T10:00","CET","2018-01-18T09:00"
"18/01/2018 10:00:00 - 18/01/2018 11:00:00","BZN|DE-AT-LU","Without Sequence",40.91,"18/01/2018 10:00:00","2018-01-18T11:00","CET","2018-01-18T10:00"
"18/01/2018 11:00:00 - 18/01/2018 12:00:00","BZN|DE-AT-LU","Without Sequence",39.34,"18/01/2018 11:00:00","2018-01-18T12:00","CET","2018-01-18T11:00"
"18/01/2018 12:00:00 - 18/01/2018 13:00:00","BZN|DE-AT-LU","Without Sequence",37.27,"18/01/2018 12:00:00","2018-01-18T13:00","CET","2018-01-18T12:00"
"18/01/2018 13:00:00 - 18/01/2018 14:00:00","BZN|DE-AT-LU","Without Sequence",31.55,"18/01/2018 13:00:00","2018-01-18T14:00","CET","2018-01-18T13:00"
"18/01/2018 14:00:00 - 18/01/2018 15:00:00","BZN|DE-AT-LU","Without Sequence",31.51,"18/01/2018 14:00:00","2018-01-18T15:00","CET","2018-01-18T14:00"
"18/01/2018 15:00:00 - 18/01/2018 16:00:00","BZN|DE-AT-LU","Without Sequence",31.54,"18/01/2018 15:00:00","2018-01-18T16:00","CET","2018-01-18T15:00"
"18/01/2018 16:00:00 - 18/01/2018 17:00:00","BZN|DE-AT-LU","Without Sequence",32.57,"18/01/2018 16:00:00","2018-01-18T17:00","CET","2018-01-18T16:00"
"18/01/2018 17:00:00 - 18/01/2018 18:00:00","BZN|DE-AT-LU","Without Sequence",39.97,"18/01/2018 17:00:00","2018-01-18T18:00","CET","2018-01-18T17:00"
"18/01/2018 18:00:00 - 18/01/2018 19:00:00","BZN|DE-AT-LU","Without Sequence",42.04,"18/01/2018 18:00:00","2018-01-18T19:00","CET","2018-01-18T18:00"
"18/01/2018 19:00:00 - 18/01/2018 20:00:00","BZN|DE-AT-LU","Without Sequence",41.49,"18/01/2018 19:00:00","2018-01-18T20:00","CET","2018-01-18T19:00"
"18/01/2018 20:00:00 - 18/01/2018 21:00:00","BZN|DE-AT-LU","Without Sequence",38.93,"18/01/2018 20:00:00","2018-01-18T21:00","CET","2018-01-18T20:00"
"18/01/2018 21:00:00 - 18/01/2018 22:00:00","BZN|DE-AT-LU","Without Sequence",34.3,"18/01/2018 21:00:00","2018-01-18T22:00","CET","2018-01-18T21:00"
"18/01/2018 22:00:00 - 18/01/2018 23:00:00","BZN|DE-AT-LU","Without Sequence",32.57,"18/01/2018 22:00:00","2018-01-18T23:00","CET","2018-01-18T22:00"
"18/01/2018 23:00:00 - 19/01/2018 00:00:00","BZN|DE-AT-LU","Without Sequence",32.57,"18/01/2018 23:00:00","2018-01-19T00:00","CET","2018-01-18T23:00"
"19/01/2018 00:00:00 - 19/01/2018 01:00:00","BZN|DE-AT-LU","Without Sequence",30,"19/01/2018 00:00:00","2018-01-19T01:00","CET","2018-01-19T00:00"
"19/01/2018 01:00:00 - 19/01/2018 02:00:00","BZN|DE-AT-LU","Without Sequence",29.97,"19/01/2018 01:00:00","2018-01-19T02:00","CET","2018-01-19T01:00"
"19/01/2018 02:00:00 - 19/01/2018 03:00:00","BZN|DE-AT-LU","Without Sequence",29.49,"19/01/2018 02:00:00","2018-01-19T03:00","CET","2018-01-19T02:00"
"19/01/2018 03:00:00 - 19/01/2018 04:00:00","BZN|DE-AT-LU","Without Sequence",29.56,"19/01/2018 03:00:00","2018-01-19T04:00","CET","2018-01-19T03:00"
"19/01/2018 04:00:00 - 19/01/2018 05:00:00","BZN|DE-AT-LU","Without Sequence",30.02,"19/01/2018 04:00:00","2018-01-19T05:00","CET","2018-01-19T04:00"
"19/01/2018 05:00:00 - 19/01/2018 06:00:00","BZN|DE-AT-LU","Without Sequence",31.76,"19/01/2018 05:00:00","2018-01-19T06:00","CET","2018-01-19T05:00"
"19/01/2018 06:00:00 - 19/01/2018 07:00:00","BZN|DE-AT-LU","Without Sequence",40.02,"19/01/2018 06:00:00","2018-01-19T07:00","CET","2018-01-19T06:00"
"19/01/2018 07:00:00 - 19/01/2018 08:00:00","BZN|DE-AT-LU","Without Sequence",48.96,"19/01/2018 07:00:00","2018-01-19T08:00","CET","2018-01-19T07:00"
"19/01/2018 08:00:00 - 19/01/2018 09:00:00","BZN|DE-AT-LU","Without Sequence",51.94,"19/01/2018 08:00:00","2018-01-19T09:00","CET","2018-01-19T08:00"
"19/01/2018 09:00:00 - 19/01/2018 10:00:00","BZN|DE-AT-LU","Without Sequence",50.36,"19/01/2018 09:00:00","2018-01-19T10:00","CET","2018-01-19T09:00"
"19/01/2018 10:00:00 - 19/01/2018 11:00:00","BZN|DE-AT-LU","Without Sequence",49.58,"19/01/2018 10:00:00","2018-01-19T11:00","CET","2018-01-19T10:00"
"19/01/2018 11:00:00 - 19/01/2018 12:00:00","BZN|DE-AT-LU","Without Sequence",46.88,"19/01/2018 11:00:00","2018-01-19T12:00","CET","2018-01-19T11:00"
"19/01/2018 12:00:00 - 19/01/2018 13:00:00","BZN|DE-AT-LU","Without Sequence",42.99,"19/01/2018 12:00:00","2018-01-19T13:00","CET","2018-01-19T12:00"
"19/01/2018 13:00:00 - 19/01/2018 14:00:00","BZN|DE-AT-LU","Without Sequence",41.67,"19/01/2018 13:00:00","2018-01-19T14:00","CET","2018-01-19T13:00"
"19/01/2018 14:00:00 - 19/01/2018 15:00:00","BZN|DE-AT-LU","Without Sequence",39.49,"19/01/2018 14:00:00","2018-01-19T15:00","CET","2018-01-19T14:00"
"19/01/2018 15:00:00 - 19/01/2018 16:00:00","BZN|DE-AT-LU","Without Sequence",41.78,"19/01/2018 15:00:00","2018-01-19T16:00","CET","2018-01-19T15:00"
"19/01/2018 16:00:00 - 19/01/2018 17:00:00","BZN|DE-AT-LU","Without Sequence",44.3,"19/01/2018 16:00:00","2018-01-19T17:00","CET","2018-01-19T16:00"
"19/01/2018 17:00:00 - 19/01/2018 18:00:00","BZN|DE-AT-LU","Without Sequence",49.57,"19/01/2018 17:00:00","2018-01-19T18:00","CET","2018-01-19T17:00"
"19/01/2018 18:00:00 - 19/01/2018 19:00:00","BZN|DE-AT-LU","Without Sequence",49.74,"19/01/2018 18:00:00","2018-01-19T19:00","CET","2018-01-19T18:00"
"19/01/2018 19:00:00 - 19/01/2018 20:00:00","BZN|DE-AT-LU","Without Sequence",44.79,"19/01/2018 19:00:00","2018-01-19T20:00","CET","2018-01-19T19:00"
"19/01/2018 20:00:00 - 19/01/2018 21:00:00","BZN|DE-AT-LU","Without Sequence",39.79,"19/01/2018 20:00:00","2018-01-19T21:00","CET","2018-01-19T20:00"
"19/01/2018 21:00:00 - 19/01/2018 22:00:00","BZN|DE-AT-LU","Without Sequence",37.84,"19/01/2018 21:00:00","2018-01-19T22:00","CET","2018-01-19T21:00"
"19/01/2018 22:00:00 - 19/01/2018 23:00:00","BZN|DE-AT-LU","Without Sequence",37.54,"19/01/2018 22:00:00","2018-01-19T23:00","CET","2018-01-19T22:00"
"19/01/2018 23:00:00 - 20/01/2018 00:00:00","BZN|DE-AT-LU","Without Sequence",37.54,"19/01/2018 23:00:00","2018-01-20T00:00","CET","2018-01-19T23:00"
"20/01/2018 00:00:00 - 20/01/2018 01:00:00","BZN|DE-AT-LU","Without Sequence",29.71,"20/01/2018 00:00:00","2018-01-20T01:00","CET","2018-01-20T00:00"
"20/01/2018 01:00:00 - 20/01/2018 02:00:00","BZN|DE-AT-LU","Without Sequence",27.84,"20/01/2018 01:00:00","2018-01-20T02:00","CET","2018-01-20T01:00"
"20/01/2018 02:00:00 - 20/01/2018 03:00:00","BZN|DE-AT-LU","Without Sequence",28.37,"20/01/2018 02:00:00","2018-01-20T03:00","CET","2018-01-20T02:00"
"20/01/2018 03:00:00 - 20/01/2018 04:00:00","BZN|DE-AT-LU","Without Sequence",23.92,"20/01/2018 03:00:00","2018-01-20T04:00","CET","2018-01-20T03:00"
"20/01/2018 04:00:00 - 20/01/2018 05:00:00","BZN|DE-AT-LU","Without Sequence",23.37,"20/01/2018 04:00:00","2018-01-20T05:00","CET","2018-01-20T04:00"
"20/01/2018 05:00:00 - 20/01/2018 06:00:00","BZN|DE-AT-LU","Without Sequence",26.01,"20/01/2018 05:00:00","2018-01-20T06:00","CET","2018-01-20T05:00"
"20/01/2018 06:00:00 - 20/01/2018 07:00:00","BZN|DE-AT-LU","Without Sequence",29.62,"20/01/2018 06:00:00","2018-01-20T07:00","CET","2018-01-20T06:00"
"20/01/2018 07:00:00 - 20/01/2018 08:00:00","BZN|DE-AT-LU","Without Sequence",30.85,"20/01/2018 07:00:00","2018-01-20T08:00","CET","2018-01-20T07:00"
"20/01/2018 08:00:00 - 20/01/2018 09:00:00","BZN|DE-AT-LU","Without Sequence",33.07,"20/01/2018 08:00:00","2018-01-20T09:00","CET","2018-01-20T08:00"
"20/01/2018 09:00:00 - 20/01/2018 10:00:00","BZN|DE-AT-LU","Without Sequence",38,"20/01/2018 09:00:00","2018-01-20T10:00","CET","2018-01-20T09:00"
"20/01/2018 10:00:00 - 20/01/2018 11:00:00","BZN|DE-AT-LU","Without Sequence",41.66,"20/01/2018 10:00:00","2018-01-20T11:00","CET","2018-01-20T10:00"
"20/01/2018 11:00:00 - 20/01/2018 12:00:00","BZN|DE-AT-LU","Without Sequence",41.68,"20/01/2018 11:00:00","2018-01-20T12:00","CET","2018-01-20T11:00"
"20/01/2018 12:00:00 - 20/01/2018 13:00:00","BZN|DE-AT-LU","Without Sequence",41.93,"20/01/2018 12:00:00","2018-01-20T13:00","CET","2018-01-20T12:00"
"20/01/2018 13:00:00 - 20/01/2018 14:00:00","BZN|DE-AT-LU","Without Sequence",41.45,"20/01/2018 13:00:00","2018-01-20T14:00","CET","2018-01-20T13:00"
"20/01/2018 14:00:00 - 20/01/2018 15:00:00","BZN|DE-AT-LU","Without Sequence",39,"20/01/2018 14:00:00","2018-01-20T15:00","CET","2018-01-20T14:00"
"20/01/2018 15:00:00 - 20/01/2018 16:00:00","BZN|DE-AT-LU","Without Sequence",40.01,"20/01/2018 15:00:00","2018-01-20T16:00","CET","2018-01-20T15:00"
"20/01/2018 16:00:00 - 20/01/2018 17:00:00","BZN|DE-AT-LU","Without Sequence",41.8,"20/01/2018 16:00:00","2018-01-20T17:00","CET","2018-01-20T16:00"
"20/01/2018 17:00:00 - 20/01/2018 18:00:00","BZN|DE-AT-LU","Without Sequence",44.68,"20/01/2018 17:00:00","2018-01-20T18:00","CET","2018-01-20T17:00"
"20/01/2018 18:00:00 - 20/01/2018 19:00:00","BZN|DE-AT-LU","Without Sequence",49.38,"20/01/2018 18:00:00","2018-01-20T19:00","CET","2018-01-20T18:00"
"20/01/2018 19:00:00 - 20/01/2018 20:00:00","BZN|DE-AT-LU","Without Sequence",43.98,"20/01/2018 19:00:00","2018-01-20T20:00","CET","2018-01-20T19:00"
"20/01/2018 20:00:00 - 20/01/2018 21:00:00","BZN|DE-AT-LU","Without Sequence",39.16,"20/01/2018 20:00:00","2018-01-20T21:00","CET","2018-01-20T20:00"
"20/01/2018 21:00:00 - 20/01/2018 22:00:00","BZN|DE-AT-LU","Without Sequence",36.37,"20/01/2018 21:00:00","2018-01-20T22:00","CET","2018-01-20T21:00"
"20/01/2018 22:00:00 - 20/01/2018 23:00:00","BZN|DE-AT-LU","Without Sequence",36.33,"20/01/2018 22:00:00","2018-01-20T23:00","CET","2018-01-20T22:00"
"20/01/2018 23:00:00 - 21/01/2018 00:00:00","BZN|DE-AT-LU","Without Sequence",36.33,"20/01/2018 23:00:00","2018-01-21T00:00","CET","2018-01-20T23:00"
"21/01/2018 00:00:00 - 21/01/2018 01:00:00","BZN|DE-AT-LU","Without Sequence",31.88,"21/01/2018 00:00:00","2018-01-21T01:00","CET","2018-01-21T00:00"
"21/01/2018 01:00:00 - 21/01/2018 02:00:00","BZN|DE-AT-LU","Without Sequence",30.41,"21/01/2018 01:00:00","2018-01-21T02:00","CET","2018-01-21T01:00"
"21/01/2018 02:00:00 - 21/01/2018 03:00:00","BZN|DE-AT-LU","Without Sequence",29.24,"21/01/2018 02:00:00","2018-01-21T03:00","CET","2018-01-21T02:00"
"21/01/2018 03:00:00 - 21/01/2018 04:00:00","BZN|DE-AT-LU","Without Sequence",27.71,"21/01/2018 03:00:00","2018-01-21T04:00","CET","2018-01-21T03:00"
"21/01/2018 04:00:00 - 21/01/2018 05:00:00","BZN|DE-AT-LU","Without Sequence",25.56,"21/01/2018 04:00:00","2018-01-21T05:00","CET","2018-01-21T04:00"
"21/01/2018 05:00:00 - 21/01/2018 06:00:00","BZN|DE-AT-LU","Without Sequence",27.68,"21/01/2018 05:00:00","2018-01-21T06:00","CET","2018-01-21T05:00"
"21/01/2018 06:00:00 - 21/01/2018 07:00:00","BZN|DE-AT-LU","Without Sequence",28.47,"21/01/2018 06:00:00","2018-01-21T07:00","CET","2018-01-21T06:00"
"21/01/2018 07:00:00 - 21/01/2018 08:00:00","BZN|DE-AT-LU","Without Sequence",30.31,"21/01/2018 07:00:00","2018-01-21T08:00","CET","2018-01-21T07:00"
"21/01/2018 08:00:00 - 21/01/2018 09:00:00","BZN|DE-AT-LU","Without Sequence",32.49,"21/01/2018 08:00:00","2018-01-21T09:00","CET","2018-01-21T08:00"
"21/01/2018 09:00:00 - 21/01/2018 10:00:00","BZN|DE-AT-LU","Without Sequence",35.3,"21/01/2018 09:00:00","2018-01-21T10:00","CET","2018-01-21T09:00"
"21/01/2018 10:00:00 - 21/01/2018 11:00:00","BZN|DE-AT-LU","Without Sequence",38.88,"21/01/2018 10:00:00","2018-01-21T11:00","CET","2018-01-21T10:00"
"21/01/2018 11:00:00 - 21/01/2018 12:00:00","BZN|DE-AT-LU","Without Sequence",40.93,"21/01/2018 11:00:00","2018-01-21T12:00","CET","2018-01-21T11:00"
"21/01/2018 12:00:00 - 21/01/2018 13:00:00","BZN|DE-AT-LU","Without Sequence",40.93,"21/01/2018 12:00:00","2018-01-21T13:00","CET","2018-01-21T12:00"
"21/01/2018 13:00:00 - 21/01/2018 14:00:00","BZN|DE-AT-LU","Without Sequence",37.77,"21/01/2018 13:00:00","2018-01-21T14:00","CET","2018-01-21T13:00"
"21/01/2018 14:00:00 - 21/01/2018 15:00:00","BZN|DE-AT-LU","Without Sequence",33.84,"21/01/2018 14:00:00","2018-01-21T15:00","CET","2018-01-21T14:00"
"21/01/2018 15:00:00 - 21/01/2018 16:00:00","BZN|DE-AT-LU","Without Sequence",34.62,"21/01/2018 15:00:00","2018-01-21T16:00","CET","2018-01-21T15:00"
"21/01/2018 16:00:00 - 21/01/2018 17:00:00","BZN|DE-AT-LU","Without Sequence",38.04,"21/01/2018 16:00:00","2018-01-21T17:00","CET","2018-01-21T16:00"
"21/01/2018 17:00:00 - 21/01/2018 18:00:00","BZN|DE-AT-LU","Without Sequence",42.93,"21/01/2018 17:00:00","2018-01-21T18:00","CET","2018-01-21T17:00"
"21/01/2018 18:00:00 - 21/01/2018 19:00:00","BZN|DE-AT-LU","Without Sequence",48.08,"21/01/2018 18:00:00","2018-01-21T19:00","CET","2018-01-21T18:00"
"21/01/2018 19:00:00 - 21/01/2018 20:00:00","BZN|DE-AT-LU","Without Sequence",42.92,"21/01/2018 19:00:00","2018-01-21T20:00","CET","2018-01-21T19:00"
"21/01/2018 20:00:00 - 21/01/2018 21:00:00","BZN|DE-AT-LU","Without Sequence",37.46,"21/01/2018 20:00:00","2018-01-21T21:00","CET","2018-01-21T20:00"
"21/01/2018 21:00:00 - 21/01/2018 22:00:00","BZN|DE-AT-LU","Without Sequence",32.53,"21/01/2018 21:00:00","2018-01-21T22:00","CET","2018-01-21T21:00"
"21/01/2018 22:00:00 - 21/01/2018 23:00:00","BZN|DE-AT-LU","Without Sequence",32.5,"21/01/2018 22:00:00","2018-01-21T23:00","CET","2018-01-21T22:00"
"21/01/2018 23:00:00 - 22/01/2018 00:00:00","BZN|DE-AT-LU","Without Sequence",32.5,"21/01/2018 23:00:00","2018-01-22T00:00","CET","2018-01-21T23:00"
"22/01/2018 00:00:00 - 22/01/2018 01:00:00","BZN|DE-AT-LU","Without Sequence",27.06,"22/01/2018 00:00:00","2018-01-22T01:00","CET","2018-01-22T00:00"
"22/01/2018 01:00:00 - 22/01/2018 02:00:00","BZN|DE-AT-LU","Without Sequence",20,"22/01/2018 01:00:00","2018-01-22T02:00","CET","2018-01-22T01:00"
"22/01/2018 02:00:00 - 22/01/2018 03:00:00","BZN|DE-AT-LU","Without Sequence",16.22,"22/01/2018 02:00:00","2018-01-22T03:00","CET","2018-01-22T02:00"
"22/01/2018 03:00:00 - 22/01/2018 04:00:00","BZN|DE-AT-LU","Without Sequence",12.88,"22/01/2018 03:00:00","2018-01-22T04:00","CET","2018-01-22T03:00"
"22/01/2018 04:00:00 - 22/01/2018 05:00:00","BZN|DE-AT-LU","Without Sequence",15.52,"22/01/2018 04:00:00","2018-01-22T05:00","CET","2018-01-22T04:00"
"22/01/2018 05:00:00 - 22/01/2018 06:00:00","BZN|DE-AT-LU","Without Sequence",25.01,"22/01/2018 05:00:00","2018-01-22T06:00","CET","2018-01-22T05:00"
"22/01/2018 06:00:00 - 22/01/2018 07:00:00","BZN|DE-AT-LU","Without Sequence",33.08,"22/01/2018 06:00:00","2018-01-22T07:00","CET","2018-01-22T06:00"
"22/01/2018 07:00:00 - 22/01/2018 08:00:00","BZN|DE-AT-LU","Without Sequence",42.95,"22/01/2018 07:00:00","2018-01-22T08:00","CET","2018-01-22T07:00"
"22/01/2018 08:00:00 - 22/01/2018 09:00:00","BZN|DE-AT-LU","Without Sequence",45.06,"22/01/2018 08:00:00","2018-01-22T09:00","CET","2018-01-22T08:00"
"22/01/2018 09:00:00 - 22/01/2018 10:00:00","BZN|DE-AT-LU","Without Sequence",45.9,"22/01/2018 09:00:00","2018-01-22T10:00","CET","2018-01-22T09:00"
"22/01/2018 10:00:00 - 22/01/2018 11:00:00","BZN|DE-AT-LU","Without Sequence",44.98,"22/01/2018 10:00:00","2018-01-22T11:00","CET","2018-01-22T10:00"
"22/01/2018 11:00:00 - 22/01/2018 12:00:00","BZN|DE-AT-LU","Without Sequence",48.39,"22/01/2018 11:00:00","2018-01-22T12:00","CET","2018-01-22T11:00"
"22/01/2018 12:00:00 - 22/01/2018 13:00:00","BZN|DE-AT-LU","Without Sequence",47,"22/01/2018 12:00:00","2018-01-22T13:00","CET","2018-01-22T12:00"
"22/01/2018 13:00:00 - 22/01/2018 14:00:00","BZN|DE-AT-LU","Without Sequence",47.39,"22/01/2018 13:00:00","2018-01-22T14:00","CET","2018-01-22T13:00"
"22/01/2018 14:00:00 - 22/01/2018 15:00:00","BZN|DE-AT-LU","Without Sequence",46.34,"22/01/2018 14:00:00","2018-01-22T15:00","CET","2018-01-22T14:00"
"22/01/2018 15:00:00 - 22/01/2018 16:00:00","BZN|DE-AT-LU","Without Sequence",43.94,"22/01/2018 15:00:00","2018-01-22T16:00","CET","2018-01-22T15:00"
"22/01/2018 16:00:00 - 22/01/2018 17:00:00","BZN|DE-AT-LU","Without Sequence",43.65,"22/01/2018 16:00:00","2018-01-22T17:00","CET","2018-01-22T16:00"
"22/01/2018 17:00:00 - 22/01/2018 18:00:00","BZN|DE-AT-LU","Without Sequence",49.5,"22/01/2018 17:00:00","2018-01-22T18:00","CET","2018-01-22T17:00"
"22/01/2018 18:00:00 - 22/01/2018 19:00:00","BZN|DE-AT-LU","Without Sequence",51,"22/01/2018 18:00:00","2018-01-22T19:00","CET","2018-01-22T18:00"
"22/01/2018 19:00:00 - 22/01/2018 20:00:00","BZN|DE-AT-LU","Without Sequence",48.05,"22/01/2018 19:00:00","2018-01-22T20:00","CET","2018-01-22T19:00"
"22/01/2018 20:00:00 - 22/01/2018 21:00:00","BZN|DE-AT-LU","Without Sequence",42.82,"22/01/2018 20:00:00","2018-01-22T21:00","CET","2018-01-22T20:00"
"22/01/2018 21:00:00 - 22/01/2018 22:00:00","BZN|DE-AT-LU","Without Sequence",38.99,"22/01/2018 21:00:00","2018-01-22T22:00","CET","2018-01-22T21:00"
"22/01/2018 22:00:00 - 22/01/2018 23:00:00","BZN|DE-AT-LU","Without Sequence",37.99,"22/01/2018 22:00:00","2018-01-22T23:00","CET","2018-01-22T22:00"
"22/01/2018 23:00:00 - 23/01/2018 00:00:00","BZN|DE-AT-LU","Without Sequence",37.99,"22/01/2018 23:00:00","2018-01-23T00:00","CET","2018-01-22T23:00"
"23/01/2018 00:00:00 - 23/01/2018 01:00:00","BZN|DE-AT-LU","Without Sequence",34.2,"23/01/2018 00:00:00","2018-01-23T01:00","CET","2018-01-23T00:00"
"23/01/2018 01:00:00 - 23/01/2018 02:00:00","BZN|DE-AT-LU","Without Sequence",32.52,"23/01/2018 01:00:00","2018-01-23T02:00","CET","2018-01-23T01:00"
"23/01/2018 02:00:00 - 23/01/2018 03:00:00","BZN|DE-AT-LU","Without Sequence",31.54,"23/01/2018 02:00:00","2018-01-23T03:00","CET","2018-01-23T02:00"
"23/01/2018 03:00:00 - 23/01/2018 04:00:00","BZN|DE-AT-LU","Without Sequence",30.38,"23/01/2018 03:00:00","2018-01-23T04:00","CET","2018-01-23T03:00"
"23/01/2018 04:00:00 - 23/01/2018 05:00:00","BZN|DE-AT-LU","Without Sequence",30.97,"23/01/2018 04:00:00","2018-01-23T05:00","CET","2018-01-23T04:00"
"23/01/2018 05:00:00 - 23/01/2018 06:00:00","BZN|DE-AT-LU","Without Sequence",32.48,"23/01/2018 05:00:00","2018-01-23T06:00","CET","2018-01-23T05:00"
"23/01/2018 06:00:00 - 23/01/2018 07:00:00","BZN|DE-AT-LU","Without Sequence",40,"23/01/2018 06:00:00","2018-01-23T07:00","CET","2018-01-23T06:00"
"23/01/2018 07:00:00 - 23/01/2018 08:00:00","BZN|DE-AT-LU","Without Sequence",48.93,"23/01/2018 07:00:00","2018-01-23T08:00","CET","2018-01-23T07:00"
"23/01/2018 08:00:00 - 23/01/2018 09:00:00","BZN|DE-AT-LU","Without Sequence",52.74,"23/01/2018 08:00:00","2018-01-23T09:00","CET","2018-01-23T08:00"
"23/01/2018 09:00:00 - 23/01/2018 10:00:00","BZN|DE-AT-LU","Without Sequence",50.79,"23/01/2018 09:00:00","2018-01-23T10:00","CET","2018-01-23T09:00"
"23/01/2018 10:00:00 - 23/01/2018 11:00:00","BZN|DE-AT-LU","Without Sequence",48.2,"23/01/2018 10:00:00","2018-01-23T11:00","CET","2018-01-23T10:00"
"23/01/2018 11:00:00 - 23/01/2018 12:00:00","BZN|DE-AT-LU","Without Sequence",44.91,"23/01/2018 11:00:00","2018-01-23T12:00","CET","2018-01-23T11:00"
"23/01/2018 12:00:00 - 23/01/2018 13:00:00","BZN|DE-AT-LU","Without Sequence",41.94,"23/01/2018 12:00:00","2018-01-23T13:00","CET","2018-01-23T12:00"
"23/01/2018 13:00:00 - 23/01/2018 14:00:00","BZN|DE-AT-LU","Without Sequence",41.83,"23/01/2018 13:00:00","2018-01-23T14:00","CET","2018-01-23T13:00"
"23/01/2018 14:00:00 - 23/01/2018 15:00:00","BZN|DE-AT-LU","Without Sequence",39,"23/01/2018 14:00:00","2018-01-23T15:00","CET","2018-01-23T14:00"
"23/01/2018 15:00:00 - 23/01/2018 16:00:00","BZN|DE-AT-LU","Without Sequence",37.5,"23/01/2018 15:00:00","2018-01-23T16:00","CET","2018-01-23T15:00"
"23/01/2018 16:00:00 - 23/01/2018 17:00:00","BZN|DE-AT-LU","Without Sequence",35.63,"23/01/2018 16:00:00","2018-01-23T17:00","CET","2018-01-23T16:00"
"23/01/2018 17:00:00 - 23/01/2018 18:00:00","BZN|DE-AT-LU","Without Sequence",40.94,"23/01/2018 17:00:00","2018-01-23T18:00","CET","2018-01-23T17:00"
"23/01/2018 18:00:00 - 23/01/2018 19:00:00","BZN|DE-AT-LU","Without Sequence",40.98,"23/01/2018 18:00:00","2018-01-23T19:00","CET","2018-01-23T18:00"
"23/01/2018 19:00:00 - 23/01/2018 20:00:00","BZN|DE-AT-LU","Without Sequence",34.59,"23/01/2018 19:00:00","2018-01-23T20:00","CET","2018-01-23T19:00"
"23/01/2018 20:00:00 - 23/01/2018 21:00:00","BZN|DE-AT-LU","Without Sequence",33.25,"23/01/2018 20:00:00","2018-01-23T21:00","CET","2018-01-23T20:00"
"23/01/2018 21:00:00 - 23/01/2018 22:00:00","BZN|DE-AT-LU","Without Sequence",29.62,"23/01/2018 21:00:00","2018-01-23T22:00","CET","2018-01-23T21:00"
"23/01/2018 22:00:00 - 23/01/2018 23:00:00","BZN|DE-AT-LU","Without Sequence",28.03,"23/01/2018 22:00:00","2018-01-23T23:00","CET","2018-01-23T22:00"
"23/01/2018 23:00:00 - 24/01/2018 00:00:00","BZN|DE-AT-LU","Without Sequence",28.03,"23/01/2018 23:00:00","2018-01-24T00:00","CET","2018-01-23T23:00"
"24/01/2018 00:00:00 - 24/01/2018 01:00:00","BZN|DE-AT-LU","Without Sequence",13.46,"24/01/2018 00:00:00","2018-01-24T01:00","CET","2018-01-24T00:00"
"24/01/2018 01:00:00 - 24/01/2018 02:00:00","BZN|DE-AT-LU","Without Sequence",11.21,"24/01/2018 01:00:00","2018-01-24T02:00","CET","2018-01-24T01:00"
"24/01/2018 02:00:00 - 24/01/2018 03:00:00","BZN|DE-AT-LU","Without Sequence",10.34,"24/01/2018 02:00:00","2018-01-24T03:00","CET","2018-01-24T02:00"
"24/01/2018 03:00:00 - 24/01/2018 04:00:00","BZN|DE-AT-LU","Without Sequence",9.26,"24/01/2018 03:00:00","2018-01-24T04:00","CET","2018-01-24T03:00"
"24/01/2018 04:00:00 - 24/01/2018 05:00:00","BZN|DE-AT-LU","Without Sequence",11.23,"24/01/2018 04:00:00","2018-01-24T05:00","CET","2018-01-24T04:00"
"24/01/2018 05:00:00 - 24/01/2018 06:00:00","BZN|DE-AT-LU","Without Sequence",16.74,"24/01/2018 05:00:00","2018-01-24T06:00","CET","2018-01-24T05:00"
"24/01/2018 06:00:00 - 24/01/2018 07:00:00","BZN|DE-AT-LU","Without Sequence",28.83,"24/01/2018 06:00:00","2018-01-24T07:00","CET","2018-01-24T06:00"
"24/01/2018 07:00:00 - 24/01/2018 08:00:00","BZN|DE-AT-LU","Without Sequence",40.92,"24/01/2018 07:00:00","2018-01-24T08:00","CET","2018-01-24T07:00"
"24/01/2018 08:00:00 - 24/01/2018 09:00:00","BZN|DE-AT-LU","Without Sequence",40,"24/01/2018 08:00:00","2018-01-24T09:00","CET","2018-01-24T08:00"
"24/01/2018 09:00:00 - 24/01/2018 10:00:00","BZN|DE-AT-LU","Without Sequence",32.66,"24/01/2018 09:00:00","2018-01-24T10:00","CET","2018-01-24T09:00"
"24/01/2018 10:00:00 - 24/01/2018 11:00:00","BZN|DE-AT-LU","Without Sequence",30.57,"24/01/2018 10:00:00","2018-01-24T11:00","CET","2018-01-24T10:00"
"24/01/2018 11:00:00 - 24/01/2018 12:00:00","BZN|DE-AT-LU","Without Sequence",29.9,"24/01/2018 11:00:00","2018-01-24T12:00","CET","2018-01-24T11:00"
"24/01/2018 12:00:00 - 24/01/2018 13:00:00","BZN|DE-AT-LU","Without Sequence",29.82,"24/01/2018 12:00:00","2018-01-24T13:00","CET","2018-01-24T12:00"
"24/01/2018 13:00:00 - 24/01/2018 14:00:00","BZN|DE-AT-LU","Without Sequence",29.06,"24/01/2018 13:00:00","2018-01-24T14:00","CET","2018-01-24T13:00"
"24/01/2018 14:00:00 - 24/01/2018 15:00:00","BZN|DE-AT-LU","Without Sequence",25.05,"24/01/2018 14:00:00","2018-01-24T15:00","CET","2018-01-24T14:00"
"24/01/2018 15:00:00 - 24/01/2018 16:00:00","BZN|DE-AT-LU","Without Sequence",26.11,"24/01/2018 15:00:00","2018-01-24T16:00","CET","2018-01-24T15:00"
"24/01/2018 16:00:00 - 24/01/2018 17:00:00","BZN|DE-AT-LU","Without Sequence",29,"24/01/2018 16:00:00","2018-01-24T17:00","CET","2018-01-24T16:00"
"24/01/2018 17:00:00 - 24/01/2018 18:00:00","BZN|DE-AT-LU","Without Sequence",29.7,"24/01/2018 17:00:00","2018-01-24T18:00","CET","2018-01-24T17:00"
"24/01/2018 18:00:00 - 24/01/2018 19:00:00","BZN|DE-AT-LU","Without Sequence",29.27,"24/01/2018 18:00:00","2018-01-24T19:00","CET","2018-01-24T18:00"
"24/01/2018 19:00:00 - 24/01/2018 20:00:00","BZN|DE-AT-LU","Without Sequence",28.37,"24/01/2018 19:00:00","2018-01-24T20:00","CET","2018-01-24T19:00"
"24/01/2018 20:00:00 - 24/01/2018 21:00:00","BZN|DE-AT-LU","Without Sequence",25.06,"24/01/2018 20:00:00","2018-01-24T21:00","CET","2018-01-24T20:00"
"24/01/2018 21:00:00 - 24/01/2018 22:00:00","BZN|DE-AT-LU","Without Sequence",18.26,"24/01/2018 21:00:00","2018-01-24T22:00","CET","2018-01-24T21:00"
"24/01/2018 22:00:00 - 24/01/2018 23:00:00","BZN|DE-AT-LU","Without Sequence",16.49,"24/01/2018 22:00:00","2018-01-24T23:00","CET","2018-01-24T22:00"
"24/01/2018 23:00:00 - 25/01/2018 00:00:00","BZN|DE-AT-LU","Without Sequence",16.49,"24/01/2018 23:00:00","2018-01-25T00:00","CET","2018-01-24T23:00"
"25/01/2018 00:00:00 - 25/01/2018 01:00:00","BZN|DE-AT-LU","Without Sequence",4.72,"25/01/2018 00:00:00","2018-01-25T01:00","CET","2018-01-25T00:00"
"25/01/2018 01:00:00 - 25/01/2018 02:00:00","BZN|DE-AT-LU","Without Sequence",5.45,"25/01/2018 01:00:00","2018-01-25T02:00","CET","2018-01-25T01:00"
"25/01/2018 02:00:00 - 25/01/2018 03:00:00","BZN|DE-AT-LU","Without Sequence",3.87,"25/01/2018 02:00:00","2018-01-25T03:00","CET","2018-01-25T02:00"
"25/01/2018 03:00:00 - 25/01/2018 04:00:00","BZN|DE-AT-LU","Without Sequence",4.69,"25/01/2018 03:00:00","2018-01-25T04:00","CET","2018-01-25T03:00"
"25/01/2018 04:00:00 - 25/01/2018 05:00:00","BZN|DE-AT-LU","Without Sequence",4.74,"25/01/2018 04:00:00","2018-01-25T05:00","CET","2018-01-25T04:00"
"25/01/2018 05:00:00 - 25/01/2018 06:00:00","BZN|DE-AT-LU","Without Sequence",13.99,"25/01/2018 05:00:00","2018-01-25T06:00","CET","2018-01-25T05:00"
"25/01/2018 06:00:00 - 25/01/2018 07:00:00","BZN|DE-AT-LU","Without Sequence",28.12,"25/01/2018 06:00:00","2018-01-25T07:00","CET","2018-01-25T06:00"
"25/01/2018 07:00:00 - 25/01/2018 08:00:00","BZN|DE-AT-LU","Without Sequence",40.94,"25/01/2018 07:00:00","2018-01-25T08:00","CET","2018-01-25T07:00"
"25/01/2018 08:00:00 - 25/01/2018 09:00:00","BZN|DE-AT-LU","Without Sequence",41.27,"25/01/2018 08:00:00","2018-01-25T09:00","CET","2018-01-25T08:00"
"25/01/2018 09:00:00 - 25/01/2018 10:00:00","BZN|DE-AT-LU","Without Sequence",39.94,"25/01/2018 09:00:00","2018-01-25T10:00","CET","2018-01-25T09:00"
"25/01/2018 10:00:00 - 25/01/2018 11:00:00","BZN|DE-AT-LU","Without Sequence",39.58,"25/01/2018 10:00:00","2018-01-25T11:00","CET","2018-01-25T10:00"
"25/01/2018 11:00:00 - 25/01/2018 12:00:00","BZN|DE-AT-LU","Without Sequence",39.8,"25/01/2018 11:00:00","2018-01-25T12:00","CET","2018-01-25T11:00"
"25/01/2018 12:00:00 - 25/01/2018 13:00:00","BZN|DE-AT-LU","Without Sequence",40.05,"25/01/2018 12:00:00","2018-01-25T13:00","CET","2018-01-25T12:00"
"25/01/2018 13:00:00 - 25/01/2018 14:00:00","BZN|DE-AT-LU","Without Sequence",41.13,"25/01/2018 13:00:00","2018-01-25T14:00","CET","2018-01-25T13:00"
"25/01/2018 14:00:00 - 25/01/2018 15:00:00","BZN|DE-AT-LU","Without Sequence",43.98,"25/01/2018 14:00:00","2018-01-25T15:00","CET","2018-01-25T14:00"
"25/01/2018 15:00:00 - 25/01/2018 16:00:00","BZN|DE-AT-LU","Without Sequence",45.29,"25/01/2018 15:00:00","2018-01-25T16:00","CET","2018-01-25T15:00"
"25/01/2018 16:00:00 - 25/01/2018 17:00:00","BZN|DE-AT-LU","Without Sequence",45.47,"25/01/2018 16:00:00","2018-01-25T17:00","CET","2018-01-25T16:00"
"25/01/2018 17:00:00 - 25/01/2018 18:00:00","BZN|DE-AT-LU","Without Sequence",49.37,"25/01/2018 17:00:00","2018-01-25T18:00","CET","2018-01-25T17:00"
"25/01/2018 18:00:00 - 25/01/2018 19:00:00","BZN|DE-AT-LU","Without Sequence",52.76,"25/01/2018 18:00:00","2018-01-25T19:00","CET","2018-01-25T18:00"
"25/01/2018 19:00:00 - 25/01/2018 20:00:00","BZN|DE-AT-LU","Without Sequence",49.93,"25/01/2018 19:00:00","2018-01-25T20:00","CET","2018-01-25T19:00"
"25/01/2018 20:00:00 - 25/01/2018 21:00:00","BZN|DE-AT-LU","Without Sequence",43.71,"25/01/2018 20:00:00","2018-01-25T21:00","CET","2018-01-25T20:00"
"25/01/2018 21:00:00 - 25/01/2018 22:00:00","BZN|DE-AT-LU","Without Sequence",38.98,"25/01/2018 21:00:00","2018-01-25T22:00","CET","2018-01-25T21:00"
"25/01/2018 22:00:00 - 25/01/2018 23:00:00","BZN|DE-AT-LU","Without Sequence",38.62,"25/01/2018 22:00:00","2018-01-25T23:00","CET","2018-01-25T22:00"
"25/01/2018 23:00:00 - 26/01/2018 00:00:00","BZN|DE-AT-LU","Without Sequence",38.62,"25/01/2018 23:00:00","2018-01-26T00:00","CET","2018-01-25T23:00"
"26/01/2018 00:00:00 - 26/01/2018 01:00:00","BZN|DE-AT-LU","Without Sequence",37.23,"26/01/2018 00:00:00","2018-01-26T01:00","CET","2018-01-26T00:00"
"26/01/2018 01:00:00 - 26/01/2018 02:00:00","BZN|DE-AT-LU","Without Sequence",35.03,"26/01/2018 01:00:00","2018-01-26T02:00","CET","2018-01-26T01:00"
"26/01/2018 02:00:00 - 26/01/2018 03:00:00","BZN|DE-AT-LU","Without Sequence",34.1,"26/01/2018 02:00:00","2018-01-26T03:00","CET","2018-01-26T02:00"
"26/01/2018 03:00:00 - 26/01/2018 04:00:00","BZN|DE-AT-LU","Without Sequence",33.01,"26/01/2018 03:00:00","2018-01-26T04:00","CET","2018-01-26T03:00"
"26/01/2018 04:00:00 - 26/01/2018 05:00:00","BZN|DE-AT-LU","Without Sequence",32.91,"26/01/2018 04:00:00","2018-01-26T05:00","CET","2018-01-26T04:00"
"26/01/2018 05:00:00 - 26/01/2018 06:00:00","BZN|DE-AT-LU","Without Sequence",34.9,"26/01/2018 05:00:00","2018-01-26T06:00","CET","2018-01-26T05:00"
"26/01/2018 06:00:00 - 26/01/2018 07:00:00","BZN|DE-AT-LU","Without Sequence",39.91,"26/01/2018 06:00:00","2018-01-26T07:00","CET","2018-01-26T06:00"
"26/01/2018 07:00:00 - 26/01/2018 08:00:00","BZN|DE-AT-LU","Without Sequence",51.27,"26/01/2018 07:00:00","2018-01-26T08:00","CET","2018-01-26T07:00"
"26/01/2018 08:00:00 - 26/01/2018 09:00:00","BZN|DE-AT-LU","Without Sequence",54.72,"26/01/2018 08:00:00","2018-01-26T09:00","CET","2018-01-26T08:00"
"26/01/2018 09:00:00 - 26/01/2018 10:00:00","BZN|DE-AT-LU","Without Sequence",54.52,"26/01/2018 09:00:00","2018-01-26T10:00","CET","2018-01-26T09:00"
"26/01/2018 10:00:00 - 26/01/2018 11:00:00","BZN|DE-AT-LU","Without Sequence",54.02,"26/01/2018 10:00:00","2018-01-26T11:00","CET","2018-01-26T10:00"
"26/01/2018 11:00:00 - 26/01/2018 12:00:00","BZN|DE-AT-LU","Without Sequence",53.18,"26/01/2018 11:00:00","2018-01-26T12:00","CET","2018-01-26T11:00"
"26/01/2018 12:00:00 - 26/01/2018 13:00:00","BZN|DE-AT-LU","Without Sequence",50.23,"26/01/2018 12:00:00","2018-01-26T13:00","CET","2018-01-26T12:00"
"26/01/2018 13:00:00 - 26/01/2018 14:00:00","BZN|DE-AT-LU","Without Sequence",49.2,"26/01/2018 13:00:00","2018-01-26T14:00","CET","2018-01-26T13:00"
"26/01/2018 14:00:00 - 26/01/2018 15:00:00","BZN|DE-AT-LU","Without Sequence",48.96,"26/01/2018 14:00:00","2018-01-26T15:00","CET","2018-01-26T14:00"
"26/01/2018 15:00:00 - 26/01/2018 16:00:00","BZN|DE-AT-LU","Without Sequence",48.25,"26/01/2018 15:00:00","2018-01-26T16:00","CET","2018-01-26T15:00"
"26/01/2018 16:00:00 - 26/01/2018 17:00:00","BZN|DE-AT-LU","Without Sequence",48.25,"26/01/2018 16:00:00","2018-01-26T17:00","CET","2018-01-26T16:00"
"26/01/2018 17:00:00 - 26/01/2018 18:00:00","BZN|DE-AT-LU","Without Sequence",51.15,"26/01/2018 17:00:00","2018-01-26T18:00","CET","2018-01-26T17:00"
"26/01/2018 18:00:00 - 26/01/2018 19:00:00","BZN|DE-AT-LU","Without Sequence",54.7,"26/01/2018 18:00:00","2018-01-26T19:00","CET","2018-01-26T18:00"
"26/01/2018 19:00:00 - 26/01/2018 20:00:00","BZN|DE-AT-LU","Without Sequence",52.09,"26/01/2018 19:00:00","2018-01-26T20:00","CET","2018-01-26T19:00"
"26/01/2018 20:00:00 - 26/01/2018 21:00:00","BZN|DE-AT-LU","Without Sequence",46,"26/01/2018 20:00:00","2018-01-26T21:00","CET","2018-01-26T20:00"
"26/01/2018 21:00:00 - 26/01/2018 22:00:00","BZN|DE-AT-LU","Without Sequence",40.44,"26/01/2018 21:00:00","2018-01-26T22:00","CET","2018-01-26T21:00"
"26/01/2018 22:00:00 - 26/01/2018 23:00:00","BZN|DE-AT-LU","Without Sequence",40.43,"26/01/2018 22:00:00","2018-01-26T23:00","CET","2018-01-26T22:00"
"26/01/2018 23:00:00 - 27/01/2018 00:00:00","BZN|DE-AT-LU","Without Sequence",40.43,"26/01/2018 23:00:00","2018-01-27T00:00","CET","2018-01-26T23:00"
"27/01/2018 00:00:00 - 27/01/2018 01:00:00","BZN|DE-AT-LU","Without Sequence",36.81,"27/01/2018 00:00:00","2018-01-27T01:00","CET","2018-01-27T00:00"
"27/01/2018 01:00:00 - 27/01/2018 02:00:00","BZN|DE-AT-LU","Without Sequence",33.8,"27/01/2018 01:00:00","2018-01-27T02:00","CET","2018-01-27T01:00"
"27/01/2018 02:00:00 - 27/01/2018 03:00:00","BZN|DE-AT-LU","Without Sequence",32.87,"27/01/2018 02:00:00","2018-01-27T03:00","CET","2018-01-27T02:00"
"27/01/2018 03:00:00 - 27/01/2018 04:00:00","BZN|DE-AT-LU","Without Sequence",32.53,"27/01/2018 03:00:00","2018-01-27T04:00","CET","2018-01-27T03:00"
"27/01/2018 04:00:00 - 27/01/2018 05:00:00","BZN|DE-AT-LU","Without Sequence",32.53,"27/01/2018 04:00:00","2018-01-27T05:00","CET","2018-01-27T04:00"
"27/01/2018 05:00:00 - 27/01/2018 06:00:00","BZN|DE-AT-LU","Without Sequence",31.79,"27/01/2018 05:00:00","2018-01-27T06:00","CET","2018-01-27T05:00"
"27/01/2018 06:00:00 - 27/01/2018 07:00:00","BZN|DE-AT-LU","Without Sequence",32.51,"27/01/2018 06:00:00","2018-01-27T07:00","CET","2018-01-27T06:00"
"27/01/2018 07:00:00 - 27/01/2018 08:00:00","BZN|DE-AT-LU","Without Sequence",34.65,"27/01/2018 07:00:00","2018-01-27T08:00","CET","2018-01-27T07:00"
"27/01/2018 08:00:00 - 27/01/2018 09:00:00","BZN|DE-AT-LU","Without Sequence",43.45,"27/01/2018 08:00:00","2018-01-27T09:00","CET","2018-01-27T08:00"
"27/01/2018 09:00:00 - 27/01/2018 10:00:00","BZN|DE-AT-LU","Without Sequence",47.19,"27/01/2018 09:00:00","2018-01-27T10:00","CET","2018-01-27T09:00"
"27/01/2018 10:00:00 - 27/01/2018 11:00:00","BZN|DE-AT-LU","Without Sequence",47.04,"27/01/2018 10:00:00","2018-01-27T11:00","CET","2018-01-27T10:00"
"27/01/2018 11:00:00 - 27/01/2018 12:00:00","BZN|DE-AT-LU","Without Sequence",43.93,"27/01/2018 11:00:00","2018-01-27T12:00","CET","2018-01-27T11:00"
"27/01/2018 12:00:00 - 27/01/2018 13:00:00","BZN|DE-AT-LU","Without Sequence",41.92,"27/01/2018 12:00:00","2018-01-27T13:00","CET","2018-01-27T12:00"
"27/01/2018 13:00:00 - 27/01/2018 14:00:00","BZN|DE-AT-LU","Without Sequence",38.06,"27/01/2018 13:00:00","2018-01-27T14:00","CET","2018-01-27T13:00"
"27/01/2018 14:00:00 - 27/01/2018 15:00:00","BZN|DE-AT-LU","Without Sequence",32.5,"27/01/2018 14:00:00","2018-01-27T15:00","CET","2018-01-27T14:00"
"27/01/2018 15:00:00 - 27/01/2018 16:00:00","BZN|DE-AT-LU","Without Sequence",32.1,"27/01/2018 15:00:00","2018-01-27T16:00","CET","2018-01-27T15:00"
"27/01/2018 16:00:00 - 27/01/2018 17:00:00","BZN|DE-AT-LU","Without Sequence",32.06,"27/01/2018 16:00:00","2018-01-27T17:00","CET","2018-01-27T16:00"
"27/01/2018 17:00:00 - 27/01/2018 18:00:00","BZN|DE-AT-LU","Without Sequence",37,"27/01/2018 17:00:00","2018-01-27T18:00","CET","2018-01-27T17:00"
"27/01/2018 18:00:00 - 27/01/2018 19:00:00","BZN|DE-AT-LU","Without Sequence",39.7,"27/01/2018 18:00:00","2018-01-27T19:00","CET","2018-01-27T18:00"
"27/01/2018 19:00:00 - 27/01/2018 20:00:00","BZN|DE-AT-LU","Without Sequence",34.07,"27/01/2018 19:00:00","2018-01-27T20:00","CET","2018-01-27T19:00"
"27/01/2018 20:00:00 - 27/01/2018 21:00:00","BZN|DE-AT-LU","Without Sequence",27.89,"27/01/2018 20:00:00","2018-01-27T21:00","CET","2018-01-27T20:00"
"27/01/2018 21:00:00 - 27/01/2018 22:00:00","BZN|DE-AT-LU","Without Sequence",11.91,"27/01/2018 21:00:00","2018-01-27T22:00","CET","2018-01-27T21:00"
"27/01/2018 22:00:00 - 27/01/2018 23:00:00","BZN|DE-AT-LU","Without Sequence",10.98,"27/01/2018 22:00:00","2018-01-27T23:00","CET","2018-01-27T22:00"
"27/01/2018 23:00:00 - 28/01/2018 00:00:00","BZN|DE-AT-LU","Without Sequence",10.98,"27/01/2018 23:00:00","2018-01-28T00:00","CET","2018-01-27T23:00"
"28/01/2018 00:00:00 - 28/01/2018 01:00:00","BZN|DE-AT-LU","Without Sequence",-0.04,"28/01/2018 00:00:00","2018-01-28T01:00","CET","2018-01-28T00:00"
"28/01/2018 01:00:00 - 28/01/2018 02:00:00","BZN|DE-AT-LU","Without Sequence",-12.02,"28/01/2018 01:00:00","2018-01-28T02:00","CET","2018-01-28T01:00"
"28/01/2018 02:00:00 - 28/01/2018 03:00:00","BZN|DE-AT-LU","Without Sequence",-19.43,"28/01/2018 02:00:00","2018-01-28T03:00","CET","2018-01-28T02:00"
"28/01/2018 03:00:00 - 28/01/2018 04:00:00","BZN|DE-AT-LU","Without Sequence",-12.19,"28/01/2018 03:00:00","2018-01-28T04:00","CET","2018-01-28T03:00"
"28/01/2018 04:00:00 - 28/01/2018 05:00:00","BZN|DE-AT-LU","Without Sequence",-9.14,"28/01/2018 04:00:00","2018-01-28T05:00","CET","2018-01-28T04:00"
"28/01/2018 05:00:00 - 28/01/2018 06:00:00","BZN|DE-AT-LU","Without Sequence",0.04,"28/01/2018 05:00:00","2018-01-28T06:00","CET","2018-01-28T05:00"
"28/01/2018 06:00:00 - 28/01/2018 07:00:00","BZN|DE-AT-LU","Without Sequence",-0.25,"28/01/2018 06:00:00","2018-01-28T07:00","CET","2018-01-28T06:00"
"28/01/2018 07:00:00 - 28/01/2018 08:00:00","BZN|DE-AT-LU","Without Sequence",2.09,"28/01/2018 07:00:00","2018-01-28T08:00","CET","2018-01-28T07:00"
"28/01/2018 08:00:00 - 28/01/2018 09:00:00","BZN|DE-AT-LU","Without Sequence",10.34,"28/01/2018 08:00:00","2018-01-28T09:00","CET","2018-01-28T08:00"
"28/01/2018 09:00:00 - 28/01/2018 10:00:00","BZN|DE-AT-LU","Without Sequence",11.65,"28/01/2018 09:00:00","2018-01-28T10:00","CET","2018-01-28T09:00"
"28/01/2018 10:00:00 - 28/01/2018 11:00:00","BZN|DE-AT-LU","Without Sequence",14.04,"28/01/2018 10:00:00","2018-01-28T11:00","CET","2018-01-28T10:00"
"28/01/2018 11:00:00 - 28/01/2018 12:00:00","BZN|DE-AT-LU","Without Sequence",11.69,"28/01/2018 11:00:00","2018-01-28T12:00","CET","2018-01-28T11:00"
"28/01/2018 12:00:00 - 28/01/2018 13:00:00","BZN|DE-AT-LU","Without Sequence",11.64,"28/01/2018 12:00:00","2018-01-28T13:00","CET","2018-01-28T12:00"
"28/01/2018 13:00:00 - 28/01/2018 14:00:00","BZN|DE-AT-LU","Without Sequence",6.32,"28/01/2018 13:00:00","2018-01-28T14:00","CET","2018-01-28T13:00"
